id,text,label,clean_text,reference_time
UgzJ9_af_WFC8dmI6K54AaABAg,"অনেক ভালবাসি রে এখনো তরে 😢
কিন্তু কেনো জানি আমাদের মিলন হলো না।",-1,অনেক ভালবাসি রে এখনো তরে কিন্তু কেনো জানি আমাদের মিলন হলো না।,2025-03-13T01:26:39Z
Ugzn9qdNj2BVdBzZ1ZV4AaABAg,কতো গুলো জীবন্ত লাশ এর জানশ্রত,-1,কতো গুলো জীবন্ত লাশ এর জানশ্রত,2025-05-04T07:07:36Z
UgzlR9yLGUAnV4zLHxJ4AaABAg,আমার পক্ষ থেকে সবার জন্য রইলো প্রাণ ডালা শুভেচ্ছা 🥰 ও অভিনন্দন 🌟😍,-1,আমার পক্ষ থেকে সবার জন্য রইলো প্রাণ ডালা শুভেচ্ছা ও অভিনন্দন,2025-05-16T18:40:05Z
UgzBjdYT7F1aJCqnGQB4AaABAg,অযথাই কমেন্টে রিপ্লাই দিন। কথা দিলাম আবার শুনতে চলে আসব........ 💔💔🥀,-1,অযথাই কমেন্টে রিপ্লাই দিন। কথা দিলাম আবার শুনতে চলে আসব........,2025-06-07T09:52:49Z
UgynZI80Q63w8Og5Yb94AaABAg,"আমার মতো কে কে এইরকম গান শুনো? 
হয়তো আমি আর থাকবোনা কিন্তু আমার করা কমেন্ট সারা জীবন থাকবে
😂😢🎉",-1,আমার মতো কে কে এইরকম গান শুনো? হয়তো আমি আর থাকবোনা কিন্তু আমার করা কমেন্ট সারা জীবন থাকবে,2025-04-02T09:29:10Z
Ugw5HFC-81sgO4Cbyyh4AaABAg,আজ ছয়টা বছর হয় মায়াবতী তোমাকে দেখীনা😅😅,-1,আজ ছয়টা বছর হয় মায়াবতী তোমাকে দেখীনা,2025-06-09T21:49:42Z
Ugyh31UMDQOUoRgrWAJ4AaABAg,আমি আজও তাকে অনেক মিছ করি 😅সেই আমার মায়াবানকে 😔😅🥺,-1,আমি আজও তাকে অনেক মিছ করি সেই আমার মায়াবানকে,2025-04-28T05:30:18Z
Ugxk8nwQXTbjGffHlsp4AaABAg,সৃতি রেখে গেলাম 2024 এর মায়াবতী কে,-1,সৃতি রেখে গেলাম 2024 এর মায়াবতী কে,2025-09-20T19:23:01Z
UgxHxxqVuLySxkZbPYZ4AaABAg,"তোমাকে পেয়ে গেলে হয়তো এতো সুন্দর গানটা শোনা হতো না প্রিয় 🥲...।
স্মৃতি রেখে গেলাম........ 
যুগ যুগ ধরে মানুষ যখন এই গানটা শুনতে আসবে আমার কমেন্ট দেখে লাইক কমেন্ট করলে নোটিফিকেশন পেয়ে আবারো শুনতে আসবো প্রিয় গানটা। 
আবারো মনে মনে অনুভব করে কত কথাইনা ভাববো তোমায় নিয়ে..!
উপর ভগবান কেন আমাদের মিলন লিখলো না সেটা ভেবে হয়তো নিজের অজান্তেই চোখের কোনে পানি চলে আসবে 😥",-1,তোমাকে পেয়ে গেলে হয়তো এতো সুন্দর গানটা শোনা হতো না প্রিয় ...। স্মৃতি রেখে গেলাম........ যুগ যুগ ধরে মানুষ যখন এই গানটা শুনতে আসবে আমার কমেন্ট দেখে লাইক কমেন্ট করলে নোটিফিকেশন পেয়ে আবারো শুনতে আসবো প্রিয় গানটা। আবারো মনে মনে অনুভব করে কত কথাইনা ভাববো তোমায় নিয়ে..! উপর ভগবান কেন আমাদের মিলন লিখলো না সেটা ভেবে হয়তো নিজের অজান্তেই চোখের কোনে পানি চলে আসবে,2025-04-21T07:44:59Z
UgzewnwqpzXXEmFWT-Z4AaABAg,"টাকার অভাবে মায়াবতী কে হাড়িয়ে ফেলেছি😢😢😢
গানটি শুনে তার কথা মণে পড়ে গেছে😢",-1,টাকার অভাবে মায়াবতী কে হাড়িয়ে ফেলেছি গানটি শুনে তার কথা মণে পড়ে গেছে,2025-03-30T06:56:43Z
UgyIUeSW2Z6OV6eKTSt4AaABAg,"জীবনের অধ্যায় থেমে গেছে ২০১৬ তে আজও  আমি দুঃখে একা একা মরি, সে তার সন্তান শামি নিয়ে আনেক খুশিতে আাছে,😔😔😔😔",-1,"জীবনের অধ্যায় থেমে গেছে ২০১৬ তে আজও আমি দুঃখে একা একা মরি, সে তার সন্তান শামি নিয়ে আনেক খুশিতে আাছে,",2025-04-22T14:59:25Z
Ugwv3Rn8GPIiVTtFKUB4AaABAg,সে আমাকে বোঝেনি। তারে না পাওয়ার ব্যাথা অনুভব করলেই গান গুলো শুনি। অনেক ভালো লাগে।   miss you too much.😢,-1,সে আমাকে বোঝেনি। তারে না পাওয়ার ব্যাথা অনুভব করলেই গান গুলো শুনি। অনেক ভালো লাগে। miss you too much.,2025-05-17T04:53:22Z
UgxUH6cmIFdTc5_0_fJ4AaABAg,আমার জীবনে প্রেম বিষয়ক কোনঁ কষ্ট নাই কিন্তু গান গুলো ভালো লাগে হাজার হজার বছর গান গুলো বেঁচে থাকুক হইতো এখন আপনি আমার কমেন্ট টা ২০৩০ বা ৪০ বা ৬০ 😮😢😂,-1,আমার জীবনে প্রেম বিষয়ক কোনঁ কষ্ট নাই কিন্তু গান গুলো ভালো লাগে হাজার হজার বছর গান গুলো বেঁচে থাকুক হইতো এখন আপনি আমার কমেন্ট টা ২০৩০ বা ৪০ বা ৬০,2025-04-19T07:37:14Z
Ugy7c2tuz5dQ-XOypdR4AaABAg,তোমাকে পেয়ে গেলে হয়তো এই গান টা আর শোনা হত না 😅😅😶😶,-1,তোমাকে পেয়ে গেলে হয়তো এই গান টা আর শোনা হত না,2025-02-27T16:09:53Z
UgwZnBKHkGnC7bytsT94AaABAg,"আমি পুরুষ মানুষ হয়ে মনেহয় আমাকে মাটি না, কষ্ট দিয়ে বানানো হয়েছে 💔 কমেন্ট পরে থাকবে হয়তো আমি থাকবো না।  আজ ০৭ মে ২০২৫।",-1,"আমি পুরুষ মানুষ হয়ে মনেহয় আমাকে মাটি না, কষ্ট দিয়ে বানানো হয়েছে কমেন্ট পরে থাকবে হয়তো আমি থাকবো না। আজ ০৭ মে ২০২৫।",2025-05-07T18:02:53Z
UgzE5E-dJYkzPj4Ubld4AaABAg,মায়াবতী তোমাকে ভালোবাসার মতো চরম সৌভাগ্য হইলো আমার ঠিকিই। শুধু ধইরা রাখার সাধ্য হইলো নাহ! তোমারে দোষ দিয়া আর কি হইবো বলো..! তুমি যে হইলা আসমানে থাকা ঐ চাঁদ। আর আমি হইলাম কপাল পুড়া এক দুর্ভাগা। তোমারে ছুঁইতে যাওয়ার যে দুঃসাহস করেছি তার শাস্তি স্বরুপ তো আমার এটা প্রাপ্যই ছিলো...!!😥💔,-1,মায়াবতী তোমাকে ভালোবাসার মতো চরম সৌভাগ্য হইলো আমার ঠিকিই। শুধু ধইরা রাখার সাধ্য হইলো নাহ! তোমারে দোষ দিয়া আর কি হইবো বলো..! তুমি যে হইলা আসমানে থাকা ঐ চাঁদ। আর আমি হইলাম কপাল পুড়া এক দুর্ভাগা। তোমারে ছুঁইতে যাওয়ার যে দুঃসাহস করেছি তার শাস্তি স্বরুপ তো আমার এটা প্রাপ্যই ছিলো...!!,2025-05-02T03:47:48Z
UgypDHsXyigVbo9VDCF4AaABAg,আমার বৃষ্টি যার জন্য চার বছর অপেক্ষায় আছি 😢😢,-1,আমার বৃষ্টি যার জন্য চার বছর অপেক্ষায় আছি,2025-06-20T11:17:06Z
UgzaiV2lSbTuXNTdPIN4AaABAg,২০৭০/২০৮০ সাল তখন হয়তো আমি বেচেঁ থাকবো না কিন্তুু আমার এই কমেন্ট থাকবো চিরো দিন। 😅,-1,২০৭০/২০৮০ সাল তখন হয়তো আমি বেচেঁ থাকবো না কিন্তুু আমার এই কমেন্ট থাকবো চিরো দিন।,2025-02-19T20:37:03Z
Ugy9-Woj5X_jobukYfp4AaABAg,এ গান আমার কথা বলে দেয়,-1,এ গান আমার কথা বলে দেয়,2025-04-22T03:26:29Z
UgzRqP3skuuGnmeDQ9R4AaABAg,"প্রেমে নামক মায়া জালে যারা বেঁধেছিল তারাই শুধু গানটার আসল মায়ায় পড়বে😅
কোন এক নাগিনীর প্রেমে আমিও পড়েছিলাম,,, ১৫ হাজার টাকা বেতনে চাকরি করি বলে আরেক ছেলে কে বিয়ে করছে।ভাগ্যের কি পরিহাস আজ আমি মাসে ৫০-৬০ হাজার টাকা বেতনের চাকরি করি কিন্তুু প্রিয় মানুষটা আর আমার হলো না 😢 দোয়া করি সব সময় সুখে থাকুক আমার না পাওয়া ভালোবাসার মানুষ টা 💔",-1,"প্রেমে নামক মায়া জালে যারা বেঁধেছিল তারাই শুধু গানটার আসল মায়ায় পড়বে কোন এক নাগিনীর প্রেমে আমিও পড়েছিলাম,,, ১৫ হাজার টাকা বেতনে চাকরি করি বলে আরেক ছেলে কে বিয়ে করছে।ভাগ্যের কি পরিহাস আজ আমি মাসে ৫০-৬০ হাজার টাকা বেতনের চাকরি করি কিন্তুু প্রিয় মানুষটা আর আমার হলো না দোয়া করি সব সময় সুখে থাকুক আমার না পাওয়া ভালোবাসার মানুষ টা",2025-03-13T15:38:43Z
UgxK7_tBQ_2evE3Oh9J4AaABAg,এই গান গুলো শুনলে মনে অনেক আনন্দ হয়,-1,এই গান গুলো শুনলে মনে অনেক আনন্দ হয়,2025-04-14T14:27:10Z
UgxGPxf-m3U3KBsyAlB4AaABAg,"আমি  বাবুল এখনও তোমাকে খুঁজি ❤ তোইতো নিরলে  কাদি তোমারে না পাওয়ার কষ্টে, তুমি জেখানে তাকো সুখে তেকো😢😢😢😢",-1,"আমি বাবুল এখনও তোমাকে খুঁজি তোইতো নিরলে কাদি তোমারে না পাওয়ার কষ্টে, তুমি জেখানে তাকো সুখে তেকো",2025-04-17T07:39:26Z
UgwcJeztjMNCxpnphzl4AaABAg,২০২৫ সাল বয়সটা ২৭ আর কিছু দিন পর চলে যেতে হবে 😢😢😢😢,-1,২০২৫ সাল বয়সটা ২৭ আর কিছু দিন পর চলে যেতে হবে,2025-05-15T06:17:09Z
UgzPXBD0rZfnSEWcBPV4AaABAg,"গান গুলো কার কার ভালো লাগে 🥰২৫,,,,৩,,,,২০২৫🥰",-1,"গান গুলো কার কার ভালো লাগে ২৫,,,,৩,,,,২০২৫",2025-03-25T17:47:31Z
Ugw7KjQ1EY2y4jEpGKh4AaABAg,"গানের মধ্যে একটা আলাদা আকর্ষণ আছ যা মনটা কেড়ে নেয়। কমেন্ট করে গেলাম লাইক, কমেন্ট করলে আবার এসে শুনে যাব।
৭/২/২৫",-1,"গানের মধ্যে একটা আলাদা আকর্ষণ আছ যা মনটা কেড়ে নেয়। কমেন্ট করে গেলাম লাইক, কমেন্ট করলে আবার এসে শুনে যাব। ৭/২/২৫",2025-02-07T01:07:42Z
UgxEMqnWhZ9LBe0MaCp4AaABAg,"তোমাকে পাই নাই তো কি হইছে, 
দূর থেকে সারাজীবন ভালো বেসে যাবো 😢😢🖤🥀",-1,"তোমাকে পাই নাই তো কি হইছে, দূর থেকে সারাজীবন ভালো বেসে যাবো",2025-04-19T10:26:03Z
Ugzo6FxzahydmVSMFu94AaABAg,সৃতি রেখে গেলাম ২০২৫,-1,সৃতি রেখে গেলাম ২০২৫,2025-04-15T18:08:58Z
Ugye-Nf9HKxzA_bWjEl4AaABAg,"2025 বলে গেলাম,, গানগুলো অমর হয়ে রবে",-1,"2025 বলে গেলাম,, গানগুলো অমর হয়ে রবে",2025-03-10T05:47:40Z
UgxcWJ9mUlij1HfhAvp4AaABAg,এই গানটা র আাগে মানে বুজতাম না  এখন প্রততেক লাইন কলিজায় লাগে,-1,এই গানটা র আাগে মানে বুজতাম না এখন প্রততেক লাইন কলিজায় লাগে,2025-05-19T14:51:08Z
UgxHqH6XG1XsIfzFSyZ4AaABAg,"না পাবার তীব্র সুখ নিয়ে এ জীবন কাটাতে হবে 😅তুমি আর ফুল হয়েও আমার হবে না 😊
30.4.25🖤",-1,না পাবার তীব্র সুখ নিয়ে এ জীবন কাটাতে হবে তুমি আর ফুল হয়েও আমার হবে না 30.4.25,2025-04-29T19:05:47Z
Ugxk_7Wvw6Z9172TNAB4AaABAg,সত্যি গান গুলো মন কে নাড়া দিয়ে যায়,-1,সত্যি গান গুলো মন কে নাড়া দিয়ে যায়,2025-05-18T05:49:01Z
Ugymv6oOodj9gFoPGyR4AaABAg,তোমায় যদি চাই 😢😢,-1,তোমায় যদি চাই,2025-08-28T19:40:54Z
Ugw-Qn76uhkQn75OKRp4AaABAg,২০২৫ সালে কে কে আসছেন?,-1,২০২৫ সালে কে কে আসছেন?,2025-03-31T13:18:26Z
UgxFXKjqTd57utgzMS14AaABAg,"2025. মায়াবতীর তুমার কথা আবার মনে পরে গেলো 😅
সৃতি হিসেবে রেখে গেলাম 😄",-1,2025. মায়াবতীর তুমার কথা আবার মনে পরে গেলো সৃতি হিসেবে রেখে গেলাম,2025-05-07T17:37:11Z
UgxiONoPf8M8V8EC7Eh4AaABAg,মানুষের আঙ্কাংকার কোন শেষ নেই। জীবনে কোন কোন কিছুর আঙ্কাংকা থেকেই যায় আর এটাই প্রকৃত জীবন।,-1,মানুষের আঙ্কাংকার কোন শেষ নেই। জীবনে কোন কোন কিছুর আঙ্কাংকা থেকেই যায় আর এটাই প্রকৃত জীবন।,2025-03-07T17:45:07Z
UgwGGhd_Sw4swUIaI794AaABAg,"২০-৩-২০২৫ 
লোকগীতি প্রেমিক হিসেবে স্মৃতি রেখে গেলাম। কমেন্টে আসলে তোমরা একটিকরে লাইক দিয়ো। হয়তো আবার শুনতে আসবো",-1,২০-৩-২০২৫ লোকগীতি প্রেমিক হিসেবে স্মৃতি রেখে গেলাম। কমেন্টে আসলে তোমরা একটিকরে লাইক দিয়ো। হয়তো আবার শুনতে আসবো,2025-03-19T18:07:33Z
UgwJVyXL_yZpbLUCeGt4AaABAg,"তুমি যেতে যেতে চোখের ভাষায় বুঝিয়ে গিয়েছিলে- তোমার চলে যাওয়াটা হবে আমার জীবনের সবচেয়ে ভয়ংকর ঘূর্ণিঝড়ের রাত। 

সেদিন নির্ঘুম একটা রাত কেটে গিয়েছিলো ঝড়ের সাথে দাঁড়িয়ে থাকতে থাকতে। সেই ভাঙচুর ঘূর্ণিঝড় টা চলছিলো বুকের ভিতর যে বুকে আর কখনো তুমি ফিরবেনা জেনেছিলাম।

সেই রাত থেকে আজও চোখ বন্ধ করলে তোমার চলে যাওয়ার দৃশ্য চোখে ভেসে ওঠে। মনে হয় এই করুণ দৃশ্য পৃথিবীর ইতিহাসের সবচেয়ে করুণ দৃশ্য কেও হার মানায়।",-1,তুমি যেতে যেতে চোখের ভাষায় বুঝিয়ে গিয়েছিলে- তোমার চলে যাওয়াটা হবে আমার জীবনের সবচেয়ে ভয়ংকর ঘূর্ণিঝড়ের রাত। সেদিন নির্ঘুম একটা রাত কেটে গিয়েছিলো ঝড়ের সাথে দাঁড়িয়ে থাকতে থাকতে। সেই ভাঙচুর ঘূর্ণিঝড় টা চলছিলো বুকের ভিতর যে বুকে আর কখনো তুমি ফিরবেনা জেনেছিলাম। সেই রাত থেকে আজও চোখ বন্ধ করলে তোমার চলে যাওয়ার দৃশ্য চোখে ভেসে ওঠে। মনে হয় এই করুণ দৃশ্য পৃথিবীর ইতিহাসের সবচেয়ে করুণ দৃশ্য কেও হার মানায়।,2025-04-24T09:02:28Z
Ugwu6_o2WYYoK-P6-t94AaABAg,স্মৃতি রেখে গেলাম ২০২৫,-1,স্মৃতি রেখে গেলাম ২০২৫,2025-04-21T16:03:47Z
UgxVlulWQYRX-YTPAVp4AaABAg,তারে না পাওয়ার যে কষ্ট টা কেমনে বুজাই 😢,-1,তারে না পাওয়ার যে কষ্ট টা কেমনে বুজাই,2025-04-14T15:12:03Z
UgyhRHeO8EkGt9dM4j14AaABAg,শিলা তোমায় পেলে এটা শুনতে পারতাম না।ইমরান,-1,শিলা তোমায় পেলে এটা শুনতে পারতাম না।ইমরান,2025-04-19T11:33:28Z
Ugx5ammtkQ6DS29DJYZ4AaABAg,ভাই মায়া বড়ো খারাপ জিনিস 😅💔,-1,ভাই মায়া বড়ো খারাপ জিনিস,2025-04-29T08:42:42Z
UgxPgvzGmTh6okG-_Pp4AaABAg,তোমাকে পেয়ে গেলে হয়তো আজকে এত সুন্দর গান শুনতে হতো না তাই আজ এই কমেন্টটা রেখে গেলাম কেউ যদি এত লাইক করে নোটিফিকেশন আসে আমার ফোনে তাহলে আবার আসব এই গানটা শুনতে,-1,তোমাকে পেয়ে গেলে হয়তো আজকে এত সুন্দর গান শুনতে হতো না তাই আজ এই কমেন্টটা রেখে গেলাম কেউ যদি এত লাইক করে নোটিফিকেশন আসে আমার ফোনে তাহলে আবার আসব এই গানটা শুনতে,2025-04-16T06:47:12Z
UgwCExxvG4Jar4lNyZx4AaABAg,কিছু ভালোবাসা অসমাপ্ত থেকে যাওয়াই ভালো। ১৯/৯/২০১৯ তাং আমার শেষ ❤ ।,-1,কিছু ভালোবাসা অসমাপ্ত থেকে যাওয়াই ভালো। ১৯/৯/২০১৯ তাং আমার শেষ ।,2025-02-17T17:54:16Z
Ugx0k_V7bhFbKx1uU1J4AaABAg,সব ভুলতে চাই পারি না😢,-1,সব ভুলতে চাই পারি না,2025-04-27T19:24:04Z
UgyCf4SsemAdnw-MxUB4AaABAg,"গান গুলো সবার মনে বা অনলাইনে রয়েযাবে, but আমি থাকবো না এই পৃথিবীতে, তাই কমেন্ট  করে দিলাম😂😂😂😢😢😢",-1,"গান গুলো সবার মনে বা অনলাইনে রয়েযাবে, but আমি থাকবো না এই পৃথিবীতে, তাই কমেন্ট করে দিলাম",2025-02-25T04:12:31Z
Ugz-8NIbU2gPr9xN5214AaABAg,"""চাঁদ ছিল অন্যের কিন্তু তার আলোতে আমি স্বপ্ন দেখতাম""😅",-1,"""চাঁদ ছিল অন্যের কিন্তু তার আলোতে আমি স্বপ্ন দেখতাম""",2025-02-15T15:41:08Z
UgwTThIzdLwm_bWH6a94AaABAg,"স্মৃতি রেখে গেলাম❤
তাং:2/5/2025
টাইম: 11:০০ Am",-1,স্মৃতি রেখে গেলাম তাং:2/5/2025 টাইম: 11:০০ Am,2025-05-02T05:00:57Z
Ugx6n7ONQCS1JdWOnR54AaABAg,গালিবের প্রেম ও বসন্তের কাব্য,-1,গালিবের প্রেম ও বসন্তের কাব্য,2025-02-15T18:28:50Z
UgzD6E1kwSEYG8O5eHl4AaABAg,🔰👉 আলামিন+উর্মি মায়াবতী 👈 গানটা ভাইরাল হবে এবং সবাই শুনবে আর যখন 2090 সাল চলে আসবে তখন আমি এই পৃথিবীতে থাকবো না🥹 কিন্তু আমার এই  কমেন্ট পড়ে থাকবে,-1,আলামিন+উর্মি মায়াবতী গানটা ভাইরাল হবে এবং সবাই শুনবে আর যখন 2090 সাল চলে আসবে তখন আমি এই পৃথিবীতে থাকবো না কিন্তু আমার এই কমেন্ট পড়ে থাকবে,2025-03-13T16:59:04Z
UgxzfF-T2APfu_1gGxN4AaABAg,গান গুলো শুনলে মন টা শীতল হয়ে যাই  ্্্  এবং এক সময় তুমার দেয়া কষ্টের কথা অনেক মনে পরে....😢😢,-1,গান গুলো শুনলে মন টা শীতল হয়ে যাই ্্্ এবং এক সময় তুমার দেয়া কষ্টের কথা অনেক মনে পরে....,2025-03-25T11:56:54Z
UgyHLhyMGvB9RVF-rCF4AaABAg,২০২৫ এ এসে শুনতেছি।অনেক সুন্দর গান গুলো। 😊,-1,২০২৫ এ এসে শুনতেছি।অনেক সুন্দর গান গুলো।,2025-04-16T02:30:33Z
UgyUKVmyBles1EiK1H54AaABAg,কাউকে ছাড়া শূন্যতা কেমন গান শুনে বুঝতে পারি 😢😢,-1,কাউকে ছাড়া শূন্যতা কেমন গান শুনে বুঝতে পারি,2025-02-15T14:41:58Z
UgzYeSS6a-YASbu54oB4AaABAg,"কমেন্টে যতবার লাইক পড়বে তত বার এসে শোনব❤️
কারন আমার জীবনের সাথে মিল😢😭",-1,কমেন্টে যতবার লাইক পড়বে তত বার এসে শোনব️ কারন আমার জীবনের সাথে মিল,2025-01-31T19:49:37Z
