id,text,label,clean_text,reference_time
UgxKpiAc5-C5g2_gUa14AaABAg,"বিয়ের পরের দিন বৌ নিয়ে বাড়িতে আসার সময় আমার প্রাইভেট কারে এই গানের সম্পূর্ণ ক্যাসেটটি বাজতে বাজতেই বাড়ির গেটে বৌ নিয়ে গাড়ি পৌঁছিয়ে গেছে বাড়ির গেটে সে এক অদ্ভুত অনুভূতি হয়েছিল আমার, এদিকে বৌয়ের কান্নার সাথে এই গানের রেকর্ডটি থেমে ছিল আমার গাড়ি থেকে বৌ নামার পরে।",-1,"বিয়ের পরের দিন বৌ নিয়ে বাড়িতে আসার সময় আমার প্রাইভেট কারে এই গানের সম্পূর্ণ ক্যাসেটটি বাজতে বাজতেই বাড়ির গেটে বৌ নিয়ে গাড়ি পৌঁছিয়ে গেছে বাড়ির গেটে সে এক অদ্ভুত অনুভূতি হয়েছিল আমার, এদিকে বৌয়ের কান্নার সাথে এই গানের রেকর্ডটি থেমে ছিল আমার গাড়ি থেকে বৌ নামার পরে।",2024-08-02T10:37:12Z
UgxXrOwHJKnfwdLfF7d4AaABAg,অম্বিকা কালনা সরস্বতী পুজো খুব বিখ্যাত ❤️😌 সকাল সকাল পাঞ্জাবী পরে প্রিয় মানুষ হাত ধরে ঠাকুর দেখা আর প্যান্ডেল এই সব গান একটা আলাদা আনন্দ পাওয়া যায় ❤️🥳mis- অনুষ্কা🫂😘🌼,-1,অম্বিকা কালনা সরস্বতী পুজো খুব বিখ্যাত ️ সকাল সকাল পাঞ্জাবী পরে প্রিয় মানুষ হাত ধরে ঠাকুর দেখা আর প্যান্ডেল এই সব গান একটা আলাদা আনন্দ পাওয়া যায় ️mis- অনুষ্কা,2025-04-28T00:54:23Z
Ugya-geoFocvXqB9Gn14AaABAg,দূর্গা পূজার আবহাওয়া নিয়ে আসে,-1,দূর্গা পূজার আবহাওয়া নিয়ে আসে,2024-10-06T15:01:43Z
Ugz_MmNgwTPWtvGUtF94AaABAg,১৯৮৮/৮৯ এর স্মৃতি গুলো আজ ও রয়েছে মনে,-1,১৯৮৮/৮৯ এর স্মৃতি গুলো আজ ও রয়েছে মনে,2025-02-16T04:55:05Z
UgyIzgkJS2bC8eT0iIp4AaABAg,গাড়িতে এই গান গুলো অনেক সুন্দর লাগে,-1,গাড়িতে এই গান গুলো অনেক সুন্দর লাগে,2023-07-03T05:57:35Z
UgxRUeXEfgBwigrV3fB4AaABAg,আজও গানটা প্রিয় আছে ❤😌 বিয়ে ফিলিং মনে হচ্ছে,-1,আজও গানটা প্রিয় আছে বিয়ে ফিলিং মনে হচ্ছে,2024-12-06T17:22:13Z
Ugz-SeEfhxotok8y9sx4AaABAg,আগের দিনে দুর্গাপূজা এ সমস্ত গান না হলে সম্পন্ন হতো না,-1,আগের দিনে দুর্গাপূজা এ সমস্ত গান না হলে সম্পন্ন হতো না,2024-08-11T12:03:50Z
UgwsUbHC0f91iHRvg-14AaABAg,গগিত্যু আর যদি একবার ওকে আমার মনে হল আমার ছেলে আমাকে বললো জামা 😮😮😢😮😮😮😢😢😢😢😢😢😢😢😢😢😢😢😢😢😢😢😢😢😢😢😢😢😢😢😢😢😢😢😢😢😢😢😢😢😢😢😮😮😮,-1,গগিত্যু আর যদি একবার ওকে আমার মনে হল আমার ছেলে আমাকে বললো জামা,2024-03-24T17:15:39Z
UgxudAiNtAuxQOIfGZV4AaABAg,"এত.ভালো.গান. এখন.আর.হবেনা❤😮ভালো.লাগে.তোমাকে.ভালোবাসি.তাই. তোমাকদূরে.কেন.আনোয়ার.কথা.বলো.কানে.কানেভালো.বাসি.তোমাকেযদি.আমি.যাই. হারিয়ে
বাঁধের.আমি.তোমাকেভালো.বাসি.তোমাকে😢😢একটু।",-1,এত.ভালো.গান. এখন.আর.হবেনাভালো.লাগে.তোমাকে.ভালোবাসি.তাই. তোমাকদূরে.কেন.আনোয়ার.কথা.বলো.কানে.কানেভালো.বাসি.তোমাকেযদি.আমি.যাই. হারিয়ে বাঁধের.আমি.তোমাকেভালো.বাসি.তোমাকেএকটু।,2025-10-24T07:08:31Z
UgwzGPdJh9KkwUnSY5l4AaABAg,স্কুল জীবনের সময়  এই গান গুলো  সরস্বতী পুজোর সময়ে খুব বাজত,-1,স্কুল জীবনের সময় এই গান গুলো সরস্বতী পুজোর সময়ে খুব বাজত,2024-11-23T08:57:18Z
UgztC_SxDCrRlVC9AkR4AaABAg,❤❤❤❤লাভ ইউ টু গান পূজার জন্য 💖💖💖 হুগলি জেলা চন্দননগর💘💘,-1,লাভ ইউ টু গান পূজার জন্য হুগলি জেলা চন্দননগর,2025-09-12T15:51:36Z
Ugzx0j2blK7Bg6aMKxt4AaABAg,এই গানগুলো শুনলে ছোটবেলার কথা মনে পড়ে যায় ❤,-1,এই গানগুলো শুনলে ছোটবেলার কথা মনে পড়ে যায়,2025-08-16T16:39:18Z
UgwBo4-1K0amvMYA0yV4AaABAg,পছন্দের একটি.গান ❤মনে.পড়ে.কথা.মনে.পডরে.না.এখন.আজ.সুদু.মনে.হয়.কত.কেন.আমি.দেখেভুলে.নিজে.কে.নিজেকেন.চোখে.ফাঁকে.সপ্ন ন.টা.ভেঙে.দিলেমনে.পরেকথা.মনসদু.পরেনা এখন😂,-1,পছন্দের একটি.গান মনে.পড়ে.কথা.মনে.পডরে.না.এখন.আজ.সুদু.মনে.হয়.কত.কেন.আমি.দেখেভুলে.নিজে.কে.নিজেকেন.চোখে.ফাঁকে.সপ্ন ন.টা.ভেঙে.দিলেমনে.পরেকথা.মনসদু.পরেনা এখন,2025-10-12T07:59:47Z
UgwFbAoiam-_pY69qKV4AaABAg,মনে মনে আমি এক জোন কে আমি ভালো বাসী জানি আমি তাকে কোনো দিন পাবো না সে কোনো দিন আমার হবে না সেটা ও আমি জানি কিন্তূ তাও আমি তাকে ভালো বাসী    . তার কথা মনে পর লেই আমি এই গান টা শুনি     জীবনে কোনো দিন পাবোনা জেনেও কাউকে ভালো বাসা র মজা টাই আলাদা,-1,মনে মনে আমি এক জোন কে আমি ভালো বাসী জানি আমি তাকে কোনো দিন পাবো না সে কোনো দিন আমার হবে না সেটা ও আমি জানি কিন্তূ তাও আমি তাকে ভালো বাসী . তার কথা মনে পর লেই আমি এই গান টা শুনি জীবনে কোনো দিন পাবোনা জেনেও কাউকে ভালো বাসা র মজা টাই আলাদা,2024-10-21T15:32:38Z
UgyYtSNTPhbB5UQUxfB4AaABAg,"সুন্দর আরো.সুন্দর ❤মনের.দরজাখুলে.দিলাম.বারের.থেকো.আর.বুঝে.না ও.কে.তুমিকে আমার 😢এত.দিন.এতকাল.পথ.চেয়ে.সামেন.দেখা.পেলাম.মনের.দরজা.খুলেই. দিলা..বারের.থেকোনা.বুঝেই না ও.তুমি.সে.অনেক দিনের.বন্ধু😢আমি.সে.তোমার. চা,এ.য়া.ফাগুন.দক্ষিন.আওয়া.বুঝেই. না ও.আমি.কে.তোমার 😢😢",-1,"সুন্দর আরো.সুন্দর মনের.দরজাখুলে.দিলাম.বারের.থেকো.আর.বুঝে.না ও.কে.তুমিকে আমার এত.দিন.এতকাল.পথ.চেয়ে.সামেন.দেখা.পেলাম.মনের.দরজা.খুলেই. দিলা..বারের.থেকোনা.বুঝেই না ও.তুমি.সে.অনেক দিনের.বন্ধুআমি.সে.তোমার. চা,এ.য়া.ফাগুন.দক্ষিন.আওয়া.বুঝেই. না ও.আমি.কে.তোমার",2025-11-09T08:01:35Z
UgzNLJ9qC1gFX5OQtgR4AaABAg,সকল বেলা খুব ভালো লাগে গান গুলি,-1,সকল বেলা খুব ভালো লাগে গান গুলি,2022-07-31T02:29:28Z
UgxOAMNoYfw0LAsG3Vx4AaABAg,গানটা খুবই ভালো❤💞🎤🎷,-1,গানটা খুবই ভালো,2024-09-07T13:53:37Z
Ugxz-s7iyvP_h5G1rLV4AaABAg,দারুণ সুন্দর একটি.গান ❤. ববমে.এমন.দূরে.নয়.ববমে.থেমেগেল.মেল.জায়াগাটা.সুন্দর. এত.খন.কেটে.গেলো.বুঝলাম.নাবিকেল.রূদোরতখন.বিকেলে,-1,দারুণ সুন্দর একটি.গান . ববমে.এমন.দূরে.নয়.ববমে.থেমেগেল.মেল.জায়াগাটা.সুন্দর. এত.খন.কেটে.গেলো.বুঝলাম.নাবিকেল.রূদোরতখন.বিকেলে,2025-11-09T08:06:25Z
UgwEHx3WSfJ4z0G34VR4AaABAg,❤❤❤❤❤ খুব সুন্দর আমার খুব ভালো লাগে এই গান গুলো শুনতে ছোটবেলার কথা মনে পড়ে গেলো পুজোর দিনের এই গান গুলো শুনতে শুনতে ঠাকুর দেখতে যেতাম তোমাদের ও যদি এই গান গুলো শুনতে ভালো লাগে প্লিস একটা লাইক করবে 🎉🎉😊😊😊,-1,খুব সুন্দর আমার খুব ভালো লাগে এই গান গুলো শুনতে ছোটবেলার কথা মনে পড়ে গেলো পুজোর দিনের এই গান গুলো শুনতে শুনতে ঠাকুর দেখতে যেতাম তোমাদের ও যদি এই গান গুলো শুনতে ভালো লাগে প্লিস একটা লাইক করবে,2025-07-21T15:40:24Z
Ugziyap7F4eU00eTPix4AaABAg,গান ভালো হয়েছে 😂😂😂❤❤❤❤🎉🎉🎉🎉😢😢😮😮😅😅😅😊😊😊😊,-1,গান ভালো হয়েছে,2024-06-11T08:27:53Z
UgwM_m_em0WxWChc8Oh4AaABAg,"অলকা ম্যাডাম আপনার এত মিষ্টি মধুর কণ্ঠে এত সুন্দর গান শুনে মোন ভোরে গেলো,, ভালো বাসা আশীর্বাদ সবই দিলাম, এগিয়ে চলো,🎉🎉",-1,"অলকা ম্যাডাম আপনার এত মিষ্টি মধুর কণ্ঠে এত সুন্দর গান শুনে মোন ভোরে গেলো,, ভালো বাসা আশীর্বাদ সবই দিলাম, এগিয়ে চলো,",2025-07-21T15:25:41Z
UgyyWRwOhjRLUu5SE9J4AaABAg,"যতবার শুনি,
মন ছুঁয়ে যায়!!",-1,"যতবার শুনি, মন ছুঁয়ে যায়!!",2022-08-16T20:07:12Z
Ugz64U2LQVznB_WHp8l4AaABAg,গানগুলো শুনলে পুরনো কিছু মনে পড়ে,-1,গানগুলো শুনলে পুরনো কিছু মনে পড়ে,2022-09-03T08:23:58Z
Ugwec22_eG3qyu1mjSd4AaABAg,২০২৫ কে কে এই গানটা শুনছো,-1,২০২৫ কে কে এই গানটা শুনছো,2025-05-31T05:03:27Z
UgwzoxtT8Giaz6v-5hh4AaABAg,কেউ আজ পর্যন্ত আমাকে ভালোবাসেনি তাই গান তো অনেক সুন্দর কিন্তূ যদি ভালোবাসার মানুষ যদি পেতাম তাহলে  গান টাকে আরো ভালো উপলব্ধি করতাম।,-1,কেউ আজ পর্যন্ত আমাকে ভালোবাসেনি তাই গান তো অনেক সুন্দর কিন্তূ যদি ভালোবাসার মানুষ যদি পেতাম তাহলে গান টাকে আরো ভালো উপলব্ধি করতাম।,2024-09-26T04:59:49Z
Ugw37hUQnYwOH9V8iUd4AaABAg,"এমন কথা ,মিউজিক,কন্ঠ আর কোনও দিন সৃষ্টি হবে না । এই গানগুলো শুনলে আবার সেই ছোটবেলায় ফিরে যাই । একটা সম্পূর্ণ আলাদা অনুভূতি হয় ।",-1,"এমন কথা ,মিউজিক,কন্ঠ আর কোনও দিন সৃষ্টি হবে না । এই গানগুলো শুনলে আবার সেই ছোটবেলায় ফিরে যাই । একটা সম্পূর্ণ আলাদা অনুভূতি হয় ।",2025-05-02T08:00:23Z
UgwuWoFP1FboSJdQo9F4AaABAg,এই গানটি আমার খুব প্রিয়,-1,এই গানটি আমার খুব প্রিয়,2022-12-18T10:04:30Z
UgzeS38e7gXEvylzR614AaABAg,এই গানগুলো  ফেভারিট,-1,এই গানগুলো ফেভারিট,2024-10-07T02:09:33Z
UgwgDd-guQEvUqnvoe94AaABAg,বুঝে নিও আমি কে তোমার,-1,বুঝে নিও আমি কে তোমার,2025-10-21T05:07:49Z
Ugw5b6I6To4sAkpZP894AaABAg,এই গান গুলো  শুনলে  ছোটোবেলার কথা মনে পড়ে,-1,এই গান গুলো শুনলে ছোটোবেলার কথা মনে পড়ে,2023-03-25T16:30:37Z
Ugwo58-6BGkqxCX_5hZ4AaABAg,এই গানগুলো শুনে আমি বড় হয়েছি । এই গানগুলো শুনলে আবার সেই ছোটবেলায় ফিরে যাই । একটা সম্পূর্ণ আলাদা অনুভূতি হয় । ❤❤❤,-1,এই গানগুলো শুনে আমি বড় হয়েছি । এই গানগুলো শুনলে আবার সেই ছোটবেলায় ফিরে যাই । একটা সম্পূর্ণ আলাদা অনুভূতি হয় ।,2025-01-05T19:03:52Z
Ugw62CA9GNHV-wVZJxR4AaABAg,আগে মনে মধ্যে প্রেম জাগলে এই গান শুনতাম দারুন গান ❤❤❤❤,-1,আগে মনে মধ্যে প্রেম জাগলে এই গান শুনতাম দারুন গান,2024-09-03T14:04:23Z
UgyBxOdPJmhJFt_JIwV4AaABAg,করে গড় গড়,-1,করে গড় গড়,2025-09-20T02:29:51Z
Ugxn77mB6_Nc8jG74oh4AaABAg,অসাধারণ অসাধারণ শুভ অলকা শুভ কামনা,-1,অসাধারণ অসাধারণ শুভ অলকা শুভ কামনা,2022-12-06T03:12:28Z
UgxdGUTHfbq131O2O6t4AaABAg,ছোট বেলায় কথা গুলো মনে পরে যায় এই গান গুলো শুনলে,-1,ছোট বেলায় কথা গুলো মনে পরে যায় এই গান গুলো শুনলে,2023-01-04T15:45:41Z
UgwHuUXDfS6Kb2POsr54AaABAg,❤❤❤❤❤❤❤❤😮😮😮 অবশ্যই অসাধারণ দুর্দান্ত ভালো গান গুলো ভালো বাসি গোঁ,-1,অবশ্যই অসাধারণ দুর্দান্ত ভালো গান গুলো ভালো বাসি গোঁ,2025-05-06T20:46:28Z
Ugx6Bv1pZ2E-fWqNkKF4AaABAg,সত্যি আপনাদের সবার বাংলা গান আমি ভীষণ ভাবে পছন্দ করি। সে পুরুষ হোক আর মেয়ে হোক আপনার সবাই অত্যন্ত সুন্দর গায়ক এবং গায়িকা। ধন্যবাদ আপু আপনাদের সবাইকে।,-1,সত্যি আপনাদের সবার বাংলা গান আমি ভীষণ ভাবে পছন্দ করি। সে পুরুষ হোক আর মেয়ে হোক আপনার সবাই অত্যন্ত সুন্দর গায়ক এবং গায়িকা। ধন্যবাদ আপু আপনাদের সবাইকে।,2025-01-08T16:51:30Z
UgxAK6GX-Hvx5m0uqPJ4AaABAg,এই গান গুলো শুনলে পুরোনো দিনের কথা গুলো মনে পরে যায়,-1,এই গান গুলো শুনলে পুরোনো দিনের কথা গুলো মনে পরে যায়,2025-07-24T18:06:00Z
Ugwf8Zvjd6yCY4wKMXR4AaABAg,দারুণ সুন্দর একটি.গান ❤. মননে.পরে.কথা.মনে.পরেনা এখন.আজ.সুদু.এই. মনে.হয়.লেগেছেভালোকেন.দেখে.ভুলেগ,-1,দারুণ সুন্দর একটি.গান . মননে.পরে.কথা.মনে.পরেনা এখন.আজ.সুদু.এই. মনে.হয়.লেগেছেভালোকেন.দেখে.ভুলেগ,2025-11-09T08:15:33Z
UgyyTC3Y7h80C54ileJ4AaABAg,এই গান গুলো আজীবন ভালো লাগার গান,-1,এই গান গুলো আজীবন ভালো লাগার গান,2023-07-03T05:56:07Z
Ugzlp1Dn_d7yBc0t4-14AaABAg,এই গানটি শুনলে মনের মধ্যে শিহরন জাগে,-1,এই গানটি শুনলে মনের মধ্যে শিহরন জাগে,2022-12-26T01:34:10Z
UgwVNBAWBDA1uflSJOt4AaABAg,আমার এসব গানগুলো খুব ভালো লাগে,-1,আমার এসব গানগুলো খুব ভালো লাগে,2025-08-14T02:49:49Z
UgwN3OEi1JZeiVqwqWR4AaABAg,সুন্দর গলা ।,-1,সুন্দর গলা ।,2024-11-25T19:33:46Z
UgzgtMZyjtvSQWv5ard4AaABAg,"ছোটো বেলায় আমার খুব ভালো লাগলো ধন্যবাদ
আমার প্রিয়",-1,ছোটো বেলায় আমার খুব ভালো লাগলো ধন্যবাদ আমার প্রিয়,2023-06-29T13:40:28Z
UgxEgyVoVDCt7JFQFzV4AaABAg,গানগুলো খুব সুন্দর,-1,গানগুলো খুব সুন্দর,2024-07-09T06:54:03Z
UgxkoitsLH-JaoxF2LR4AaABAg,মন ছুঁয়ে যায়!!,-1,মন ছুঁয়ে যায়!!,2022-10-01T13:07:16Z
UgzTLSvZEevSCXrj5dN4AaABAg,সকাল বেলা আমার SCORPIO টে গান টা চালালাম আমার গাড়ির সমস্ত যাএি একদম চুপ দেখছি মন দিয়ে গান গুলি শুনছে।।। অনেক ভালো গান গুলি।।। love from HOOGHLY DISTRICT ARAMBAGH. MADHUR PUR....... 🥰🥰,-1,সকাল বেলা আমার SCORPIO টে গান টা চালালাম আমার গাড়ির সমস্ত যাএি একদম চুপ দেখছি মন দিয়ে গান গুলি শুনছে।।। অনেক ভালো গান গুলি।।। love from HOOGHLY DISTRICT ARAMBAGH. MADHUR PUR.......,2022-07-15T01:26:49Z
UgzklFylPrHLOnMs3e54AaABAg,এই গান গুলো শুনলে এখনো নতুন মনে হয়,-1,এই গান গুলো শুনলে এখনো নতুন মনে হয়,2022-08-01T08:28:03Z
UgzqGTE9Zt-BN8gFKNJ4AaABAg,অসাধারণ অপূর্ব সব গান গুলো ❤❤❤❤,-1,অসাধারণ অপূর্ব সব গান গুলো,2025-05-25T06:09:22Z
UgywemeGI7LpTUj3nrt4AaABAg,আমার খুব পছন্দের একটা গান❤️,-1,আমার খুব পছন্দের একটা গান️,2024-08-12T09:15:29Z
Ugx2jHrWV2nLmvIUAVh4AaABAg,খুব সুন্দর ভালো লাগার গান 💃🎼🎵🎶💕,-1,খুব সুন্দর ভালো লাগার গান,2022-10-06T06:26:12Z
Ugxo0Y63FjGOyXskzV54AaABAg,"আমি এখনো শুনছি, যতদিন বেঁচে থাকব ❤❤❤❤❤",-1,"আমি এখনো শুনছি, যতদিন বেঁচে থাকব",2025-05-23T02:44:56Z
Ugxxeh8-OwEx99Urn9R4AaABAg,"এই গান গুলো সত্যি সুন্দর, পুরোনো হয় না",-1,"এই গান গুলো সত্যি সুন্দর, পুরোনো হয় না",2023-04-05T04:57:46Z
Ugx91hntkZeGQ-kttQN4AaABAg,মন ছুঁয়ে গেল,-1,মন ছুঁয়ে গেল,2022-06-25T03:43:20Z
Ugx2De-1V-BbVGqqful4AaABAg,বিশেষ করে দুর্গা পূজার সময় এই গান গুলো না শুনলে পুজার ঠিক ইমেজ টাই আসে না ❤❤❤❤❤❤❤❤❤,-1,বিশেষ করে দুর্গা পূজার সময় এই গান গুলো না শুনলে পুজার ঠিক ইমেজ টাই আসে না,2023-10-17T06:44:56Z
UgzqYp9GwVfjxa3Eyqt4AaABAg,আমার বিকালে গান গুলো শুনতে ভীষণ ভালো লাগে ❤😊,-1,আমার বিকালে গান গুলো শুনতে ভীষণ ভালো লাগে,2025-09-04T13:14:12Z
UgxACwoFvUNgbKeEXlp4AaABAg,"খুব সুন্দর হয়েছে গানগুলি❤❤❤❤❤❤❤
ধন্যবাদ ❤❤❤❤",-1,খুব সুন্দর হয়েছে গানগুলি ধন্যবাদ,2025-03-15T06:32:09Z
UgzzOQRg9h0vbsLs9GV4AaABAg,আমি সেই তোমারি চাওয়া ফাগুনের দক্ষিণা হওয়া এই লাইন টা জাস্ট ফাটাফাটি ❤,-1,আমি সেই তোমারি চাওয়া ফাগুনের দক্ষিণা হওয়া এই লাইন টা জাস্ট ফাটাফাটি,2025-02-17T11:35:54Z
UgyytDx-fD22O19D1fd4AaABAg,আমি এই গান সব সময় শুনতে,-1,আমি এই গান সব সময় শুনতে,2025-06-28T09:25:58Z
UgyqzhbANZPD6RS9nXN4AaABAg,😢😢😢😢😢😮😮❤❤❤❤ঐ শুনো তুমিতো আমার প্রিয় মনের মতো করে নেব আমিতো তোমার সেই প্রথম দিন থেকেই প্রথম পিও,-1,ঐ শুনো তুমিতো আমার প্রিয় মনের মতো করে নেব আমিতো তোমার সেই প্রথম দিন থেকেই প্রথম পিও,2025-05-06T20:38:59Z
UgxC-KBFEGCJw4lzghR4AaABAg,মনর.দরজা.খুলে.দিলাম.খুঁজে.না ও.তুমি.কে.আমার এত.দিন.এতকাল.সন্ধ্যাতুমি.সে.বন্ধুপ্রাণ আমার. আমি.সে.তোমার চা ওয়া.ফাগুন.হাবুঝে.না ও.কে.আমার 😢,-1,মনর.দরজা.খুলে.দিলাম.খুঁজে.না ও.তুমি.কে.আমার এত.দিন.এতকাল.সন্ধ্যাতুমি.সে.বন্ধুপ্রাণ আমার. আমি.সে.তোমার চা ওয়া.ফাগুন.হাবুঝে.না ও.কে.আমার,2025-10-12T07:43:27Z
