id,text,label,clean_text,reference_time
UgzWCScO5P8oyFRdftF4AaABAg,তোমাকে শাড়িতেই ভালো লাগে,-1,তোমাকে শাড়িতেই ভালো লাগে,2025-11-01T06:47:54Z
Ugz-vTcqygJ643H8nSZ4AaABAg,শাড়ি পরলে ভালো দেখাতো❤,-1,শাড়ি পরলে ভালো দেখাতো,2025-10-14T09:58:11Z
Ugwr3kWB5dl1nx2fnfF4AaABAg,আপু নিচের ডিজাইন কেমন,-1,আপু নিচের ডিজাইন কেমন,2025-04-15T16:06:20Z
UgysZRd8-rSZTXPAmrh4AaABAg,প্যান্টটা ছোট পোজ কেন,-1,প্যান্টটা ছোট পোজ কেন,2025-03-01T16:28:27Z
UgyRLiN7pVLztw12KJZ4AaABAg,আপু তোমাকে শাড়ি  পরলে ভালো লাগে ❤❤,-1,আপু তোমাকে শাড়ি পরলে ভালো লাগে,2025-12-12T13:05:56Z
UgwQm2j2E4JXp4ujJup4AaABAg,দিদি তোমার নাম কী ❤❤❤❤❤❤❤❤,-1,দিদি তোমার নাম কী,2025-05-08T06:59:20Z
UgwEA67DcMo_EELhGSp4AaABAg,জামাটা বেশি   ছোট হয়েগেছে😂🙄,-1,জামাটা বেশি ছোট হয়েগেছে,2025-05-19T10:12:35Z
Ugysod9Gz0rEye2sg-54AaABAg,আচ্ছা আপনার সামিকে দেখান কেন ❤❤❤,-1,আচ্ছা আপনার সামিকে দেখান কেন,2025-02-08T08:38:30Z
Ugx6fLOaJTPsgI56tdV4AaABAg,তুমি খুব কিউট তোমার ভিডিও গুলো খুব সুন্দর লাগে 😊😊😊❤❤❤❤❤❤,-1,তুমি খুব কিউট তোমার ভিডিও গুলো খুব সুন্দর লাগে,2025-05-18T13:45:49Z
Ugw09PI409eiT86_4dd4AaABAg,অসাধারণ হয়েছে দিদিভাই 🎉🎉❤❤❤❤❤,-1,অসাধারণ হয়েছে দিদিভাই,2024-10-28T07:25:39Z
Ugz-tL8gTv_6JB0DRqV4AaABAg,সবকিছু খুলে দাও কোন অসুবিধা হবে না,-1,সবকিছু খুলে দাও কোন অসুবিধা হবে না,2025-08-06T09:26:18Z
UgxZNSzUgt9hRMafSz54AaABAg,আপু তোমাকে শাড়ি পড়লে অনেক সুন্দর লাগে🥰🥰❤❤ এগুলো পড়লে ভালো লাগে না 😥,-1,আপু তোমাকে শাড়ি পড়লে অনেক সুন্দর লাগে এগুলো পড়লে ভালো লাগে না,2025-05-15T02:27:07Z
UgwXKN7EI8FYU5n3UzJ4AaABAg,লাল জিনিসটা একবার দেখাও ভেতরের,-1,লাল জিনিসটা একবার দেখাও ভেতরের,2025-08-06T09:25:44Z
Ugz-Sl-9PyhtN0bJZfJ4AaABAg,প্যান্টের ভিতরে যে লাল জিনিসটা আছে উপরে কালো ভিতরে লাল,-1,প্যান্টের ভিতরে যে লাল জিনিসটা আছে উপরে কালো ভিতরে লাল,2025-08-06T09:26:00Z
UgzpoWlEie5neMWpDod4AaABAg,বাহাদুরপুরে কাজটা কেন ছেড়ে দিলে ওটাই তো ভালো ছিল,-1,বাহাদুরপুরে কাজটা কেন ছেড়ে দিলে ওটাই তো ভালো ছিল,2025-08-06T09:26:49Z
UgxX3LvU_FFdhFYvzSt4AaABAg,নতুন একটা হোটেল খুলেছে বাহাদুরপুরে তুমি আসবা,-1,নতুন একটা হোটেল খুলেছে বাহাদুরপুরে তুমি আসবা,2025-08-06T09:26:59Z
UgxWe_ZyXbWUNDizl154AaABAg,জামাটা খুলে দিতে,-1,জামাটা খুলে দিতে,2025-08-06T09:25:23Z
UgzAxG1rd7sp0xf-0IV4AaABAg,খুব খুব খুব খুব সুন্দর হয়েছে নাচটা,-1,খুব খুব খুব খুব সুন্দর হয়েছে নাচটা,2025-08-18T12:38:23Z
UgzyaJDr4jerGRBkNN14AaABAg,প্যান্ট জামা খুলে ভিডিও বানালে বেশি লাইক পাবে,-1,প্যান্ট জামা খুলে ভিডিও বানালে বেশি লাইক পাবে,2025-08-06T09:26:09Z
UgzdSZ1IBZpyiOV6ZeN4AaABAg,দিদি প্লিজ তোমার নামটা বল প্লিজ 🙏🙏🙏🙏🙏🙏,-1,দিদি প্লিজ তোমার নামটা বল প্লিজ,2025-10-05T07:47:28Z
UgzhRkyfbW_Ss0E6an54AaABAg,ড্রেসটা একবার দেখেছো,-1,ড্রেসটা একবার দেখেছো,2025-11-27T07:08:30Z
UgwYDEq9YxLTyZSn9th4AaABAg,কার থেকে ন্যাংটো হয়ে নাচবে আর একটু ভালো লাগবে😊😊,-1,কার থেকে ন্যাংটো হয়ে নাচবে আর একটু ভালো লাগবে,2025-06-26T13:28:50Z
UgwAVEfueUkEHKjBX5x4AaABAg,দিদি তোমার কাপড়ের সুন্দর এগুলো নয়,-1,দিদি তোমার কাপড়ের সুন্দর এগুলো নয়,2025-05-27T13:19:43Z
Ugx2aGMGhwadOTj-RA14AaABAg,খোলা শুরু করে দিয়েছো আস্তে আস্তে,-1,খোলা শুরু করে দিয়েছো আস্তে আস্তে,2025-08-06T09:25:16Z
Ugwqze-_6k8WosA7KMl4AaABAg,দিদি এড্রেসে তোমাকে একদম ভালো লাগছে না😢😢😢 তুমি শাড়িতেই সুন্দরী❤❤❤😊,-1,দিদি এড্রেসে তোমাকে একদম ভালো লাগছে না তুমি শাড়িতেই সুন্দরী,2025-09-19T08:32:52Z
UgxceifDLILLPNUft8V4AaABAg,আপি তোমাকে শর্ট ড্রেসের থেকে শাড়িতে অসাধারণ লাগে 🥰🥰,-1,আপি তোমাকে শর্ট ড্রেসের থেকে শাড়িতে অসাধারণ লাগে,2025-01-22T07:05:28Z
UgzsJhMkZnP2MD_lcHt4AaABAg,❤তুমার  নাম কি আপু,-1,তুমার নাম কি আপু,2024-10-30T05:22:57Z
Ugyk6k9awskliEH6tXR4AaABAg,আপনার নাম কি,-1,আপনার নাম কি,2025-11-19T15:33:43Z
Ugyt8LcFGPZBVnvJDPx4AaABAg,নিচে প্যান্ট পড়েছে ওটা খুলে দাও,-1,নিচে প্যান্ট পড়েছে ওটা খুলে দাও,2025-08-06T09:25:35Z
Ugy4jB_IA09LxHk4wWZ4AaABAg,পায়ে কালো ইটা পড়বে না,-1,পায়ে কালো ইটা পড়বে না,2025-06-13T06:26:02Z
UgxLqMFxK53vsJ3np394AaABAg,তোমার নাম কী❤❤❤,-1,তোমার নাম কী,2025-02-06T02:52:44Z
Ugy7gSKNGSPd1OeKG6x4AaABAg,আপু আপনার নাম কি🎉❤,-1,আপু আপনার নাম কি,2025-12-19T04:20:01Z
UgyFI2_8VHAXX7E_o-t4AaABAg,কোন অসুবিধা হলে আমরা আছি তো তোমার ভাতারকে বলে সবকিছু ঠিক করিয়ে দেবো,-1,কোন অসুবিধা হলে আমরা আছি তো তোমার ভাতারকে বলে সবকিছু ঠিক করিয়ে দেবো,2025-08-06T09:26:30Z
Ugw9Wi_NLVDBj0zsPpR4AaABAg,তোমার ভাতার ও নাং করছে আর তুমিও নাং করছো,-1,তোমার ভাতার ও নাং করছে আর তুমিও নাং করছো,2025-08-06T09:26:39Z
Ugwlw3p7l_j_3ngWm194AaABAg,এই মেয়েটা কে আমার ভালো লাগেনা,-1,এই মেয়েটা কে আমার ভালো লাগেনা,2025-08-07T09:39:15Z
Ugy-im2jhmvXTACf3c14AaABAg,শাড়ি ছেড়ে কিনা এতো ছোট্ট ড্রেস 😅😅😅😅😅😅😅😅😅😂😂😂😂😂😂,-1,শাড়ি ছেড়ে কিনা এতো ছোট্ট ড্রেস,2024-11-18T11:04:04Z
UgzG7pUCGgpMTB8_DTl4AaABAg,দিদি আপনার নিচের হাফপ্যান্টা দেখা গেছে,-1,দিদি আপনার নিচের হাফপ্যান্টা দেখা গেছে,2025-01-04T13:43:02Z
Ugw8778sysAFGqCgbJN4AaABAg,দেখাবো তুই কিরকম হয় 😈😅,-1,দেখাবো তুই কিরকম হয়,2025-12-15T02:57:17Z
UgxfP0EN_EFQ6T2kkkZ4AaABAg,আমার বিচ্ছেদ হয়ে গেলো একটা লাইন আমি আমার প্রিয় মানুষের জন্য ভালো বাসা ভালো থাকুক অন্য কোনো ভালো বাসা য় কেউ লাইক করলে আবার গানটা শুনে যাব,-1,আমার বিচ্ছেদ হয়ে গেলো একটা লাইন আমি আমার প্রিয় মানুষের জন্য ভালো বাসা ভালো থাকুক অন্য কোনো ভালো বাসা য় কেউ লাইক করলে আবার গানটা শুনে যাব,2025-09-17T04:46:03Z
UgwPnwhLaUxW72rwQDR4AaABAg,লতাজী নেই এটা ভাবতেই কষ্ট লাগে। সুরের সম্রাট লতাজীর গান এই মুহূর্তে কে কে শুনছেন?,-1,লতাজী নেই এটা ভাবতেই কষ্ট লাগে। সুরের সম্রাট লতাজীর গান এই মুহূর্তে কে কে শুনছেন?,2024-11-26T11:44:08Z
Ugw9FDGv-ZnTewJ6rsx4AaABAg,লতা মঙ্গেশকর সত্যি সত্যি মা সরস্বতী এক রুপ।,-1,লতা মঙ্গেশকর সত্যি সত্যি মা সরস্বতী এক রুপ।,2022-11-15T14:44:45Z
Ugy5v9AR-I49pKQU9Ix4AaABAg,"জীবনের কথা লিখতে বসেছি,দুঃখগুলি সব লেখা হয়ে গেছে,এরপর সুখগুলি লিখতে যাব,,,,তখনই কলমের কালি শেষ....হয়তো এটাই জীবন...",-1,"জীবনের কথা লিখতে বসেছি,দুঃখগুলি সব লেখা হয়ে গেছে,এরপর সুখগুলি লিখতে যাব,,,,তখনই কলমের কালি শেষ....হয়তো এটাই জীবন...",2024-06-06T09:25:10Z
Ugxcp2Hbxjl7iClb9CF4AaABAg,"সুখ  ,দুঃখ ,ব্যথা,, বেদনা,   মানসিক যন্ত্রনা,IIII সকল সময়ে ।।। আপনার কন্ঠ আপনার গান শুনলে মনে শান্তি মেলে।।।। ,, BENGALI to HINDI ,,❤️❤️❤️❤️❤️❤️❤️❤️❤️❤️❤️❤️❤️❤️❤️❤️❤️❤️❤️❤️❤️❤️❤️❤️❤️❤️❤️❤️❤️❤️❤️❤️",-1,"সুখ ,দুঃখ ,ব্যথা,, বেদনা, মানসিক যন্ত্রনা,IIII সকল সময়ে ।।। আপনার কন্ঠ আপনার গান শুনলে মনে শান্তি মেলে।।।। ,, BENGALI to HINDI ,,️️️️️️️️️️️️️️️️️️️️️️️️️️️️️️️️",2023-01-23T16:37:23Z
UgwZV9v2YyUptOY5_Op4AaABAg,মা তোমার এই কথার আর গানের সঙ্গে আমার সব কিছু মিল আছে কেউ নেই আমার🙏 নীয়ো,-1,মা তোমার এই কথার আর গানের সঙ্গে আমার সব কিছু মিল আছে কেউ নেই আমার নীয়ো,2022-04-28T05:57:07Z
UgzQ0UEC8yya64BeEZB4AaABAg,"জানিনা এই গানের মধ্যে কি আছে, কেনো এতো ভাললাগে😢😢 গানের প্রতিটা লাইন জীবনের সংগে মিলে গেছে 😢😢 """"আজ পড়ে আছে হিরা পান্না খুশি নেই আছে শুধু কান্না""""😢😢 হৃদয় স্পর্সি লাইন 😢❤",-1,"জানিনা এই গানের মধ্যে কি আছে, কেনো এতো ভাললাগে গানের প্রতিটা লাইন জীবনের সংগে মিলে গেছে """"আজ পড়ে আছে হিরা পান্না খুশি নেই আছে শুধু কান্না"""" হৃদয় স্পর্সি লাইন",2025-08-21T09:28:54Z
UgzCkaS7gs7EelDtKLN4AaABAg,গানের মধ্য দিয়েই লতা মঙ্গেশকর মানুষের মনে অমর হয়ে থাকবে। লহ প্রনাম।,-1,গানের মধ্য দিয়েই লতা মঙ্গেশকর মানুষের মনে অমর হয়ে থাকবে। লহ প্রনাম।,2022-08-31T02:20:09Z
UgyAXbB-IGGvVOSoAQh4AaABAg,আপন মানুষ গুলো অনেক নিষ্ঠোর,-1,আপন মানুষ গুলো অনেক নিষ্ঠোর,2024-03-14T09:31:44Z
UgySafJaELVWja2NWHF4AaABAg,"আমি তখন খুব ছোট, আমার এক দাদা tape recoder ছিল, সেটাতে এই গানটা শুনেছিলাম। অনেক পুরানো দিনের গান, তখন আমার পাড়ায় কারেন্ট আসেনি।",-1,"আমি তখন খুব ছোট, আমার এক দাদা tape recoder ছিল, সেটাতে এই গানটা শুনেছিলাম। অনেক পুরানো দিনের গান, তখন আমার পাড়ায় কারেন্ট আসেনি।",2025-07-09T11:33:03Z
UgywTBSGf8v63ocKpCF4AaABAg,লতা দিদির কণ্ঠ আগামী  হাজার বছরেও কেউ তৈরি করতে পারবে না। প্রণাম দিদি মা❤❤❤,-1,লতা দিদির কণ্ঠ আগামী হাজার বছরেও কেউ তৈরি করতে পারবে না। প্রণাম দিদি মা,2023-09-28T16:54:23Z
Ugz5X0ghxGAJiX-ODcp4AaABAg,গানগুলি  চির অমর  হয়ে রইল।,-1,গানগুলি চির অমর হয়ে রইল।,2025-07-04T19:50:14Z
Ugw3-DanFishg3A4kkN4AaABAg,কি গান গেয়ে গ্যাছো মা গো 😌🙏😭😭😭,-1,কি গান গেয়ে গ্যাছো মা গো,2022-04-23T18:05:00Z
Ugwlcibs81PoNbqgEct4AaABAg,"শেষের লাইনটা শুনে ভীষন কষ্ট লাগলো। 
""চলে যাওয়া দিন ফিরে আসে না তো আর""। 
সত্যিই তাই আমি নিজের অযত্নে অনেক ভালো ভালো দিন হারিয়ে ফেলেছি, যেগুলো আর কি সত্যিই কখনো ফিরে পাবো না?!",-1,"শেষের লাইনটা শুনে ভীষন কষ্ট লাগলো। ""চলে যাওয়া দিন ফিরে আসে না তো আর""। সত্যিই তাই আমি নিজের অযত্নে অনেক ভালো ভালো দিন হারিয়ে ফেলেছি, যেগুলো আর কি সত্যিই কখনো ফিরে পাবো না?!",2025-11-27T17:40:39Z
UgyDUWrt_BDJ9PHiEhd4AaABAg,বেদনা আঘাত সবার মধ্যেই আছে সে যেমন মানুষ ই হোক । এই একটা দিকে আমরা সব মানুষ এক আরো কোন দিকে তো ছোট বড় ধনী গরীব এসব নিয়ে ব্যস্ত  সবাই--,-1,বেদনা আঘাত সবার মধ্যেই আছে সে যেমন মানুষ ই হোক । এই একটা দিকে আমরা সব মানুষ এক আরো কোন দিকে তো ছোট বড় ধনী গরীব এসব নিয়ে ব্যস্ত সবাই--,2023-03-24T06:07:40Z
UgzWK31f5HG2ZuPoNv54AaABAg,মনটা খুব ভারাক্রান্ত হয়ে গেল শুনতে শুনতে।। 🥺😢,-1,মনটা খুব ভারাক্রান্ত হয়ে গেল শুনতে শুনতে।।,2022-02-10T14:55:33Z
Ugz8BPjij8kxD8xDukR4AaABAg,আমার জীবনের সাথে পুরোপুরি মিলে গেছে। অসাধারণ গান। বারবার শুনে ও আশ মেটে না,-1,আমার জীবনের সাথে পুরোপুরি মিলে গেছে। অসাধারণ গান। বারবার শুনে ও আশ মেটে না,2025-09-06T17:56:57Z
Ugyhve5IqerFIl8nf7h4AaABAg,আপনার প্রতিটি গান অসাধারণ। আপনার প্রতি শুভ কামনা রইল।,-1,আপনার প্রতিটি গান অসাধারণ। আপনার প্রতি শুভ কামনা রইল।,2022-07-06T17:10:54Z
Ugx-8lKnklQkYqxEelZ4AaABAg,জীবনের যত কষ্ট সবটাই মনপ্রাণ জুড়ে 🙏,-1,জীবনের যত কষ্ট সবটাই মনপ্রাণ জুড়ে,2022-03-22T10:47:29Z
UgwKneMMC7j63NJQrtp4AaABAg,"পঞ্চমের সঙ্গীত রচনা, স্বপন চক্রবর্তীর কথা ও লতাজির কণ্ঠ। জীবনে আর কি দরকার?",-1,"পঞ্চমের সঙ্গীত রচনা, স্বপন চক্রবর্তীর কথা ও লতাজির কণ্ঠ। জীবনে আর কি দরকার?",2023-11-25T05:40:09Z
Ugw7FQYKaxEqWuaMqY14AaABAg,মা স্বরস্বতীর সমতুল্য আপনি লতা মা আপনী যেখানেই থাকুন খুব খুব ভালো থাকুন Miss you maa😭😭😭❤️❤️❤️🙇🙇🙇,-1,মা স্বরস্বতীর সমতুল্য আপনি লতা মা আপনী যেখানেই থাকুন খুব খুব ভালো থাকুন Miss you maa️️️,2025-11-22T14:50:41Z
UgwxjSsvCCJ-Gk5HVEt4AaABAg,এই গান শুনলে নিজেকে খুব একা মনে হয়। মনে হয় আমি কে আমি শুধু একটা আত্মা । সবাই কে নিয়ে যখোন চলতে হবে তখন আর ঝগড়া মারপিট করে কি লাভ আজ আছি কাল না থাকতেও পারি । আর সব থেকে বড় কথা হলো যে আজ সব ফাচলামির গান বেরিয়ে এই গান গুলো চাপা পড়ে গেছে । আজ এই গান গুলো অনেকে শুনে বলে কি গান শুনছিস এইগুলো ।,-1,এই গান শুনলে নিজেকে খুব একা মনে হয়। মনে হয় আমি কে আমি শুধু একটা আত্মা । সবাই কে নিয়ে যখোন চলতে হবে তখন আর ঝগড়া মারপিট করে কি লাভ আজ আছি কাল না থাকতেও পারি । আর সব থেকে বড় কথা হলো যে আজ সব ফাচলামির গান বেরিয়ে এই গান গুলো চাপা পড়ে গেছে । আজ এই গান গুলো অনেকে শুনে বলে কি গান শুনছিস এইগুলো ।,2023-03-05T17:22:21Z
Ugy-20tiFEW3Zncv52B4AaABAg,"আপনজনেরা ব্যাথা বেদনা বেশি দেয়, আপনি সেটা টলারেট করলে একসময় পর যারা তারা ও একৈভাবে ব্যাথা বেদনা দিয়ে যায় বারে বারে। অনুরাধা মেডামের কন্ঠে কয়েকটি বাংলা গান চাইছি!",-1,"আপনজনেরা ব্যাথা বেদনা বেশি দেয়, আপনি সেটা টলারেট করলে একসময় পর যারা তারা ও একৈভাবে ব্যাথা বেদনা দিয়ে যায় বারে বারে। অনুরাধা মেডামের কন্ঠে কয়েকটি বাংলা গান চাইছি!",2025-04-07T03:41:26Z
UgyPpV-nio6Qf4jTGYt4AaABAg,"লতা দির গাওয়া যে কোনো গানই হোক না কেন,তাঁর গলায় গানের রস খুঁজে নিতে মোটেই অসুবিধা হয় না আমার।তাঁর এই
সব গানের মাঝে তাঁকে আজীবন বাঁচিয়ে রাখার চেষ্টা করি। অমর শিল্পী তুমি দিদি
সকলের আছে এই ভাবেই বেঁচে থাকো",-1,"লতা দির গাওয়া যে কোনো গানই হোক না কেন,তাঁর গলায় গানের রস খুঁজে নিতে মোটেই অসুবিধা হয় না আমার।তাঁর এই সব গানের মাঝে তাঁকে আজীবন বাঁচিয়ে রাখার চেষ্টা করি। অমর শিল্পী তুমি দিদি সকলের আছে এই ভাবেই বেঁচে থাকো",2022-11-07T15:45:10Z
UgybnA_49-ny_Obl-xl4AaABAg,গানের প্রতিটা কথার সাথে আমার জীবনের অনেক মিল খুঁজে পেলাম। চোখের জল কিছুতেই যেন ধরে রাখতে পারলাম না। 😂😂😂😂😂,-1,গানের প্রতিটা কথার সাথে আমার জীবনের অনেক মিল খুঁজে পেলাম। চোখের জল কিছুতেই যেন ধরে রাখতে পারলাম না।,2025-12-09T16:19:15Z
Ugx4bQeYuSeSk4oQp-F4AaABAg,"আপন যারা,তারাই আমায় দিয়ে গেলো বেদনারি ভার ।। সত্যিই  তাই।
আপনজনরা এমন কেন হয় ??",-1,"আপন যারা,তারাই আমায় দিয়ে গেলো বেদনারি ভার ।। সত্যিই তাই। আপনজনরা এমন কেন হয় ??",2024-01-16T12:09:49Z
UgyW9Utkr-p9vzIXJfF4AaABAg,আপনজন দের থেকে দুঃখ পেলে এই গানটা শুনবেন। দেখবেন বুকটা অনেক হালকা হবে 😢,-1,আপনজন দের থেকে দুঃখ পেলে এই গানটা শুনবেন। দেখবেন বুকটা অনেক হালকা হবে,2025-07-01T03:26:12Z
UgzeBEEgqvRs-0vtPmF4AaABAg,"জীবনটা খুব কষ্টের... 😢😢মিছে কেনো আর বেচেঁ থাকা..,কেনো করো নাম ধরে ডাকা... 🙏🙏💐💐😭😭",-1,"জীবনটা খুব কষ্টের... মিছে কেনো আর বেচেঁ থাকা..,কেনো করো নাম ধরে ডাকা...",2022-12-17T10:35:57Z
UgziQnYriylnF2XFCS94AaABAg,"শুভ সন্ধ্যা
গান টা অসাধারন, একটু শান্তি পেলাম",-1,"শুভ সন্ধ্যা গান টা অসাধারন, একটু শান্তি পেলাম",2022-10-01T14:15:28Z
UgxBwzHYnOVDe0klvB54AaABAg,একেই বলে সরস্বতীর দান 🎉সারা জিবোন মনের মধ্যেই থেকে যাবে ❤❤❤❤❤❤,-1,একেই বলে সরস্বতীর দান সারা জিবোন মনের মধ্যেই থেকে যাবে,2024-10-27T15:05:28Z
