id,text,label,clean_text,reference_time
Ugy9XUbR8yihya_fTHh4AaABAg,খুব খুব ভালো লাগলো,-1,খুব খুব ভালো লাগলো,2025-11-11T14:59:27Z
Ugx7O5gU_8AfRlYEXtl4AaABAg,সত্যি  অনেক সুন্দর হয়েছে 😂😂😂😂😂,-1,সত্যি অনেক সুন্দর হয়েছে,2025-11-08T10:26:10Z
Ugw1uAKqfXnNPtYZWzp4AaABAg,অনেক সুন্দর একটা গান ❤️❤️❤️,-1,অনেক সুন্দর একটা গান ️️️,2025-10-20T04:57:42Z
Ugzjk-tGH8Fm1jgukS94AaABAg,আমার পছন্দের গানের মধ্যে একটা 🤗🤗,-1,আমার পছন্দের গানের মধ্যে একটা,2025-11-03T04:38:30Z
Ugxn8WYUnwl4SeAU7zR4AaABAg,আমার এই গানটা খুব ভালো লাগে 😊🎉,-1,আমার এই গানটা খুব ভালো লাগে,2025-10-18T03:42:11Z
Ugxac1xcL8XpHtw5rbt4AaABAg,তাই নাকি ভাইয়া গো 😊😊😊,-1,তাই নাকি ভাইয়া গো,2025-11-17T10:48:10Z
UgxGguz0FhQ5GHy_alV4AaABAg,কানা করে ফিলছি 😂😂😂,-1,কানা করে ফিলছি,2025-10-20T13:39:35Z
UgyDLWZMYh-gkOFFkzR4AaABAg,খুব  সুন্দর হয়েছে ভিডিও টা ❤❤❤❤,-1,খুব সুন্দর হয়েছে ভিডিও টা,2025-11-23T06:34:08Z
Ugwh-1Spsc4-ftrtuB14AaABAg,আমার পছন্দের গান শুনলে মন ভালো হয়ে যায়,-1,আমার পছন্দের গান শুনলে মন ভালো হয়ে যায়,2025-11-19T06:58:40Z
UgwY6vXJAfYM1gKuQhJ4AaABAg,আমি এক টা প্রেম করব কেউ কি আছেন,-1,আমি এক টা প্রেম করব কেউ কি আছেন,2025-11-09T16:48:33Z
UgyJpBgnewRojKDSCZB4AaABAg,কেমন আচেন আপু❤❤,-1,কেমন আচেন আপু,2025-10-26T04:09:09Z
Ugy3L8CHwThGRWeXieB4AaABAg,একজন মেয়ের জীবনে এই সময় আসে,-1,একজন মেয়ের জীবনে এই সময় আসে,2025-12-13T05:21:37Z
UgxZk9hSz5mXJ-kRLcl4AaABAg,আমি কে দেখিয়ে দিয়েছি 😭😭😭😭😭😭😭😭😭😭😭😭😭😭😭😭😭😭😭😭😭😭😭😭😭😭😭🥺🥺🥺🥺🥺🥺🥺🥺🥺🥺🤒🤒🤒🤒🤒🤒💙💙💙,-1,আমি কে দেখিয়ে দিয়েছি,2025-10-24T08:43:08Z
UgxzycUZtOBAU5WJu514AaABAg,ও-ই আমি আমার মনে করেন আমাদের জন্য অপেক্ষা করছে তার সাথে কথা হবে এমন হয়ে যায়,-1,ও-ই আমি আমার মনে করেন আমাদের জন্য অপেক্ষা করছে তার সাথে কথা হবে এমন হয়ে যায়,2025-10-20T05:05:45Z
UgyvkBDyuuyIwls0cW94AaABAg,অনেক সুন্দর  গানটা😊😊,-1,অনেক সুন্দর গানটা,2025-10-20T15:39:59Z
UgwPtsU-1hHeq-o_vcl4AaABAg,এই গান টা খুব প্রিয় 😭😭😭😭😭😭,-1,এই গান টা খুব প্রিয়,2025-11-19T01:57:16Z
UgykmbcFbBdpK0QHCEF4AaABAg,ওয়াও নাইস সো বিউটিফুল গান 🥰🥰🥰🥰🥰🥰,-1,ওয়াও নাইস সো বিউটিফুল গান,2025-11-26T04:48:41Z
Ugw1gwvvD9Ux9d5VJqB4AaABAg,অনেক সুন্দর হয়েছে 😊😊,-1,অনেক সুন্দর হয়েছে,2025-11-10T23:52:53Z
UgzcXQyW75GFTrSEmdF4AaABAg,"আমাদের বাংলাদেশের একজন ছাগলের বাচ্চা, ছাগু উদ্দিন 😊",-1,"আমাদের বাংলাদেশের একজন ছাগলের বাচ্চা, ছাগু উদ্দিন",2025-06-05T10:55:12Z
Ugx5s5ahySDbuExj6214AaABAg,এখন সবায় বলো কেমন লাগতেছে গান গুলো,-1,এখন সবায় বলো কেমন লাগতেছে গান গুলো,2025-06-04T16:24:08Z
UgyvIu4oMDUrhFrvEAJ4AaABAg,"আসাধারন ❤❤❤❤❤❤❤❤❤❤ মনটা ভরে গেল, আমার জীবনের সেরা অভিজ্ঞতা ❤❤❤❤❤।",-1,"আসাধারন মনটা ভরে গেল, আমার জীবনের সেরা অভিজ্ঞতা ।",2025-07-29T05:09:18Z
UgyQpu4OeGdYojVpyux4AaABAg,গানের তুলনাই হয় না,-1,গানের তুলনাই হয় না,2025-10-03T09:18:43Z
UgzXhXiitcP3dG6OWnJ4AaABAg,ভালো লাগে গান গুলো 😊❤,-1,ভালো লাগে গান গুলো,2025-07-26T07:09:25Z
Ugz-TPjeEefGmEv1D-p4AaABAg,খুব ভালো লাগলো  অনেক আগের গান শুনে ❤,-1,খুব ভালো লাগলো অনেক আগের গান শুনে,2025-08-22T10:29:33Z
Ugzc0kjZ5tLBh-Q2kmh4AaABAg,কেন জানি ভালো লাগে গান গুলা❤,-1,কেন জানি ভালো লাগে গান গুলা,2025-08-28T02:17:45Z
UgzZ39_y7LRKUKoSPZB4AaABAg,জীবনের প্রথম থেকেই ধোকা খাওয়াই যেন আমার ভাগ্য 😭 যাকে যত বেশি বিশ্বাস করলাম সে তত বেশিই কান্দাইলো 😭😭😭,-1,জীবনের প্রথম থেকেই ধোকা খাওয়াই যেন আমার ভাগ্য যাকে যত বেশি বিশ্বাস করলাম সে তত বেশিই কান্দাইলো,2025-10-19T17:29:01Z
UgzqYMypeNRKPDgde994AaABAg,অনেক দিন পারে মন ছুয়ানো মাটির গান শুনতে পেলাম,-1,অনেক দিন পারে মন ছুয়ানো মাটির গান শুনতে পেলাম,2025-07-31T16:35:43Z
Ugzd7uZkDnNKtCMFTaR4AaABAg,"আমি আজকে পবিত্র ঈদের দিন বন্ধ ঘরে হেডফোন লাগিয়ে গানগুলো শুনলাম সত্যিই অনেক অনেক সুন্দর গান 
ভাই আমরা তো প্রবাসী তাই আজকে পবিত্র ঈদের দিনে রুমে শুয়ে পরিবারের কথা ভেবে চোঁখের পানি ফেলছি 😢😢",-1,আমি আজকে পবিত্র ঈদের দিন বন্ধ ঘরে হেডফোন লাগিয়ে গানগুলো শুনলাম সত্যিই অনেক অনেক সুন্দর গান ভাই আমরা তো প্রবাসী তাই আজকে পবিত্র ঈদের দিনে রুমে শুয়ে পরিবারের কথা ভেবে চোঁখের পানি ফেলছি,2025-06-07T08:34:08Z
UgyYa438leXN_4MI74d4AaABAg,আমি আ  রাজজাক   সুনি ।,-1,আমি আ রাজজাক সুনি ।,2025-07-03T10:18:12Z
UgyitIVKDCnKV1UtMiR4AaABAg,আমি রেগুলার শুনি,-1,আমি রেগুলার শুনি,2025-07-18T08:51:33Z
UgzXEJmJVaB_OmleMOp4AaABAg,গান শুনে  মনে শাস্তি পাইলাম একটু,-1,গান শুনে মনে শাস্তি পাইলাম একটু,2025-06-01T21:08:52Z
UgwHW3B7-C0c1VFSxF94AaABAg,আগের গান গুলুর মধ্যা অনেক কিছু খুজে পাওয়া যায়। গান গুলো খুব ভালো লাগে।❤❤❤❤❤,-1,আগের গান গুলুর মধ্যা অনেক কিছু খুজে পাওয়া যায়। গান গুলো খুব ভালো লাগে।,2025-10-02T13:02:14Z
Ugw9p-asGsad2Pg-sQt4AaABAg,গাজীপুর থেকে শূনছি আমার খুব  পিয় গান,-1,গাজীপুর থেকে শূনছি আমার খুব পিয় গান,2025-06-07T07:42:21Z
UgyMe6WS69bAerduGVh4AaABAg,আমি গীতিকার আবুপাগলা শুনছি,-1,আমি গীতিকার আবুপাগলা শুনছি,2025-06-04T15:37:55Z
UgyDFWUTlHlkmHYdxhR4AaABAg,"আমি একজন প্রবাসি ২৫০০ মতন গান আছে আমার,,, 
বাংলা দে-শটা মুসলিম রাষ্ট্র 
এদের পুড়ে করো কাষ্ঠ 
নাইলে হবে দেশটা নষ্ট 
বলে আব্দুর রহমান যায়।।",-1,"আমি একজন প্রবাসি ২৫০০ মতন গান আছে আমার,,, বাংলা দে-শটা মুসলিম রাষ্ট্র এদের পুড়ে করো কাষ্ঠ নাইলে হবে দেশটা নষ্ট বলে আব্দুর রহমান যায়।।",2025-06-14T20:32:58Z
UgxrjQDOHvoFFjBzklp4AaABAg,যাড়া এই যোগে এসে এই গান গুলো শুনে তারা সত্যিই অনেক ভালো মনের মানুষ 😊🥺,-1,যাড়া এই যোগে এসে এই গান গুলো শুনে তারা সত্যিই অনেক ভালো মনের মানুষ,2025-07-29T18:51:08Z
UgzNlKGMW3VssYVvJ_F4AaABAg,কিছু কিছু গানের সাথে জীবনের কাহিনী  মিলে যায়,-1,কিছু কিছু গানের সাথে জীবনের কাহিনী মিলে যায়,2025-07-07T19:58:02Z
Ugx6Le-SS7wSMpQUizV4AaABAg,অনেক সুন্দর কন্ঠ ভাওয়াইয়া। এ কন্ঠে বেশি বেশি গান শুনতে চাই।,-1,অনেক সুন্দর কন্ঠ ভাওয়াইয়া। এ কন্ঠে বেশি বেশি গান শুনতে চাই।,2025-06-15T07:27:53Z
UgxkZpyOikjwQnB8hRN4AaABAg,গান গুলো হয়তোবা আমার জন্মের আগের কিন্তু ২০২৫ সালে এসে এই গান শুনে গানের মায়ার পড়ে গেলাম,-1,গান গুলো হয়তোবা আমার জন্মের আগের কিন্তু ২০২৫ সালে এসে এই গান শুনে গানের মায়ার পড়ে গেলাম,2025-06-05T11:31:18Z
UgxZQ9vd2I9BjGcSZ2J4AaABAg,অনেক ভালো লাগলো গান গুলি ❤❤❤❤❤❤,-1,অনেক ভালো লাগলো গান গুলি,2025-06-25T15:17:25Z
UgwJLi__Cbs3FDsK2s94AaABAg,খুবই ভালো লাগছে গান,-1,খুবই ভালো লাগছে গান,2025-06-21T13:58:12Z
UgzGvy1uiOqBnMU52PJ4AaABAg,গান গুলো অনেক অগের গানটি সুনে মন জুরালো ❤❤❤❤❤❤❤❤😢😢😢😢😢,-1,গান গুলো অনেক অগের গানটি সুনে মন জুরালো,2025-07-26T20:23:20Z
Ugw-sBsnIXepzGoOtdF4AaABAg,অনেক সুন্দর একটা গান আমার কাছে ভালো লাগে,-1,অনেক সুন্দর একটা গান আমার কাছে ভালো লাগে,2025-06-10T02:26:40Z
Ugx_6t69SPoEY8Wb9fh4AaABAg,উপ উপ মনটা পাগল হয়ে যায় এমন গান ছোটা বেলার গান❤❤❤🤣🤣😪😪😪,-1,উপ উপ মনটা পাগল হয়ে যায় এমন গান ছোটা বেলার গান,2025-06-25T17:13:09Z
UgzKvOOHRWfO3m7pnAx4AaABAg,এই দরনে গান সুনলে জুবক ছেলে ও মেয়ের ইপটিজিন করে না।দুইজনের বিতোর ভালোবাস তৈরিহয়।রাজি না হলে বিবেদ শিস্টি কোনো পোরজন নাই।,-1,এই দরনে গান সুনলে জুবক ছেলে ও মেয়ের ইপটিজিন করে না।দুইজনের বিতোর ভালোবাস তৈরিহয়।রাজি না হলে বিবেদ শিস্টি কোনো পোরজন নাই।,2025-06-24T06:00:19Z
Ugz-6P8KaB6NrD2dUjR4AaABAg,কেউ বলেন শিল্পী নাম কী 😊,-1,কেউ বলেন শিল্পী নাম কী,2025-07-26T07:23:19Z
UgyUfwaJel3saMVrM3V4AaABAg,তিন নাম্বার গানটা অনেক ভালো লাগছে 😢😢😢😢,-1,তিন নাম্বার গানটা অনেক ভালো লাগছে,2025-06-24T04:34:27Z
UgwN9B6gujp9yKMhCnV4AaABAg,"খুব সুন্দর আগেকার ভাটিয়ালী গান, মনটা অতীতের মাঝে চলে যাই।",-1,"খুব সুন্দর আগেকার ভাটিয়ালী গান, মনটা অতীতের মাঝে চলে যাই।",2025-06-05T04:34:12Z
UgzJAKrV_8YnzRUmCQl4AaABAg,"এই গাান গুলা আনার জিবনের সাথে মিলে,💔😩",-1,"এই গাান গুলা আনার জিবনের সাথে মিলে,",2025-06-01T07:52:30Z
UgxKtT4X0Y2098mUUIt4AaABAg,গানের অর্থ্য ব্যাপক,-1,গানের অর্থ্য ব্যাপক,2025-12-16T05:50:25Z
UgwVfPEG0niw7cxaM_R4AaABAg,এমনিতেই ত তুমি আমার সাথেই থাকো। আমি যেখানে যাই সেখানে। আলহামদুলিল্লাহ 🎉😂,-1,এমনিতেই ত তুমি আমার সাথেই থাকো। আমি যেখানে যাই সেখানে। আলহামদুলিল্লাহ,2025-06-06T16:24:47Z
UgwxscmdgIMFgwEbAcp4AaABAg,এক কথাই ওসাদারন❤❤❤,-1,এক কথাই ওসাদারন,2025-06-27T18:16:17Z
Ugxk2V7zSl1eDckk2T14AaABAg,১ নাম্বার গানটার প্রেমে পড়ে গেছি 😊,-1,১ নাম্বার গানটার প্রেমে পড়ে গেছি,2025-06-29T14:18:41Z
UgyiuPzs02QOOmxmxpl4AaABAg,"অসাধারণ একটি গান , অনেক বেশি ভালো লাগে ❤❤❤❤❤❤",-1,"অসাধারণ একটি গান , অনেক বেশি ভালো লাগে",2025-09-16T05:28:55Z
UgzFFU5qUMHONztfG5d4AaABAg,খুব চমৎকার একটা গান❤❤❤❤❤,-1,খুব চমৎকার একটা গান,2025-06-01T09:44:26Z
UgwxSkzhtm7ApxooDhR4AaABAg,আমি শুনছি  ভালো  লাগে,-1,আমি শুনছি ভালো লাগে,2025-05-31T06:38:42Z
UgyjDKaJgyd2fI1mZoR4AaABAg,কি বলবো বলার ভাষা নাই ভাই,-1,কি বলবো বলার ভাষা নাই ভাই,2025-08-14T16:37:44Z
Ugw4uwhZ6nvCHtbx7HF4AaABAg,এটাই বাংঙালির খাটি বাংঙালির সুর।,-1,এটাই বাংঙালির খাটি বাংঙালির সুর।,2025-06-07T03:09:50Z
UgyMuGSBjvTpl8LDF4R4AaABAg,অনেক দিন পরে মন-ছুয়ানো মাটির গান শুনতে পেলাম 💐 💝👌🏻👍,-1,অনেক দিন পরে মন-ছুয়ানো মাটির গান শুনতে পেলাম 🏻,2025-07-20T18:36:12Z
UgzGAHzMW-6yv9af7qp4AaABAg,অনেক ভালো লাগলো❤❤🎉,-1,অনেক ভালো লাগলো,2025-05-31T08:09:27Z
Ugyop7ebLgwlRwSXLPN4AaABAg,"আমার প্রিয় গান, আপনার",-1,"আমার প্রিয় গান, আপনার",2025-06-12T03:39:38Z
Ugz4WXtqX7eeCkez2zZ4AaABAg,মাশাল্লাহ যে-মন কনঠ।তেমন সুর,-1,মাশাল্লাহ যে-মন কনঠ।তেমন সুর,2025-06-09T12:04:36Z
Ugx_5u3LRRXJzqNzUJ54AaABAg,অনেক অনেক সুন্দর লাগছে গানগুলি,-1,অনেক অনেক সুন্দর লাগছে গানগুলি,2025-05-31T16:44:38Z
UgwWb2poV4wlsfq2ZHl4AaABAg,গান শুনে অনেক অনেক ভালো লাগলো,-1,গান শুনে অনেক অনেক ভালো লাগলো,2025-06-04T21:56:44Z
UgwJ5_z0ZcyyZKmpY6x4AaABAg,মনটা গলে গেলো আমার😢😢😢😢,-1,মনটা গলে গেলো আমার,2025-06-07T17:21:27Z
UgyN77OdVbT8OtM3TPZ4AaABAg,অনেক দিন পরে গুনলাম ভালো লাগলো,-1,অনেক দিন পরে গুনলাম ভালো লাগলো,2025-06-26T16:32:12Z
UgwP7Bgy9ccM4Oaj_jN4AaABAg,শিল্পীর নাম টা কি বলবেন প্লিজ,-1,শিল্পীর নাম টা কি বলবেন প্লিজ,2025-06-01T05:04:42Z
Ugz_cViuhWxKwR3yq3h4AaABAg,শিল্পির নাম কি,-1,শিল্পির নাম কি,2025-06-03T09:50:06Z
Ugxf_-7DrQmtu0GfWep4AaABAg,অনেক আমার প্রিয় ❤❤❤,-1,অনেক আমার প্রিয়,2025-06-01T06:57:51Z
Ugx42sUngxuwxyk_px54AaABAg,কত সুন্দর গান,-1,কত সুন্দর গান,2025-09-02T17:37:54Z
Ugx_2NE-3YYJ2gdMsEd4AaABAg,অসাধারণ সুন্দর লাগছে,-1,অসাধারণ সুন্দর লাগছে,2025-12-02T05:26:22Z
UgxD5_oNBjyYgZn36q14AaABAg,অনেক ভালো লাগে,-1,অনেক ভালো লাগে,2025-05-31T08:51:53Z
UgxhgteRU_RRqKCrzJp4AaABAg,অনেক সুন্দর গান। অনেক ভালো লাগছে। যখন তুমি নিজে ফিরে আসবে। 🎉😂,-1,অনেক সুন্দর গান। অনেক ভালো লাগছে। যখন তুমি নিজে ফিরে আসবে।,2025-06-06T16:23:27Z
UgxK8Mp4bSzDiDJJjP94AaABAg,হারানো দিনের হৃদয় স্পর্শ করা গান নয়নকে ভাসায় ।অনেক শ্রদ্ধা রইল আপনার প্রতি ।,-1,হারানো দিনের হৃদয় স্পর্শ করা গান নয়নকে ভাসায় ।অনেক শ্রদ্ধা রইল আপনার প্রতি ।,2025-06-10T16:06:14Z
UgzYA1ZqJsgcxYu-ciV4AaABAg,"এই অ্যালবামের প্রথম গানটা আমার দয়াল হাসান চিশতীর লেখা কালাম,আমার দয়ালের চরণের ভক্তি রইল, শিল্পী সাহেবকে বলছি গীতিকারের নাম বললেন না কেন আপনাকে দন্ডি অপরাধ,এর জন্য আপনার ক্ষমা চাইতে হবে",-1,"এই অ্যালবামের প্রথম গানটা আমার দয়াল হাসান চিশতীর লেখা কালাম,আমার দয়ালের চরণের ভক্তি রইল, শিল্পী সাহেবকে বলছি গীতিকারের নাম বললেন না কেন আপনাকে দন্ডি অপরাধ,এর জন্য আপনার ক্ষমা চাইতে হবে",2025-05-30T11:46:43Z
UgxqOiIjvLgrmJCiVfd4AaABAg,লিবিয়া থেকে শুনছি অনেক সুন্দর হয়েছে ❤❤❤❤❤❤❤❤❤❤❤❤❤❤❤❤❤❤❤,-1,লিবিয়া থেকে শুনছি অনেক সুন্দর হয়েছে,2025-06-11T23:18:28Z
Ugxgg5DIxtaeE3PxxAx4AaABAg,"মাটির ঘরে পোষা পাখি একদিন যাবে,,,উড়ে
মনের পাখি মরে যাবে আর আসবে না ফিরে।😭😭
চলে যাবে বহু দূরে কাদিয়ে এই ভুবনে😭😭👈",-1,"মাটির ঘরে পোষা পাখি একদিন যাবে,,,উড়ে মনের পাখি মরে যাবে আর আসবে না ফিরে। চলে যাবে বহু দূরে কাদিয়ে এই ভুবনে",2025-06-20T07:38:34Z
UgwRLV76427_AVdMTi54AaABAg,অসাধারন গান গোলি,-1,অসাধারন গান গোলি,2025-06-24T04:45:05Z
UgyUg16i5URw5_d3ZrF4AaABAg,খুব সুন্দর লাগে গান গুলো,-1,খুব সুন্দর লাগে গান গুলো,2025-05-31T08:36:55Z
UgxD0YTl7mvXgxd1QrJ4AaABAg,অনেক ভালো লাগলো গানটা শুনে ❤❤,-1,অনেক ভালো লাগলো গানটা শুনে,2025-06-02T15:58:44Z
UgyOxyRHxQ7GGb3H6Bx4AaABAg,আমার অনেক ভালো লাগে গান গোলা,-1,আমার অনেক ভালো লাগে গান গোলা,2025-05-31T19:17:54Z
UgxX0Qdn4Z4SQlYRejZ4AaABAg,এই হগানের অর্থ যে বুঝবে তার কাছে এই গান অনেক কিছু।,-1,এই হগানের অর্থ যে বুঝবে তার কাছে এই গান অনেক কিছু।,2025-06-03T17:03:37Z
Ugw5_MtmzS3HEI1zJRF4AaABAg,আমার পছন্দের শিল্পী পছন্দের গান শুনতে ভালো লাগছে,-1,আমার পছন্দের শিল্পী পছন্দের গান শুনতে ভালো লাগছে,2025-05-30T11:48:12Z
Ugz8SnVzdfUCdIAB5rB4AaABAg,এই গানের শিল্পী কে এক্টু বলবেন কেউ,-1,এই গানের শিল্পী কে এক্টু বলবেন কেউ,2025-05-31T16:33:57Z
UgyvZXC2Q0KtsYmwooV4AaABAg,2025 সালে কেকে সুনতেছো,-1,2025 সালে কেকে সুনতেছো,2025-05-31T05:21:46Z
UgyeXqL0Jibfys4v4SJ4AaABAg,❤❤❤❤ওনেক সুন্দর হয়েছে ❤❤❤,-1,ওনেক সুন্দর হয়েছে,2025-09-03T18:20:13Z
UgxGmig7FLfJbjdLrft4AaABAg,দারুন একটি গান,-1,দারুন একটি গান,2025-06-01T19:55:42Z
UgxRrAL4xYoC23pXtjN4AaABAg,আমার পছন্দের একটা গান,-1,আমার পছন্দের একটা গান,2025-11-23T14:47:51Z
UgxPuCQ3Sb7ZPabFTpl4AaABAg,আমার গান শুনতে বড় ভালো লাগছে,-1,আমার গান শুনতে বড় ভালো লাগছে,2025-06-24T10:42:56Z
UgzIYFAuImyXsjiZCX54AaABAg,আমার ওঅনেক ভালো লাগে গানটা,-1,আমার ওঅনেক ভালো লাগে গানটা,2025-07-24T08:51:45Z
Ugxtrit903WbG_YFScF4AaABAg,অনেক  জবানের সুন্দর গান,-1,অনেক জবানের সুন্দর গান,2025-07-04T12:49:04Z
Ugw7WwINN2jJ2k09y_x4AaABAg,গান গুলো অনেক সুন্দর,-1,গান গুলো অনেক সুন্দর,2025-06-28T18:59:44Z
UgxbzR71f4SHrNiKKe14AaABAg,পুরনো এই গান গুলো সুনে মনটা অনেক ভালো লাগল,-1,পুরনো এই গান গুলো সুনে মনটা অনেক ভালো লাগল,2025-07-26T07:47:48Z
UgwQ1-hQ6fjwdY_6dLt4AaABAg,খুব ভালো  লাগলো❤️💕💕,-1,খুব ভালো লাগলো️,2025-06-05T14:36:11Z
UgwlzjbLrjP_0YSPSZN4AaABAg,"গান, গুলো, ভাল, তেন্স,",-1,"গান, গুলো, ভাল, তেন্স,",2025-06-05T14:39:29Z
UgztwOGDnriFQI2UeZ14AaABAg,অনেক ভালো লাগছে গানটা,-1,অনেক ভালো লাগছে গানটা,2025-06-02T06:07:51Z
UgzhxYMN1v5KUEHGIf94AaABAg,মালোশিয়া থেকে শুনছি খুব সুন্দর গান,-1,মালোশিয়া থেকে শুনছি খুব সুন্দর গান,2025-06-06T13:48:32Z
UgyAYUH-Km6ZlwY4rzB4AaABAg,তিন নম্বৱ গানটি দুৱবিন শাহৱ একটি বিখ‍্যাত গান। কিছু শব্দ পৱিবৰ্তন কৱে লেখকেৱ নাম গোপন কৱে অন‍্যায় কৱেছেন।,-1,তিন নম্বৱ গানটি দুৱবিন শাহৱ একটি বিখ্যাত গান। কিছু শব্দ পৱিবৰ্তন কৱে লেখকেৱ নাম গোপন কৱে অন্যায় কৱেছেন।,2025-06-03T23:23:08Z
