id,text,label,clean_text,reference_time
UgxhQPAFa8mTqst-sMp4AaABAg,শ্রীতী রেখে গেলাম ❤❤❤❤❤,-1,শ্রীতী রেখে গেলাম,2024-12-26T12:00:49Z
UgyLgTXHgJFOnN4Uf8B4AaABAg,আমি আজ 15.02.2025..এসে গান গুলা শুনে গেলাম,-1,আমি আজ 15.02.2025..এসে গান গুলা শুনে গেলাম,2025-02-15T03:10:23Z
Ugz_yyptWYX7qFXBCpZ4AaABAg,অপূর্ব এক টি.গান ❤তোমা.কে.লাগছে.ভারি.চেয়ারম্যান.তোমার.ওমিষট.মুখের.হাসিতে.লাগছে.ভারি.চেনা.কোথায়.দেখেছিলেন.ফুলের.চেয়ে.সুন্দর. তোমার.কাছে.না ও.তোমার. অনেক. নামে.ডেকে.ছি.তোমাকে.কাছে.ডেকে.ছি.তাই. তোমার.মুখের.হাসি.তোমাকে.লাগছে.ভারি.চেনা.কোথায়.দেখেছি❤❤❤,-1,অপূর্ব এক টি.গান তোমা.কে.লাগছে.ভারি.চেয়ারম্যান.তোমার.ওমিষট.মুখের.হাসিতে.লাগছে.ভারি.চেনা.কোথায়.দেখেছিলেন.ফুলের.চেয়ে.সুন্দর. তোমার.কাছে.না ও.তোমার. অনেক. নামে.ডেকে.ছি.তোমাকে.কাছে.ডেকে.ছি.তাই. তোমার.মুখের.হাসি.তোমাকে.লাগছে.ভারি.চেনা.কোথায়.দেখেছি,2025-11-06T06:42:18Z
Ugy3aTXaC_wIvbIIPp54AaABAg,"প্রথম গানটা আমার জীবনের সঙ্গে রিলেটেড। 🥺🥺🥺🥺 তার অপেক্ষায় আছি, কবে যে সে আসবে আমার জীবনে 😢😢😢",-1,"প্রথম গানটা আমার জীবনের সঙ্গে রিলেটেড। তার অপেক্ষায় আছি, কবে যে সে আসবে আমার জীবনে",2024-07-12T09:15:00Z
UgwYJ9bDZGSsfepf0QZ4AaABAg,"এখন আমি ৪৫, গান গুলি শুনলে ছেলে বেলার কথা, প্রথম প্রেমের কথা মনে হয়। কি সুন্দর ছিল সেই দিনগুলি।",-1,"এখন আমি ৪৫, গান গুলি শুনলে ছেলে বেলার কথা, প্রথম প্রেমের কথা মনে হয়। কি সুন্দর ছিল সেই দিনগুলি।",2025-05-01T16:33:56Z
Ugwstt7UPiw5p7WG39F4AaABAg,"আজকে 05/03/2025 আমার বয়স
20+ আজকে গান গুলো শুনে কমেন্ট করে গেলাম যদি আমার এই কমেন্টে লাইক করে আবার আসবো শুনতে গান গুলো  ❤❤
Love from Bankura 🎉🎉🎉❤
Time 03:18 am❤❤",-1,আজকে 05/03/2025 আমার বয়স 20+ আজকে গান গুলো শুনে কমেন্ট করে গেলাম যদি আমার এই কমেন্টে লাইক করে আবার আসবো শুনতে গান গুলো Love from Bankura Time 03:18 am,2025-03-04T21:47:57Z
UgxG2x_3OFvh-xPc8UJ4AaABAg,আমি বাংলাদেশি | আমি এখন প্রবাস জীবন ওমানে বসবাসরত | এই গান টা আমার খুব প্রীয় | সেই ১৯৯৮ ইং থেকে শুনছি | লাইক দিলে খুবই খুশি হবো |,-1,আমি বাংলাদেশি | আমি এখন প্রবাস জীবন ওমানে বসবাসরত | এই গান টা আমার খুব প্রীয় | সেই ১৯৯৮ ইং থেকে শুনছি | লাইক দিলে খুবই খুশি হবো |,2025-03-28T10:49:57Z
UgwRRLdYAAgPooqQ9Ft4AaABAg,2025 সালে এসেও কে কে এই গান শুনছেন।,-1,2025 সালে এসেও কে কে এই গান শুনছেন।,2025-01-03T18:02:00Z
Ugw3kYY_-FOyBF-jLQl4AaABAg,"অনেক সুন্দর গান,,মনটা ভরে যায়❤❤❤❤❤❤",-1,"অনেক সুন্দর গান,,মনটা ভরে যায়",2024-05-15T17:44:18Z
Ugx2_uWZcDX2swo1Uth4AaABAg,আমরা বিজয় সরকারের বাড়ি থেকে নড়াইল জেলা আমরা চারজন শুনতেছি গানটা অনেক সুন্দর অনেক অনেক 11.5 2025 তারিখে শুনতেছি নড়াইল থেকে পাগলা সাজ্জাদ,-1,আমরা বিজয় সরকারের বাড়ি থেকে নড়াইল জেলা আমরা চারজন শুনতেছি গানটা অনেক সুন্দর অনেক অনেক 11.5 2025 তারিখে শুনতেছি নড়াইল থেকে পাগলা সাজ্জাদ,2025-05-11T09:24:44Z
UgxPTCnKBuwVtVU4KNl4AaABAg,হ‍্যাঁ এখনো  এই গান  গুলো  খুব  প্রিয়,-1,হ্যাঁ এখনো এই গান গুলো খুব প্রিয়,2023-06-01T14:18:28Z
UgwDHMfkrCc_soSGdEt4AaABAg,আগে এই গান গুলো খুব পরিমাণে ইগনোর করতাম যখন বাবা মা শুনতেন । এখন এগুলোই শুনতে ভালো লাগছে। বয়স আমার ১৯+ শ্রদ্ধেয়রা প্রণাম নেবেন 🙏🏼,-1,আগে এই গান গুলো খুব পরিমাণে ইগনোর করতাম যখন বাবা মা শুনতেন । এখন এগুলোই শুনতে ভালো লাগছে। বয়স আমার ১৯+ শ্রদ্ধেয়রা প্রণাম নেবেন 🏼,2024-06-17T16:37:09Z
UgxdnIrUh15pAXieYdp4AaABAg,আমি বাংলাদেশের গোপালগঞ্জ জেলা থেকে শুনছি তারিখ ৩১/০৭/২০২৪,-1,আমি বাংলাদেশের গোপালগঞ্জ জেলা থেকে শুনছি তারিখ ৩১/০৭/২০২৪,2024-07-31T05:12:16Z
UgwKoLJYExqxA5qeM5B4AaABAg,এইসব গান ভালো থাকতে সাহায্যে করে ❤️❤️❤️❤️❤️,-1,এইসব গান ভালো থাকতে সাহায্যে করে ️️️️️,2024-09-26T10:36:14Z
UgzpsqQYRRcEhtryFUl4AaABAg,"23  07   2024  গান শুনছি @ আমার বয়েস 58 বছর @ মাঝে মাঝে শুনতে পাই আর এখন শুনছি @সঙ্গীত জগতে র দিক পাল তুমি অমৃতলোকে ভালো থেকো @বিনম্র শ্রদ্ধা ও প্রণাম জানাই 
নারায়ণ গড ব্লক পশ্চিম মেদিনীপুর পশ্চিমবঙ্গ ভারত বর্ষ থেকে কুশধ্বজ রাণা",-1,23 07 2024 গান শুনছি @ আমার বয়েস 58 বছর @ মাঝে মাঝে শুনতে পাই আর এখন শুনছি @সঙ্গীত জগতে র দিক পাল তুমি অমৃতলোকে ভালো থেকো @বিনম্র শ্রদ্ধা ও প্রণাম জানাই নারায়ণ গড ব্লক পশ্চিম মেদিনীপুর পশ্চিমবঙ্গ ভারত বর্ষ থেকে কুশধ্বজ রাণা,2024-07-23T07:32:47Z
Ugy5RpBprLIzSkGHtUN4AaABAg,এই গান কোন দিন পুরাতন হবে না,-1,এই গান কোন দিন পুরাতন হবে না,2024-06-27T15:21:41Z
Ugx8jRZHB4GvQ-z5Pyx4AaABAg,"অসাধারণ একটা কন্ঠ, আর ফিরে পাবোনা, যুগযুগ ধরে রইবে সবার মনে,এই ভালবসার গান।অমর তুমি বাপ্পি দাদা",-1,"অসাধারণ একটা কন্ঠ, আর ফিরে পাবোনা, যুগযুগ ধরে রইবে সবার মনে,এই ভালবসার গান।অমর তুমি বাপ্পি দাদা",2025-03-05T09:14:47Z
UgzrR6DT7UApfNd6FLF4AaABAg,14/9/2024 ....==== 1.53 এই সময় গানটি সুনলাম ❤❤,-1,14/9/2024 ....==== 1.53 এই সময় গানটি সুনলাম,2024-09-14T08:24:19Z
Ugwmc5QOs1UkHgxLNNF4AaABAg,আমার মনে হয় না পৃথিবীতে এরকম শিল্পী কোন দিন আসবে।,-1,আমার মনে হয় না পৃথিবীতে এরকম শিল্পী কোন দিন আসবে।,2024-05-07T17:36:18Z
Ugwx-RuXOqE0xu-ezBR4AaABAg,এই গানগুলি কখনো পুরনো হয় না,-1,এই গানগুলি কখনো পুরনো হয় না,2025-01-08T07:04:00Z
Ugx6rGF4mQRooPEGqIt4AaABAg,"বাপ্পী দা তোমার অনুপস্থিতে গোটা সংগীত জগত‌ যেন অচল।
😔😭🥺",-1,বাপ্পী দা তোমার অনুপস্থিতে গোটা সংগীত জগত যেন অচল।,2023-12-11T13:12:43Z
UgyhwqxCUQnV2rA5Nk54AaABAg,সত্যিই খুব সুন্দর গান😊😊😊,-1,সত্যিই খুব সুন্দর গান,2025-07-13T13:18:53Z
UgzmxZ7D40KEcaWDsMZ4AaABAg,আমি রুপা বাড়ি বাঘাডাঙ্গা চুয়াডাঙ্গা  থাকি লেবানন। ২৫/১/২০২৪ এসে কে কে শুনছেন? কেউ লাইক দিলে আবার এসে শুনবো।❤❤❤❤ পৃথিবীর সব প্রবাসীরা ভালো থাকুক। ❤️❤️❤️,-1,আমি রুপা বাড়ি বাঘাডাঙ্গা চুয়াডাঙ্গা থাকি লেবানন। ২৫/১/২০২৪ এসে কে কে শুনছেন? কেউ লাইক দিলে আবার এসে শুনবো। পৃথিবীর সব প্রবাসীরা ভালো থাকুক। ️️️,2024-01-25T17:55:57Z
UgzmwkR1Ktv4-SGEQN14AaABAg,"আমি রিঙ্কি     
 31/8/2025(রবিবার)  আজকে রাধা অষ্টমী 
আমারএই গান গুলো আমার ও খুব পছন্দের গান এবং আমি যাকে খুব ভালো বাসি তারও খুব পছন্দের গান!",-1,আমি রিঙ্কি 31/8/2025(রবিবার) আজকে রাধা অষ্টমী আমারএই গান গুলো আমার ও খুব পছন্দের গান এবং আমি যাকে খুব ভালো বাসি তারও খুব পছন্দের গান!,2025-08-31T07:16:05Z
UgwdmwqAwL2ziHXG-ah4AaABAg,কে কে ২০২৫ গান গুলো শুনছো,-1,কে কে ২০২৫ গান গুলো শুনছো,2025-01-25T13:05:27Z
UgwWFIzY5Yn4xHrvww14AaABAg,জীবনের এতো গুলা দিন কেটে গেল একা একা তুমি কেন আগে আসনি আগে কেন দাওনি দেখা,-1,জীবনের এতো গুলা দিন কেটে গেল একা একা তুমি কেন আগে আসনি আগে কেন দাওনি দেখা,2025-08-29T05:20:02Z
UgxBU585YsgiI-iWNGZ4AaABAg,"খুবই সুন্দর কণ্ঠ আর গান। একটু অন্যরকম,  এই রকম গান এই ধরনের কণ্ঠে আর কেউ গাইতে পারবে না।",-1,"খুবই সুন্দর কণ্ঠ আর গান। একটু অন্যরকম, এই রকম গান এই ধরনের কণ্ঠে আর কেউ গাইতে পারবে না।",2025-11-10T05:54:42Z
UgwxMkHvpjD5HLVdB714AaABAg,ভালোবাসা  দিয়েই অসম্ভবকে সম্ভব করা যায় ।,-1,ভালোবাসা দিয়েই অসম্ভবকে সম্ভব করা যায় ।,2024-01-02T13:53:25Z
UgyRko_7O5sWP75reIR4AaABAg,16.05.2025 বৃষ্টি ভেজা সকালে এক কাপ চা খেতে খেতে কে কে শুনছো এইসব গানগুলো । মন ভালো হয়ে যাবে❤❤❤,-1,16.05.2025 বৃষ্টি ভেজা সকালে এক কাপ চা খেতে খেতে কে কে শুনছো এইসব গানগুলো । মন ভালো হয়ে যাবে,2025-05-16T00:56:17Z
UgwJmz6a-RpkpvKCaOp4AaABAg,বনগাঁ থেকে বলছি আপনার এই গানগুলো অনেক মধুর স্বর এবং খুব ভালো লাগে গত দু'বছর ধরে গানগুলো শুনছি। আজকের তারিখ 15/02/2025,-1,বনগাঁ থেকে বলছি আপনার এই গানগুলো অনেক মধুর স্বর এবং খুব ভালো লাগে গত দু'বছর ধরে গানগুলো শুনছি। আজকের তারিখ 15/02/2025,2025-02-15T16:28:37Z
UgwIUh3jj8q4BAwcSSN4AaABAg,"আমি কোনো গায়ক নয়, কিন্তু প্রতিটা গান আমার মুখস্ত, এবং এখনও যখন বোরিং লাগে এই গানগুলি শুনি এবং জোরে জোরে গাই",-1,"আমি কোনো গায়ক নয়, কিন্তু প্রতিটা গান আমার মুখস্ত, এবং এখনও যখন বোরিং লাগে এই গানগুলি শুনি এবং জোরে জোরে গাই",2025-06-04T14:09:10Z
Ugz9I683pxecsTXijDt4AaABAg,গান গুলো খুব ভালো লাগে ❤❤❤❤🥰,-1,গান গুলো খুব ভালো লাগে,2024-01-09T07:28:20Z
UgxW08MOSL0s3U4meQx4AaABAg,আমি শুনছি ২০২৫/৬/১০/২০২৫,-1,আমি শুনছি ২০২৫/৬/১০/২০২৫,2025-10-06T15:34:12Z
UgyyG45J1X3OD56Pg5N4AaABAg,"25.06.2024
এই গান গুলা আরো ১৫ বছর আগে থেকে শুনছি। ❤❤❤",-1,25.06.2024 এই গান গুলা আরো ১৫ বছর আগে থেকে শুনছি।,2024-06-25T16:21:48Z
UgwHQ183_1vIv2VIbhF4AaABAg,সত্যিই অসাধারণ বেঁচে যতদিন থাকবো! ততদিন শুনবো,-1,সত্যিই অসাধারণ বেঁচে যতদিন থাকবো! ততদিন শুনবো,2025-07-09T07:04:19Z
Ugwsi5Iz6uL2YbMSoKR4AaABAg,"আমি ঝাড়খণ্ডের জামতাড়া জেলা থেকে কুন্ডহিত খন্ড নাটুলতলা গ্রাম থেকে
গান টা কিন্তু ট্রেনে সফর করতে করতে শুনছি বোম্বাই থেকে ফেরার পথে 
আমার জীবনের দুঃখের শেষ নেই",-1,আমি ঝাড়খণ্ডের জামতাড়া জেলা থেকে কুন্ডহিত খন্ড নাটুলতলা গ্রাম থেকে গান টা কিন্তু ট্রেনে সফর করতে করতে শুনছি বোম্বাই থেকে ফেরার পথে আমার জীবনের দুঃখের শেষ নেই,2024-08-08T08:42:35Z
UgwpALyt5F3xt53yV6J4AaABAg,আমার জীবনের গল্প গান তাইতে আমি এই গান বেশি সুনি,-1,আমার জীবনের গল্প গান তাইতে আমি এই গান বেশি সুনি,2025-04-18T10:27:06Z
UgyqiahJ8nD454-wi4F4AaABAg,"অপূর্ব সুন্দর কণ্ঠ ও সুর অসাধারণ ❤❤
এই সব গান শুনে স্মৃতি হয়ে রয়ে গেলাম।
2023 সে কোন কোন ব্যাক্তি শুনেছেন ❤❤",-1,অপূর্ব সুন্দর কণ্ঠ ও সুর অসাধারণ এই সব গান শুনে স্মৃতি হয়ে রয়ে গেলাম। 2023 সে কোন কোন ব্যাক্তি শুনেছেন,2023-10-03T05:53:18Z
UgwWbcBFrqtrKqCK27p4AaABAg,সেই ত্রিশ বছর ধরে শুনছি। অসাধারণ ❤,-1,সেই ত্রিশ বছর ধরে শুনছি। অসাধারণ,2024-06-07T04:48:12Z
Ugz1oFpS3HYtB-tmiER4AaABAg,❤ অনেক সুন্দর গান শাহিনুর বাংলাদেশ জয়পুরহাট❤,-1,অনেক সুন্দর গান শাহিনুর বাংলাদেশ জয়পুরহাট,2025-08-28T05:53:46Z
Ugzd0uwq0o6-1FiHhlV4AaABAg,যে মন কন্ঠ তেমন গানের কথা লিখেছেন । একদম পারফেক্ট,-1,যে মন কন্ঠ তেমন গানের কথা লিখেছেন । একদম পারফেক্ট,2025-02-19T18:47:00Z
UgxIUgdbR1qpJlLzFBN4AaABAg,বাপ্পি সার আমাদের মধ্যে বেঁচে আছে থাকবে,-1,বাপ্পি সার আমাদের মধ্যে বেঁচে আছে থাকবে,2023-09-23T04:20:44Z
Ugx595LXS4BjRoXJ_YZ4AaABAg,তার পূর্বপুরুষদের বাড়ি বাংলাদেশের সিরাজগঞ্জের উল্লাহপাড়া উপজেলায়।,-1,তার পূর্বপুরুষদের বাড়ি বাংলাদেশের সিরাজগঞ্জের উল্লাহপাড়া উপজেলায়।,2025-11-21T05:13:01Z
UgwYlLcdBblAtrWAFWB4AaABAg,এরকম আর কেউ পারবে না  ❤❤,-1,এরকম আর কেউ পারবে না,2023-11-01T15:01:34Z
UgwXp6glSBxHMXIflaF4AaABAg,"আমি North Atlantic ( উত্তর মেরু) থেকে শুনছি আমি 42 y old এই গান গুলো কৈশোর, যৌবন এর অনেক কিছু জড়িয়ে,",-1,"আমি North Atlantic ( উত্তর মেরু) থেকে শুনছি আমি 42 y old এই গান গুলো কৈশোর, যৌবন এর অনেক কিছু জড়িয়ে,",2025-02-21T17:14:58Z
UgyzxaTqqC6Ikd7Ohp94AaABAg,25/07/2025 আমার বয়স 25 +আজকে গান গুলো শুনে কমেন্ট করে গেলাম আমি যদি মরে যায় তাহলে এই কমেন্ট টা আমার হয়ে থাকবে।।❤❤❤❤❤❤❤🎉🎉🎉🎉 এতো সুন্দর গান গুলো শুনেলে মনটা খুব ভালো হয়ে যায় ♥️😇♥️😇😇😇,-1,25/07/2025 আমার বয়স 25 +আজকে গান গুলো শুনে কমেন্ট করে গেলাম আমি যদি মরে যায় তাহলে এই কমেন্ট টা আমার হয়ে থাকবে।। এতো সুন্দর গান গুলো শুনেলে মনটা খুব ভালো হয়ে যায় ️️,2025-07-25T17:01:27Z
UgwRvN-z_KdZSu8dFTx4AaABAg,এসব গান আছে বলে আবসার সময়ে  এত ভালো  লাগে,-1,এসব গান আছে বলে আবসার সময়ে এত ভালো লাগে,2024-11-10T06:48:01Z
UgwXZ8LWNA0z303qn9t4AaABAg,"আপনি যত কষ্টের মাঝে থাকুন না কেন , একটু মন দিয়ে এই গান গুলো শুনুন, আপনার মনের পরিবর্তন হবেই হবে, এই জন্য গান হলো সৃষ্টির সব থেকে সুন্দর ঔষধ।।  আজকে 4/10/25 আমি রাজীব চক্রবর্তী কোচবিহার জেলা থেকে বলছি। খুব ভালো লাগে বাপি দার গান গুলো।",-1,"আপনি যত কষ্টের মাঝে থাকুন না কেন , একটু মন দিয়ে এই গান গুলো শুনুন, আপনার মনের পরিবর্তন হবেই হবে, এই জন্য গান হলো সৃষ্টির সব থেকে সুন্দর ঔষধ।। আজকে 4/10/25 আমি রাজীব চক্রবর্তী কোচবিহার জেলা থেকে বলছি। খুব ভালো লাগে বাপি দার গান গুলো।",2025-10-04T12:28:26Z
UgyD1pScyuYuWmwNtq54AaABAg,আমার পছন্দের একটি.গান ❤এই. সিনেমা.দেখতে.গিয়েছিলাম আমাদের.বাড়ি.পাশে.হলে.কি.মজা.আমার. ভালোবাসা.সেদিন. এসেছিলো আমার. মনেরমত.সিনেমা.চোখে.জলে.ভরে.যাই ❤❤❤❤❤❤❤,-1,আমার পছন্দের একটি.গান এই. সিনেমা.দেখতে.গিয়েছিলাম আমাদের.বাড়ি.পাশে.হলে.কি.মজা.আমার. ভালোবাসা.সেদিন. এসেছিলো আমার. মনেরমত.সিনেমা.চোখে.জলে.ভরে.যাই,2025-11-06T06:48:23Z
Ugyf5qkmkCyrbY95xuZ4AaABAg,অসাধারণ একটি.গান❤.আমার এই. জীবন মরসুমে.তোমার. আর.কাটোয়ার.তুমিযে.ভরিয়ে.দিলে.ভালোবাসার তোমার.মনে.কাছে.শিখে.নিলাম.প্রেমদামি.তুমি.যে.ভরিয়ে.দিয়েছে.আর.কারো.নাকাগজ.ফুলের.দূরে.ফেলে.তুমি.সত্যিই তুমি.গোলাপ.গন্ধ. পরিচয় আমার. এই.জীবন. মরণ.আর.করো.না❤,-1,অসাধারণ একটি.গান.আমার এই. জীবন মরসুমে.তোমার. আর.কাটোয়ার.তুমিযে.ভরিয়ে.দিলে.ভালোবাসার তোমার.মনে.কাছে.শিখে.নিলাম.প্রেমদামি.তুমি.যে.ভরিয়ে.দিয়েছে.আর.কারো.নাকাগজ.ফুলের.দূরে.ফেলে.তুমি.সত্যিই তুমি.গোলাপ.গন্ধ. পরিচয় আমার. এই.জীবন. মরণ.আর.করো.না,2025-11-06T06:29:01Z
UgxEr-t4iH8whAEM_vl4AaABAg,জীবনের এতগুলো দিন কেটে গেল একা একা .........🥺😅,-1,জীবনের এতগুলো দিন কেটে গেল একা একা .........,2025-01-05T04:26:36Z
UgybVTUxzQ5TsfKjDa54AaABAg,"এই গান শুনলে পুরানো কথা মনে পড়ে যায়  
খুব সুন্দর রোমান্টিক লাগে
বাপ্পি দাকে কোন দিন ভোলানো যাবেনা",-1,এই গান শুনলে পুরানো কথা মনে পড়ে যায় খুব সুন্দর রোমান্টিক লাগে বাপ্পি দাকে কোন দিন ভোলানো যাবেনা,2024-05-20T11:08:54Z
Ugy-W5Em6n9Tlz2b3DF4AaABAg,জীবনের এত গুলো দিন কেটে গেলো একা একা  এই গান টা আমার খুব প্রিয় ❤❤💞💞🥰🥰🥰🥰🥰🥰😊😊😊😊😊😄😃😃😀😊😊☺️☺️☺️🙂🙂🙂👌,-1,জীবনের এত গুলো দিন কেটে গেলো একা একা এই গান টা আমার খুব প্রিয় ️️️,2025-06-11T14:13:30Z
