id,text,label,clean_text,reference_time
UgwJdttLSFY-rTI2UaF4AaABAg,"গানটি ভুলতে বসেছিলাম, আজ শুনে আবার মনটা ভরে গেল। এ ধরনের পুরান দিনের গান আরও চাই। ধন্যবাদ।",-1,"গানটি ভুলতে বসেছিলাম, আজ শুনে আবার মনটা ভরে গেল। এ ধরনের পুরান দিনের গান আরও চাই। ধন্যবাদ।",2022-04-26T10:15:29Z
UgwR_qWYelrbsYlA-7h4AaABAg,তখন মানুষের অভাব থাকলেও মনে শান্তি ছিলো।,-1,তখন মানুষের অভাব থাকলেও মনে শান্তি ছিলো।,2023-01-20T07:23:42Z
UgxEwMekz34ai1TyMZt4AaABAg,"বাবার মুখে শুনতাম এই গানগুলো,,
কিন্তু বাবা আজ নেই,, মাও বাবার আগেই চলে গেছে 😭😭,
হারানোর ব্যাথা যে কতটা যন্ত্রণাদায়ক'যার হারিয়েছে শুধু সেই জানে হারানোর ব্যথা।",-1,"বাবার মুখে শুনতাম এই গানগুলো,, কিন্তু বাবা আজ নেই,, মাও বাবার আগেই চলে গেছে , হারানোর ব্যাথা যে কতটা যন্ত্রণাদায়ক'যার হারিয়েছে শুধু সেই জানে হারানোর ব্যথা।",2022-04-19T02:50:50Z
Ugx8mKtLwZdqvhg9hxN4AaABAg,২০২৫ এ কে কে শুনছো লাইক দিলে আবার শুনতে আসবো🙂 ২০৭০ সালের জন্য কমেন্টটা রেখে গেলাম,-1,২০২৫ এ কে কে শুনছো লাইক দিলে আবার শুনতে আসবো ২০৭০ সালের জন্য কমেন্টটা রেখে গেলাম,2025-05-14T09:03:44Z
Ugw8N8pCSYWgnDNSYmx4AaABAg,কমেন্ট পড়লে বুঝা যায় আসলে আমাদের হাসিখুসির আড়ালে আমরা সবাই দুঃখি।,-1,কমেন্ট পড়লে বুঝা যায় আসলে আমাদের হাসিখুসির আড়ালে আমরা সবাই দুঃখি।,2022-06-19T01:47:15Z
UgzvMg5nFA5O13rM56p4AaABAg,মুল গানটি হলো বাঁকুড়ার লোককবি পীতাম্বর দাসের লেখা ও সুরে 'একবার বিদায় দে মা ঘুরে আসি' । উনি গানটি লিখেছিলেন শহিদ ক্ষুদিরাম বসুর স্মরণে ।,-1,মুল গানটি হলো বাঁকুড়ার লোককবি পীতাম্বর দাসের লেখা ও সুরে 'একবার বিদায় দে মা ঘুরে আসি' । উনি গানটি লিখেছিলেন শহিদ ক্ষুদিরাম বসুর স্মরণে ।,2025-12-04T18:40:30Z
Ugw4dLjz8D_-u3UpxV94AaABAg,বাংলাদেশ বেতারে যখন রাতে এই গান গান গুলো বাজত কি যে ভালো লাগত।আহ কি মুধুর সৃতি।,-1,বাংলাদেশ বেতারে যখন রাতে এই গান গান গুলো বাজত কি যে ভালো লাগত।আহ কি মুধুর সৃতি।,2022-11-25T19:13:05Z
Ugwp8LfRDqXauxRvWJB4AaABAg,"জানিনা কতদিন বেঁচে থাকব এই দুনিয়ায়, কমেন্ট টা রেখে গেলাম স্মৃতি হিসেবে, কেউ যদি স্মরণ করে আবারও আসব গানটা শুনতে, যদি বেঁচে থাকি 😢
এই দুনিয়ায় কেউ কারো আপন না 😭🙏🤲 আহ 😢😢",-1,"জানিনা কতদিন বেঁচে থাকব এই দুনিয়ায়, কমেন্ট টা রেখে গেলাম স্মৃতি হিসেবে, কেউ যদি স্মরণ করে আবারও আসব গানটা শুনতে, যদি বেঁচে থাকি এই দুনিয়ায় কেউ কারো আপন না আহ",2023-12-14T15:09:14Z
UgwrdiNEDpnKk_fCMQx4AaABAg,কি সুন্দর গান গানের মাঝেই আল্লাহর দাওয়াতদেওয়া হয়েছে,-1,কি সুন্দর গান গানের মাঝেই আল্লাহর দাওয়াতদেওয়া হয়েছে,2022-05-24T01:25:55Z
UgxF1jBEhtl4Txe7lup4AaABAg,গান টি ২৫ সালে এসেও শুনছি,-1,গান টি ২৫ সালে এসেও শুনছি,2025-01-19T18:26:17Z
Ugy8-tiuiG0xImaggrF4AaABAg,আগের গানে জাদু আছে । আমার বাবা মা এই গানগুলো শুনতো । এখন আর বাবা মা নেই 😭 এই গানগুলো শুনলে অনেক কষ্ট হয় ।,-1,আগের গানে জাদু আছে । আমার বাবা মা এই গানগুলো শুনতো । এখন আর বাবা মা নেই এই গানগুলো শুনলে অনেক কষ্ট হয় ।,2022-04-20T06:26:37Z
Ugx2j9Y_fLPZqjRI0054AaABAg,"আমি আজমান 
সুনামগঞ্জ জামাই পাড়া থেকে 
এই ১১\৪\২৫ তারিখে শুনছি 
স্মৃতি রেখে গেলাম",-1,আমি আজমান সুনামগঞ্জ জামাই পাড়া থেকে এই ১১\৪\২৫ তারিখে শুনছি স্মৃতি রেখে গেলাম,2025-04-11T08:38:26Z
UgwW0gdVfoJhA5tw0_R4AaABAg,"যতই শুনি ততই শুনতে ইচ্ছে করে,, 
প্রাণটা জুড়িয়ে যায় 😥😥",-1,"যতই শুনি ততই শুনতে ইচ্ছে করে,, প্রাণটা জুড়িয়ে যায়",2022-04-28T15:03:48Z
UgwpaqNp9NX7DMfkVnl4AaABAg,"মায়ের গলায় শুনতে কত ভালো লাগত😔
আল্লাহ যেন আমার মাকে হেফাজতে রাখেন🤲",-1,মায়ের গলায় শুনতে কত ভালো লাগত আল্লাহ যেন আমার মাকে হেফাজতে রাখেন,2022-10-28T07:22:44Z
UgycJAPjerKN7McdQJ14AaABAg,"কত আসবে যাবে উনাদের কে ভুলা যাবে না যত দিন গান চলবে এই দুনিয়ায়, আবদুল আলিম এক আর একজন হবে না।",-1,"কত আসবে যাবে উনাদের কে ভুলা যাবে না যত দিন গান চলবে এই দুনিয়ায়, আবদুল আলিম এক আর একজন হবে না।",2022-12-30T22:26:23Z
UgzlXh7s2-wkSjR_isl4AaABAg,কে সে যার একটি লাইক আমাকে গানটি আবার মনে করিয়ে দেবে,-1,কে সে যার একটি লাইক আমাকে গানটি আবার মনে করিয়ে দেবে,2024-10-15T17:52:30Z
Ugz5h2LUMkbe82-RRS54AaABAg,ছোট্ট বেলায়  রেডিওতে শুনতাম এই গান।,-1,ছোট্ট বেলায় রেডিওতে শুনতাম এই গান।,2022-04-30T10:08:46Z
UgxzfD1BFGPOChsuZuR4AaABAg,লাইক দিলে আবার শুনতে আসবো 🥺🥺,-1,লাইক দিলে আবার শুনতে আসবো,2025-05-30T02:51:33Z
Ugz6Y9WVDWSCx3neBHp4AaABAg,২০২৩ সালে এসে এই গান শুনে মনটা জুড়িয়ে গেল ♥️,-1,২০২৩ সালে এসে এই গান শুনে মনটা জুড়িয়ে গেল ️,2023-07-03T04:35:42Z
UgwY1v69HQafK7D9uQB4AaABAg,বেস্ট সং এভার,-1,বেস্ট সং এভার,2025-12-08T12:12:51Z
UgwNxtyX2_RwUpI8uj94AaABAg,"২০২৪ এ এসে এই গানগুলা কেউ সুনবে না জানি, কিন্তু আমরা কিছু মানুষ আছি জারা আমাদের প্রানের গানগুলাকে হারিয়ে জেতে দিবো না।😢",-1,"২০২৪ এ এসে এই গানগুলা কেউ সুনবে না জানি, কিন্তু আমরা কিছু মানুষ আছি জারা আমাদের প্রানের গানগুলাকে হারিয়ে জেতে দিবো না।",2024-06-30T18:45:18Z
UgxTIusMNnoyQU6Dqw94AaABAg,আমার মতো 2025 এ দেখি কে কে এই গানটি শুনতে আসছে।👇,-1,আমার মতো 2025 এ দেখি কে কে এই গানটি শুনতে আসছে।,2025-01-15T18:28:28Z
UgzIIdOJ7cBJXv95KZh4AaABAg,মন খারাপ লাগলে তখন এই গান শুনতে আসি অনেক অনেক ভালো লাগে এবং মন ভালো হয়ে যায় তাই স্মৃতি রেখে গেলাম,-1,মন খারাপ লাগলে তখন এই গান শুনতে আসি অনেক অনেক ভালো লাগে এবং মন ভালো হয়ে যায় তাই স্মৃতি রেখে গেলাম,2024-06-26T16:41:32Z
Ugx3Pf4emPPGI5iUXIV4AaABAg,আপনি লাইক দিলেই আমি আরেক বার গানটা শুনবো।,-1,আপনি লাইক দিলেই আমি আরেক বার গানটা শুনবো।,2024-05-03T17:22:45Z
Ugwy-pFG3iuIi3CLGil4AaABAg,"ভাই, অনেক, দিন,এই,গান টি, সোনার, জন্য, অনেক, খোঁজ,করছি,ভাইজান,টি,ডনলোট, দিবেন।",-1,"ভাই, অনেক, দিন,এই,গান টি, সোনার, জন্য, অনেক, খোঁজ,করছি,ভাইজান,টি,ডনলোট, দিবেন।",2022-04-17T20:24:19Z
UgzQwSy1LjRZ1oHLv0J4AaABAg,"আমি বছরের শেষে এসে গানটি শুনলাম, কারো যদি চোখে আমার কমেন্ট পরে তাহলে লাইক দিবেন আবার শুনতে আসবো",-1,"আমি বছরের শেষে এসে গানটি শুনলাম, কারো যদি চোখে আমার কমেন্ট পরে তাহলে লাইক দিবেন আবার শুনতে আসবো",2024-12-11T18:23:28Z
Ugx9NoenoDlkTmwvgA94AaABAg,"এক কথায় অসাধারণ ❤️
বাস্তবমুখী গান",-1,এক কথায় অসাধারণ ️ বাস্তবমুখী গান,2022-04-19T03:20:11Z
Ugw2t2-L322U7odBv5V4AaABAg,২০২৫ এ কেউ,-1,২০২৫ এ কেউ,2025-06-04T21:36:15Z
UgxmJseYx7nuceufiCh4AaABAg,আহা কি কন্ঠ!অন্তর জুড়িয়ে যায়। বাস্তব গান,-1,আহা কি কন্ঠ!অন্তর জুড়িয়ে যায়। বাস্তব গান,2022-08-17T16:32:24Z
UgxiMUNWMDQVZPY9gHp4AaABAg,এই গান গুলো কখনো দিন ও পূরন হবেনা 😢😢😢,-1,এই গান গুলো কখনো দিন ও পূরন হবেনা,2025-01-30T06:17:20Z
UgweipYD0VToiKwE8B14AaABAg,আহা গানের কথা গুলো কলিজা ছুয়ে যায়,-1,আহা গানের কথা গুলো কলিজা ছুয়ে যায়,2022-03-24T07:06:26Z
Ugy6Wnku4OM_uzeovAx4AaABAg,2050 সালের জন্য কমেন্ট রেখে গেলাম।,-1,2050 সালের জন্য কমেন্ট রেখে গেলাম।,2024-07-05T01:26:24Z
UgzOK-7X2ZphVbvnWtR4AaABAg,"ভাই এই গান গোল শ্তনে কান্না চলে আসে, কিন্তু সারা জীবন কান্না করলেও আগের দিন গুলো পাবনা খুব মিস করি আগের দিন গুলো 2024সালে, এসে যারা এই গান গোল শ্তনে তাদের রুচির প্রতি সম্মান জানাই এই গান গুলো কোনদিন পুরনো হবেনা 😭😭😭😭😭😭😭😭😭😭😭😭😭😭😭😭😭😭😭😭😭😭😭😭😭😭😭😭😭😭😭😭😭😭😭😭😭😭😭",-1,"ভাই এই গান গোল শ্তনে কান্না চলে আসে, কিন্তু সারা জীবন কান্না করলেও আগের দিন গুলো পাবনা খুব মিস করি আগের দিন গুলো 2024সালে, এসে যারা এই গান গোল শ্তনে তাদের রুচির প্রতি সম্মান জানাই এই গান গুলো কোনদিন পুরনো হবেনা",2024-07-03T06:20:11Z
UgzoTZ_OLFjlCeHWPz94AaABAg,২০২৪ সালে কে? কে? শুনছেন🇧🇩🇦🇿🇦🇪🇩🇿❤️,-1,২০২৪ সালে কে? কে? শুনছেন️,2024-06-02T12:16:02Z
Ugxy9y6MkcLsg-VsNsR4AaABAg,আহারে এই সত্যিটা বুঝতে বুঝতে জীবন থেকে হারিয়ে গেল ২৮ টা বছর৷ 😢😢,-1,আহারে এই সত্যিটা বুঝতে বুঝতে জীবন থেকে হারিয়ে গেল ২৮ টা বছর৷,2025-05-23T17:49:23Z
Ugxq2hZNaa2frmtCtj14AaABAg,এই গানের গায়ক আব্দুল আলীম সাহেব জানিনা কত বছর আগে এই গানটি গেয়েছেন তবে বর্তমান জগতে সংসারের জীবন বাস্তব জীবনের সাথে মিলে গেছে সংসারের কর্তার দায়িত্ব শুধু সবার মুখের হাসি ফুটানো কর্তার খবর কেউ রাখেনা সবার কাছে অবহেলিত,-1,এই গানের গায়ক আব্দুল আলীম সাহেব জানিনা কত বছর আগে এই গানটি গেয়েছেন তবে বর্তমান জগতে সংসারের জীবন বাস্তব জীবনের সাথে মিলে গেছে সংসারের কর্তার দায়িত্ব শুধু সবার মুখের হাসি ফুটানো কর্তার খবর কেউ রাখেনা সবার কাছে অবহেলিত,2025-12-19T16:56:37Z
UgxjRbskZxeB-u53EeR4AaABAg,মন ছুয়ে গেল অসম্ভব ভালো লাগল গানটা,-1,মন ছুয়ে গেল অসম্ভব ভালো লাগল গানটা,2022-04-27T14:32:36Z
UgzVtAsnHUUH9qm2e014AaABAg,৪০ বছর ধরে এই সব গান শুনছি। অন্তরে গিয়ে লাগে কথা গুলো। অসাধারণ,-1,৪০ বছর ধরে এই সব গান শুনছি। অন্তরে গিয়ে লাগে কথা গুলো। অসাধারণ,2022-09-19T14:12:27Z
Ugz14sOROYrkoV1_hGl4AaABAg,2024 সালে এই গানগুলো শুনতে আসে মানুষ গুলোর মস্তিষ্ক সত্যি অনেক ভালো ❤,-1,2024 সালে এই গানগুলো শুনতে আসে মানুষ গুলোর মস্তিষ্ক সত্যি অনেক ভালো,2024-10-05T05:54:49Z
UgzKC_pc_rA-fWSfi3Z4AaABAg,২০২৫ না শুধু ২০৫০ সালেও গানটা অমর হয়ে থাকবে বাস্তবতা যে এমনই ❤❤,-1,২০২৫ না শুধু ২০৫০ সালেও গানটা অমর হয়ে থাকবে বাস্তবতা যে এমনই,2025-06-05T19:26:26Z
UgyXz8SVXkWY1AiGdat4AaABAg,কেউ আপন নাই একমাত্র আল্লাহ ছাড়া,-1,কেউ আপন নাই একমাত্র আল্লাহ ছাড়া,2024-09-24T06:37:31Z
UgyzKa65sjtnQSU6Fwp4AaABAg,গানের কথা গুলো কলিজায় লাগে এবং এটাই চিরন্তন বাস্তব এবং সত্যি পৃথিবীতে কেউ কারো আপন নয়,-1,গানের কথা গুলো কলিজায় লাগে এবং এটাই চিরন্তন বাস্তব এবং সত্যি পৃথিবীতে কেউ কারো আপন নয়,2022-06-08T10:30:43Z
UgwYiCp9Rl7PlAOBHZp4AaABAg,আহ কতনা কষ্টের  গান গানগুলি সুনতেই মনচায়,-1,আহ কতনা কষ্টের গান গানগুলি সুনতেই মনচায়,2022-04-26T13:19:47Z
UgzydEQsVekUEWX2w8h4AaABAg,"আমার দাদা ৬৮ বছর বয়স,,মাত্র এই গান শুনতে চাইলো,,আসলেই গানগুলো অনেক মায়ায় আর গভীর উপলব্ধির বিষয়,, আমি আর দাদা শুনলাম",-1,"আমার দাদা ৬৮ বছর বয়স,,মাত্র এই গান শুনতে চাইলো,,আসলেই গানগুলো অনেক মায়ায় আর গভীর উপলব্ধির বিষয়,, আমি আর দাদা শুনলাম",2022-09-08T16:37:06Z
UgxXjY3UbG6EGc8im4N4AaABAg,ছোটবেলায় আমার আব্বু এই গানটি ঘুমপাড়ানি গান হিসেবে গাইতেন! আহা সেই দিনগুলো!,-1,ছোটবেলায় আমার আব্বু এই গানটি ঘুমপাড়ানি গান হিসেবে গাইতেন! আহা সেই দিনগুলো!,2022-06-29T14:08:24Z
UgwALUN3TTdmWAjWVxF4AaABAg,এই গান সুনলে আগের দিন মনে পড়ে জায়,-1,এই গান সুনলে আগের দিন মনে পড়ে জায়,2022-05-03T18:50:27Z
UgwEEH6_IhpOVJR3kzl4AaABAg,আমি আপন বলতে একজন কে চিনিই আমার আল্লাহ 🥰❤️,-1,আমি আপন বলতে একজন কে চিনিই আমার আল্লাহ ️,2025-08-11T14:12:08Z
UgwiD8OtHiO1B_91vjh4AaABAg,"অসাধারণ কন্ঠে
অসাধারণ কথা",-1,অসাধারণ কন্ঠে অসাধারণ কথা,2022-04-21T17:40:14Z
Ugyit5Zkb7cESkS1tW54AaABAg,অনেক অনেক ভালো লাগলো পুরনো দিনের গান গুলো 💓🌷🌹💓,-1,অনেক অনেক ভালো লাগলো পুরনো দিনের গান গুলো,2022-04-29T03:15:38Z
UgyieIZR6lzXs-ndhu94AaABAg,অনেক পুরনো দিনের গান মন ছুঁয়ে গেছে।,-1,অনেক পুরনো দিনের গান মন ছুঁয়ে গেছে।,2022-05-02T09:09:19Z
UgyFtRLKOolqaPsb8ax4AaABAg,ভালো খুব ভালো লাগলো অনেক অনেক ধন্যবাদ আপনাকে ভাইয়া,-1,ভালো খুব ভালো লাগলো অনেক অনেক ধন্যবাদ আপনাকে ভাইয়া,2022-04-15T06:20:46Z
Ugw4oDTlbawySAnKUrt4AaABAg,আজ থেকে অনেক অনেক দিন পর যারা এই গান শুনবে অবশ্যই আমাদের কমেন্ট দেখবে। তাদের জন্য স্মৃতি রেখে গেলাম।,-1,আজ থেকে অনেক অনেক দিন পর যারা এই গান শুনবে অবশ্যই আমাদের কমেন্ট দেখবে। তাদের জন্য স্মৃতি রেখে গেলাম।,2024-09-25T13:39:26Z
UgwlRZY3ZNgZWPoAsm14AaABAg,"আহ্ কি অসাধারণ কথা আর সুর,, হৃদয় ছুঁয়ে যায় ।",-1,"আহ্ কি অসাধারণ কথা আর সুর,, হৃদয় ছুঁয়ে যায় ।",2022-09-02T05:01:10Z
UgzGX7C8QpYtjk9PaE94AaABAg,আহা দরদী আমার কলিজা ঠান্ডা হয়ে গেলো 😢,-1,আহা দরদী আমার কলিজা ঠান্ডা হয়ে গেলো,2024-11-27T19:12:28Z
UgzToFiXICZVkihM68V4AaABAg,পৃথিবীতে কেউ ১৬ আনা আপন হয় না,-1,পৃথিবীতে কেউ ১৬ আনা আপন হয় না,2025-01-30T18:09:03Z
UgxZXfWNtpa4SQkye0V4AaABAg,২১ বছরের জিবনে প্রথম বার কাজে আসসি ৪৭ দিন হলো,-1,২১ বছরের জিবনে প্রথম বার কাজে আসসি ৪৭ দিন হলো,2024-10-17T11:17:14Z
Ugw-va9CBmUCYg9ELLR4AaABAg,এখনো তেমন সুখ পাবেন যদি মন থেকে  হিংসা বিদ্বেষ গীবত লোভ অহংকার আমরা দূর করে সেই আগেকার মানুষের মত সহজ সরল হতে পারি।,-1,এখনো তেমন সুখ পাবেন যদি মন থেকে হিংসা বিদ্বেষ গীবত লোভ অহংকার আমরা দূর করে সেই আগেকার মানুষের মত সহজ সরল হতে পারি।,2023-07-01T06:27:02Z
Ugx8rlBTTGLU85MJ50F4AaABAg,২০৫০ সালের জন্য কমেন্ট করে রেখে দিলাম ❤,-1,২০৫০ সালের জন্য কমেন্ট করে রেখে দিলাম,2024-04-17T18:49:08Z
UgwhGkSHAYtkCLAin5Z4AaABAg,"ছোট বেলায় এই গান রেডিওতে অনেক শুনেছি কিন্তু তখন অর্থ বুঝতামনা।
এখন জীবনের দুপুর বেলায় এসে মনে হয় এই গানের প্রতিটি শব্দই আমার হৃদয়ের অন্তরালের কথা।",-1,ছোট বেলায় এই গান রেডিওতে অনেক শুনেছি কিন্তু তখন অর্থ বুঝতামনা। এখন জীবনের দুপুর বেলায় এসে মনে হয় এই গানের প্রতিটি শব্দই আমার হৃদয়ের অন্তরালের কথা।,2025-03-18T07:59:06Z
Ugx-GLGJXQyQGyKIULl4AaABAg,ছোট বেলায় দেখতাম আমার আব্বা রাত ৮টার পর রেডিও স্টেশন থেকে এই গান গুলো শুনতো 😢,-1,ছোট বেলায় দেখতাম আমার আব্বা রাত ৮টার পর রেডিও স্টেশন থেকে এই গান গুলো শুনতো,2024-12-29T15:14:02Z
UgyYPH-WaG2zLUTg09F4AaABAg,❤❤❤❤আলহামদুলিল্লাহ আলহামদুলিল্লাহ সত্যিই গানের ভিতরে সবকিছুই স্পষ্ট আমরা কেউ কারো নয় মহান আল্লাহ পাকই আমাদের প্রিয়,-1,আলহামদুলিল্লাহ আলহামদুলিল্লাহ সত্যিই গানের ভিতরে সবকিছুই স্পষ্ট আমরা কেউ কারো নয় মহান আল্লাহ পাকই আমাদের প্রিয়,2025-04-10T09:02:38Z
UgwH5vowSI4QCFEep7d4AaABAg,২০২৫ সালে গানটা শুনলাম,-1,২০২৫ সালে গানটা শুনলাম,2025-01-06T16:46:40Z
