id,text,label,clean_text,reference_time
UgxqRFfAoytk34bormh4AaABAg,"মাশাআল্লাহ মাশাআল্লাহ দুজনের কন্ঠটা অসাধারণ,, আমি গানটা যতবারই শুনি তারপরও মনে হয় পারো একটু শুনি নেই 🥰👌",-1,"মাশাআল্লাহ মাশাআল্লাহ দুজনের কন্ঠটা অসাধারণ,, আমি গানটা যতবারই শুনি তারপরও মনে হয় পারো একটু শুনি নেই",2025-06-27T17:06:55Z
Ugx21Uly2ADu5VoHfdJ4AaABAg,❤❤❤❤❤❤❤❤❤🎉🎉🎉🎉🎉 খুবই সুন্দর লাগছে গান টা ❤❤❤❤,-1,খুবই সুন্দর লাগছে গান টা,2023-12-07T08:01:12Z
UgxH10EzOktsBBKXzBx4AaABAg,এটা অনেক আগের গান তবু্ও শুনতে খুবই ভালো লাগে ❤❤❤,-1,এটা অনেক আগের গান তবু্ও শুনতে খুবই ভালো লাগে,2025-11-04T12:12:02Z
Ugz8aeYABudZpgQBnnp4AaABAg,"ভারত থেকে বলছি, ভাবতে পারিনি চঞ্চল চৌধুরী এই গানটা গেয়েছে। এককথায় অনবদ্য।।।। 🎉🎉🎉🎉🎉🎉🎉❤❤❤❤❤❤❤❤",-1,"ভারত থেকে বলছি, ভাবতে পারিনি চঞ্চল চৌধুরী এই গানটা গেয়েছে। এককথায় অনবদ্য।।।।",2023-08-11T00:41:24Z
UgwoO2BpUOaYglFZX154AaABAg,চনচল খাইয়া দিছে তাইরে😅😅😂😂😂,-1,চনচল খাইয়া দিছে তাইরে,2024-08-14T06:08:32Z
Ugz8yY5Yjll3RRw8hlt4AaABAg,দারুন লাগলো সত্যি সত্যিই অসাধারণ,-1,দারুন লাগলো সত্যি সত্যিই অসাধারণ,2025-06-17T23:29:54Z
UgzXrVzPhAySEXr1Va54AaABAg,"এই গানটা খুবই ভালো লাগে,,  আর কে কে এই গানটা পছন্দ করেন",-1,"এই গানটা খুবই ভালো লাগে,, আর কে কে এই গানটা পছন্দ করেন",2024-07-23T06:56:19Z
UgxEuctcYFPQexyzGr54AaABAg,যেমন শব্দ তেমনই সুর। ❤,-1,যেমন শব্দ তেমনই সুর।,2024-02-04T12:11:02Z
UgxDi9LcPqBweSnLnQl4AaABAg,অসাধারণ একটি গান সত্যি খুব সুন্দর হয়েছে,-1,অসাধারণ একটি গান সত্যি খুব সুন্দর হয়েছে,2025-06-13T17:15:48Z
UgxmMQl2e_dEEVSLIjt4AaABAg,আমার খুব প্রিয় গান ও পরিবেশন চমৎকার 🙏,-1,আমার খুব প্রিয় গান ও পরিবেশন চমৎকার,2023-08-20T05:34:53Z
UgxMTFlde-L3Hor7NSd4AaABAg,যত দেখি ততই ভালো লাগছে আবার দেখার সুজোক করে দেও ❤❤,-1,যত দেখি ততই ভালো লাগছে আবার দেখার সুজোক করে দেও,2025-07-19T05:06:00Z
UgwYUoMgCpqmAqP5mO54AaABAg,অসাধারণ। গান টা শুনে আমি চঞ্চল চৌধুরী এর ফ্যান হয়ে গেছি।,-1,অসাধারণ। গান টা শুনে আমি চঞ্চল চৌধুরী এর ফ্যান হয়ে গেছি।,2023-12-13T07:29:29Z
UgwuCXnUNNh2fXDD37N4AaABAg,নিউ ফ্রেন্ড খুব সুন্দর হয়েছে পাশে আছি 🎉🎉❤,-1,নিউ ফ্রেন্ড খুব সুন্দর হয়েছে পাশে আছি,2025-07-20T14:53:49Z
UgwKL2egy3ECyNzAqth4AaABAg,আমাৱ কাছে গানটা অনেক ভালো লাগে ❤❤❤❤😊😊😊,-1,আমাৱ কাছে গানটা অনেক ভালো লাগে,2023-09-28T13:00:17Z
UgwuYb4Rcy0JijjHPtt4AaABAg,সত্যি যতবার শুনি ততবারই ভালো লাগে। 👍🏻👍🏻,-1,সত্যি যতবার শুনি ততবারই ভালো লাগে। 🏻🏻,2023-06-11T17:26:42Z
UgzWIxS5Z9HgyeNXnCZ4AaABAg,খুব সুন্দর শুনলে মন ভরে যায় ❤❤,-1,খুব সুন্দর শুনলে মন ভরে যায়,2025-08-14T17:59:27Z
UgyCSKOIfSxkMHIr0o94AaABAg,"আমার অনেক প্রিয় একটা গান
আমি সব সময় শোনি 🥰🥰🥰♥️♥️♥️",-1,আমার অনেক প্রিয় একটা গান আমি সব সময় শোনি ️️️,2023-09-23T20:10:07Z
Ugxx3DrEyXsU3aabuQF4AaABAg,যেমন সুন্দর গানের গলা তেমন সুন্দর অভিনয়,-1,যেমন সুন্দর গানের গলা তেমন সুন্দর অভিনয়,2025-06-14T04:52:01Z
UgxatoDq7BoBfurL7Ih4AaABAg,দারুণ লাগলো সত্যি সত্যিই অসাধারণ,-1,দারুণ লাগলো সত্যি সত্যিই অসাধারণ,2024-03-29T02:01:39Z
UgxiGT4LU0ngb8zyUW94AaABAg,খুব সুন্দর আপু মন ছুঁয়ে যায়,-1,খুব সুন্দর আপু মন ছুঁয়ে যায়,2025-06-06T04:10:58Z
UgxEgfDNuzsJrM0a58p4AaABAg,অসাধারণ সুন্দর হইছে ❤❤❤❤,-1,অসাধারণ সুন্দর হইছে,2025-09-07T05:08:55Z
Ugz9pqTGtfC-4VHxR6N4AaABAg,অনেক সুন্দর চালিয়ে যান পাশে আছি,-1,অনেক সুন্দর চালিয়ে যান পাশে আছি,2025-05-27T15:31:33Z
UgwwK_cyfkpUX6kHKkx4AaABAg,"আমার অনেক ভালো লাগে,,, অনেক সুন্দর একটা গান❤❤❤",-1,"আমার অনেক ভালো লাগে,,, অনেক সুন্দর একটা গান",2024-10-16T05:07:10Z
UgyImdlzjbVrGB9afGF4AaABAg,"গানটা সত্যি অসাধারণ
গানটা দেখে আমার বাবার কথা খুব মনে পড়ছে আমার বাবার প্রিয় গান এটা।",-1,গানটা সত্যি অসাধারণ গানটা দেখে আমার বাবার কথা খুব মনে পড়ছে আমার বাবার প্রিয় গান এটা।,2024-08-02T16:28:59Z
UgwfD6scfl8IBYUNxEh4AaABAg,খুব সুন্দর অসাধারণ গানটা খুব ভালো লাগলো শুনে,-1,খুব সুন্দর অসাধারণ গানটা খুব ভালো লাগলো শুনে,2025-10-14T07:40:42Z
UgxTh2ht3Hvfcgq_zKd4AaABAg,"খুব ভালো লাগে শুনতে গান টা, চনচল এবং মেহের এর কন্ঠ। ❤❤",-1,"খুব ভালো লাগে শুনতে গান টা, চনচল এবং মেহের এর কন্ঠ।",2023-09-29T04:06:10Z
UgzVElRi0-zYtT-ThOh4AaABAg,২০২৫ দেখছে  কে কে,-1,২০২৫ দেখছে কে কে,2025-12-05T23:55:14Z
UgxXf930rri7DSn7-SJ4AaABAg,খুব সুন্দর হয়েছে আমার খুব প্রিয় এই গানটা হরে কৃষ্ণ রাধে রাধে❤❤❤❤❤❤,-1,খুব সুন্দর হয়েছে আমার খুব প্রিয় এই গানটা হরে কৃষ্ণ রাধে রাধে,2025-11-05T10:12:25Z
UgxDhD5ICPjRV38Z5kZ4AaABAg,"হাত বাড়ালে কি আর চাঁদ দেখা যায়?
চাঁদ দেখতে হলে চোখ দিয়ে আকাশের দিকে তাকাও",-1,হাত বাড়ালে কি আর চাঁদ দেখা যায়? চাঁদ দেখতে হলে চোখ দিয়ে আকাশের দিকে তাকাও,2023-08-03T14:19:27Z
Ugw7NxXAVuY5UlpNoS94AaABAg,আমার এই গান খুব ভালো লাগে ❤❤❤❤❤❤❤❤❤❤❤❤❤❤❤👌👌👌👌👌👌👌👌👌👌👌👌👌,-1,আমার এই গান খুব ভালো লাগে,2025-02-19T16:46:24Z
Ugymx7VFvxR7Jw0C1kt4AaABAg,❤❤🎉চঞ্চল দা গানটা কিন্তু অসাধারণ হয়েছে❤❤🎉,-1,চঞ্চল দা গানটা কিন্তু অসাধারণ হয়েছে,2023-07-05T17:12:54Z
UgwN4PWPjm3NIEsH5J54AaABAg,গোয়াল অর্থ গরুরঘর। গোয়ালার ঝি হবে শব্দটা।,-1,গোয়াল অর্থ গরুরঘর। গোয়ালার ঝি হবে শব্দটা।,2023-09-15T06:20:06Z
Ugzr9_CGKhSqDGbKBeh4AaABAg,দারুণ লাগে যত বার শুনি,-1,দারুণ লাগে যত বার শুনি,2025-07-19T10:29:09Z
Ugz-NpfyS8ZFg9Ybanh4AaABAg,এই গানটা গানের জগতে অন্যমাত্রা এনেছে।,-1,এই গানটা গানের জগতে অন্যমাত্রা এনেছে।,2023-10-21T16:41:23Z
Ugx4DNj8tGvGtHfP5Ph4AaABAg,"এই গানটি মহান ঈশ্বর... পরম করুণাময় ভগবান শ্রী কৃষ্ণ কে নিয়ে লেখা.., জয় রাধে জয় গোবিন্দ...🙏🙏🙏 চঞ্চল দা সেরা...🔥🔥🔥 লাভ from ভারত",-1,"এই গানটি মহান ঈশ্বর... পরম করুণাময় ভগবান শ্রী কৃষ্ণ কে নিয়ে লেখা.., জয় রাধে জয় গোবিন্দ... চঞ্চল দা সেরা... লাভ from ভারত",2024-04-19T16:24:03Z
UgwRhqK8RALfTpkPF_14AaABAg,খুব সুন্দর  গান 😍😍😍😍❤️❤️❤️❤️❤️❤️❤️❤️❤️❤️❤️❤️❤️❤️❤️❤️❤️❤️,-1,খুব সুন্দর গান ️️️️️️️️️️️️️️️️️️,2024-11-04T20:03:29Z
UgzqW3HWGwUvhmSdGqR4AaABAg,ভাই গো এত ভালো গান তোমরা কোথায় পাও বল দেখি,-1,ভাই গো এত ভালো গান তোমরা কোথায় পাও বল দেখি,2023-05-25T00:24:25Z
Ugwk8uH_FEBLaxYw1d54AaABAg,মাশাল্লাহ অনেক সুন্দর একটা ভিডিও ফুটেজ অভিনয় টা অনেক সুন্দর গান টা অনেক সুন্দর ❤❤❤❤❤❤❤🎉🎉🎉🎉,-1,মাশাল্লাহ অনেক সুন্দর একটা ভিডিও ফুটেজ অভিনয় টা অনেক সুন্দর গান টা অনেক সুন্দর,2025-07-17T05:55:50Z
UgxPMCyPSmP8xb7qw6Z4AaABAg,খুব সুন্দর হয়েছে দিদি ভাই। 🙏🙏🙏🙏,-1,খুব সুন্দর হয়েছে দিদি ভাই।,2025-05-28T07:23:29Z
Ugy6VL_iBqiOGq-YbgR4AaABAg,অনেক সুন্দর হয়েছে এগুলা আগের গান গুলা কিন্তু অনেক ভালো লাগে শুনতে তাই তো ছুটে ছুটে,-1,অনেক সুন্দর হয়েছে এগুলা আগের গান গুলা কিন্তু অনেক ভালো লাগে শুনতে তাই তো ছুটে ছুটে,2025-06-13T17:55:26Z
UgyW1H-tcrzmn0DRR7d4AaABAg,"খুব পছন্দের একটা গান,❤❤",-1,"খুব পছন্দের একটা গান,",2025-07-13T03:54:35Z
UgwtSfHH6uC7DPw_bpR4AaABAg,গানটা আমার অনেক পছন্দের❤❤,-1,গানটা আমার অনেক পছন্দের,2025-08-18T14:20:38Z
UgzuLEwpiDb21UecaBx4AaABAg,ওনার মুন পোরা সবি টা খুব সুন্দর হয়েছে আমার অনেক ভালো লেগেছে 😊,-1,ওনার মুন পোরা সবি টা খুব সুন্দর হয়েছে আমার অনেক ভালো লেগেছে,2025-05-31T04:08:01Z
UgwmxKkthTHihtQDTmp4AaABAg,অনেক সুন্দর হয়েছে ভিডিওটা,-1,অনেক সুন্দর হয়েছে ভিডিওটা,2025-07-22T13:08:39Z
Ugzf2mpjWSdxofHofeR4AaABAg,খুব খুব সুন্দর লাগলো❤❤,-1,খুব খুব সুন্দর লাগলো,2025-08-12T02:10:17Z
UgzhswTtpyQGbk4RsD54AaABAg,বহুত বহুত সুন্দর লাগছে ❤,-1,বহুত বহুত সুন্দর লাগছে,2025-05-29T00:53:59Z
UgxfOqL8vFgu9bUnkTp4AaABAg,দারুণ লাগল খুব ❤❤❤❤❤❤❤❤❤❤❤❤❤❤❤❤❤❤🎉😢😮😅,-1,দারুণ লাগল খুব,2025-06-15T16:13:25Z
UgyVD1nSjBWcJ5iakPR4AaABAg,২০২৫ সালে কে কে এই গান টা শুনেছেন,-1,২০২৫ সালে কে কে এই গান টা শুনেছেন,2025-12-20T05:08:40Z
UgwO2elxupDTvRLtGf14AaABAg,চঞ্চল চৌধুরী এত ভালো গান করেন এই গানটি না শুনলে জানতাম না,-1,চঞ্চল চৌধুরী এত ভালো গান করেন এই গানটি না শুনলে জানতাম না,2024-07-31T11:22:51Z
UgwpOcLWwhn4uFKAnpN4AaABAg,গানটা কেন জানি খুব বেশি ভালো লাগে ❤️,-1,গানটা কেন জানি খুব বেশি ভালো লাগে ️,2025-06-03T19:09:48Z
UgyUuyM1838tySz7Tah4AaABAg,শাওনকে দেখলে আমার ভালবাসা শিখতে মন চায় কেউ ভালোবাসা শিখাইবে?!,-1,শাওনকে দেখলে আমার ভালবাসা শিখতে মন চায় কেউ ভালোবাসা শিখাইবে?!,2025-07-10T03:48:21Z
UgzmW5cDUNcrEhZ7VCl4AaABAg,চঞ্চল নাটক অনেক সুন্দর। কিপঠা  নাটকের জন্য চঞ্চল সেরা গ্রামের নাট অনেক জনপ্রিয় আমার কাছে ❤❤❤❤,-1,চঞ্চল নাটক অনেক সুন্দর। কিপঠা নাটকের জন্য চঞ্চল সেরা গ্রামের নাট অনেক জনপ্রিয় আমার কাছে,2024-05-03T17:52:02Z
UgxTkxkTrVA2JW-ojK54AaABAg,খুব সুন্দর খুব সুন্দর❤,-1,খুব সুন্দর খুব সুন্দর,2025-06-17T15:08:20Z
Ugytudky1lmNQSYPjgB4AaABAg,সুন্দর হয়েছে তার ❤,-1,সুন্দর হয়েছে তার,2025-07-07T14:48:55Z
UgwG4Oc8jDoBZxVcm4d4AaABAg,গানটা আমার অনেক প্রিয়❤❤,-1,গানটা আমার অনেক প্রিয়,2025-08-01T15:21:38Z
Ugz98LYSmfA05-fqXBR4AaABAg,দারুন হয়েছে গানটি ❤❤❤❤❤❤❤❤,-1,দারুন হয়েছে গানটি,2025-08-08T22:31:32Z
UgyD9WI7VB6vGWnXwd14AaABAg,আপা জেলে কেমন লাগছে?,-1,আপা জেলে কেমন লাগছে?,2025-07-29T11:21:28Z
UgwssEG5k_cXBXNaQ7p4AaABAg,অসাধারণ একটি ভিডিও পোস্ট করেছেন প্রিয় বন্ধু আমার ❤❤❤❤❤,-1,অসাধারণ একটি ভিডিও পোস্ট করেছেন প্রিয় বন্ধু আমার,2025-07-24T04:29:24Z
UgyuLu1MSzasDRF4Qct4AaABAg,"❤❤অসাধারণ ভিডিও 🎉🎉
গানটা শুনে মন ভরে গেল 
❤❤❤
এমন গান আরোও শুনান😮😮
২০২৫ _সালে_কে_কে_আমার কমেন্ট পড়ছো একটা লাইক দিবেন আবার ❤আসবো দেখতে🎉🎉কিড়কি😮",-1,অসাধারণ ভিডিও গানটা শুনে মন ভরে গেল এমন গান আরোও শুনান ২০২৫ _সালে_কে_কে_আমার কমেন্ট পড়ছো একটা লাইক দিবেন আবার আসবো দেখতেকিড়কি,2025-08-31T17:21:43Z
UgxkupoDIMYDVBJxKZF4AaABAg,গলায় খুব শুনিয়া যমুনাতে❤,-1,গলায় খুব শুনিয়া যমুনাতে,2025-06-14T12:27:18Z
UgxGd2Sy8FN40BZwR0h4AaABAg,"কিরে হুমায়ন শেষ আর তুই শুরু,,",-1,"কিরে হুমায়ন শেষ আর তুই শুরু,,",2024-04-25T21:44:02Z
UgyWj4zGjswjJI5MCH14AaABAg,গানটা সত্যি অসাধারণ❤️❤️,-1,গানটা সত্যি অসাধারণ️️,2025-10-22T16:39:00Z
Ugz7Wf8-r091SrF9GsR4AaABAg,আমার পছন্দের গান এটা,-1,আমার পছন্দের গান এটা,2024-09-18T13:13:14Z
Ugx-FX8wW98e2edgQxd4AaABAg,মাসালা মাসালা জাযাকাল্লাহ,-1,মাসালা মাসালা জাযাকাল্লাহ,2025-06-05T15:51:35Z
UgzpmS4Ep6sxfs0u_eZ4AaABAg,এই যে সেলিব্রেটি ভাই আপনার একটু ভালোবাসা ও সাপোর্ট চাই ❤❤,-1,এই যে সেলিব্রেটি ভাই আপনার একটু ভালোবাসা ও সাপোর্ট চাই,2025-05-27T18:37:26Z
UgxUIpY0tZMhhbLmib54AaABAg,"lyrics delicate all my listener's
and delegation category! 

সখি ঘটল দশম দশা। 
কালার ঔ পিরিতে সখি গো সখি ঘটল দশম দশা। 
এ গো জাতি কূল দাগ লাগাইলাম করে ভালো বাসা গো।। ধু।

বিশ্বাসের ঘরে তারে আমি গো  সখি করিয়া ভরশা। 
এ গো সার হল দু চোখের জল  বহে যমুনা শিব সাহা গো।। ধু।

পাড়ার লোকের ঠাট্টা করে গো  সখি কলঙ্কিনী ভে দিশা। 
এ গো পুরল না মোর মনস্কাম বাসনা পাঁচে 
সর্বনাশা  গো।।ধু।

বুক ভরা শ্মশানের চিতা গো  সখি বলে
মহাশয় আব্দুল মুকিম শাহ্।
শ্যাম উদ্দেশ্যে রাইয়ার অঙ্গের ভাষণ কার সনে খেলিব পাশা গো।। ধু।

কালার ঔ পিরিতে সখি গো সখি ঘটল দশম দশা। 
এ গো জাতি কূলে দাগ লাগাইলাম করে ভালো বাসা গো।। ধু।
সখি ঘটল দশম দশা।। 
অনুসন্ধানী গিতমালা  শাস্ত্র  রাধিকা পক্ষ। 
কথাও কণ্ঠস্বর, আমাহতে।
বাংলাদেশে বসত করি আব্দুল মুকিম তালুকদার হল নাম, 
সিলেট জেলা ফেঞ্চুগঞ্জ থানা 
নিজ ঘিলাছড়া মাইজ ভাগ আমার পাড়া গ্রাম। 
সম্ভ্রান্ত, জমিদার আমজাদ আলী তালুকদার 
( বাড়ি)  বাউল দর্শন। 
🚧📻🎹🎻🪕🪘🎵🎶🎙️📣📢🏠🏡🌲🌳🛖🌴⛩️⚓⛵🛶🛶🌘🚁✈️🛩️🛫🔕🔇🇧🇩🇧🇩🇧🇩🇧🇩🇧🇩🌐🌏",-1,"lyrics delicate all my listener's and delegation category! সখি ঘটল দশম দশা। কালার ঔ পিরিতে সখি গো সখি ঘটল দশম দশা। এ গো জাতি কূল দাগ লাগাইলাম করে ভালো বাসা গো।। ধু। বিশ্বাসের ঘরে তারে আমি গো সখি করিয়া ভরশা। এ গো সার হল দু চোখের জল বহে যমুনা শিব সাহা গো।। ধু। পাড়ার লোকের ঠাট্টা করে গো সখি কলঙ্কিনী ভে দিশা। এ গো পুরল না মোর মনস্কাম বাসনা পাঁচে সর্বনাশা গো।।ধু। বুক ভরা শ্মশানের চিতা গো সখি বলে মহাশয় আব্দুল মুকিম শাহ্। শ্যাম উদ্দেশ্যে রাইয়ার অঙ্গের ভাষণ কার সনে খেলিব পাশা গো।। ধু। কালার ঔ পিরিতে সখি গো সখি ঘটল দশম দশা। এ গো জাতি কূলে দাগ লাগাইলাম করে ভালো বাসা গো।। ধু। সখি ঘটল দশম দশা।। অনুসন্ধানী গিতমালা শাস্ত্র রাধিকা পক্ষ। কথাও কণ্ঠস্বর, আমাহতে। বাংলাদেশে বসত করি আব্দুল মুকিম তালুকদার হল নাম, সিলেট জেলা ফেঞ্চুগঞ্জ থানা নিজ ঘিলাছড়া মাইজ ভাগ আমার পাড়া গ্রাম। সম্ভ্রান্ত, জমিদার আমজাদ আলী তালুকদার ( বাড়ি) বাউল দর্শন। ️️️️",2024-10-06T08:16:21Z
UgzSear_3BLJlj46Vv94AaABAg,ভালো বাসা ডান আশা করি পাশে থাকবেন ইনশাআল্লাহ ❤❤❤❤,-1,ভালো বাসা ডান আশা করি পাশে থাকবেন ইনশাআল্লাহ,2025-07-15T18:38:27Z
UgzZMeoW-KDO9VdHgJ14AaABAg,চঞ্চল চৌধুরী বহু প্রতি ভার অধিকারী। অসাধারণ,-1,চঞ্চল চৌধুরী বহু প্রতি ভার অধিকারী। অসাধারণ,2025-11-05T15:05:07Z
UgzbfII7Zl20_0D6M314AaABAg,দারুন হয়েছে ভিডিওটা,-1,দারুন হয়েছে ভিডিওটা,2025-10-02T11:20:45Z
Ugxraf53i8LBI0GMdfJ4AaABAg,আপনাকে অনেক ধন্যবাদ চঞ্চল ভাই,-1,আপনাকে অনেক ধন্যবাদ চঞ্চল ভাই,2025-08-14T17:15:10Z
UgxJepNNk8b5y2r3uW94AaABAg,খুবই পছন্দের একটি গান আমার শখের মানুষটির জন্য রাই🌼🫰🏻💙🙏🏻😌,-1,খুবই পছন্দের একটি গান আমার শখের মানুষটির জন্য রাই🏻🏻,2025-09-29T13:56:56Z
UgwlcxSVm0Y3a9dOU654AaABAg,আমার খুব  পছন্দের  গান।,-1,আমার খুব পছন্দের গান।,2025-10-12T09:59:48Z
Ugxj3xWaF1_fxY_pLCJ4AaABAg,সেই সুন্দর হয়েছে,-1,সেই সুন্দর হয়েছে,2025-05-22T22:26:36Z
Ugwwd4kJx2MVqCRRXLx4AaABAg,খুব সুন্দর গান ❤️❤️,-1,খুব সুন্দর গান ️️,2025-06-13T10:11:15Z
UgzfIHGNfOZmfxpHWr54AaABAg,দারুন সুন্দর হয়েছে,-1,দারুন সুন্দর হয়েছে,2025-08-15T15:38:06Z
Ugxollu0kLXAL7Qv8b54AaABAg,সো বিউটিফুল ভিডিও,-1,সো বিউটিফুল ভিডিও,2025-06-01T13:22:05Z
UgyQBjZwFW67ANxQM094AaABAg,খুবই ভালো লাগলো,-1,খুবই ভালো লাগলো,2024-06-17T12:21:13Z
UgxRhu8CAykfKM6zmOh4AaABAg,সত্যি অসাধারণ গান,-1,সত্যি অসাধারণ গান,2025-05-19T18:23:57Z
UgzikLW-jAOpLXj8PQN4AaABAg,খুব সুন্দর হয়েছে নাইস,-1,খুব সুন্দর হয়েছে নাইস,2024-07-15T09:57:10Z
UgwUexQrgTBMI-vfSlF4AaABAg,অসাধারণ বললেও kom hobe অনবদ্য hoye6e.❤,-1,অসাধারণ বললেও kom hobe অনবদ্য hoye6e.,2024-08-23T08:00:40Z
UgzBj_bd5HVaXA3v7-54AaABAg,অনেক সুন্দর গান টি,-1,অনেক সুন্দর গান টি,2025-11-10T07:50:37Z
