id,text,label,clean_text,reference_time
UgwO2Y9PO8qhNL_Yfzd4AaABAg,আমার প্রিয় শিল্পী ইমন খান ❤ লাভ ইউ ইমন ভাই❤ আপনি বাংলাদেশের যেখানেই থাকেন একদিন নাহ একদিন আপনার সাথে দেখা করবো ইনশাআল্লাহ,-1,আমার প্রিয় শিল্পী ইমন খান লাভ ইউ ইমন ভাই আপনি বাংলাদেশের যেখানেই থাকেন একদিন নাহ একদিন আপনার সাথে দেখা করবো ইনশাআল্লাহ,2024-04-14T19:43:06Z
Ugxrqsuua4Wo0kYCoxZ4AaABAg,অসাধারণ ইমন ভাই অসাধারণ খুব সুন্দর হয়েছে 👍👍👍👍👍🌹🌹🌹,-1,অসাধারণ ইমন ভাই অসাধারণ খুব সুন্দর হয়েছে,2025-06-19T16:44:36Z
Ugy1mbnp5c9cfcN06H54AaABAg,"বেস্ট ইমন খান,,,,, অনেক কষ্টরে গান",-1,"বেস্ট ইমন খান,,,,, অনেক কষ্টরে গান",2025-07-28T13:35:54Z
UgzaSPZgJynlkevkZcl4AaABAg,খুব ভালো লাগলো অনেক সুন্দর ভিডিও,-1,খুব ভালো লাগলো অনেক সুন্দর ভিডিও,2025-10-14T19:13:16Z
Ugw8lj_jpCtlf_cZBbV4AaABAg,অসাধারণ অনেক সুন্দর হয়েছে,-1,অসাধারণ অনেক সুন্দর হয়েছে,2024-05-09T05:26:59Z
UgyuOVbOtx775MxNiYd4AaABAg,ইমন ভাই আপনার গানটা আমার অনেক ভালো লাগে ❤❤😂,-1,ইমন ভাই আপনার গানটা আমার অনেক ভালো লাগে,2024-07-05T14:59:22Z
UgykMm5boaqgJ95VgIF4AaABAg,ভাই আমি আপনার গানের ভক্ত,-1,ভাই আমি আপনার গানের ভক্ত,2023-10-19T14:09:49Z
UgwwSJb9APmcJhX0Qy94AaABAg,দারুণ দৃশ্য ছিল অসাধারণ গান পরিবেশন করেছেন অসাধারণ,-1,দারুণ দৃশ্য ছিল অসাধারণ গান পরিবেশন করেছেন অসাধারণ,2025-04-28T19:08:06Z
UgziAy9XVaajf55Lg_p4AaABAg,ভাইজান প্রেম করে কি এত বড় ছ্যাকা খাইছেন আমার মত যত কষ্টের গান গান আপনার গানগুলো শুনে আমার কষ্টে বুক ফেটে যায় আমি নিজের কান্না করি,-1,ভাইজান প্রেম করে কি এত বড় ছ্যাকা খাইছেন আমার মত যত কষ্টের গান গান আপনার গানগুলো শুনে আমার কষ্টে বুক ফেটে যায় আমি নিজের কান্না করি,2025-10-30T16:39:22Z
UgwiUHOVSmBXsTMHfOd4AaABAg,অনেক সুন্দর হয়েছে বন্ধু ভিডিওটি দোয়া করি আরো সুন্দর সুন্দর গান 🎉❤,-1,অনেক সুন্দর হয়েছে বন্ধু ভিডিওটি দোয়া করি আরো সুন্দর সুন্দর গান,2025-10-13T15:05:03Z
UgyFuGqu5K55P2pOBZ54AaABAg,অনেক সুন্দর একটা গান পাশে আছে এগিয়ে যান পাশে রাখবেন,-1,অনেক সুন্দর একটা গান পাশে আছে এগিয়ে যান পাশে রাখবেন,2025-05-05T03:03:04Z
UgxxsTajarEmuoOHHS94AaABAg,অনেক সুন্দর ভিডিও,-1,অনেক সুন্দর ভিডিও,2025-06-07T08:43:42Z
Ugz7NOVfmpwSjYUQVSR4AaABAg,ইমন তোমার একটা অ্যালবাম বানাবো আমি,-1,ইমন তোমার একটা অ্যালবাম বানাবো আমি,2024-05-24T16:51:44Z
UgwyYtsftmygKBQ3X1p4AaABAg,❤❤❤❤❤❤❤ ইমন ভাই আমাকেও একটু সাপোর্ট করে দিন,-1,ইমন ভাই আমাকেও একটু সাপোর্ট করে দিন,2024-03-16T07:47:45Z
UgysH5Zi_xTi2OCmp9l4AaABAg,প্রথিবিতে মানুষ চিনা বড় কষ্ট,-1,প্রথিবিতে মানুষ চিনা বড় কষ্ট,2025-11-18T15:55:31Z
UgydKyQyJMb4UdkSEFh4AaABAg,আমার বুকের ভিতর দুঃখ একটা ঘর বানাইছে রে সেগুলোই দুঃখ থেকে সুখ থাকে নারে,-1,আমার বুকের ভিতর দুঃখ একটা ঘর বানাইছে রে সেগুলোই দুঃখ থেকে সুখ থাকে নারে,2025-04-30T11:55:33Z
Ugztneb-EqzAcCA-5YZ4AaABAg,অনেক অনেক চমৎকার,-1,অনেক অনেক চমৎকার,2025-04-17T15:15:12Z
UgxFNyBlLBGs-X8E7dp4AaABAg,আহ্ অনেক সুন্দর একটা গান মন ভরে যায় আরো ভিডিও চাই,-1,আহ্ অনেক সুন্দর একটা গান মন ভরে যায় আরো ভিডিও চাই,2025-10-22T14:24:07Z
UgwbK-4QAQRkZUX56zZ4AaABAg,প্লিজ আপনাদের একটু ভালোবাসা চাই প্লিজ অহংকার না রেখে একটু ভালোবাসা দিয়েন যাতে আপনাদের পাশে থাকতে পারি,-1,প্লিজ আপনাদের একটু ভালোবাসা চাই প্লিজ অহংকার না রেখে একটু ভালোবাসা দিয়েন যাতে আপনাদের পাশে থাকতে পারি,2025-05-23T16:23:31Z
UgzvqthJvcTRDDqq7f54AaABAg,মানুষের ভাবনা টা হয় অন্য এরকম৷,-1,মানুষের ভাবনা টা হয় অন্য এরকম৷,2025-12-10T14:50:39Z
UgxMGSvil7tDBmD-n6N4AaABAg,আপনার গানটা খুব অসাধারণ হয়েছে,-1,আপনার গানটা খুব অসাধারণ হয়েছে,2025-04-19T07:02:30Z
Ugy6m4jbRzOiul4g4Q14AaABAg,আই এম ফাইন খুব সুন্দর হয়েছে❤❤❤❤❤❤❤❤❤❤❤❤❤❤❤❤❤❤🎉🎉🎉🎉🎉🎉🎉🎉🎉🎉🎉🎉🎉🎉🎉🎉🎉🎉🎉🎉🎉🎉🎉🎉🎉🎉🎉,-1,আই এম ফাইন খুব সুন্দর হয়েছে,2025-05-02T15:56:31Z
Ugzw83s4cl6-8N6cGNZ4AaABAg,ভালো লাগলে ভাই,-1,ভালো লাগলে ভাই,2025-09-20T18:08:35Z
UgxpNtK4avn8EgMmFft4AaABAg,সেই রকম একটা গান  মন ছুয়ে যাওয়ার মতো একটা গান  বেইমন  রা মানুষ  পারে  তার জন্যই তো এইসব  গান   হইছে,-1,সেই রকম একটা গান মন ছুয়ে যাওয়ার মতো একটা গান বেইমন রা মানুষ পারে তার জন্যই তো এইসব গান হইছে,2024-03-01T06:55:01Z
UgwdL9qO91ehik9hzsd4AaABAg,অপূর্ব সুন্দর হয়েছে ইমন ভাই অসাধারণ কেমন আছেন ভাই  আপনি,-1,অপূর্ব সুন্দর হয়েছে ইমন ভাই অসাধারণ কেমন আছেন ভাই আপনি,2025-10-21T20:04:02Z
UgwB9PzOZ0_FwZRY8yV4AaABAg,"সত্যি,, আমিও ভাবিনি হবে এমন,,
আমার পাখি আমারে দিবে শূন্য জীবন,,,
❤❤❤❤",-1,"সত্যি,, আমিও ভাবিনি হবে এমন,, আমার পাখি আমারে দিবে শূন্য জীবন,,,",2024-09-26T08:39:58Z
UgxEPwmA1ivkIW3MN7t4AaABAg,ভাই এই গান আর সোনা পাখি আমি তোমার গান খুব সুন্দর আমার বয়স যখন তিন এখন আমার বয়স এখন আমার বয়স 15 এই দুটো গান আমি যদি মরে যাই এই গানটিকে শাড়ি যাব না বলছি ভাই তোমার যদি কাছে না গেলে পাই বুকে ছোট ভাই এই দুটো গান আমাকে পাদ দেন আর আপনার নাম্বারটা বলেন আমাদের আমাদের এগিয়ে কোন সেট হবে এলইডি গান বলবেন মুসলিম ভাইয়া আমার নাম মুন্না আপনার গানের এখন করলে লাইট সবচেয়ে কমান্ড হয়ে গেছে ভাইয়া বলছেন আমাকে কেউ লাইক দেন,-1,ভাই এই গান আর সোনা পাখি আমি তোমার গান খুব সুন্দর আমার বয়স যখন তিন এখন আমার বয়স এখন আমার বয়স 15 এই দুটো গান আমি যদি মরে যাই এই গানটিকে শাড়ি যাব না বলছি ভাই তোমার যদি কাছে না গেলে পাই বুকে ছোট ভাই এই দুটো গান আমাকে পাদ দেন আর আপনার নাম্বারটা বলেন আমাদের আমাদের এগিয়ে কোন সেট হবে এলইডি গান বলবেন মুসলিম ভাইয়া আমার নাম মুন্না আপনার গানের এখন করলে লাইট সবচেয়ে কমান্ড হয়ে গেছে ভাইয়া বলছেন আমাকে কেউ লাইক দেন,2025-04-30T11:54:44Z
UgybgeGfOBAz9xmK6At4AaABAg,ভাবিনেবো😊চূবো😊😅😮😢🎉😂❤ ভাবি যেন ভালো থাকে তাকে আমি তাকে আমি শুনবো মন❤সস ইমন তোর কাছে থাকবে না আমার কাছে আসবে তুমি ভালোবাসি না আমি ভালোবাসি বেশি বুঝতে পারছস আমার কাছে থাকলে আমি আত্মহত্যা মরে যাবো বুঝতে পারছিস এমন ভাই কেন আসবে কেন আসবে😅,-1,ভাবিনেবোচূবো ভাবি যেন ভালো থাকে তাকে আমি তাকে আমি শুনবো মনসস ইমন তোর কাছে থাকবে না আমার কাছে আসবে তুমি ভালোবাসি না আমি ভালোবাসি বেশি বুঝতে পারছস আমার কাছে থাকলে আমি আত্মহত্যা মরে যাবো বুঝতে পারছিস এমন ভাই কেন আসবে কেন আসবে,2025-08-07T03:52:15Z
Ugw3MgpjQRe0Pc-tZo94AaABAg,ভাইয়া একটু সাপোর্ট করেন প্লিজ ❤❤❤,-1,ভাইয়া একটু সাপোর্ট করেন প্লিজ,2025-07-30T14:09:36Z
UgytmyFuhyi-gMreCfd4AaABAg,গানটি আমার সাথে মিলে গেছে 😂😂😂😂😂😂😂😂😂😂😂😂😂😂😂😂😂😂😂,-1,গানটি আমার সাথে মিলে গেছে,2024-01-07T13:56:33Z
UgyTpUxESz1Ogods4AJ4AaABAg,সুন্দর একটা ভিডিও ❤❤❤❤❤,-1,সুন্দর একটা ভিডিও,2025-04-10T01:58:03Z
UgyY434niIBZoYl9zp54AaABAg,এই গানটা কবে আসবে,-1,এই গানটা কবে আসবে,2024-02-03T14:28:14Z
Ugx5iRCouYnnBWxiXUp4AaABAg,পাখি গান ১০ চাই ❤❤,-1,পাখি গান ১০ চাই,2023-09-21T14:22:12Z
UgzOlruWyt4yPE_Ks6d4AaABAg,সবাই সুন্দর সুন্দর কমেন্ট করে সাবস্ক্রাইবার বাড়ায় নিয়ে যান ❤❤,-1,সবাই সুন্দর সুন্দর কমেন্ট করে সাবস্ক্রাইবার বাড়ায় নিয়ে যান,2025-04-26T13:26:46Z
Ugw7hnNtlxj5gFHQ2kd4AaABAg,আসসালামু আলাইকুম ভাই,-1,আসসালামু আলাইকুম ভাই,2025-11-26T09:10:59Z
Ugzq9JX2-ckjz4QMQqV4AaABAg,ইমন ভাই আপনার গান খুব ভালো লাগে,-1,ইমন ভাই আপনার গান খুব ভালো লাগে,2023-09-06T16:01:01Z
UgwUUZUixgBIl60uQ954AaABAg,খুব সুন্দর একটা গান ভাইয়া তোমার সব গান আমার অনেক ভালো লাগে ❤❤❤❤,-1,খুব সুন্দর একটা গান ভাইয়া তোমার সব গান আমার অনেক ভালো লাগে,2023-09-15T15:38:38Z
UgxsL6N4K6jvid2Mzjx4AaABAg,কোনদিন আরিয়ান খান ভাবে নাই ইমন খানের মতো আমার পাখি আমাকে দেবে আকাল মরণ ইমন খান আপনার ভিডিও গান আমার অনেক ❤❤❤❤❤❤❤,-1,কোনদিন আরিয়ান খান ভাবে নাই ইমন খানের মতো আমার পাখি আমাকে দেবে আকাল মরণ ইমন খান আপনার ভিডিও গান আমার অনেক,2024-01-15T15:16:23Z
UgxSgxd3srM_4wHEBSV4AaABAg,দীপা নিতা nambar 1  hobe so nice gaan  amr vlo lagha,-1,দীপা নিতা nambar 1 hobe so nice gaan amr vlo lagha,2025-12-05T19:52:23Z
UgwIZuE4YyQoySNk2BR4AaABAg,তোর মন পাড়া থাকতে দে আমা❤️🫣🫶🥰,-1,তোর মন পাড়া থাকতে দে আমা️,2025-12-05T04:40:07Z
Ugxjt_vB-o8RGr3rhLF4AaABAg,"1,3 ❤❤❤ আমার কাছে খুব ভালো লেগেছে ❤❤❤",-1,"1,3 আমার কাছে খুব ভালো লেগেছে",2025-12-14T04:01:22Z
UgxVlujvm0bLrX42pFJ4AaABAg,অনেক সুন্দর হয়েছে দিদি ভাই,-1,অনেক সুন্দর হয়েছে দিদি ভাই,2025-12-17T04:37:04Z
UgzqQ76PimdVR6vpRlV4AaABAg,অপরাধী গান এবং তোর মনের পিঞ্জিরায় গান এবং ঝোল গান,-1,অপরাধী গান এবং তোর মনের পিঞ্জিরায় গান এবং ঝোল গান,2025-11-20T13:26:02Z
UgwB2cqJI-XjlEe_gY54AaABAg,নাম্বার 1 দীপান্বিতা হবে ❤❤❤❤❤❤❤❤❤❤❤❤,-1,নাম্বার 1 দীপান্বিতা হবে,2025-11-01T13:33:58Z
Ugx3oVvyjh5fbCaZCDh4AaABAg,আমার কাছে সোব ফ্যেবরেড,-1,আমার কাছে সোব ফ্যেবরেড,2025-12-08T08:10:25Z
UgzSEz47WjO2lCzlbCd4AaABAg,"দিপান্বিতা আরো উপরে থাকার কথা না??,, 🤔",-1,"দিপান্বিতা আরো উপরে থাকার কথা না??,,",2025-12-04T13:22:47Z
UgyiztkyB2KqLZgKAIF4AaABAg,123 আমার ফেভারিট❤❤❤,-1,123 আমার ফেভারিট,2025-11-13T06:02:50Z
UgzBvhO6R40qqYIZP2p4AaABAg,"আমি কিছু গান ইউবটুবে ছেড়েছি, কেমন হয়েছে জানাবে।",-1,"আমি কিছু গান ইউবটুবে ছেড়েছি, কেমন হয়েছে জানাবে।",2025-10-19T19:06:47Z
UgzPePxCZzfeVaqNPkh4AaABAg,এরমধ্যে কি গান বল,-1,এরমধ্যে কি গান বল,2025-12-19T10:58:10Z
UgyVrMkf279J1H47beB4AaABAg,এই গান আমাৰ কলিজা,-1,এই গান আমাৰ কলিজা,2025-06-17T05:07:35Z
UgyJxhCCM6Sh2-6YQSx4AaABAg,অনেক ভালোবাসি ছায়া ছবি গান কে....😊😊,-1,অনেক ভালোবাসি ছায়া ছবি গান কে....,2025-12-09T02:17:25Z
Ugx0gABhwyu89qSiO_R4AaABAg,পছন্দের গান এইগুলা,-1,পছন্দের গান এইগুলা,2025-08-21T02:05:20Z
Ugz0WP6dQmfmst-GrjB4AaABAg,আমি একটা রেস্টুন এ চাকরি করি আর কাজের পাকে গান গুলি সোনি অনেক বালো লাগে ভাই ❤❤❤,-1,আমি একটা রেস্টুন এ চাকরি করি আর কাজের পাকে গান গুলি সোনি অনেক বালো লাগে ভাই,2025-09-25T03:34:47Z
UgyJYQpkU61eU18Ci-h4AaABAg,আমার বয়স ৩৪ বছর গান গুলো  সব সময় শুনে  দুঃখ প্রকাশ করা যায় না মাষুসের  সেরা এলবাম  গান,-1,আমার বয়স ৩৪ বছর গান গুলো সব সময় শুনে দুঃখ প্রকাশ করা যায় না মাষুসের সেরা এলবাম গান,2025-05-29T04:45:55Z
Ugze6gZmYoApHaLXARh4AaABAg,আমারও প্রিয় গান এটা 💞💞💞👌👌👌,-1,আমারও প্রিয় গান এটা,2025-04-26T09:21:19Z
UgyvNTuM4auy1xAE-7J4AaABAg,গোলাপজান ছবির গান,-1,গোলাপজান ছবির গান,2024-12-01T18:25:38Z
UgzUt2iXhcidoWheiPF4AaABAg,"সবগুলো গানই  অনেক সুন্দর,,  আমার কাছে খুব প্রিয়,,  মালয়েশিয়া থেকে শুনছি।",-1,"সবগুলো গানই অনেক সুন্দর,, আমার কাছে খুব প্রিয়,, মালয়েশিয়া থেকে শুনছি।",2025-11-23T01:49:02Z
UgygQ7X27r71PsjbfRB4AaABAg,আমি যাকে ভালোবাসি তারে এই গান শুনাইতাম,-1,আমি যাকে ভালোবাসি তারে এই গান শুনাইতাম,2025-02-05T12:37:47Z
UgyJhM0rR85oaV8KABJ4AaABAg,আমার প্রিয়ো গান,-1,আমার প্রিয়ো গান,2025-01-28T17:34:31Z
Ugwlqj3dmPL1QqGr1gR4AaABAg,আমার অনেক পছন্দের গান গুলো,-1,আমার অনেক পছন্দের গান গুলো,2025-08-23T12:09:52Z
UgzQ4Hp6NbiJsXejSWV4AaABAg,কি ছবির গান,-1,কি ছবির গান,2024-10-22T14:26:34Z
UgwOihn0awmrnQlO0Ol4AaABAg,অনেক সুন্দর গান আমার খুব পছন্দ লাগে,-1,অনেক সুন্দর গান আমার খুব পছন্দ লাগে,2024-12-18T01:20:33Z
UgzNdf3Tq6ydxr_KVnx4AaABAg,গান আমি সবসময় শুনি এই গান আমার কাছে খুব ভালো লাগে  আমার কিন্তু বয়স বেশি না ২০+ তবুও আমার ভালো লাগে এই গানটা❤,-1,গান আমি সবসময় শুনি এই গান আমার কাছে খুব ভালো লাগে আমার কিন্তু বয়স বেশি না ২০+ তবুও আমার ভালো লাগে এই গানটা,2024-12-20T05:58:03Z
Ugyv1CTXRBFOwzpEJ-d4AaABAg,"আজকে মনটা খুব খারাপ তাই গান শুনরাম,  😰",-1,"আজকে মনটা খুব খারাপ তাই গান শুনরাম,",2025-10-22T19:59:47Z
UgzLPMJ3YT4BeqE2AHZ4AaABAg,দারুন একটা গান মনির খান,-1,দারুন একটা গান মনির খান,2024-09-30T05:21:34Z
UgxZt4ZQk8YFFgin9IF4AaABAg,অসাধারণ আগে গান শুনে লাগে ❤❤❤,-1,অসাধারণ আগে গান শুনে লাগে,2024-12-12T13:20:15Z
Ugz5Kq7_hV_2KNeQC5V4AaABAg,আমার প্রিয় গানগুলো,-1,আমার প্রিয় গানগুলো,2025-06-11T05:15:59Z
UgxCFOK_w6Et1hO9M8h4AaABAg,আমার  পিয় গান,-1,আমার পিয় গান,2025-02-18T04:24:34Z
Ugx78KA57QAB98gsmv14AaABAg,কার কার পছন্দের নায়িকা শাবনুর❤❤,-1,কার কার পছন্দের নায়িকা শাবনুর,2024-11-01T16:11:10Z
UgygrxfCU4LEkFUKWut4AaABAg,অতুলনীয় এক নায়িকা শাবনূর আপু সবার সেরা ❤❤❤,-1,অতুলনীয় এক নায়িকা শাবনূর আপু সবার সেরা,2024-05-15T18:24:19Z
Ugz7fcZHyM5XOgxUcNZ4AaABAg,অপরুপ সৌন্দর্যের অধিকারী  শাবনুর। শাবনুরকে দেখে অন্য কোনো নাইকাকে দেখার ইচ্ছে হয় না।,-1,অপরুপ সৌন্দর্যের অধিকারী শাবনুর। শাবনুরকে দেখে অন্য কোনো নাইকাকে দেখার ইচ্ছে হয় না।,2024-05-18T04:03:45Z
UgwImoWaCeyjn6RaSYt4AaABAg,খুব মিস করি আগের সেই শৈশবের দিন গুলি প্রতি বৃহস্পতিবার আর শ্রক্রবার বিকালে মুভি দেখতাম ভিটিবি তে সবাই মিলে সেই দিন গুলিই ভালো ছিলো,-1,খুব মিস করি আগের সেই শৈশবের দিন গুলি প্রতি বৃহস্পতিবার আর শ্রক্রবার বিকালে মুভি দেখতাম ভিটিবি তে সবাই মিলে সেই দিন গুলিই ভালো ছিলো,2024-05-18T20:34:27Z
UgzDyNKTMFV4nNgDYBF4AaABAg,এই গান গুলা আর অভিনয় আর খুজে পাওয়া যায়না 😢😢,-1,এই গান গুলা আর অভিনয় আর খুজে পাওয়া যায়না,2025-01-18T14:12:44Z
UgwcTQj2_ZvWs93Pl7V4AaABAg,"অলরাউন্ডার নায়িকা আমার পিয় শাবনুর আপু
তার সাথে কারো তুলনা হয়না
শাবানা ও ববিতা নায়িকাদের পর শাবনুরি সেরা নায়িকা। তিনি অভিনয় থেকে জাওয়ার পর তাকে অেনক মিস করি❤❤😊",-1,অলরাউন্ডার নায়িকা আমার পিয় শাবনুর আপু তার সাথে কারো তুলনা হয়না শাবানা ও ববিতা নায়িকাদের পর শাবনুরি সেরা নায়িকা। তিনি অভিনয় থেকে জাওয়ার পর তাকে অেনক মিস করি,2024-12-16T23:51:18Z
UgwoNJDTXTIlWSf3AJp4AaABAg,ও হচ্ছে আমার সবচেয়ে প্রিয় নায়িকা❤❤❤ আই লাভ ইউ শাবনূর আপু,-1,ও হচ্ছে আমার সবচেয়ে প্রিয় নায়িকা আই লাভ ইউ শাবনূর আপু,2024-12-10T13:43:05Z
Ugww4hCpC1vUb57O9RF4AaABAg,বাংলার নাম্বার ওয়ান আইডল .........,-1,বাংলার নাম্বার ওয়ান আইডল .........,2024-05-17T16:58:11Z
UgzxC9ezo_Cvyn-UMZN4AaABAg,আমার খুব পছন্দের গান সৃতি  হিসেবে কমেন্ট রেখে গেলাম গান গুলো কখনোই পুরাতন হবেনা কি বলেন আপনারা❤❤❤❤❤,-1,আমার খুব পছন্দের গান সৃতি হিসেবে কমেন্ট রেখে গেলাম গান গুলো কখনোই পুরাতন হবেনা কি বলেন আপনারা,2024-10-24T13:26:57Z
UgwFrO3FmsQxUmNSyEl4AaABAg,অনেক ভালোই হয়েছে আমি একজন ছোট আমার দিকে লক্ষ্য রাখেন,-1,অনেক ভালোই হয়েছে আমি একজন ছোট আমার দিকে লক্ষ্য রাখেন,2025-08-09T07:14:24Z
