id,text,label,clean_text,reference_time
UgytMFAVAoEbHts6q-p4AaABAg,একদিন আমি এই পৃথিবী ছেড়ে চলে যাবো!আমার করা কমেন্ট থেকে যাবে।কোথাও আঘাত লাগলে সে আঘাত ভালো হয়েগেলে আমার ভুলে যাই।একবার কেউ যদি হৃদয়ে আঘাত দিয়ে থাকে সে আঘাত আমরা কোনোদিন ভুলতে পারিনা।আমি ভগবানের কাছে পার্থনা করি যারা হৃদয়ে আঘাত দিয়ে কথা বলে তারা যেন খুব খুব সুখী হয়।,-1,একদিন আমি এই পৃথিবী ছেড়ে চলে যাবো!আমার করা কমেন্ট থেকে যাবে।কোথাও আঘাত লাগলে সে আঘাত ভালো হয়েগেলে আমার ভুলে যাই।একবার কেউ যদি হৃদয়ে আঘাত দিয়ে থাকে সে আঘাত আমরা কোনোদিন ভুলতে পারিনা।আমি ভগবানের কাছে পার্থনা করি যারা হৃদয়ে আঘাত দিয়ে কথা বলে তারা যেন খুব খুব সুখী হয়।,2024-12-19T06:54:59Z
Ugy7m7S_gXNXPatnHSl4AaABAg,"সুখ কি জিনিস আমি আজ ও পেলাম না আর হয়তো কোনোদিনও পাবনা 😢
শূন্য হৃদয় নিয়ে এই পৃথিবী থেকে বিদায় নেবে😢
সবাই ভালো থেকো সুখে থেকো 😢",-1,সুখ কি জিনিস আমি আজ ও পেলাম না আর হয়তো কোনোদিনও পাবনা শূন্য হৃদয় নিয়ে এই পৃথিবী থেকে বিদায় নেবে সবাই ভালো থেকো সুখে থেকো,2024-08-07T16:45:52Z
Ugy6BEPAAdh2jqRGvjN4AaABAg,❤❤❤❤নিত্য দিনে জিবনের প্রতিটি মুহূর্তের সাথে জরিয়ে আছে😂😂😂😂,-1,নিত্য দিনে জিবনের প্রতিটি মুহূর্তের সাথে জরিয়ে আছে,2024-09-20T20:51:23Z
Ugwyat3I5DTfpRHImaR4AaABAg,আমি একটা মেয়ে কে অনেক ভালো বাসে চিলাম কিন্তু সেই মেয়ে আমাকে চেরে চলি গেলো  তার পরে মেয়েটার সাথে ৮ বচর কনো যোগাযোগ চিলো না তার পরে আবার ভালো বাসা শরু হয়লো ৭ বচর  পরে তাকে পেলাম বিয়ে ও করলাম কিছু দিন সংসার করে চলি গেলো আমার কাছে থেকে,-1,আমি একটা মেয়ে কে অনেক ভালো বাসে চিলাম কিন্তু সেই মেয়ে আমাকে চেরে চলি গেলো তার পরে মেয়েটার সাথে ৮ বচর কনো যোগাযোগ চিলো না তার পরে আবার ভালো বাসা শরু হয়লো ৭ বচর পরে তাকে পেলাম বিয়ে ও করলাম কিছু দিন সংসার করে চলি গেলো আমার কাছে থেকে,2025-06-30T07:42:02Z
UgxhwuYqljti1PX_TCp4AaABAg,❤❤ আমি তোমার কষ্ট দেখতে পারছি না তাই আমি ভেবছি আমি তোমার বৌয়ের সাথে আমি কথা বলবো তোমার জন্য আমি সব অপমান সইতে পারবো । শুধু তোমার এতো কষ্ট আমি সয্য করতে পারবো না। তুমি শুধু আমাকে পারমিশন দাও তারপর দেখো আমি তোমার জন্য কি করতে পারি । তুমি কোন অপরাধ না করে অপরাধী হয়ে বসে আছো কি আমি তামানি তুমি বলো।,-1,আমি তোমার কষ্ট দেখতে পারছি না তাই আমি ভেবছি আমি তোমার বৌয়ের সাথে আমি কথা বলবো তোমার জন্য আমি সব অপমান সইতে পারবো । শুধু তোমার এতো কষ্ট আমি সয্য করতে পারবো না। তুমি শুধু আমাকে পারমিশন দাও তারপর দেখো আমি তোমার জন্য কি করতে পারি । তুমি কোন অপরাধ না করে অপরাধী হয়ে বসে আছো কি আমি তামানি তুমি বলো।,2024-08-16T06:06:26Z
Ugyp3xfdlEElM9O47mV4AaABAg,"যদি সম্ভব হত নিজের জীবন টা নতুন করে শুরু করতাম, জীবন একটা জিনিস শেখালো, কারো জন্য যত করো একটা সময় সেও অপমান আর অসম্মান করতে ছাড়ে না, সার্থে আঘাত লাগলে 😔😔😔গান গুলো শুনে মনের ভিতরের চাপা যন্ত্রনা গুলো দুমরে মুচরে উঠছে, রেখে গেলাম একটা কমেন্ট হয়তো আমি যখন থাকবো না কেউ না কেউ আমার এই কমেন্টটা পড়বে 😔😔😔😔",-1,"যদি সম্ভব হত নিজের জীবন টা নতুন করে শুরু করতাম, জীবন একটা জিনিস শেখালো, কারো জন্য যত করো একটা সময় সেও অপমান আর অসম্মান করতে ছাড়ে না, সার্থে আঘাত লাগলে গান গুলো শুনে মনের ভিতরের চাপা যন্ত্রনা গুলো দুমরে মুচরে উঠছে, রেখে গেলাম একটা কমেন্ট হয়তো আমি যখন থাকবো না কেউ না কেউ আমার এই কমেন্টটা পড়বে",2024-09-13T05:34:49Z
UgwXc4hVL7gO3a1_nKF4AaABAg,আমি যাকে একদিন আমার বাবা মা সবাই কে ছেড়ে যাকে বেছে নিয়েছিলাম তার কাছে তার সবাই আপন আর আমি কিছুই নয় আমার কোনো দাম নেই তার কাছে আমি ভীষন কষ্ট পাই আর গান গুলো সুনি 😢😢😢,-1,আমি যাকে একদিন আমার বাবা মা সবাই কে ছেড়ে যাকে বেছে নিয়েছিলাম তার কাছে তার সবাই আপন আর আমি কিছুই নয় আমার কোনো দাম নেই তার কাছে আমি ভীষন কষ্ট পাই আর গান গুলো সুনি,2024-07-27T10:42:11Z
UgzUCNbtIgFQlNh6l2h4AaABAg,আমি এত ভালোবেসেছিলাম নিজের জীবনের থেকে অনেক বেশি ভালোবেসে ছিলাম আমি অন্ধের মত বিশ্বাস করতাম আমার হাত রেখে কথা দিয়েছিল সে কোনদিন আমায় ভুলবে না অথচ সে আমাকে ঠিকই ভুলে গেছে একটি বছর হয়ে গেল আমি এখনো মানতে পারিনি আমার শুধু মনে হয় সে আসবে কিন্তু যে চলে যায় সে আর কখনো ফিরে আসে না আমার মনকে কখনো বুঝাইতে পারি না  সে   আমার ছিল না,-1,আমি এত ভালোবেসেছিলাম নিজের জীবনের থেকে অনেক বেশি ভালোবেসে ছিলাম আমি অন্ধের মত বিশ্বাস করতাম আমার হাত রেখে কথা দিয়েছিল সে কোনদিন আমায় ভুলবে না অথচ সে আমাকে ঠিকই ভুলে গেছে একটি বছর হয়ে গেল আমি এখনো মানতে পারিনি আমার শুধু মনে হয় সে আসবে কিন্তু যে চলে যায় সে আর কখনো ফিরে আসে না আমার মনকে কখনো বুঝাইতে পারি না সে আমার ছিল না,2024-10-12T03:54:33Z
UgxiSe7A7x1qKlzRqyx4AaABAg,এটাই ব্যাস্তব মন যা চায় সেটা সে কখনো পায় না।,-1,এটাই ব্যাস্তব মন যা চায় সেটা সে কখনো পায় না।,2025-12-14T20:27:27Z
Ugz1zPIfV6LD-F_cr8p4AaABAg,পুরনো দিনের কথা মনে পড়লে.... পুরনো দিনের ফিরে যেতে ইচ্ছা করে কিন্তু আমরা সবাই জানি ও দিন আর আসবে না😢😢,-1,পুরনো দিনের কথা মনে পড়লে.... পুরনো দিনের ফিরে যেতে ইচ্ছা করে কিন্তু আমরা সবাই জানি ও দিন আর আসবে না,2024-08-22T03:58:39Z
UgzUWuAyCu3Mwu83pyB4AaABAg,"সুখ কি জিনিস আমি আজ ও পেলাম না আর হয়তো কোনোদিনও পাবনা 😢
শূন্য হৃদয় নিয়ে এই পৃথিবী থেকে বিদায় নেবে😢
সবাই ভালো থেকো সুখে থেকো        প্রেমা কামাল",-1,সুখ কি জিনিস আমি আজ ও পেলাম না আর হয়তো কোনোদিনও পাবনা শূন্য হৃদয় নিয়ে এই পৃথিবী থেকে বিদায় নেবে সবাই ভালো থেকো সুখে থেকো প্রেমা কামাল,2024-10-15T05:32:06Z
UgwBDl3VoWZxG7cXxC14AaABAg,"আমার পাগলি তো আমাকে ভুল বুঝলো 😢 সে আমাকে কি সহজেই বলতে পারলো 😢যে সে নাকি মারা যাবে 😭😭😭😭😭😭তাই আমিও আর চাইনি যে আমার জন্য আমার পাগলি এই পৃথিবী ছেড়ে চলে যাক 😭😭😭😭😭😭তাই নিজেই আমি সরে গেলাম 😩😩😩😭😭😭😭😭 আমার পাগলি খুব ভালো থাকুক ,,,,দরকার পড়লে ভগবান আমার জীবন টা নিয়ে নিক কিন্তূ আমার পাগলিকে যেনো সারাজীবন খুব খুব ভালো রাখেন 😩😩😭😭😭Rama💔🥀🥀🥀",-1,"আমার পাগলি তো আমাকে ভুল বুঝলো সে আমাকে কি সহজেই বলতে পারলো যে সে নাকি মারা যাবে তাই আমিও আর চাইনি যে আমার জন্য আমার পাগলি এই পৃথিবী ছেড়ে চলে যাক তাই নিজেই আমি সরে গেলাম আমার পাগলি খুব ভালো থাকুক ,,,,দরকার পড়লে ভগবান আমার জীবন টা নিয়ে নিক কিন্তূ আমার পাগলিকে যেনো সারাজীবন খুব খুব ভালো রাখেন Rama",2024-11-21T19:32:39Z
UgzelC69Ul73c0Sz1eN4AaABAg,"আমার কষ্ট গুলো কাউকে বলতে পারি না, খুব কষ্ট হয় 😔😭",-1,"আমার কষ্ট গুলো কাউকে বলতে পারি না, খুব কষ্ট হয়",2024-08-22T15:24:50Z
UgxsIvv7XpneOHB6dJ54AaABAg,সবাই সব কিছু কেড়ে নিতে পারে কিন্তু ভাগ্য কেউ নিতে পারে না😭😭ভালো থেকো প্রিয়ো😭😭 আমি সারাজীবন দূরেই থেকে যাবো,-1,সবাই সব কিছু কেড়ে নিতে পারে কিন্তু ভাগ্য কেউ নিতে পারে নাভালো থেকো প্রিয়ো আমি সারাজীবন দূরেই থেকে যাবো,2024-08-03T09:54:44Z
UgxTOhe_f1tK9H6XEhJ4AaABAg,"বাবাকে হারিয়েছি 06-10-2024 জীবনে অনেক বড় আঘাত পেয়েছি। 
আরা আজ 04-01-2025 আমার জীবনসঙ্গী আমাকে ছেড়ে চলে গেল ভাষা খুঁজে পাচ্ছিনা কি বলবো আর আমি নিজে কি করবো😢😢",-1,বাবাকে হারিয়েছি 06-10-2024 জীবনে অনেক বড় আঘাত পেয়েছি। আরা আজ 04-01-2025 আমার জীবনসঙ্গী আমাকে ছেড়ে চলে গেল ভাষা খুঁজে পাচ্ছিনা কি বলবো আর আমি নিজে কি করবো,2025-01-04T09:37:22Z
UgzMnCZz4aqxCuTSQ0J4AaABAg,মা বাবা ভাই বোন সবাই কে ছেড়ে একজনের হাত ধরে ছিলাম 😢কিন্তু     আজ সে হাতটি ছেড়ে দিলো😢😢😢😢😢😢,-1,মা বাবা ভাই বোন সবাই কে ছেড়ে একজনের হাত ধরে ছিলাম কিন্তু আজ সে হাতটি ছেড়ে দিলো,2024-12-08T14:39:17Z
UgxW_A3qGhMmurEqabt4AaABAg,I love you song ❤️😢😢😢😭😭😭 আমি  এই  গান শুনতে শুনতে কখন ঘুমিয়ে যাই আমি নিজে জানি না  একজনের কথা খুব মনে পড়ে 😢😢😢 আমি কমেন্ট দিয়ে গেলাম বন্ধু সবাই  ভালো থাকবেন ❤❤,-1,I love you song ️ আমি এই গান শুনতে শুনতে কখন ঘুমিয়ে যাই আমি নিজে জানি না একজনের কথা খুব মনে পড়ে আমি কমেন্ট দিয়ে গেলাম বন্ধু সবাই ভালো থাকবেন,2024-11-07T12:08:00Z
UgzigTuZCeYVyJL6BHh4AaABAg,"এই গানটা অনেক মানুষের নীরবতাকে তীব্র করে , অনেক ভালোবাসার যন্ত্রণায় কতর হওয়া মানুষকে নতুন করে ভালো থাকার বার্তা দেয় । কাউকে ভালোবেসে হারিয়ে ফেলার যন্ত্রনা যে কি কষ্টের তাও যদি আগে থেকেই জানা যায় ওকে আমি পাবনা তাহলে তো প্রতি রাতে নেশার মত এই গান কে খাওয়া যায় এবং চোখের জলে জীবনকে ভিজিয়ে আরও কিছুক্ষণ বেচেঁ থাকতে ইচ্ছা করে যদি সে কখনো ফিরে আসে 😢 কমেন্ট টা রেখে গেলাম কখনো সে আমার হলে নিশ্চিত ফিরবে এই কমেন্ট দেখে ❤",-1,"এই গানটা অনেক মানুষের নীরবতাকে তীব্র করে , অনেক ভালোবাসার যন্ত্রণায় কতর হওয়া মানুষকে নতুন করে ভালো থাকার বার্তা দেয় । কাউকে ভালোবেসে হারিয়ে ফেলার যন্ত্রনা যে কি কষ্টের তাও যদি আগে থেকেই জানা যায় ওকে আমি পাবনা তাহলে তো প্রতি রাতে নেশার মত এই গান কে খাওয়া যায় এবং চোখের জলে জীবনকে ভিজিয়ে আরও কিছুক্ষণ বেচেঁ থাকতে ইচ্ছা করে যদি সে কখনো ফিরে আসে কমেন্ট টা রেখে গেলাম কখনো সে আমার হলে নিশ্চিত ফিরবে এই কমেন্ট দেখে",2024-08-18T06:01:16Z
UgwHjcBP5COYPZ__YLR4AaABAg,ওপি ভাই লোক 🍻🍻🍻🍻🥂🥂🥂🥂🍾🍾🍾🍾🍾🍷🍷🍷🍷🥃🥃🥃,-1,ওপি ভাই লোক,2025-11-05T17:17:35Z
UgwFtMWoBVKkk_Uh0M14AaABAg,"আমার এই‌ সব গান গুলো শূনলে কেমন যে লাগে আমি বুঝতে পারবো না, কিন্তু আমি অনেক ভাবি যে কত দাদা ভালোবেসে কত আঘাত পেয়েছেন কিন্তু সবেই ভাগ্যের নিষ্ঠুর পরিহাস",-1,"আমার এই সব গান গুলো শূনলে কেমন যে লাগে আমি বুঝতে পারবো না, কিন্তু আমি অনেক ভাবি যে কত দাদা ভালোবেসে কত আঘাত পেয়েছেন কিন্তু সবেই ভাগ্যের নিষ্ঠুর পরিহাস",2024-12-17T19:30:28Z
UgwLOtpmeL4R4tA9-I94AaABAg,মন জা চায় তা পায় না  😢😢😢😢😢😢😢😢😢😢😢😢😢😢😢😢😢😢😢😢😢😢😢😢😢😢😢😢😢😢😢😢😢😢😢😢😢😢😢😢😢😢😢😢😢😢😢😢😢😢😢😢😢😢😢😢😢😢😢😢😢😢😢😢😢😢😢😢😢😢😢😢😢😢😢😢😢😢😢😢😢😢😢😢😢😢😢😢😢😢😢😢😢😢😢😢😢😢😢😢😢😢😢😢,-1,মন জা চায় তা পায় না,2024-07-22T14:37:26Z
UgwEQEneo7NwJtftbLN4AaABAg,"যদিও মিউজিক গান শোনা ঠিক না । বাট তাও গান গুলো খুব ভালো লাগে।
তবে এই সব মিউজিক গান মানুষকে বিপাকে ফেলে দেয় । কষ্টগুলো মেনে নেয়া যায় না 😢😢
খুব কষ্ট হয় গানগুলো শুনলে । 

একমাত্র কুরআন তেলাওয়াত শুনলে শান্তি পাওয়া যায় ❤",-1,যদিও মিউজিক গান শোনা ঠিক না । বাট তাও গান গুলো খুব ভালো লাগে। তবে এই সব মিউজিক গান মানুষকে বিপাকে ফেলে দেয় । কষ্টগুলো মেনে নেয়া যায় না খুব কষ্ট হয় গানগুলো শুনলে । একমাত্র কুরআন তেলাওয়াত শুনলে শান্তি পাওয়া যায়,2024-09-14T16:26:30Z
UgwCJ35xXMKWJUuNaul4AaABAg,"হয়তো কোনো একদিন হঠাৎ করে শুনবে তোমাদের এই সার্থপর পৃথিবী ছেড়ে চলে গেছি,,,ওই দুর আকাশে লক্ষ কোটি তারার মাঝে আমারও ঠাই হবে,,,,,, তোমার জন্য দোয়া থাকবে যে সুখের আশায় ছেড়েছো আমায় তাকে নিয়ে সুখে থাকো,,,",-1,"হয়তো কোনো একদিন হঠাৎ করে শুনবে তোমাদের এই সার্থপর পৃথিবী ছেড়ে চলে গেছি,,,ওই দুর আকাশে লক্ষ কোটি তারার মাঝে আমারও ঠাই হবে,,,,,, তোমার জন্য দোয়া থাকবে যে সুখের আশায় ছেড়েছো আমায় তাকে নিয়ে সুখে থাকো,,,",2024-07-26T03:28:28Z
Ugxza-UKtbsNARddRrV4AaABAg,"আমার খুব প্রিও গান এই গান গুলো নিয়ে বেঁচে আছি কুমার সানু দাদা ,🙏🙏🙏🙏🙏🙏",-1,"আমার খুব প্রিও গান এই গান গুলো নিয়ে বেঁচে আছি কুমার সানু দাদা ,",2024-07-19T17:51:52Z
UgxukaeGVajz47bOAXZ4AaABAg,কষ্ট একটাই আমি আমার পাগলিকে শেষবারের জন্য একবার জড়িয়ে ধরে যদি বলতে পারতাম যে তোমাকে ছাড়া যে আমি একটুও ভালো নেই পাগলি 😭😭😭😭😭 Rama 💔🥀😩😭,-1,কষ্ট একটাই আমি আমার পাগলিকে শেষবারের জন্য একবার জড়িয়ে ধরে যদি বলতে পারতাম যে তোমাকে ছাড়া যে আমি একটুও ভালো নেই পাগলি Rama,2024-11-21T19:28:39Z
Ugz4QNhZF8DDFX0gV_F4AaABAg,এই গান শুনে আমি আমার জীবনের সেই দিনগুলো মনে করি যখন আমার সব কিছু ছিল,-1,এই গান শুনে আমি আমার জীবনের সেই দিনগুলো মনে করি যখন আমার সব কিছু ছিল,2024-07-14T21:41:48Z
Ugw0AqiNkF7_UO_IS7J4AaABAg,"কিছু মানুষ নিজের স্বার্থের জন্য সংসার ধ্বংস করে দেয় 
শুভ রাত্রি 13/9/2025",-1,কিছু মানুষ নিজের স্বার্থের জন্য সংসার ধ্বংস করে দেয় শুভ রাত্রি 13/9/2025,2025-09-13T16:38:53Z
UgzIyJFya27gRKW-j1J4AaABAg,রহিম তুমি চলে গেলে এক সাগরে ফেলে ।সেই সাগর সাত রিয়ে যখন তীরে আসতে বারো বছর লেগেছে ।আর এখন তোমার মেয়ে আবার সেই  সাগরে ফালা ইয়া চলে গেল ।,-1,রহিম তুমি চলে গেলে এক সাগরে ফেলে ।সেই সাগর সাত রিয়ে যখন তীরে আসতে বারো বছর লেগেছে ।আর এখন তোমার মেয়ে আবার সেই সাগরে ফালা ইয়া চলে গেল ।,2024-09-01T01:52:55Z
Ugz7bl4PrZ3gEdg2EoZ4AaABAg,ভালোবাসা র মানুষ কে না পাওয়ার কষ্ট কি sita যে পায়নি সে বোঝো 🙏🙏🙏অনেক ভালোবাসা গান,-1,ভালোবাসা র মানুষ কে না পাওয়ার কষ্ট কি sita যে পায়নি সে বোঝো অনেক ভালোবাসা গান,2024-10-18T14:30:15Z
