id,text,label,clean_text,reference_time
UgxC2bLnCnLu55w3s794AaABAg,অসাধারণ কথা গুলো ভালো লাগে এই গানটা,-1,অসাধারণ কথা গুলো ভালো লাগে এই গানটা,2025-04-05T04:40:13Z
Ugw97yVkDY2W5kyucY94AaABAg,এইসব গান যখনই শুনব তখনই নতুন❤❤❤,-1,এইসব গান যখনই শুনব তখনই নতুন,2025-07-23T05:35:01Z
UgwTP4xw2oBOMtoaDvx4AaABAg,নিশ্চয়ই ঐ সময়টা ছিল বাংলা চলচ্চিত্র জগতের স্বর্ণ যোগ এবং সালমান শাহ ও শাবনূর ছিল স্বর্ণ মুকুট।,-1,নিশ্চয়ই ঐ সময়টা ছিল বাংলা চলচ্চিত্র জগতের স্বর্ণ যোগ এবং সালমান শাহ ও শাবনূর ছিল স্বর্ণ মুকুট।,2025-07-22T18:11:37Z
UgxG9kyrQh6pkRjx1tx4AaABAg,"তোমাকে বলতে মন চায়, সারাদিনে কতবার তোমাকে মনে পড়ে, বলার ভাষা নেই প্রতিটা মুহূর্তে তোমার কথা মনে আসে, চোখ বন্ধ করলেই তোমার মুখটা ভাসে আমার চোখের সামনে তুমি না থাকলে-ও আমার হৃদয় যেনো তোমার জন্যই ধড়ফড় করে, তোমার হাসি, তোমার কথা, তোমার চোখের সুন্দরতা সবকিছুই আমার মনে গেঁথে আছে, কখনো কখনো মনে হয় তুমি আমার কাছে আছো পাশেই আছো আমার কথা শোনো তুমি যেখানেই থাকো, আমি তোমাকে ভুলতে পারি নাহ তোমার স্মৃতির ছোঁয়া ছাড়া এক মুহূর্তও আমি থাকতে পারি নাহ প্রতিদিন তোমাকে ভেবেই দিন শুরু হয়,তোমার কথা ভেবেই রাত শেষ হয়, তোমার ভালোবাসা আমার জীবনের সবচেয়ে বড়ো উপহার, যা আমি কখনো ভুলবো না আমার ভালোবাসা তোমার জন্য কখনো কমবে নাহ বরং প্রতিদিন বাড়তে থাকবে তুমি আমার জীবনের সেই বিশেষ মানুষ যার জন্য আমি সারাজীবন অপেক্ষা করতে চাই তোমার জন্য আমার মন সবসময় খোলা আমার ভালোবাসা চিরকাল তোমার জন্যই থাকবে...!! 🖤❤️",-1,"তোমাকে বলতে মন চায়, সারাদিনে কতবার তোমাকে মনে পড়ে, বলার ভাষা নেই প্রতিটা মুহূর্তে তোমার কথা মনে আসে, চোখ বন্ধ করলেই তোমার মুখটা ভাসে আমার চোখের সামনে তুমি না থাকলে-ও আমার হৃদয় যেনো তোমার জন্যই ধড়ফড় করে, তোমার হাসি, তোমার কথা, তোমার চোখের সুন্দরতা সবকিছুই আমার মনে গেঁথে আছে, কখনো কখনো মনে হয় তুমি আমার কাছে আছো পাশেই আছো আমার কথা শোনো তুমি যেখানেই থাকো, আমি তোমাকে ভুলতে পারি নাহ তোমার স্মৃতির ছোঁয়া ছাড়া এক মুহূর্তও আমি থাকতে পারি নাহ প্রতিদিন তোমাকে ভেবেই দিন শুরু হয়,তোমার কথা ভেবেই রাত শেষ হয়, তোমার ভালোবাসা আমার জীবনের সবচেয়ে বড়ো উপহার, যা আমি কখনো ভুলবো না আমার ভালোবাসা তোমার জন্য কখনো কমবে নাহ বরং প্রতিদিন বাড়তে থাকবে তুমি আমার জীবনের সেই বিশেষ মানুষ যার জন্য আমি সারাজীবন অপেক্ষা করতে চাই তোমার জন্য আমার মন সবসময় খোলা আমার ভালোবাসা চিরকাল তোমার জন্যই থাকবে...!! ️",2025-09-11T10:27:10Z
UgwRbcrefDSnCecj_zp4AaABAg,2025 সালে কে কে এই গান শুনছে❤❤❤,-1,2025 সালে কে কে এই গান শুনছে,2025-08-20T05:12:45Z
UgwI0QV9ZMgM282jTEh4AaABAg,কে কে২০২৫ সালের নবেম্বরের ২৭ তারিখে   গান শুনতে আসছো❤আগের গান গুলো ভালোই লাগে❤❤❤,-1,কে কে২০২৫ সালের নবেম্বরের ২৭ তারিখে গান শুনতে আসছোআগের গান গুলো ভালোই লাগে,2025-11-27T16:29:22Z
UgxaR7SxfGgLmmbfq6R4AaABAg,যত শুনি তত ভালো লাগে ❤,-1,যত শুনি তত ভালো লাগে,2025-07-26T03:36:50Z
UgzYwwP5EC51J2lc8Kp4AaABAg,এগুলো গান শুনতে ভালো লাগে,-1,এগুলো গান শুনতে ভালো লাগে,2025-03-25T03:45:51Z
UgyCQv_h9eA1nA057Dp4AaABAg,সালমান শাহ চিরজীবী হোক,-1,সালমান শাহ চিরজীবী হোক,2025-05-26T17:32:22Z
UgwnathSh3ZqjCuID4t4AaABAg,সেই ছোট্ট বেলা থেকে এই গান শুনতে শুনতে বড়ো হয়েছি কিন্তু আজ পর্যন্ত একবারো আমার কাছে মনে হয়নি যে এই গান পুরাতন হয়েছে,-1,সেই ছোট্ট বেলা থেকে এই গান শুনতে শুনতে বড়ো হয়েছি কিন্তু আজ পর্যন্ত একবারো আমার কাছে মনে হয়নি যে এই গান পুরাতন হয়েছে,2025-10-13T10:08:15Z
UgxcgeIty7f32Mlq4yt4AaABAg,"আমার খুবই পৃয় আমারই ❤ভালোবাসার অর্থ  খুঁজে যেন পাই 
এই গানগুলি ভিতরেই  ❤,",-1,"আমার খুবই পৃয় আমারই ভালোবাসার অর্থ খুঁজে যেন পাই এই গানগুলি ভিতরেই ,",2025-01-04T10:51:24Z
Ugw4TZHBVc2Ttbb8DUl4AaABAg,আমিও শুনি সব সময়,-1,আমিও শুনি সব সময়,2025-08-24T11:26:49Z
UgxXmSU5bnE08yVgjtx4AaABAg,সালমান শাহ লাভ ইউ❤❤❤,-1,সালমান শাহ লাভ ইউ,2025-06-03T23:19:13Z
UgwszM8l8GbNxpFTloh4AaABAg,জনম জনম দরে এই গান গুলো ককনো পুরোনো হবে না জকনি কেও শুনবে হারিয়ে জাবে চুট্টো বেলায় 😢😢😢মিস ইউ সালমানশাহ 😢😢😢😢😢😢😢😢😢😢😢😢😢😢😢😢😢😢😢😢😢,-1,জনম জনম দরে এই গান গুলো ককনো পুরোনো হবে না জকনি কেও শুনবে হারিয়ে জাবে চুট্টো বেলায় মিস ইউ সালমানশাহ,2025-06-27T20:11:14Z
UgxBM3-Pf7oPHMOg0rF4AaABAg,এগুলা গান শুনতে ভালো লাগে,-1,এগুলা গান শুনতে ভালো লাগে,2025-04-09T05:38:05Z
Ugy8D9-5iAmMO9gdv3l4AaABAg,"শালমান শাহ মারা গেছে 26 বছর হইছে, আর আমি ভাবতাম দুই তিন বছর আগে মারা গেছে 😂❤",-1,"শালমান শাহ মারা গেছে 26 বছর হইছে, আর আমি ভাবতাম দুই তিন বছর আগে মারা গেছে",2025-09-10T05:44:11Z
UgyC_V-MdFRVfxusxG94AaABAg,২০২৫সালে কে কে এই গান শুনছে❤❤❤,-1,২০২৫সালে কে কে এই গান শুনছে,2025-05-01T07:46:14Z
UgytL7OqQQjoD6yLmzJ4AaABAg,জ্বলেপুড়ে মরার মাঝে যদি কোনো সুখ থাকে,-1,জ্বলেপুড়ে মরার মাঝে যদি কোনো সুখ থাকে,2025-07-09T06:23:08Z
UgxXBPlXqIN8Tkevv-N4AaABAg,"ভালো থেক,সুখে থেক",-1,"ভালো থেক,সুখে থেক",2025-09-29T10:12:29Z
UgzBgBZ5RbemZyrF3hR4AaABAg,কারা ২০২৫ সালের শেষে এসেও এই গানগুলো শুনেছেন কমেন্ট করে জানাবেন,-1,কারা ২০২৫ সালের শেষে এসেও এই গানগুলো শুনেছেন কমেন্ট করে জানাবেন,2025-09-29T19:27:10Z
Ugw-KpOhu0scN9x8YYp4AaABAg,"🎉অনেক পছন্দের কিছু গান,,সৃতি রেখে গেলাম কেউ লাইক দিলে আবার শুনতে আসবো",-1,"অনেক পছন্দের কিছু গান,,সৃতি রেখে গেলাম কেউ লাইক দিলে আবার শুনতে আসবো",2025-08-06T03:56:49Z
UgwLPBRScqIw6EiMzJx4AaABAg,সালমানসার কেমন বক্ত হলে মানুষ রাত ১টা ৩৪মন খারাপের সময় তার গান শুনে😂,-1,সালমানসার কেমন বক্ত হলে মানুষ রাত ১টা ৩৪মন খারাপের সময় তার গান শুনে,2025-05-28T19:35:04Z
UgxAAcrJk5jOQhmdgxh4AaABAg,আদি যুগের গান🙄,-1,আদি যুগের গান,2023-05-07T05:58:00Z
UgwTHb73f9CoErMM5hh4AaABAg,নাইস অনেক সুন্দর হয়েছে গানটা❤❤❤,-1,নাইস অনেক সুন্দর হয়েছে গানটা,2025-09-01T04:03:28Z
UgzBNcZmkaJxMpi10aF4AaABAg,সে কত সালে মরছে কেউ জানেন,-1,সে কত সালে মরছে কেউ জানেন,2025-06-16T03:44:20Z
Ugy3QO8cpJMmi371j7l4AaABAg,"পূর্বের গানগুলো শুনলে মনটা জুড়ে যায় । কিন্তু , বর্তমান যুগের গানগুলো এতো ভালো লাগেনা ।",-1,"পূর্বের গানগুলো শুনলে মনটা জুড়ে যায় । কিন্তু , বর্তমান যুগের গানগুলো এতো ভালো লাগেনা ।",2025-04-21T06:48:25Z
UgynO0HY8z69PCkeZ_l4AaABAg,যতো বার শুনি অনেক ভালো লাগে গান গুলো ❤❤❤,-1,যতো বার শুনি অনেক ভালো লাগে গান গুলো,2025-11-10T09:15:27Z
UgzupLUou5w5cHFSkgF4AaABAg,"বাহ,,,বাহ,,,,অসাধারণ সুন্দর গান গুলি,, চমৎকার হয়েছে অডিও গান গুলি।।। বার বার শুনতে ইচ্ছা করে, 🌸🌸🌸",-1,"বাহ,,,বাহ,,,,অসাধারণ সুন্দর গান গুলি,, চমৎকার হয়েছে অডিও গান গুলি।।। বার বার শুনতে ইচ্ছা করে,",2025-01-29T18:54:44Z
UgyFBVryKKcjNsWSp0R4AaABAg,এই গানগুলো শুনে আমি মনে করি আমি স্বর্গের উপরে বাস করছি এত সুন্দর গানগুলো,-1,এই গানগুলো শুনে আমি মনে করি আমি স্বর্গের উপরে বাস করছি এত সুন্দর গানগুলো,2025-11-20T02:10:48Z
UgybtOM0udoo6yy8Owd4AaABAg,যতই শ্রেয়া ঘোষাল আলকা ইয়াগ্নিক আশা ভোঁসলে যতই গায়িকা আসুক না কেন আমাদের মিতা চ্যাটার্জি দিদি গান সত্যিই অনন্য গলা ও অসাধারণ ওণার উপরে বাংলা ইন্ডাস্ট্রিতে আর কেউ নেই,-1,যতই শ্রেয়া ঘোষাল আলকা ইয়াগ্নিক আশা ভোঁসলে যতই গায়িকা আসুক না কেন আমাদের মিতা চ্যাটার্জি দিদি গান সত্যিই অনন্য গলা ও অসাধারণ ওণার উপরে বাংলা ইন্ডাস্ট্রিতে আর কেউ নেই,2025-09-28T16:43:52Z
Ugy3lV0rgaZMeJozqNl4AaABAg,"কি অসাধারণ গানের কথা, কি অসাধারণ গানের সুর, কত আন্তরিকতার সাথে গানগুলো গেয়েছেন....সর্বপরী এসব গান মানে শারদ উৎসব, বিয়ে বাড়ি...❤❤",-1,"কি অসাধারণ গানের কথা, কি অসাধারণ গানের সুর, কত আন্তরিকতার সাথে গানগুলো গেয়েছেন....সর্বপরী এসব গান মানে শারদ উৎসব, বিয়ে বাড়ি...",2025-07-25T15:35:15Z
UgyjR1TQGw4v0MCQwyF4AaABAg,আমি যখন এই গানগুলো শুনি পৃথিবীর কোন কষ্ট আমার কাছে থাকে না আমি মনে করি সবচেয়ে বড় সুখী মানুষ নারায়ণ মন্ডল,-1,আমি যখন এই গানগুলো শুনি পৃথিবীর কোন কষ্ট আমার কাছে থাকে না আমি মনে করি সবচেয়ে বড় সুখী মানুষ নারায়ণ মন্ডল,2024-12-27T13:03:09Z
UgydYYPhSPOWkh4dXs94AaABAg,খুব সুন্দর এই গান গুলো কখনই পুরোনো হবে না ❤❤❤❤❤❤❤,-1,খুব সুন্দর এই গান গুলো কখনই পুরোনো হবে না,2025-07-28T12:34:41Z
UgwSwcWfKrwzIUOmf2V4AaABAg,সত্যি গানগুলো শুনে মনভরে গেলো ❤❤❤❤অসাধারণ গেয়েছেন দু জনেই ❤❤❤,-1,সত্যি গানগুলো শুনে মনভরে গেলো অসাধারণ গেয়েছেন দু জনেই,2025-10-08T11:25:02Z
UgxFiLVELj26es1XiJF4AaABAg,খুব সুন্দর লাগলো গান গুলো❤❤❤❤❤❤❤,-1,খুব সুন্দর লাগলো গান গুলো,2024-11-30T05:35:41Z
Ugy30SKE7tslddIh7sd4AaABAg,এই ধরনের গান শুনলে মানুষের মন অনেক শান্ত হয়ে যায়,-1,এই ধরনের গান শুনলে মানুষের মন অনেক শান্ত হয়ে যায়,2025-06-02T15:38:42Z
UgynBzjZHDcjG1NdFi14AaABAg,আইনা মন ভাংগা আইনা ❤❤মন ❤❤❤❤,-1,আইনা মন ভাংগা আইনা মন,2025-12-15T14:43:25Z
Ugxb5mgpAub-emkjiC54AaABAg,৫/৪/৪/২/১/ ভালো লাগে ❤❤❤🥰🥰🥰💔 জুবিন 💔💔💔💔💔😭😭,-1,৫/৪/৪/২/১/ ভালো লাগে জুবিন,2025-10-15T02:14:15Z
UgyEE65N79vef5CYQbN4AaABAg,জুবিন গার্গ এর সব গান গুলোই তো হিট ভাই,-1,জুবিন গার্গ এর সব গান গুলোই তো হিট ভাই,2025-11-21T19:19:44Z
UgwLyCwIFHNhQtzychN4AaABAg,আমার সব থেকে আয়না মন ভাঙ্গা আয়না গানটা ভাল লেগেছে,-1,আমার সব থেকে আয়না মন ভাঙ্গা আয়না গানটা ভাল লেগেছে,2025-11-15T09:22:12Z
UgzO3Pqk5I31mTqCKZx4AaABAg,এছাড়াও আরো অনেক গান রয়েছে❤,-1,এছাড়াও আরো অনেক গান রয়েছে,2025-12-16T04:31:12Z
UgzLKZwBcdaSa-vYAOF4AaABAg,আমার কাছে ১নাম্বার গান ভালো লাগে নি,-1,আমার কাছে ১নাম্বার গান ভালো লাগে নি,2025-12-05T10:20:56Z
UgyQntHcOi3qW8E1TXN4AaABAg,মায়াবিনী আমার প্রিয় গান,-1,মায়াবিনী আমার প্রিয় গান,2025-10-18T05:17:07Z
UgwwSk2NR6iNeIidnVV4AaABAg,সব গানই  ভাল  ❤❤❤😢😢😢,-1,সব গানই ভাল,2025-11-09T16:57:08Z
UgxyTSNV-Fgtcru2EEV4AaABAg,আমার প্রিয় গানটি আয়না মন ভাঙা আয়না ❤❤,-1,আমার প্রিয় গানটি আয়না মন ভাঙা আয়না,2025-11-21T15:24:10Z
UgyaOyoYmqLtYxmPHS54AaABAg,ওনার সব গান বেস্ট 😊,-1,ওনার সব গান বেস্ট,2025-11-08T09:43:42Z
UgyAOCwe8KkBViZELAV4AaABAg,বাংলাদেশ বরিশাল সদর থানা সোহাগ ভাই 🙏👍,-1,বাংলাদেশ বরিশাল সদর থানা সোহাগ ভাই,2025-11-17T17:42:48Z
UgxpE_G6XFqUgCnvKjV4AaABAg,প্রথম লিস্টে রয়েছে চোখের জলে ভাসিয়ে দিলাম,-1,প্রথম লিস্টে রয়েছে চোখের জলে ভাসিয়ে দিলাম,2025-10-12T22:21:17Z
UgzrMkH9af-pVDnB6aF4AaABAg,চোখের জলে ভাসিয়ে দিলাম মনের ঠিকানায়,-1,চোখের জলে ভাসিয়ে দিলাম মনের ঠিকানায়,2025-11-21T12:30:40Z
Ugx_E16v22bL6c1LEaB4AaABAg,জয়ী জুবিন দা,-1,জয়ী জুবিন দা,2025-11-20T14:47:12Z
Ugz7i2Cuv69W_QybfJh4AaABAg,মায়াবিনী সবচেয়ে ভালো❤❤❤,-1,মায়াবিনী সবচেয়ে ভালো,2025-10-26T15:25:45Z
UgxyxaaauZHPeDoT_wt4AaABAg,মাই ফেভারিট অরিজিৎ সিং❤❤,-1,মাই ফেভারিট অরিজিৎ সিং,2025-11-12T20:39:12Z
UgzrTWXziRR9uVhx46B4AaABAg,দেবের গান নিয়ে জুবিনের গান করছে জাস্ট একটাই জুবিনের গান,-1,দেবের গান নিয়ে জুবিনের গান করছে জাস্ট একটাই জুবিনের গান,2025-12-11T02:55:26Z
