id,text,label,clean_text,reference_time
Ugyys--cWWUBoaSfotl4AaABAg,"মানুষ সব ভুলতে পারলেও অতীত ভুলতে পারে না,,😓😊 তবে  আমারটা একটু বেশিই ভয়ংকর 🙂😓",1,"মানুষ সব ভুলতে পারলেও অতীত ভুলতে পারে না,, তবে আমারটা একটু বেশিই ভয়ংকর",2025-07-06T03:57:39Z
Ugz1wsAZa2Z7GeLk4bF4AaABAg,মনের মতো গান গুলো শুনে মনের গহীন হতে আন্তরিক ভালোবাসা.....,1,মনের মতো গান গুলো শুনে মনের গহীন হতে আন্তরিক ভালোবাসা.....,2025-07-04T20:34:20Z
UgwdZBjLAS8YBkNHj6p4AaABAg,ডাউনলোড অপশন চালু নেই কেন😢,0,ডাউনলোড অপশন চালু নেই কেন,2025-07-22T04:16:35Z
Ugxhy9zW7R4wJNeFYp54AaABAg,হারিয়ে ফেলেছি মিথ্যা মায়ায় পড়ে জীবনের সব আনন্দ😢😢😢😢😢😅😅😅😅😊,1,হারিয়ে ফেলেছি মিথ্যা মায়ায় পড়ে জীবনের সব আনন্দ,2025-07-07T18:16:42Z
Ugw_zmZGFpiGRgXsJBl4AaABAg,অসাধারণ গান কলিজায় লাগে কেমনে অন্ধকার কবরে থাকবো😢😢,1,অসাধারণ গান কলিজায় লাগে কেমনে অন্ধকার কবরে থাকবো,2025-07-16T10:19:06Z
UgwBPo4Vly0fu-Q37Hh4AaABAg,আসসালামু আলাইকুম ভাইয়া আমি তো আপনার সঙ্গে কথা বলতে চাই,0,আসসালামু আলাইকুম ভাইয়া আমি তো আপনার সঙ্গে কথা বলতে চাই,2025-07-05T05:56:34Z
UgyyfeMMEV-8j3WieiJ4AaABAg,গানের সাথে বাস্তবতার মিল আছে ১০০ ভাগ 😢😢😢😢 গান টা ভালো করে শুনলে বুঝতে পারলাম,0,গানের সাথে বাস্তবতার মিল আছে ১০০ ভাগ গান টা ভালো করে শুনলে বুঝতে পারলাম,2025-07-03T20:13:16Z
Ugzjker0A4BLzFX7os94AaABAg,ডাউনলোড অপশন খুলে দিলে কি হত এত সুন্দর গানটা ডাউনলোড দিতে পারলাম না 😅😅😢😢😢,1,ডাউনলোড অপশন খুলে দিলে কি হত এত সুন্দর গানটা ডাউনলোড দিতে পারলাম না,2025-07-10T16:45:24Z
Ugx39vayt3xwFF416cV4AaABAg,শিল্পীর নাম কি একটু জানাবেন,1,শিল্পীর নাম কি একটু জানাবেন,2025-12-13T10:54:26Z
Ugy6f24X-sczBMzxzNV4AaABAg,"বাঃ চমৎকার মনোমুগ্ধকর গান সোনালেন,",1,"বাঃ চমৎকার মনোমুগ্ধকর গান সোনালেন,",2025-07-05T02:19:37Z
UgzZBWYawne9dNsYA0F4AaABAg,কমেন্ট করে গেলাম কেউ নোটিফিকেশন পাঠাইলে আবার আসবো🥹,1,কমেন্ট করে গেলাম কেউ নোটিফিকেশন পাঠাইলে আবার আসবো,2025-08-29T14:13:12Z
UgytzcJiCTcvZos8liZ4AaABAg,"❤...ইতিহাস সাকী ...💔🌿
😊 onek sundor song....♥️",1,...ইতিহাস সাকী ... onek sundor song....️,2025-07-05T18:49:40Z
UgzmMwOp6drd7R9DKed4AaABAg,এই গানগুলো আমাদেরও অন্তরের গান,1,এই গানগুলো আমাদেরও অন্তরের গান,2025-06-27T02:23:21Z
UgxCr8l3958CcHhcUpx4AaABAg,এই গান শুনে আমার আগের কথা মনে পড়ে ছোট বেলার কথা মনে পড়ে ভাই,1,এই গান শুনে আমার আগের কথা মনে পড়ে ছোট বেলার কথা মনে পড়ে ভাই,2025-06-27T11:17:05Z
UgynF_vPhq8aalsY_314AaABAg,-আহা গান গুলো অনেক ভালো লাগে ❤🥰,1,-আহা গান গুলো অনেক ভালো লাগে,2025-06-30T06:50:41Z
UgwGmxEHok81IX7TKo94AaABAg,অপূর্ব সুন্দর একটি গান মধুর কন্ঠ❤😢😢😢😢😢😢😢😢😢😢😢,1,অপূর্ব সুন্দর একটি গান মধুর কন্ঠ,2025-07-06T05:49:05Z
UgzTYon4fu08gdjEeVl4AaABAg,গান গুলা সেই❤❤,1,গান গুলা সেই,2025-07-10T18:13:44Z
UgyGKftEbtHJPQiGmTp4AaABAg,"একটা সময়ে এসমস্ত গান শুনে হৃদয় মন সবকিছুই নিজের ভিতরে নিজে মানুষ হারিয়ে যেত। এখন কলির জোগ,মানুষ এগুলি বেশি শোনে না। ফেসবুক ঠিকটক এগুলো নিয়ে মানুষ ব্যস্ত",1,"একটা সময়ে এসমস্ত গান শুনে হৃদয় মন সবকিছুই নিজের ভিতরে নিজে মানুষ হারিয়ে যেত। এখন কলির জোগ,মানুষ এগুলি বেশি শোনে না। ফেসবুক ঠিকটক এগুলো নিয়ে মানুষ ব্যস্ত",2025-07-03T09:20:34Z
Ugxpg_jXbv5Y2N7pDod4AaABAg,যতই শুনি তত ভালো লাগে,0,যতই শুনি তত ভালো লাগে,2025-06-28T05:59:00Z
UgzHaPVICmYbXPGBgxR4AaABAg,আপনার গান অনেক সুন্দর,0,আপনার গান অনেক সুন্দর,2025-07-19T02:55:20Z
Ugw73hyyA_pHaj9d06x4AaABAg,এ গান অমৃতসমান।,1,এ গান অমৃতসমান।,2025-06-27T17:20:36Z
UgwVWSk3mCDeSP9Qy_14AaABAg,"একটা সম্পর্ক শুরুর আগমুহূর্তে কি অসাধারণ তাই না?কত মনোযোগ দিয়ে কথার সংখ্যা বাড়াতে থাকে দুজন মানুষ । তার চেয়েও বেশি সুন্দর হয় সম্পর্ক শুরুর মুহূর্তগুলো। মনে হয় এই একটা মানুষ যাকে, আমার সবটুকু বলে দিতে মন চায়।
শুরুর দিকগুলোতে অনেক সুন্দর সুন্দর স্মৃতি জন্ম নেয়। দুজন মিলে একে অপরকে নিয়ে কত স্বপ্ন দেখে ফেলে মানুষ। রাগ করে দু চার দিন কথা না বলে থাকা। তারপর আবার সব ঠিক হয়ে যাওয়ার পরের মুহূর্তটা। কি অদ্ভুত রকমের সুন্দর লাগে সবকিছু। অনুভব হয় আমার একটা ব্যক্তিগত মানুষ আছে।
তারপর যখন সম্পর্কের বয়স বাড়ে হঠাৎ সব কিছু কেমন যেন এলোমেলো হয়ে যায়। কোন একজনের কথা ফুরিয়ে যায়। ধীরে ধীরে ব্যস্ততা অজুহাত কথা কম হতে থাকে। তারপর শুরু হয়ে যায় কথার আঘাতের পর্ব। আচমকা হঠাৎ শুরুর দিন গুলো হারিয়ে যায়।
মানুষগুলো কি অদ্ভুত। কাছে আসার জন্য কত বাহানা, কত অনুরোধ, তারপর যখন কাছে আসার অনুমতি পায় তাদের আগ্রহ কমে যায়। একটা সময় পর দূরে যাওয়ার জন্য ছটফট করতে থাকে। কি ভয়ংকর ব্যাপার। সত্যি দুনিয়াতে মানুষ আছে ভয়ঙ্কর কিছু নাই........??",1,"একটা সম্পর্ক শুরুর আগমুহূর্তে কি অসাধারণ তাই না?কত মনোযোগ দিয়ে কথার সংখ্যা বাড়াতে থাকে দুজন মানুষ । তার চেয়েও বেশি সুন্দর হয় সম্পর্ক শুরুর মুহূর্তগুলো। মনে হয় এই একটা মানুষ যাকে, আমার সবটুকু বলে দিতে মন চায়। শুরুর দিকগুলোতে অনেক সুন্দর সুন্দর স্মৃতি জন্ম নেয়। দুজন মিলে একে অপরকে নিয়ে কত স্বপ্ন দেখে ফেলে মানুষ। রাগ করে দু চার দিন কথা না বলে থাকা। তারপর আবার সব ঠিক হয়ে যাওয়ার পরের মুহূর্তটা। কি অদ্ভুত রকমের সুন্দর লাগে সবকিছু। অনুভব হয় আমার একটা ব্যক্তিগত মানুষ আছে। তারপর যখন সম্পর্কের বয়স বাড়ে হঠাৎ সব কিছু কেমন যেন এলোমেলো হয়ে যায়। কোন একজনের কথা ফুরিয়ে যায়। ধীরে ধীরে ব্যস্ততা অজুহাত কথা কম হতে থাকে। তারপর শুরু হয়ে যায় কথার আঘাতের পর্ব। আচমকা হঠাৎ শুরুর দিন গুলো হারিয়ে যায়। মানুষগুলো কি অদ্ভুত। কাছে আসার জন্য কত বাহানা, কত অনুরোধ, তারপর যখন কাছে আসার অনুমতি পায় তাদের আগ্রহ কমে যায়। একটা সময় পর দূরে যাওয়ার জন্য ছটফট করতে থাকে। কি ভয়ংকর ব্যাপার। সত্যি দুনিয়াতে মানুষ আছে ভয়ঙ্কর কিছু নাই........??",2025-06-27T08:35:02Z
UgwoYjAAstD_tpNT6V54AaABAg,সায়া ডালাম ছাকিত,1,সায়া ডালাম ছাকিত,2025-06-27T05:57:13Z
UgzbtRQUO5hoIjv4xVJ4AaABAg,আমি পছন্দ করি,0,আমি পছন্দ করি,2025-06-26T21:25:25Z
UgyEVaCW9trCTNmNjd94AaABAg,খুব সুন্দর গান ভালো লাগলো সুনে ❤,1,খুব সুন্দর গান ভালো লাগলো সুনে,2025-07-09T07:01:35Z
UgzGis-t-7aIajsvcyh4AaABAg,সেই রকম গান ❤😢,1,সেই রকম গান,2025-06-28T04:58:45Z
UgwbI1BvFG9UqfNMV7t4AaABAg,আমার অন্ত রের গান ❤❤❤❤❤,1,আমার অন্ত রের গান,2025-06-26T15:06:43Z
UgzSjkLEdSapF3iL4HN4AaABAg,বড়ো  ভাই আপনার গানগুলো সুন্দর হয়েছে এবং আমার জীবনের সাথে অনেক অংশ মিল রয়েছে তাই সব সময় আল্লাহর কাছে প্রার্থনা করি যেন আমার কষ্ট আল্লাহ তাআলা কবুল করে ❤❤❤❤,1,বড়ো ভাই আপনার গানগুলো সুন্দর হয়েছে এবং আমার জীবনের সাথে অনেক অংশ মিল রয়েছে তাই সব সময় আল্লাহর কাছে প্রার্থনা করি যেন আমার কষ্ট আল্লাহ তাআলা কবুল করে,2025-06-24T15:25:08Z
Ugz_pYuInDLhi-Lzi5J4AaABAg,"খুব সুন্দর গান গুলো 😊
ধন্যবাদ সব গুলো ডাউনলোড দিয়েছি",0,খুব সুন্দর গান গুলো ধন্যবাদ সব গুলো ডাউনলোড দিয়েছি,2025-07-05T15:27:43Z
UgyNhZfivodAiulDsxp4AaABAg,জানি একদিন চলে যাবো। কিন্তু স্মৃতি হিসেবে আমার কমেন্ট রেখে দিলাম। যদি কখনো কারো মনে হয় তবে কমেন্টে লাইক দিবেন তাহলে আমি নোটিফিকেশন পাবো এবং  দুইজনে মিলে আবারও গানটি  শুনতে আসবো। ❤️🇧🇩❤️,1,জানি একদিন চলে যাবো। কিন্তু স্মৃতি হিসেবে আমার কমেন্ট রেখে দিলাম। যদি কখনো কারো মনে হয় তবে কমেন্টে লাইক দিবেন তাহলে আমি নোটিফিকেশন পাবো এবং দুইজনে মিলে আবারও গানটি শুনতে আসবো। ️️,2025-07-24T08:36:27Z
UgxSXbvoimM4H1HYujl4AaABAg,এই গান গুলো মরনের কথা স্বরন করে দেয় 😢😢 এবং মৃত্যুই সবচেয়ে নিশ্চিত সত্যি।,1,এই গান গুলো মরনের কথা স্বরন করে দেয় এবং মৃত্যুই সবচেয়ে নিশ্চিত সত্যি।,2025-07-30T17:17:50Z
UgzObdZbQhPSqeWxjCJ4AaABAg,ভালোবাসা অভিরাম বড়ো ভাই..?,1,ভালোবাসা অভিরাম বড়ো ভাই..?,2025-06-24T08:38:28Z
Ugx3P-lqHGbu0jwTXpZ4AaABAg,এ-ই গান গুলো হছে আসল গান ইকবাল ডিজিটাল মাইক নরসিংদী,0,এ-ই গান গুলো হছে আসল গান ইকবাল ডিজিটাল মাইক নরসিংদী,2025-06-25T16:55:08Z
UgyASwq7EOLToBZPNpx4AaABAg,গানগুলো আসলেই ভালো হইছে শুনার মত গান,0,গানগুলো আসলেই ভালো হইছে শুনার মত গান,2025-06-25T05:00:40Z
Ugzv9nqsdY5e4Udrk7Z4AaABAg,❤❤ অনেকদিন পরে মনের মতন একখানা গান শুনলাম পরানটা জুড়িয়ে গেল ❤❤,1,অনেকদিন পরে মনের মতন একখানা গান শুনলাম পরানটা জুড়িয়ে গেল,2025-10-30T18:12:43Z
Ugx3rwb6XuvTAxunj4t4AaABAg,❤কেমন আছো সবাই বন্দু  রা❤😂😂,1,কেমন আছো সবাই বন্দু রা,2025-07-08T06:24:43Z
UgxoGjHhIpwQKgW83lZ4AaABAg,গান টি শুনে মন জুরিয়ে গেলো ধন্যবাদ ❤ i ❤ you🌺🌺🌺🌺,1,গান টি শুনে মন জুরিয়ে গেলো ধন্যবাদ i you,2025-07-10T06:57:38Z
UgxgmGkfx4U4L7G0C1t4AaABAg,"ভেবেছিলাম তুমি আসবে!
ভোরের কুয়াশায় হাটবো
তোমার হাতটি ধরে...
কিন্তু তুমি এলেনা।

ভেবে ছিলাম পড়ন্ত বিকেলে হয়তো
গোধূলি লগ্নে তোমার দেখা পাবো! 
তখনো তুমি এলেনা

ভেবে ছিলাম সন্ধ্যা তারাদের মাঝে
তোমায় খুঁজে পাবো!
অবশেষে খুজে পেলাম ঠিকই,
কিন্তু তুমি ছিলো ঐ দূর আকাশে ।
আমার দিকে ফিরেও তাকালেনা।

ভাবনা আমার ভাবনাই রয়ে গেলো...
বাস্তব আর হলোনা......!",1,"ভেবেছিলাম তুমি আসবে! ভোরের কুয়াশায় হাটবো তোমার হাতটি ধরে... কিন্তু তুমি এলেনা। ভেবে ছিলাম পড়ন্ত বিকেলে হয়তো গোধূলি লগ্নে তোমার দেখা পাবো! তখনো তুমি এলেনা ভেবে ছিলাম সন্ধ্যা তারাদের মাঝে তোমায় খুঁজে পাবো! অবশেষে খুজে পেলাম ঠিকই, কিন্তু তুমি ছিলো ঐ দূর আকাশে । আমার দিকে ফিরেও তাকালেনা। ভাবনা আমার ভাবনাই রয়ে গেলো... বাস্তব আর হলোনা......!",2025-06-27T16:47:59Z
Ugzkx0-8lLUOR_DWlOd4AaABAg,আমার মনের মত গানগুলো দেওয়ার জন্য আপনাকে অনেক ধন্যবাদ থ্যাংক ইউ ভাইয়া অনেক দোয়া রইল আপনার জন্য,1,আমার মনের মত গানগুলো দেওয়ার জন্য আপনাকে অনেক ধন্যবাদ থ্যাংক ইউ ভাইয়া অনেক দোয়া রইল আপনার জন্য,2025-06-25T07:47:16Z
Ugy2XevOq-01y421NcJ4AaABAg,সব মানুষ  আমাকে ভুল  বুঝতে  থাকে  তাই মনে র  দুঃখ  মনে রইলো কেউ  বুঝতে পারে   না😊😂😢,1,সব মানুষ আমাকে ভুল বুঝতে থাকে তাই মনে র দুঃখ মনে রইলো কেউ বুঝতে পারে না,2025-07-21T19:12:35Z
UgznfhR_cchDxujsK7B4AaABAg,"গান গুলা শুনলে মনটা জানি কোথায় হারিয়ে যায় 
❤❤❤❤",1,গান গুলা শুনলে মনটা জানি কোথায় হারিয়ে যায়,2025-07-04T04:17:13Z
Ugx_9n0dLmoPnKeLsNt4AaABAg,অনেক সুন্দর গান বড় ভাই আমার ❤❤❤❤❤,1,অনেক সুন্দর গান বড় ভাই আমার,2025-06-29T10:51:07Z
UgyJBWzAyHSurlmSGix4AaABAg,হরে কৃষ্ণ 🙏🏻🙏🏻,1,হরে কৃষ্ণ 🏻🏻,2025-06-26T06:51:50Z
UgxRhgtu5rwduyLJuHt4AaABAg,খুব সুন্দর গান গুলো বন্ধ ❤❤,1,খুব সুন্দর গান গুলো বন্ধ,2025-07-02T06:18:07Z
UgyWyLC3BITT6cYj1BF4AaABAg,"আমি আমার বাবাকে শিল্পী বানাতে চাই,, 😊 কিন্তু আমি তেমন কোনো মানুষ পাচ্ছি বা কোথায় যোগাযোগ করবো বুঝতে পারছি না,,কেউ যদি পারো,, একটু সাহায্য করো,, প্লিজ কি করতে পারি বলে যাবেন🙏🙏😊😊",1,"আমি আমার বাবাকে শিল্পী বানাতে চাই,, কিন্তু আমি তেমন কোনো মানুষ পাচ্ছি বা কোথায় যোগাযোগ করবো বুঝতে পারছি না,,কেউ যদি পারো,, একটু সাহায্য করো,, প্লিজ কি করতে পারি বলে যাবেন",2025-07-06T05:14:36Z
UgwtbSjRb61nCOpooQJ4AaABAg,"ভেবেছিলাম তুমি আসবে!
ভোরের কুয়াশায় হাটবো
তোমার হাতটি ধরে...
কিন্তু তুমি এলেনা।

ভেবে ছিলাম পড়ন্ত বিকেলে হয়তো
গোধূলি লগ্নে তোমার দেখা পাবো! 
তখনো তুমি এলেনা

ভেবে ছিলাম সন্ধ্যা তারাদের মাঝে
তোমায় খুঁজে পাবো!
অবশেষে খুজে পেলাম ঠিকই,
কিন্তু তুমি ছিলো ঐ দূর আকাশে ।
আমার দিকে ফিরেও তাকালেনা।

ভাবনা আমার ভাবনাই রয়ে গেলো...
বাস্তব আর হলোনা......! 0:48",1,"ভেবেছিলাম তুমি আসবে! ভোরের কুয়াশায় হাটবো তোমার হাতটি ধরে... কিন্তু তুমি এলেনা। ভেবে ছিলাম পড়ন্ত বিকেলে হয়তো গোধূলি লগ্নে তোমার দেখা পাবো! তখনো তুমি এলেনা ভেবে ছিলাম সন্ধ্যা তারাদের মাঝে তোমায় খুঁজে পাবো! অবশেষে খুজে পেলাম ঠিকই, কিন্তু তুমি ছিলো ঐ দূর আকাশে । আমার দিকে ফিরেও তাকালেনা। ভাবনা আমার ভাবনাই রয়ে গেলো... বাস্তব আর হলোনা......! 0:48",2025-06-27T16:48:13Z
Ugw2YOY8H1jn4GXz0qx4AaABAg,সুপার গান গুলো,0,সুপার গান গুলো,2025-08-26T14:19:21Z
Ugxij-Em78WL8ReEFER4AaABAg,এই গানটা আমার ভিশন পছন্দের একটা গান❤❤❤❤❤,1,এই গানটা আমার ভিশন পছন্দের একটা গান,2025-09-07T03:58:00Z
UgwXD7nsTQnSXUKmsk54AaABAg,"মনটা ভরে গেল, গান শুনে",1,"মনটা ভরে গেল, গান শুনে",2025-08-05T04:44:18Z
UgxPymfwwknnsUytEDt4AaABAg,আসলে সেই লাগছে ❤❤❤❤,1,আসলে সেই লাগছে,2025-10-19T04:42:14Z
Ugzgx4LAtC0gpsiqbBF4AaABAg,অনেক পছন্দের গান আমার ❤❤❤❤,0,অনেক পছন্দের গান আমার,2025-10-10T13:13:36Z
UgzUZuDA6KBSautqgzl4AaABAg,ভাই খুব সুন্দর গান,1,ভাই খুব সুন্দর গান,2025-12-13T01:52:13Z
Ugw1CSXLsqr2jKe1DWh4AaABAg,খুব সুন্দর গান খুব ভালো লাগে,0,খুব সুন্দর গান খুব ভালো লাগে,2025-06-25T10:02:41Z
Ugw4xXIK19Rc3smQLYR4AaABAg,নাইস গান গুলো সত্যিই অনেক সুন্দর,1,নাইস গান গুলো সত্যিই অনেক সুন্দর,2025-07-01T11:06:28Z
Ugz54feTfQ4S00QLMw94AaABAg,অনেক সুন্দর গান ভাই  কলিজায় লাগছে❤❤,1,অনেক সুন্দর গান ভাই কলিজায় লাগছে,2025-07-10T17:58:50Z
Ugx0CvQ0QakLzfaR2_B4AaABAg,ভাই গান গুলো  কলিজায় লাগছে❤❤❤❤,1,ভাই গান গুলো কলিজায় লাগছে,2025-08-12T14:34:25Z
UgxLhcOXn-571DRw1ex4AaABAg,অনেক সুন্দর গান গুলো ভাইয়া 👌👌👌,0,অনেক সুন্দর গান গুলো ভাইয়া,2025-07-08T17:00:48Z
UgxUkD4ueUlcAcj4bQ94AaABAg,অসাধারণ গানটা মনে হলো,1,অসাধারণ গানটা মনে হলো,2025-09-03T04:42:51Z
Ugzbj8BTbhZJqHJO6gt4AaABAg,আমার জীবনে এর  লগে মিলে আছে এই গানটা,1,আমার জীবনে এর লগে মিলে আছে এই গানটা,2025-07-04T08:44:19Z
Ugx1ZyUxXRJNQ9eBpSx4AaABAg,ভালো লাগলো গান গুলো,0,ভালো লাগলো গান গুলো,2025-07-07T13:54:37Z
UgwnV2hSkJRl644YfEF4AaABAg,মন থেকে বলছি এ গান গুলো খুব সুন্দর লাগে,1,মন থেকে বলছি এ গান গুলো খুব সুন্দর লাগে,2025-07-10T12:42:42Z
Ugy5jL2HBJ1STEl3dV94AaABAg,অনেক সুন্দর গান শুনতে শুধু। মন চাই,1,অনেক সুন্দর গান শুনতে শুধু। মন চাই,2025-08-14T11:58:12Z
