id,text,label,clean_text,reference_time
UgxGYLMvh9k1nPWvcwt4AaABAg,অার কখনোই অাসবেনা সেই সুন্দর ছবিগুলো  যা দেখার জন্য সবসময় মুখীয়ে থাকতাম। অামার পছন্দের নায়কা ছিল শাবনুর।,-1,অার কখনোই অাসবেনা সেই সুন্দর ছবিগুলো যা দেখার জন্য সবসময় মুখীয়ে থাকতাম। অামার পছন্দের নায়কা ছিল শাবনুর।,2020-01-25T12:57:20Z
UgwM3SkuOFHlb-HOg1V4AaABAg,অনেক ভালো লাগলো ২০৪০ সালের জন্য কমেন্ট করে গেলাম যে আমাদের  কাছে গান কতো প্রিয়  ছিলো❤️❤️❤️,-1,অনেক ভালো লাগলো ২০৪০ সালের জন্য কমেন্ট করে গেলাম যে আমাদের কাছে গান কতো প্রিয় ছিলো️️️,2022-05-26T15:17:21Z
UgyMCGju-9ekGzGW5r94AaABAg,"সত্যি এন্ড্রু কিশোর এর কন্ঠ এত সুন্দর যে কি বলবো। 
মনে হয় বার বার এই গানটাই শুনি। এন্ড্রু কিশোর এর কন্ঠ শুনলে মনটা ভরে যায়। 🥰🥰🥰🥰🥰❤️❤️❤️❤️",-1,সত্যি এন্ড্রু কিশোর এর কন্ঠ এত সুন্দর যে কি বলবো। মনে হয় বার বার এই গানটাই শুনি। এন্ড্রু কিশোর এর কন্ঠ শুনলে মনটা ভরে যায়। ️️️️,2022-02-08T06:12:15Z
Ugx74QvwgUQqaHa-pW14AaABAg,শাবনূর একটি ইতিহাস এর নাম ❤️,-1,শাবনূর একটি ইতিহাস এর নাম ️,2021-11-29T19:26:37Z
Ugyq_Nb8tgIw7MOBt4B4AaABAg,আমাদের কক্সবাজারেরর সিনারি যেমন সু্ন্দর তার চেয়ে বেশি সুন্দর গান।,-1,আমাদের কক্সবাজারেরর সিনারি যেমন সু্ন্দর তার চেয়ে বেশি সুন্দর গান।,2020-03-23T08:46:17Z
UgzJz_1-9TJPVS_v_mp4AaABAg,কতটা ভালোবাসা থাকলে মানুষ এভাবে সেই মানুষ টাকে নিয়ে ভাবতপ পারে,-1,কতটা ভালোবাসা থাকলে মানুষ এভাবে সেই মানুষ টাকে নিয়ে ভাবতপ পারে,2025-02-20T04:45:53Z
UgwTVHWFeuGF12lDUkZ4AaABAg,মন থেকে কাউকে ভালোবাসলে তার রুপের এমন বর্ণনা দেওয়া সম্ভব,-1,মন থেকে কাউকে ভালোবাসলে তার রুপের এমন বর্ণনা দেওয়া সম্ভব,2025-05-08T14:58:10Z
Ugwv89-yecbT5pPGYZt4AaABAg,শাবনুর জীবন্ত কিংবদন্তি। ইতিহাসের সেরা অভিনেত্রী,-1,শাবনুর জীবন্ত কিংবদন্তি। ইতিহাসের সেরা অভিনেত্রী,2023-08-02T19:32:45Z
UgyyKduwqHVKh37qvUB4AaABAg,শাকিব সবার সেরা আগের গান গুলোতে তার অসাধারণ অভিনয় যা এখনো ভাললাগে আগামী দিনেও দর্শক দের ভালো লাগবে।,-1,শাকিব সবার সেরা আগের গান গুলোতে তার অসাধারণ অভিনয় যা এখনো ভাললাগে আগামী দিনেও দর্শক দের ভালো লাগবে।,2021-08-12T06:45:11Z
UgwwDxMFi0fq7v4zagx4AaABAg,"এই আগের গানগুলোর কাছে এখনকার গানগুলো ধারের কাছে যেতে পারবে মা,,জিনিয়াস বুলবুল সাহেব এবং কিশোর দা,,,",-1,"এই আগের গানগুলোর কাছে এখনকার গানগুলো ধারের কাছে যেতে পারবে মা,,জিনিয়াস বুলবুল সাহেব এবং কিশোর দা,,,",2025-11-28T08:29:04Z
UgwG9m6iY_2I-Ihmbkh4AaABAg,ধন্যবাদ আহমেদ ইমতিয়াজ বুলবুল করে যার প্রতিটি গানই সেরা।একটা প্রেমিক মন ছিলো।,-1,ধন্যবাদ আহমেদ ইমতিয়াজ বুলবুল করে যার প্রতিটি গানই সেরা।একটা প্রেমিক মন ছিলো।,2025-09-18T08:18:59Z
UgwvdUcUXMXNLieqB414AaABAg,কতই না সুন্ধর ছিলো আগের দিন গুলি যখন বিটিভি পর্দায় এই গান গুলা শুনতাম রূপালী পর্দায় দেখতাম মিস করি আগের দিন গুলি 🩵🩷,-1,কতই না সুন্ধর ছিলো আগের দিন গুলি যখন বিটিভি পর্দায় এই গান গুলা শুনতাম রূপালী পর্দায় দেখতাম মিস করি আগের দিন গুলি,2025-01-21T11:35:51Z
Ugw4BE5QIteBgAm7nAF4AaABAg,সাকিব খান যে ভাবে তাকিয়ে আছে আমার নেশা লেগে গেছে,-1,সাকিব খান যে ভাবে তাকিয়ে আছে আমার নেশা লেগে গেছে,2025-05-20T04:26:03Z
UgyGb3387ABi_NQyaMV4AaABAg,কি গানের কথা জাষ্ট অসাধারণ  ২০০৭ সালে রেডিও তে শুনেছি কতবার,-1,কি গানের কথা জাষ্ট অসাধারণ ২০০৭ সালে রেডিও তে শুনেছি কতবার,2025-12-13T22:49:07Z
UgywRVpi-b8djm5DsTF4AaABAg,2025 এ কে কে দেখছো? ❤,-1,2025 এ কে কে দেখছো?,2025-09-17T16:01:48Z
Ugz5oXyQmswgyX0An8J4AaABAg,গানটা শুনলে একটা অন্য রকমের অনুভূতি চলে আসে,-1,গানটা শুনলে একটা অন্য রকমের অনুভূতি চলে আসে,2025-11-11T06:22:44Z
UgyDbvLL6wMF_L5ZnOJ4AaABAg,"শাকিব খানকে,মেগা স্টার বানানোর মুূল কারিগর,শাবনূর আন্টি🤩",-1,"শাকিব খানকে,মেগা স্টার বানানোর মুূল কারিগর,শাবনূর আন্টি",2025-07-03T20:04:06Z
Ugx0Qpsu-3nygQOP_K94AaABAg,"১৩ এপ্রিল ২০২৫, 
আজ একটা স্মৃতি রেখে গেলাম, এই গান যতদিন থাকবে আজীবন আমার এই মেসেজ দেখে যাবে ❤❤",-1,"১৩ এপ্রিল ২০২৫, আজ একটা স্মৃতি রেখে গেলাম, এই গান যতদিন থাকবে আজীবন আমার এই মেসেজ দেখে যাবে",2025-04-13T07:01:49Z
UgwUFDJXh_FD72QJ5rN4AaABAg,"এটা গান নয়, যেন ১৮ টি কোটি বাঙ্গালীর আবেগ। চলে গেলেন বাংলার সংগীত কিং কিশোর দা। এমন গায়ক কখনো জন্ম নেবেনা বাংলার জমিনে।",-1,"এটা গান নয়, যেন ১৮ টি কোটি বাঙ্গালীর আবেগ। চলে গেলেন বাংলার সংগীত কিং কিশোর দা। এমন গায়ক কখনো জন্ম নেবেনা বাংলার জমিনে।",2020-08-22T04:28:56Z
Ugzqa_kGlgPRd-hrYWt4AaABAg,ভই আভিনেতা হিসাবে শাহরূখান আর অভিনেত্রী হিসাবে শাবনূর।  এই দুইজন বিশ্বসেরা। সেরাদের সেরা,-1,ভই আভিনেতা হিসাবে শাহরূখান আর অভিনেত্রী হিসাবে শাবনূর। এই দুইজন বিশ্বসেরা। সেরাদের সেরা,2023-10-15T19:52:24Z
UgzrjRZ0T7YKvWnjpGR4AaABAg,এসব গান যারা সার্চ করে শুনে তাদের রুচির প্রশংসা করে গেলাম,-1,এসব গান যারা সার্চ করে শুনে তাদের রুচির প্রশংসা করে গেলাম,2025-08-03T09:08:02Z
UgxKqBuzyIfjUnfDoot4AaABAg,"কি একটা অন্যরকম অভিনয় করছে শাকিব খান আর শাবনূর ,এক্কেবারে মাইলফলক অভিনয়।",-1,"কি একটা অন্যরকম অভিনয় করছে শাকিব খান আর শাবনূর ,এক্কেবারে মাইলফলক অভিনয়।",2021-02-13T16:59:10Z
UgxqYWXtpYa-rybb0lB4AaABAg,"২:৫২ মিনিটে যে লাইনটা গাওয়া হইছে তুমি নারী নাকি পরী বিধি নিজেই করবে ভুল, এই কথাটি সম্পুর্ন শিরক, কারন আল্লাহ কখনো ভুল করতে পারেন না, আল্লাহ যেন সবাইকে বুঝার তৌফিক দান করেন আমীন.",-1,"২:৫২ মিনিটে যে লাইনটা গাওয়া হইছে তুমি নারী নাকি পরী বিধি নিজেই করবে ভুল, এই কথাটি সম্পুর্ন শিরক, কারন আল্লাহ কখনো ভুল করতে পারেন না, আল্লাহ যেন সবাইকে বুঝার তৌফিক দান করেন আমীন.",2025-02-18T09:09:39Z
UgzCQ-3dkRee-XVG5rp4AaABAg,ছবিটা অনেক বার দেখেছি তখন সিডি ক্যাসেট এ দেখতাম। ছবির প্রতিটা গান ই সুন্দর,-1,ছবিটা অনেক বার দেখেছি তখন সিডি ক্যাসেট এ দেখতাম। ছবির প্রতিটা গান ই সুন্দর,2025-08-19T05:17:56Z
UgxHEk5M8JL6pucto2B4AaABAg,"২০৪০ সালের জন্য কমেন্ট করে গেলাম। আজ থেকে ১৫ বছর পরে যখন ছোটরা এই গানটা শুনবে, তখন বুঝতে পারবে এই গানটা আমাদের কাছে কত প্রিয় ছিলো❤😮",-1,"২০৪০ সালের জন্য কমেন্ট করে গেলাম। আজ থেকে ১৫ বছর পরে যখন ছোটরা এই গানটা শুনবে, তখন বুঝতে পারবে এই গানটা আমাদের কাছে কত প্রিয় ছিলো",2025-05-11T05:37:39Z
Ugxy07YzZ_m63aaQ43p4AaABAg,"গানটি শুন্তেছি ১২/৭/২০২৫
শাবনুর ই বেস্ট অলরাউন্ডার বাংলার নায়িকা।",-1,গানটি শুন্তেছি ১২/৭/২০২৫ শাবনুর ই বেস্ট অলরাউন্ডার বাংলার নায়িকা।,2025-12-07T18:37:20Z
UgwgYquqBTbFHNj5MdN4AaABAg,"আমার খুব প্রিয় একটি গান,  যতবারই শুনি ততবারই প্রিয় মানুষ টার কথা মনে পরে। কিসব দিন যে ছিল! গানের মাঝে প্রিয় মানুষ টিকে খুঁজে পেতাম।",-1,"আমার খুব প্রিয় একটি গান, যতবারই শুনি ততবারই প্রিয় মানুষ টার কথা মনে পরে। কিসব দিন যে ছিল! গানের মাঝে প্রিয় মানুষ টিকে খুঁজে পেতাম।",2020-12-15T12:29:11Z
Ugx1pcSEl7X1BE087LN4AaABAg,আগের শাকিব শাবনুর যেমন নামেও মিল কামেও ছিল অস্থির,-1,আগের শাকিব শাবনুর যেমন নামেও মিল কামেও ছিল অস্থির,2025-01-31T21:01:09Z
UgwZrT2v0gRTacLi4D14AaABAg,"যতদিন বাংলা সিনেমা আছে ততদিন বেঁচে থাকবে এই গানগুলি, বেঁচে থাকবে সালমান শাহ+শাবনূর
রিয়াজ+শাবনূর, শাকিব খান + শাবনূর এই জুটি গুলি। চির অমর এই বিষয় গুলো। 
আর বেঁচে থাকবে বাংলা চলচিত্রের ইতিহাসের মহানায়িকা শাবনূর ম্যাম
লক্ষকোটি বছরেও বিলীন হবেনা সে আর দ্বিতীয় কেউ জন্মও নেবে না কোনোদিন।",-1,"যতদিন বাংলা সিনেমা আছে ততদিন বেঁচে থাকবে এই গানগুলি, বেঁচে থাকবে সালমান শাহ+শাবনূর রিয়াজ+শাবনূর, শাকিব খান + শাবনূর এই জুটি গুলি। চির অমর এই বিষয় গুলো। আর বেঁচে থাকবে বাংলা চলচিত্রের ইতিহাসের মহানায়িকা শাবনূর ম্যাম লক্ষকোটি বছরেও বিলীন হবেনা সে আর দ্বিতীয় কেউ জন্মও নেবে না কোনোদিন।",2019-07-11T18:03:07Z
UgwG7FtdrwWoP9--iRh4AaABAg,আমি আজ ১৯. ১২. ২০২৫ দেখতাছি ❤❤বস শাকিব খান❤❤,-1,আমি আজ ১৯. ১২. ২০২৫ দেখতাছি বস শাকিব খান,2025-12-19T03:42:04Z
UgzrDQoPv6XaaEEpaaV4AaABAg,"যার চোখ কথা বলে সেই হল শাবনূর❤❤ শাবনূরের তুলনা সে নিজেই, ভবিষ্যতে এরকম শাবনূর আসবে কিনা জানিনা, তাকে দেখলেই মন জুড়ে যায়।❤❤❤",-1,"যার চোখ কথা বলে সেই হল শাবনূর শাবনূরের তুলনা সে নিজেই, ভবিষ্যতে এরকম শাবনূর আসবে কিনা জানিনা, তাকে দেখলেই মন জুড়ে যায়।",2023-05-22T21:01:19Z
Ugy6ImDhiv6O-NL1Pwt4AaABAg,সত্যি চাঁদের মতো সুন্দরী মেয়ে শাবনূর। শাবনূরকে লীল শাড়ি আর খোলা চুলে অসাধারণ লাগে। 🥰,-1,সত্যি চাঁদের মতো সুন্দরী মেয়ে শাবনূর। শাবনূরকে লীল শাড়ি আর খোলা চুলে অসাধারণ লাগে।,2022-02-18T13:42:39Z
Ugz3NLb1-1yOXUsJmQl4AaABAg,"২০০২ প্রথম  এ শুনি, আহা দারুন। চিরসবুজ গান।  ২০৪০ এ তাই মনে হবে। 😮",-1,"২০০২ প্রথম এ শুনি, আহা দারুন। চিরসবুজ গান। ২০৪০ এ তাই মনে হবে।",2024-12-13T07:01:27Z
UgySsiSMf7uLF6xS-pd4AaABAg,"মিস ইউ এন্ড্রু কিশোর স্যার 😭। ওপারে ভালো থাকবেন। 
 জয় হিন্দ 🥰🇮🇳😍",-1,মিস ইউ এন্ড্রু কিশোর স্যার । ওপারে ভালো থাকবেন। জয় হিন্দ,2020-09-15T16:43:38Z
UgyImA9F7sb6g0RZ93B4AaABAg,এত সুন্দর গান আর এখন হয় না।।।এই গান গুলোতে অন্য রকম ভালোলাগা কাজ করে।।।,-1,এত সুন্দর গান আর এখন হয় না।।।এই গান গুলোতে অন্য রকম ভালোলাগা কাজ করে।।।,2019-02-21T17:35:54Z
UgynfDmn2xjdJfAc5cB4AaABAg,"সর্বকালের সর্বশ্রেষ্ঠ সেরা অভিনেত্রী শাবনুর। 
বাঙালি হিন্দু নারীদের কাছে শাবনুর হলো আদর্শের চাবীকাঠি ❤❤",-1,সর্বকালের সর্বশ্রেষ্ঠ সেরা অভিনেত্রী শাবনুর। বাঙালি হিন্দু নারীদের কাছে শাবনুর হলো আদর্শের চাবীকাঠি,2021-07-06T11:16:57Z
Ugy6D-bZSBR0IfUoY0B4AaABAg,"যে,,রুপ,,দিয়ে,, বর্ননা,, করতো,,সে,,,চলে,,যাওয়ার,, সাথে,,রুপটাও,, নিয়ে,, গেছে",-1,"যে,,রুপ,,দিয়ে,, বর্ননা,, করতো,,সে,,,চলে,,যাওয়ার,, সাথে,,রুপটাও,, নিয়ে,, গেছে",2025-02-18T15:52:18Z
UgzeUrLcS0tnAMHYO0R4AaABAg,"আসলেই গানটি অসাধারণ হয়েছে, 
যত শুনি ততই প্রেমে পড়ি।",-1,"আসলেই গানটি অসাধারণ হয়েছে, যত শুনি ততই প্রেমে পড়ি।",2019-06-04T10:32:46Z
Ugz5zAszPm820bnS62B4AaABAg,শাবনুরের মতো অভিনেত্রী বাংলাদেশে আর দ্বিতীয় কেউ আসবে না। এই অপুর্নতা  থেকেই যাবে ❤❤,-1,শাবনুরের মতো অভিনেত্রী বাংলাদেশে আর দ্বিতীয় কেউ আসবে না। এই অপুর্নতা থেকেই যাবে,2024-01-04T08:52:47Z
UgydONb7-P1_97s5JH54AaABAg,গানে শাকিবের অভিনয় অসাধারন।,-1,গানে শাকিবের অভিনয় অসাধারন।,2021-04-23T17:58:30Z
Ugx8CeFsjX6VWy2XrQZ4AaABAg,"২:৫২ মিনিটে যে লাইনটা গাওয়া হইছে তুমি নারী নাকি পরী বিধি নিজেই করবে ভুল, এই কথাটি সম্পূর্ন শিরক, কারন আল্লাহ কখনো ভুল করতে পারেন না, আল্লাহ যেন সবাইকে বুঝার তৌফিক..দান করুন আমিন 😊",-1,"২:৫২ মিনিটে যে লাইনটা গাওয়া হইছে তুমি নারী নাকি পরী বিধি নিজেই করবে ভুল, এই কথাটি সম্পূর্ন শিরক, কারন আল্লাহ কখনো ভুল করতে পারেন না, আল্লাহ যেন সবাইকে বুঝার তৌফিক..দান করুন আমিন",2025-01-27T13:04:13Z
UgxHMo7hGLes_U-R8zt4AaABAg,"একসাথে ৪ বার শুনলাম,,, কিন্তু তারপরেও শুধু শুনতেই ইচ্ছে করে,,, হৃদয় ছুঁয়ে যায় গানটা",-1,"একসাথে ৪ বার শুনলাম,,, কিন্তু তারপরেও শুধু শুনতেই ইচ্ছে করে,,, হৃদয় ছুঁয়ে যায় গানটা",2021-11-29T16:28:47Z
UgysnFPrdbGTsWJj4sB4AaABAg,"কে কে চান সাবনুর আপুর সংসারটা আবার জোড়া লাগক,,কমেন্ট করে জানিয়ে দিন",-1,"কে কে চান সাবনুর আপুর সংসারটা আবার জোড়া লাগক,,কমেন্ট করে জানিয়ে দিন",2020-03-07T20:17:35Z
UgyVyOVKBHvb5aB7Grd4AaABAg,"।২০২৪ কে কে শুনেছেন লাইক দিন।
❤❤❤❤❤❤❤
🌹🌹🌹🌹🌹🌹🌹🌹🌹🌹🌹🌹",-1,।২০২৪ কে কে শুনেছেন লাইক দিন।,2019-03-11T16:33:53Z
UgwF_BIMRovQUD8FIdp4AaABAg,৫/৪/২০২৫ রাত ১ টায় আমার এই প্রিয় গানটা সুনলাম ২০৩২ সালের জন্য কমেন্ট করে গেলাম  ছোটরা বুঝতে পারবে কত সুন্দর এই ♪ টা,-1,৫/৪/২০২৫ রাত ১ টায় আমার এই প্রিয় গানটা সুনলাম ২০৩২ সালের জন্য কমেন্ট করে গেলাম ছোটরা বুঝতে পারবে কত সুন্দর এই টা,2025-06-02T17:28:45Z
Ugxy0mmNOxtu-AZaSlZ4AaABAg,"শাবনূর♥♥♥
বস্ সাকিব খান",-1,শাবনূর বস্ সাকিব খান,2019-08-06T13:30:29Z
UgyWbVE8daEN61TL_q54AaABAg,"এমন গানগুলো যতদিন পৃথিবী বেচে থাকবে, ততদিন তো রবেই। যতদিন স্যাটেলাইট চ্যানেল, আর ইন্টারনেট সংযোগ থাকবে, ততদিন পর্যন্ত হৃদয়ে সুখের যোগান দেবে।",-1,"এমন গানগুলো যতদিন পৃথিবী বেচে থাকবে, ততদিন তো রবেই। যতদিন স্যাটেলাইট চ্যানেল, আর ইন্টারনেট সংযোগ থাকবে, ততদিন পর্যন্ত হৃদয়ে সুখের যোগান দেবে।",2019-06-22T18:13:34Z
Ugzz1y_dgQr44S_WTPN4AaABAg,সাকিব খান শাবনুর কে যারা ভালো বাসেন তারাই লাইক করুন ❤,-1,সাকিব খান শাবনুর কে যারা ভালো বাসেন তারাই লাইক করুন,2025-03-23T14:54:30Z
Ugwgr-k1biC0_hF23B94AaABAg,আমার বাংলাদেশের সবচেয়ে প্রিও নাইকা  সাবনুর & সাকিব খান কে  সবচেয়ে ভালো লাগে ❤,-1,আমার বাংলাদেশের সবচেয়ে প্রিও নাইকা সাবনুর & সাকিব খান কে সবচেয়ে ভালো লাগে,2022-12-11T16:08:04Z
UgzR1r4WRkgkf767MX94AaABAg,শাবনুর আপুকে সব ড্রেসই ভালো লাগে। তার হাসি মুখে অভিনয়ে magic থাকে। যা অন্য কোন নায়িকার নেই।,-1,শাবনুর আপুকে সব ড্রেসই ভালো লাগে। তার হাসি মুখে অভিনয়ে magic থাকে। যা অন্য কোন নায়িকার নেই।,2020-12-08T16:07:28Z
Ugzr00-RIhm0sqrXJ8l4AaABAg,শাকিব খানের অনেক সুন্দর একটা গান❤❤❤❤❤❤,-1,শাকিব খানের অনেক সুন্দর একটা গান,2025-12-07T10:11:33Z
UgwT2vh6NfRwPkMdpOl4AaABAg,20 বছর পরে ও শাকিব খান সেরা নায়ক।,-1,20 বছর পরে ও শাকিব খান সেরা নায়ক।,2020-08-18T17:26:44Z
UgzPiGtcNf8jBaql3x14AaABAg,2020 সালে কে কে দেখছেন জাতি দেখতে চায়,-1,2020 সালে কে কে দেখছেন জাতি দেখতে চায়,2020-01-08T17:19:08Z
