id,text,label,clean_text,reference_time
UgznDIHcXFs_ojzfObZ4AaABAg,এমন গান এখন আর হয়না 😥 অনেক মিস করি আগের গান গুলো এবং দিন গুলো।,-1,এমন গান এখন আর হয়না অনেক মিস করি আগের গান গুলো এবং দিন গুলো।,2021-05-30T16:49:20Z
UgzS898EvKIUYddVaL14AaABAg,কাজী শুভর অন্য গানটির থেকে এই গানটি অনেক ভালো লেগেছে  কার কার এই গান ভালো লেগেছে তারা এই কমেন্টে একটি লাইক করে দিবেন,-1,কাজী শুভর অন্য গানটির থেকে এই গানটি অনেক ভালো লেগেছে কার কার এই গান ভালো লেগেছে তারা এই কমেন্টে একটি লাইক করে দিবেন,2020-12-25T08:47:10Z
UgxkcqDPuoMFnNZr5CJ4AaABAg,"মন থেকে চাইলে পাবেন।
একদিনে না পেলেও, একদিন ঠিকই পাবেন।",-1,"মন থেকে চাইলে পাবেন। একদিনে না পেলেও, একদিন ঠিকই পাবেন।",2025-11-07T05:55:32Z
UgzEoApwp6Yfnl2wTZt4AaABAg,"সেই সাত বছর আগের  আমি 
এখন আমির মধ্যে অনেক অমিল 
কিন্তুু গানটা আগের মতই আছে ২০২১",-1,সেই সাত বছর আগের আমি এখন আমির মধ্যে অনেক অমিল কিন্তুু গানটা আগের মতই আছে ২০২১,2021-06-16T17:32:20Z
Ugzbgc035SJ0pP1f6FR4AaABAg,গান টা  আমার পুরানো স্মৃতি জড়িয়ে আছে 😔💞,-1,গান টা আমার পুরানো স্মৃতি জড়িয়ে আছে,2022-08-23T19:11:35Z
Ugx_LPExMUY2EbWPAq14AaABAg,2025 24 শে March দেখি কারা এরপর আসছো এই প্রিয় গানটা শোনার জন্য ❤,-1,2025 24 শে March দেখি কারা এরপর আসছো এই প্রিয় গানটা শোনার জন্য,2025-03-24T06:52:25Z
UgzckN2g-vBhKgMTr4l4AaABAg,"২০২৫ সালে এসে কে কে গানটা শুনেছেন,,,,,❤",-1,"২০২৫ সালে এসে কে কে গানটা শুনেছেন,,,,,",2025-07-19T15:11:20Z
UgybWLIAPxhxz5YpkYp4AaABAg,"এখনো প্রতিদিন শুনি....
ছোটবেলার প্রিয়া গান🖤
১৩ সাল থেকে শুনি....
আম্মুর বাটন ফোন এ শুনতাম🥰",-1,এখনো প্রতিদিন শুনি.... ছোটবেলার প্রিয়া গান ১৩ সাল থেকে শুনি.... আম্মুর বাটন ফোন এ শুনতাম,2022-04-09T06:26:56Z
UgyY1-ux0hTd0MFjY9h4AaABAg,আর কখনো হয়তো ফিরে পাবো না সেই সময়টা যখন ভাই এর মোবাইলে এই গানগুলো শুনতাম।সত্যিই অসাধারণ একটা সময় ছিলো তখন। সেই সময়ে কখনো বুঝতে পারিনি একদিন এই দিন গুলো এভাবে হারিয়ে ফেলবো।আজও মিস করি ওই দিন গুলো কে,-1,আর কখনো হয়তো ফিরে পাবো না সেই সময়টা যখন ভাই এর মোবাইলে এই গানগুলো শুনতাম।সত্যিই অসাধারণ একটা সময় ছিলো তখন। সেই সময়ে কখনো বুঝতে পারিনি একদিন এই দিন গুলো এভাবে হারিয়ে ফেলবো।আজও মিস করি ওই দিন গুলো কে,2022-04-27T07:19:39Z
Ugx61Rb6Cg92EhA7iOx4AaABAg,এসময়ের পোলাপান গুলো তো ফেসবুক আর অনলাইন গেমিং ছাড়া কিছু বোঝে না। এসব গান আমাদের সময়ে জনপ্রিয় হয়ে ওঠেছিলো।তাই ২০২২ এসে আবার শুনে গেলাম ❤️❤️,-1,এসময়ের পোলাপান গুলো তো ফেসবুক আর অনলাইন গেমিং ছাড়া কিছু বোঝে না। এসব গান আমাদের সময়ে জনপ্রিয় হয়ে ওঠেছিলো।তাই ২০২২ এসে আবার শুনে গেলাম ️️,2022-10-30T19:44:32Z
UgwXUkGdih8VLORJbAB4AaABAg,"কিছু গানের সাথে হারানো দিনের সৃতি লুকিয়ে থাকে,, সেগুলো মনে পরলে ফিরে যেতে ইচ্ছে করে সেই সময়ে,, চাইলে ও হয়তো সেটা সম্ভব হবেনা।",-1,"কিছু গানের সাথে হারানো দিনের সৃতি লুকিয়ে থাকে,, সেগুলো মনে পরলে ফিরে যেতে ইচ্ছে করে সেই সময়ে,, চাইলে ও হয়তো সেটা সম্ভব হবেনা।",2021-09-24T21:43:51Z
Ugxl8H-aNiVbXvJnBBl4AaABAg,"2015 সালে এই গানটা আমার প্রিয়জনের ফোনে ফোন দিলে আমি শুনতে পারতাম আহারে কই গেল দিনগুলো
গানটা তো ঠিকই রয়ে গেল কিন্তু আমার সেই শৈশবের প্রেমটা আর নাই",-1,2015 সালে এই গানটা আমার প্রিয়জনের ফোনে ফোন দিলে আমি শুনতে পারতাম আহারে কই গেল দিনগুলো গানটা তো ঠিকই রয়ে গেল কিন্তু আমার সেই শৈশবের প্রেমটা আর নাই,2021-03-30T14:40:41Z
UgwE0HxsR1O7U2dYzQ94AaABAg,কেনো জানি এই গানটা শুনলে সেই স্কুল জিবনের কথা মনে পরে,-1,কেনো জানি এই গানটা শুনলে সেই স্কুল জিবনের কথা মনে পরে,2022-02-14T16:42:19Z
UgwMYmeOrISL84iZ1_d4AaABAg,"৯০০৳ সেকেনহ্যান্ড বাটন ফোনে শুনতাম ৮-৯ বছর আগে
আর এখন শুনি ১৮০০০৳
কিন্ত তফাত ৮বছর আগের স্বাদ মনের ভিতর ২০২২ সালে নাই!
আহ্ শৈশব",-1,৯০০৳ সেকেনহ্যান্ড বাটন ফোনে শুনতাম ৮-৯ বছর আগে আর এখন শুনি ১৮০০০৳ কিন্ত তফাত ৮বছর আগের স্বাদ মনের ভিতর ২০২২ সালে নাই! আহ্ শৈশব,2022-02-14T14:48:28Z
UgwgXH36iOITNuPKpgd4AaABAg,কে কে শুনছ এখন?????,-1,কে কে শুনছ এখন?????,2025-06-21T17:04:28Z
UgxfIUDnA1dDDbmn0wp4AaABAg,"কোথায় হারিয়ে গেল কেয়া, অরিন, পূর্ণতা র মতো গুনী শিল্পীরা😭😭",-1,"কোথায় হারিয়ে গেল কেয়া, অরিন, পূর্ণতা র মতো গুনী শিল্পীরা",2021-08-17T18:49:04Z
UgynzH-2dsHRbByZ76Z4AaABAg,"কোথায় হারিয়ে গেলো সেই সোনালী দিনগুলো? মিস করি প্রতিটা দিন।
সত্যিই মনটাকে বোঝানো দ্বায় খুব 😞😞(এফ আই ফিরোজ)",-1,কোথায় হারিয়ে গেলো সেই সোনালী দিনগুলো? মিস করি প্রতিটা দিন। সত্যিই মনটাকে বোঝানো দ্বায় খুব (এফ আই ফিরোজ),2023-03-22T09:28:36Z
UgwuMGeVEKxx5mGDsy94AaABAg,গানটা যখন শুনি  তখন মনে হয়  সেই  পুরোনো দিনে চলে যাই হাইস্কুল লাইফে যার জন্য এগুলো গান শুনতাম  সে এখন কোথায় আমি এখন কোথায় 😢😢😢,-1,গানটা যখন শুনি তখন মনে হয় সেই পুরোনো দিনে চলে যাই হাইস্কুল লাইফে যার জন্য এগুলো গান শুনতাম সে এখন কোথায় আমি এখন কোথায়,2025-08-15T04:50:49Z
UgxY9CxOf6dht1_FmkZ4AaABAg,প্রতিটা ভালবাসার ব্যর্থ জীবন্ত লাস গুলি খুজে বেড়ায় আজ ও তাদের মনের খুনি কে😔,-1,প্রতিটা ভালবাসার ব্যর্থ জীবন্ত লাস গুলি খুজে বেড়ায় আজ ও তাদের মনের খুনি কে,2022-11-16T06:21:55Z
UgyKRJV4BaGJmK7qHeV4AaABAg,"২০১৩ সালে আমার ২জিবির কেনা নতুন মেমোরিতে এই গানটা ছিল..  ❤ ভালো লাগার একটি গান।
 সত্যিই সেই সময় টা আ্যলবাম গানের জগতে একটা সেরা সময় ছিল.. 👍❤️🇧🇩👍✅",-1,২০১৩ সালে আমার ২জিবির কেনা নতুন মেমোরিতে এই গানটা ছিল.. ভালো লাগার একটি গান। সত্যিই সেই সময় টা আ্যলবাম গানের জগতে একটা সেরা সময় ছিল.. ️,2023-04-01T00:05:27Z
UgyUSZgC0GKblngPjhV4AaABAg,আহারে আমাদের কৈশোরে উতলা সময় গুলো মনে হয় ❤️,-1,আহারে আমাদের কৈশোরে উতলা সময় গুলো মনে হয় ️,2022-08-30T20:20:58Z
UgzsF2_A4folTn_bpsJ4AaABAg,এ গানটি শুনলে তাঁর হাতের তালুতে ঝলমল করতে থাকা রুপালী শহর আমাকে ডাকতে থাকে..🥺😭,-1,এ গানটি শুনলে তাঁর হাতের তালুতে ঝলমল করতে থাকা রুপালী শহর আমাকে ডাকতে থাকে..,2025-02-12T11:15:31Z
UgwhSLOpR9Im2BeRR1Z4AaABAg,"আহ স্কুল লাইফের সবচেয়ে প্রিয় গান ছিলো এগুলো 🥰
এই গান গুলোর সাথে প্রিয় মানুষটাকে নিয়ে অনেক অনুভূতি জড়িয়ে থাকে🥰
মিস করি স্কুল লাইফের সময়টা,,, আহ কি যে ভালো লাগা ছিলো, 🥰",-1,"আহ স্কুল লাইফের সবচেয়ে প্রিয় গান ছিলো এগুলো এই গান গুলোর সাথে প্রিয় মানুষটাকে নিয়ে অনেক অনুভূতি জড়িয়ে থাকে মিস করি স্কুল লাইফের সময়টা,,, আহ কি যে ভালো লাগা ছিলো,",2022-04-16T01:47:26Z
Ugx3FVxMvW33oS0rjEN4AaABAg,"২০২২ এ প্রিয়,,,বিংশ শতাব্দীর জন্য,,,,,, ২০৫০ সালের জন্য রেখে গেলাম,,",-1,"২০২২ এ প্রিয়,,,বিংশ শতাব্দীর জন্য,,,,,, ২০৫০ সালের জন্য রেখে গেলাম,,",2022-02-14T03:38:05Z
Ugzk-Oy2B1Idk_YksXN4AaABAg,"আমার প্রিয় একটা গান 😍 যেটা ছোটবেলা থেকে শুনে আসছি আর আজীবন শুনে যাবো । 😯👌👸🥰🥰🥰 
ভবিস্বতের জন্য কমেন্ট টা করে গেলাম এখন 2022 । love you subha da 😊😊😊",-1,আমার প্রিয় একটা গান যেটা ছোটবেলা থেকে শুনে আসছি আর আজীবন শুনে যাবো । ভবিস্বতের জন্য কমেন্ট টা করে গেলাম এখন 2022 । love you subha da,2022-05-18T05:32:03Z
UgxIXdRyjF9tL8ac_eh4AaABAg,আগের সেই দিনে ফিরে যেতে চাই আগের সেই বাটন ফোন ২ জিবি মেমরি সোনালী জীবন ফিলিংস অনুভুতি এখন আইফোন চালাইও পাইনা 😢,-1,আগের সেই দিনে ফিরে যেতে চাই আগের সেই বাটন ফোন ২ জিবি মেমরি সোনালী জীবন ফিলিংস অনুভুতি এখন আইফোন চালাইও পাইনা,2025-07-08T20:06:38Z
Ugzjn5_voPnRUAFHTSx4AaABAg,"এই গানটা আমার প্রিয় মানুষটার খুব পছন্দের,,বহু বার তার মুখে শুনেছি,সে আমাকে উদ্দেশ্য করে গাইতো,,, আমি যত বার গান টি শুনি পুরনো স্মৃতি গুলো মনে পরে, মনে আমার ভালোবাসার সেই দিন গুলোর কথা!!!",-1,"এই গানটা আমার প্রিয় মানুষটার খুব পছন্দের,,বহু বার তার মুখে শুনেছি,সে আমাকে উদ্দেশ্য করে গাইতো,,, আমি যত বার গান টি শুনি পুরনো স্মৃতি গুলো মনে পরে, মনে আমার ভালোবাসার সেই দিন গুলোর কথা!!!",2023-03-27T13:15:56Z
UgzmOJMUXG6mnZo7-MR4AaABAg,"গানটা এতো এতো ভালো লাগে,, এই গানটা শুনলে আমার স্কুল জীবনের কথা মনে পড়ে ,,",-1,"গানটা এতো এতো ভালো লাগে,, এই গানটা শুনলে আমার স্কুল জীবনের কথা মনে পড়ে ,,",2020-10-13T23:58:46Z
Ugz7k7j5oRqhaw82udx4AaABAg,"বর্তমান সালটা 2022।।সেই ছোট বেলার কথা কখনও কখনও কারো প্রেমে পড়ে যেতাম,মেয়েটার কথা মনে করতাম আর এই গানগুলো শুনতাম হাসতামো অনেক কি আবেগটাই না ছিলো  তাও বাটন ফোনে শুনতাম।।আর এখন বেশি দামের ফোন চালালেও না আবেগ কাজ করে না ওরকম রোমান্চ কোনটাই না,সেই সময় আর এখন সময় কতটা পার্থক্য🙂😌",-1,"বর্তমান সালটা 2022।।সেই ছোট বেলার কথা কখনও কখনও কারো প্রেমে পড়ে যেতাম,মেয়েটার কথা মনে করতাম আর এই গানগুলো শুনতাম হাসতামো অনেক কি আবেগটাই না ছিলো তাও বাটন ফোনে শুনতাম।।আর এখন বেশি দামের ফোন চালালেও না আবেগ কাজ করে না ওরকম রোমান্চ কোনটাই না,সেই সময় আর এখন সময় কতটা পার্থক্য",2022-06-13T06:11:17Z
Ugyqxp4GRvfTkv87P2t4AaABAg,"আমার এক ছোট ভাই নাম দিলীপ,,, অবশ্যই তার উদ্দেশ্য আমার এই ছোট্ট কমেন্ট টা এই সুন্দর গান গুলো তার খুব প্রিয়,, এই গান গুলো সুনলে ভাইটির কথা খুব মনে পড়ে যায়,,,,সে কাজী শুভর বড় একজন ফ্যান ❤",-1,"আমার এক ছোট ভাই নাম দিলীপ,,, অবশ্যই তার উদ্দেশ্য আমার এই ছোট্ট কমেন্ট টা এই সুন্দর গান গুলো তার খুব প্রিয়,, এই গান গুলো সুনলে ভাইটির কথা খুব মনে পড়ে যায়,,,,সে কাজী শুভর বড় একজন ফ্যান",2024-09-05T08:37:30Z
Ugxxbgqwem4oZ8FHNrV4AaABAg,"তখন খুব ছোট্ট 🙂🙂 
    সেই সময় গানটি রিলিজ করে
            খুব ভালো লাগে শুনতে 😜",-1,তখন খুব ছোট্ট সেই সময় গানটি রিলিজ করে খুব ভালো লাগে শুনতে,2021-03-26T09:27:30Z
UgxT4nkptT9Qhcm_NJJ4AaABAg,এই গান গুলো  কম্পিউটার থেকে ডাওনলোড করা পাবলিক গুলো কই✋✋,-1,এই গান গুলো কম্পিউটার থেকে ডাওনলোড করা পাবলিক গুলো কই,2025-02-03T05:46:12Z
Ugy4AcBxHYo47KyGFlB4AaABAg,"সেই MP4 এ শুনা গান,,,কত মায়া কত আবেগ জড়িয়ে আছে,,,গানগুলো শুনার সাথে সাথে প্রিয় মানুষের সাথে কাটানো সব স্মৃতি মনে পড়ে যায়,,,এমন গান হয়তো আর পাবনা,,,পরের প্রজন্মরা হয়তো গানগুলো শুনলে বুঝবে আমরা কত রোমান্টিক ছিলাম",-1,"সেই MP4 এ শুনা গান,,,কত মায়া কত আবেগ জড়িয়ে আছে,,,গানগুলো শুনার সাথে সাথে প্রিয় মানুষের সাথে কাটানো সব স্মৃতি মনে পড়ে যায়,,,এমন গান হয়তো আর পাবনা,,,পরের প্রজন্মরা হয়তো গানগুলো শুনলে বুঝবে আমরা কত রোমান্টিক ছিলাম",2022-08-19T21:46:02Z
Ugy-wVZaB2uG5lfLxk54AaABAg,কাল থেকে আমার কলিজার বউ রাগ করে কথা বলেনা তাই এই গান গুলো শুনতেছি আর কলিজা ফেটে কান্না করতেছি😭😭😭😭😭😭😭,-1,কাল থেকে আমার কলিজার বউ রাগ করে কথা বলেনা তাই এই গান গুলো শুনতেছি আর কলিজা ফেটে কান্না করতেছি,2024-09-10T11:16:22Z
UgwO__ftbxVeiY7_w4F4AaABAg,আহারে সেই সোনালী শৈশব কাল কোথায় হারিয়ে গেলো😭💔,-1,আহারে সেই সোনালী শৈশব কাল কোথায় হারিয়ে গেলো,2022-10-07T16:12:08Z
UgzHU1WRdmXAtJpXEPV4AaABAg,৮ বছর আগে থেকে গানটা প্রায়ই  শুনতাম। আজ ২০২২ এ এসেও গানটা এতো ভালো লাগে যা বলার বাহিরে🥀🖤,-1,৮ বছর আগে থেকে গানটা প্রায়ই শুনতাম। আজ ২০২২ এ এসেও গানটা এতো ভালো লাগে যা বলার বাহিরে,2022-11-20T13:19:05Z
UgzE4xJQd-4wKEl_EJV4AaABAg,বাটন ফোনে শুনতাম আগে 😊,-1,বাটন ফোনে শুনতাম আগে,2025-12-19T17:09:39Z
Ugz9zxudFYnGxmsG3e14AaABAg,গানটার সাথে অনেক পুরোনো দিনের আবেগ মিশে আছে।,-1,গানটার সাথে অনেক পুরোনো দিনের আবেগ মিশে আছে।,2021-06-17T01:56:48Z
UgzGCnbgIyBBb9nPn454AaABAg,"পুরোনো দিনের স্মৃতি ফিরে পাবার মতো যখনই শুনিনা কেন গানগুলো, 
মনে হয় যেনো মনের মাঝের সেই প্রথম আবেগগুলো আবার ফিরে আসে।",-1,"পুরোনো দিনের স্মৃতি ফিরে পাবার মতো যখনই শুনিনা কেন গানগুলো, মনে হয় যেনো মনের মাঝের সেই প্রথম আবেগগুলো আবার ফিরে আসে।",2022-02-15T09:55:51Z
UgwwEfx3G3q1OQVjg9B4AaABAg,প্রথম শুনেছিলাম 2016 সালে 50 টাকা একটা মেমোরি যে আবার 2 জিবি😅 লাইক কমেন্ট আসলে আবার শুনে জাব ❤,-1,প্রথম শুনেছিলাম 2016 সালে 50 টাকা একটা মেমোরি যে আবার 2 জিবি লাইক কমেন্ট আসলে আবার শুনে জাব,2025-10-17T10:38:02Z
Ugyo3DNo7j8tySkrVAh4AaABAg,"অাহ ২০১৫ এর সেই দিনগুলো। ২০২১ সালে এসেও স্কুলের সময়টায় যেনো হারিয়ে যাচ্ছে..!!৷ 
Golden days 😍",-1,অাহ ২০১৫ এর সেই দিনগুলো। ২০২১ সালে এসেও স্কুলের সময়টায় যেনো হারিয়ে যাচ্ছে..!!৷ Golden days,2021-10-07T15:05:07Z
Ugzo2MwbObCO6nNTE454AaABAg,"যখন প্রথম প্রেমে পড়ি তখন গানটা নতুন রিলিজ হয়, গানটি এখনো আছে শুধু প্রেমের মানুষটি হারিয়ে গেছে 😢😢",-1,"যখন প্রথম প্রেমে পড়ি তখন গানটা নতুন রিলিজ হয়, গানটি এখনো আছে শুধু প্রেমের মানুষটি হারিয়ে গেছে",2020-07-22T16:45:52Z
UgzLN9pH59pMb7S5PlV4AaABAg,"2022 এ এসে ও গানটা আগের মতোই ভালো লাগে,,আর অতীতের সৃতি গুলো অণুভব করিয়ে দেয়",-1,"2022 এ এসে ও গানটা আগের মতোই ভালো লাগে,,আর অতীতের সৃতি গুলো অণুভব করিয়ে দেয়",2022-09-04T21:57:14Z
UgwGvjMOXj6qu3MAh514AaABAg,এই গানটির সাথে মিশে আছে আমার ভালবাসার কিছু স্মৃতি।,-1,এই গানটির সাথে মিশে আছে আমার ভালবাসার কিছু স্মৃতি।,2020-03-03T16:16:52Z
UgxCApvr89Vwz3aDvPh4AaABAg,এই গানটা শুনলে হাইস্কুল লাইফের কথা মনে পড়ে... nostalgic,-1,এই গানটা শুনলে হাইস্কুল লাইফের কথা মনে পড়ে... nostalgic,2019-07-25T08:38:21Z
UgykSVG7aR16-y9VQtd4AaABAg,কি যে মায়া এই গান গুলোর মধ্যে 🥹,-1,কি যে মায়া এই গান গুলোর মধ্যে,2022-12-06T16:21:25Z
UgyCsW4E_CYGXhMkRpV4AaABAg,"২০১৭ সাল হেডফোন লাগিয়ে গানটি শুনতাম আর প্রিয় মানুষটার কথা ভাবতাম,আলহামদুলিল্লাহ এখন আমাদের বিয়ের বয়স ৪ বছর।",-1,"২০১৭ সাল হেডফোন লাগিয়ে গানটি শুনতাম আর প্রিয় মানুষটার কথা ভাবতাম,আলহামদুলিল্লাহ এখন আমাদের বিয়ের বয়স ৪ বছর।",2024-08-16T12:01:46Z
