id,text,label,clean_text,reference_time
Ugznw3RcM2WmmR7j1TZ4AaABAg,অনেক রোমান্টিক সুন্দর একটি গান ❤❤,-1,অনেক রোমান্টিক সুন্দর একটি গান,2024-11-10T09:17:52Z
UgzDTvIdmw0cCykgQRx4AaABAg,"গীতিকারঃমাসুদ করিম
সুরকারঃআলাউদ্দিন আলী
শিল্পীঃ কুমার সানু / উমা খান",-1,গীতিকারঃমাসুদ করিম সুরকারঃআলাউদ্দিন আলী শিল্পীঃ কুমার সানু / উমা খান,2022-05-25T03:34:27Z
UgyEk7jQthMEUYVtAmN4AaABAg,প্রথম যেদিন সুনেছিলাম মনে হয়েছিল পৃথিবীতে এত এত সুন্দর গান আর গানের কথা থাকতে পারে??,-1,প্রথম যেদিন সুনেছিলাম মনে হয়েছিল পৃথিবীতে এত এত সুন্দর গান আর গানের কথা থাকতে পারে??,2021-03-24T05:00:42Z
Ugw8yvQRoXeB2keCdgN4AaABAg,এই সুর ও মিউজিকগুলো কত নিখুত ছিলো । প্রতিটা শব্দ কলিজাতে দাগ কাটে । মনে চাই আবারো ৯০দশকে ফিরে যাই।,-1,এই সুর ও মিউজিকগুলো কত নিখুত ছিলো । প্রতিটা শব্দ কলিজাতে দাগ কাটে । মনে চাই আবারো ৯০দশকে ফিরে যাই।,2025-07-31T10:17:49Z
UgwwOeXVvWhu0RPmTtZ4AaABAg,90s kids  ই বুঝবে এই গানগুলোর সাথে কত সৃতি জড়িয়ে আছে 😢😢,-1,90s kids ই বুঝবে এই গানগুলোর সাথে কত সৃতি জড়িয়ে আছে,2023-07-09T21:36:11Z
Ugy0IstVhSSPRtCS6Jl4AaABAg,২০২৪ এসে ও কেন জানি না গানটা বার বার শুনতে ইচ্ছে করছে ❤️,-1,২০২৪ এসে ও কেন জানি না গানটা বার বার শুনতে ইচ্ছে করছে ️,2024-10-15T16:05:04Z
UgxFTmyHOWwmlrg1KvR4AaABAg,গানটি শুনলে নিজেকে প্রেমিক বনে নিয়ে যাই❤️,-1,গানটি শুনলে নিজেকে প্রেমিক বনে নিয়ে যাই️,2024-12-18T02:58:22Z
Ugxi8wYPqC-Wvix_a414AaABAg,"😢প্রিয় তুমি আজ অনেক সুখি,,, কিন্ত আমি তোমাকে ভেবে ভেবেই দিন কাটিয়ে দেই😢😢",-1,"প্রিয় তুমি আজ অনেক সুখি,,, কিন্ত আমি তোমাকে ভেবে ভেবেই দিন কাটিয়ে দেই",2024-11-21T12:31:54Z
Ugwo2tqyiYxrD5u11tR4AaABAg,হাজারো গানের মধ্যে এই একটি গান আমার সেরা গান।,-1,হাজারো গানের মধ্যে এই একটি গান আমার সেরা গান।,2025-02-02T16:32:28Z
UgzhiZuQbXs_NUto5Bd4AaABAg,এই গানগুলো ছাড়া ইদানীং এর কোনো গান এতটা শান্তি পাই না।এত সুন্দর এত বিরহ সত্যি কান্না চলে আসে।,-1,এই গানগুলো ছাড়া ইদানীং এর কোনো গান এতটা শান্তি পাই না।এত সুন্দর এত বিরহ সত্যি কান্না চলে আসে।,2022-09-24T18:26:00Z
Ugye4pq3coeL6ZaP1yR4AaABAg,সবাই ভালো থাকুক ব্যর্থ প্রেমগুলো,-1,সবাই ভালো থাকুক ব্যর্থ প্রেমগুলো,2024-11-05T17:59:06Z
UgxC1VZ3n3NpKySLsFF4AaABAg,ইচ্ছে হয় আবার ফিরে যাই সেই পুরনো দিনগুলো তে।।।তরে খুব মিস করি রে,-1,ইচ্ছে হয় আবার ফিরে যাই সেই পুরনো দিনগুলো তে।।।তরে খুব মিস করি রে,2022-09-21T14:02:19Z
Ugwdd-Fz7JqgMrhDprp4AaABAg,"2000 সালের পরে যেকোনো ছায়াছবির গান কে হার মানায়, হৃদয়গ্রাহী কথা ,সুর কথাগুলো আমার থাকবে",-1,"2000 সালের পরে যেকোনো ছায়াছবির গান কে হার মানায়, হৃদয়গ্রাহী কথা ,সুর কথাগুলো আমার থাকবে",2023-03-26T14:59:56Z
UgxvJcR99xqkdOGId-d4AaABAg,মনজুড়ানো গান।এই গান শুনলে একজনের কথা বেশি মনে পড়ে।সুখে থাকুক সেই প্রিয় মানুষ টা।,-1,মনজুড়ানো গান।এই গান শুনলে একজনের কথা বেশি মনে পড়ে।সুখে থাকুক সেই প্রিয় মানুষ টা।,2025-01-30T16:18:28Z
UgxeXlV9STLJnU7GxOB4AaABAg,আমার সবচাইতে প্রিয় গান।।,-1,আমার সবচাইতে প্রিয় গান।।,2024-12-23T18:27:07Z
UgynE5PU5lC64-vhsIZ4AaABAg,এটা শুধু গান নয় মনের সবটুকু আবেগ 🥰😥,-1,এটা শুধু গান নয় মনের সবটুকু আবেগ,2022-04-26T17:55:18Z
UgxO8c8leG8qLfXBF3p4AaABAg,আমি ছোট বেলা থেকেই এদের গান পছন্দ করি,-1,আমি ছোট বেলা থেকেই এদের গান পছন্দ করি,2024-12-19T20:37:46Z
UgyKA9NOCF_ueEg3AGl4AaABAg,"২০২৫ এ এসে আমার মতো কে কে এ গানটি শুনছেন, সবাইকে ধন্যবাদ❤❤❤",-1,"২০২৫ এ এসে আমার মতো কে কে এ গানটি শুনছেন, সবাইকে ধন্যবাদ",2025-02-15T15:29:44Z
UgypJ3FeGT5h_IEQVMx4AaABAg,এই গান গুলো যখন শুনি তখন অনেক স্মৃতি এখনো মনের মধ্যে দোলা দেয়।,-1,এই গান গুলো যখন শুনি তখন অনেক স্মৃতি এখনো মনের মধ্যে দোলা দেয়।,2024-12-27T15:19:40Z
Ugw0FsTYd8iAeUBA3oh4AaABAg,"চির সবুজ গান 
সেই দিন অনেক দুরে ফেলে এসেছি😢",-1,চির সবুজ গান সেই দিন অনেক দুরে ফেলে এসেছি,2025-03-29T16:54:48Z
Ugwqw2HJJgsAGYmng7x4AaABAg,পোড়া হৃদয়ের মানুষেরাই এই গানের কষ্ট বুঝতে পারেবন যারা শত কষ্ট হৃদয়ে চেপে রেখে মুখে সর্বদা হাসি রাখে,-1,পোড়া হৃদয়ের মানুষেরাই এই গানের কষ্ট বুঝতে পারেবন যারা শত কষ্ট হৃদয়ে চেপে রেখে মুখে সর্বদা হাসি রাখে,2025-07-29T21:13:59Z
UgyTfAziMjp1uPw4y9F4AaABAg,"যৌবনের প্রথম সোনা গানটি 2001 সালে, আজও খুব প্রিয়,কুমার শানুর গানে,আমাদের বাংলাদেশের শিল্পী রুমা খান গেয়ে,গানটি অপরূপ একসঙ্গীতে পরিণত হয়েছে।",-1,"যৌবনের প্রথম সোনা গানটি 2001 সালে, আজও খুব প্রিয়,কুমার শানুর গানে,আমাদের বাংলাদেশের শিল্পী রুমা খান গেয়ে,গানটি অপরূপ একসঙ্গীতে পরিণত হয়েছে।",2025-07-20T09:55:49Z
UgxewpguScdrlKXhTjN4AaABAg,"আমি কখনো প্রেম করিনি প্রেম কি বোজার আগেই আমার বিয়ে হয়ে যায়,  কিন্তু এখন এসব কালজয়ী গান গুলো শুনলে কেন জানি মনে হয়  জিবনে অনেক কিছু জানার বাকি আছে যা আমি কখনো জানতে পারিনি বুঝতে পারিনি",-1,"আমি কখনো প্রেম করিনি প্রেম কি বোজার আগেই আমার বিয়ে হয়ে যায়, কিন্তু এখন এসব কালজয়ী গান গুলো শুনলে কেন জানি মনে হয় জিবনে অনেক কিছু জানার বাকি আছে যা আমি কখনো জানতে পারিনি বুঝতে পারিনি",2025-05-23T12:29:38Z
Ugzje__UH3eQaBwGGmd4AaABAg,এই গানের সঙ্গে আমার জীবনের অনেক মিল আছে কখনো যদি এই গানটা কেউ শুনি আমার কথা খুব মনে পড়বে আমার প্রিয় মানুষটার কাছে,-1,এই গানের সঙ্গে আমার জীবনের অনেক মিল আছে কখনো যদি এই গানটা কেউ শুনি আমার কথা খুব মনে পড়বে আমার প্রিয় মানুষটার কাছে,2025-02-16T04:25:44Z
UgyCeRHF7TZ5__SMdPl4AaABAg,"2025
11,3,2025 সালে শুনতেছি অনুভূতি আগের মতই আছে । অনেক ভালোবাসি জান",-1,"2025 11,3,2025 সালে শুনতেছি অনুভূতি আগের মতই আছে । অনেক ভালোবাসি জান",2025-03-11T10:23:00Z
Ugxez3PftJk9zqFSOyl4AaABAg,"আমার ভীষণ ভীষণ প্রিয় একটি গান। ❤
২০২৫ সালে এসেও আমার মতো কে কে গানটি শুনছেন?",-1,আমার ভীষণ ভীষণ প্রিয় একটি গান। ২০২৫ সালে এসেও আমার মতো কে কে গানটি শুনছেন?,2025-03-15T12:54:23Z
Ugy4hg3dlpa96Ij1H394AaABAg,আমি  যখন এইধরনের গান শুনি তখন মনে হয় আমি ৯০ দশকে আছি,-1,আমি যখন এইধরনের গান শুনি তখন মনে হয় আমি ৯০ দশকে আছি,2024-11-24T13:12:54Z
UgzIIbcJmnR2WNC_g5J4AaABAg,"এই পৃথিবীর কোনো কিছুই স্থায়ী নয়,,
তবুও কিছু কথা, কিছু গান, কিছু সৃত্মি চিরকালই নতুন রূপে রয়ে যাবে,,
পৃথিবী ধ্বংশের পূর্ব মুহূর্ত পর্যন্ত,,,,",-1,"এই পৃথিবীর কোনো কিছুই স্থায়ী নয়,, তবুও কিছু কথা, কিছু গান, কিছু সৃত্মি চিরকালই নতুন রূপে রয়ে যাবে,, পৃথিবী ধ্বংশের পূর্ব মুহূর্ত পর্যন্ত,,,,",2024-01-18T23:06:15Z
Ugyjc4UESt5ABoIcrcZ4AaABAg,"তোমাকে পেয়ে গেলে হয়তো এই গান গুলো r শোনা হতো না প্রিয়,  অনেক মিস করি তোমাকে ❤",-1,"তোমাকে পেয়ে গেলে হয়তো এই গান গুলো r শোনা হতো না প্রিয়, অনেক মিস করি তোমাকে",2025-05-24T14:14:29Z
UgzUo25ZWQOj6JjuP4R4AaABAg,"বাস্তবিক
অনেক কিছু জীবনের সাথে মিলে যায়
কখনো কাউকে বলা হয় না
নিজের কাছে মৃত্য যন্ত্রনার চেয়ে ও বেশি  মনে হয়",-1,বাস্তবিক অনেক কিছু জীবনের সাথে মিলে যায় কখনো কাউকে বলা হয় না নিজের কাছে মৃত্য যন্ত্রনার চেয়ে ও বেশি মনে হয়,2025-05-23T01:20:27Z
Ugxr1jqXCaK60UHpNW94AaABAg,জীবনের ফেলে আসা স্মৃতি ভোলা খুবই কষ্টকর। গানটা যখন শুনি কমপক্ষে একটানা ১০ বার শুনি।,-1,জীবনের ফেলে আসা স্মৃতি ভোলা খুবই কষ্টকর। গানটা যখন শুনি কমপক্ষে একটানা ১০ বার শুনি।,2025-06-28T11:04:16Z
Ugx18Xl7hzPPm58BdYJ4AaABAg,অসাধারণ গানের কথা..by..masud karim♥♥ অসাধারণ সুর এবং মিউজিক কম্পোজ by..সুর স্রষ্ঠা Alauddin ali স্যার😍😍 লিজেন্ডরা একবারই জন্মায় বার বার নয়..ভালো থাকবেন ওপারে🙏🙏🙏,-1,অসাধারণ গানের কথা..by..masud karim অসাধারণ সুর এবং মিউজিক কম্পোজ by..সুর স্রষ্ঠা Alauddin ali স্যার লিজেন্ডরা একবারই জন্মায় বার বার নয়..ভালো থাকবেন ওপারে,2020-09-09T16:40:56Z
UgwwXN2ynfhBzZ-97xB4AaABAg,সুরের জাদুকর শ্রদ্ধেয়  আলাউদ্দিন আলীর এক অনবদ্য কালজয়ী সৃষ্টি। জীবনে কতবার যে এ গান শুনিছি  তা হিসাব করতে পারব না।,-1,সুরের জাদুকর শ্রদ্ধেয় আলাউদ্দিন আলীর এক অনবদ্য কালজয়ী সৃষ্টি। জীবনে কতবার যে এ গান শুনিছি তা হিসাব করতে পারব না।,2020-09-22T16:07:27Z
Ugyr4RDiTUjLacpNCul4AaABAg,2025  সালে কে কে এই গানটা শুনছো,-1,2025 সালে কে কে এই গানটা শুনছো,2025-01-05T03:15:17Z
Ugw7D6mwnl7pGeJGGIt4AaABAg,চিরো অমর হয়ে থাকবে গান গুলো আমার জিবনে .... রেডিওতে শুনতাম গান গুলো,-1,চিরো অমর হয়ে থাকবে গান গুলো আমার জিবনে .... রেডিওতে শুনতাম গান গুলো,2021-05-22T04:45:35Z
Ugz1XDZld8VlPGdjUlt4AaABAg,গানটি যতবার শুনছি বারবার শুধু শুনতেই ইচ্ছে করছে,-1,গানটি যতবার শুনছি বারবার শুধু শুনতেই ইচ্ছে করছে,2025-01-26T03:05:45Z
Ugw_67-rHKelAzfemPt4AaABAg,গানটা আমি প্রায়ই শুনি। এটা আমার হৃদয় ছুঁয়ে যায়।,-1,গানটা আমি প্রায়ই শুনি। এটা আমার হৃদয় ছুঁয়ে যায়।,2021-11-06T06:33:42Z
UgwenQx30jiQE7f-NWR4AaABAg,গানের কথাগুলো বাস্তব জিবনকে মনে করিয়ে দেয়।,-1,গানের কথাগুলো বাস্তব জিবনকে মনে করিয়ে দেয়।,2021-11-26T01:29:16Z
Ugwmvk4DwY3OnWMMa8N4AaABAg,মনে পরে গেল সেই অতিতের কথা বেকারত্বের অভিশাপের জন্য নিজের প্রিয়াকে অন্যের হতে।আজ চাকরি টাকা পয়সা সবই হয়েছে কিন্তু রয়ে গেছে সেই স্মৃতি যা আমাকে মাঝে মাঝে কাঁদায়।,-1,মনে পরে গেল সেই অতিতের কথা বেকারত্বের অভিশাপের জন্য নিজের প্রিয়াকে অন্যের হতে।আজ চাকরি টাকা পয়সা সবই হয়েছে কিন্তু রয়ে গেছে সেই স্মৃতি যা আমাকে মাঝে মাঝে কাঁদায়।,2024-08-22T20:27:41Z
Ugw7DFS09j-2WYbISD94AaABAg,এক।বুক। কষ্ট আমায়। দিয়ে ছ। হুমায়ূন ভালো। থেকে 😂,-1,এক।বুক। কষ্ট আমায়। দিয়ে ছ। হুমায়ূন ভালো। থেকে,2025-07-09T18:08:14Z
UgzLp5foGvU2r1-EfHh4AaABAg,গানের কথাগুলো একদম অসাধারণ এবং মন মাতানো সুর এবং ছন্দে ভরা যা বার বার শুনলেও মন ভরে না,-1,গানের কথাগুলো একদম অসাধারণ এবং মন মাতানো সুর এবং ছন্দে ভরা যা বার বার শুনলেও মন ভরে না,2021-05-12T17:26:04Z
UgxfAdSU5Cy6JR3YCPx4AaABAg,"এই গান গুলো সময়ের ইমোশন, যদিও তখন এত কিছু বুঝি না।
🥰🥰🥰",-1,"এই গান গুলো সময়ের ইমোশন, যদিও তখন এত কিছু বুঝি না।",2021-10-08T07:02:19Z
Ugw1zi7aYWARdYkme4F4AaABAg,কুমার শানু গানের ভগবান,-1,কুমার শানু গানের ভগবান,2021-05-04T07:32:29Z
UgxLq_dZIWqiG4grpJx4AaABAg,"আমি মরণেও কোনো ভয় পাইনা
শুধু তোমাকে চাই না",-1,আমি মরণেও কোনো ভয় পাইনা শুধু তোমাকে চাই না,2024-03-28T16:44:17Z
Ugygy930bNvW0ybrU7t4AaABAg,"2025 এসেও ইতালী থেকে শুনতেছি গান টা- 🇧🇩🇮🇹🇧🇩🇮🇹
আমি খুজে খুজে পুরনো দিনের গান গুলা শুনি অনেক ভালো লাগে আগের গান গুলাই- 💗
নতুন প্রজন্মের জন্য কমেন্ট রেখে গেলাম আগের গান তোমাদের কাছে হয়তো ভালো লাগে না -
কিন্তু তোমরা হয়তো জানো না এসব গান কখনো পুরনো হবে না -
বর্তমানের গান আগের গানের কাছে কিছুই না-  
  কারো লাইক পেলে নোটিফিকেশন পেয়ে আবার শুনতে আসবো-/",-1,2025 এসেও ইতালী থেকে শুনতেছি গান টা- আমি খুজে খুজে পুরনো দিনের গান গুলা শুনি অনেক ভালো লাগে আগের গান গুলাই- নতুন প্রজন্মের জন্য কমেন্ট রেখে গেলাম আগের গান তোমাদের কাছে হয়তো ভালো লাগে না - কিন্তু তোমরা হয়তো জানো না এসব গান কখনো পুরনো হবে না - বর্তমানের গান আগের গানের কাছে কিছুই না- কারো লাইক পেলে নোটিফিকেশন পেয়ে আবার শুনতে আসবো-/,2025-07-28T21:12:48Z
UgyA-DGvulcUEjlB_5l4AaABAg,মনে হয় 30 থেকে 35 বছর আগে এই গান শুনতাম। সারারাত জেগে ভিসিআর এই ছবি দেখতাম। কি যে মজার ছিল সেই দিনগুলো এখনো ভাবলে অবাক লাগে,-1,মনে হয় 30 থেকে 35 বছর আগে এই গান শুনতাম। সারারাত জেগে ভিসিআর এই ছবি দেখতাম। কি যে মজার ছিল সেই দিনগুলো এখনো ভাবলে অবাক লাগে,2025-10-04T17:29:39Z
UgzSMe5ZpCdvdp-ZbGN4AaABAg,2030 সালে এসে কে কে গানটি শুনলাম,-1,2030 সালে এসে কে কে গানটি শুনলাম,2024-05-09T15:31:02Z
UgzW2-limmRqfOZIJuN4AaABAg,আমি আমার  এক কাকার কন্ঠে শুনতাম তখন বুঝতেম না আমার কাকা অনেক সুন্দর গান গাইতো এখন বুঝি গান গুলো কি ছিলো যত শুনি ততো ভালো লাগে আমার কাকাও আর নেই ৪ বছর হইছে মারা গেছে,-1,আমি আমার এক কাকার কন্ঠে শুনতাম তখন বুঝতেম না আমার কাকা অনেক সুন্দর গান গাইতো এখন বুঝি গান গুলো কি ছিলো যত শুনি ততো ভালো লাগে আমার কাকাও আর নেই ৪ বছর হইছে মারা গেছে,2025-04-30T00:03:43Z
UgzpVsfyKmguUKQp8wF4AaABAg,এই সিনেমা টি 20 বছর আগে দেখেছি। খুব খুব ভালো লেগেছিল। 2025 কমেন্ট করলাম। পৃথিবীতে কত বাঁচবো জানিনা । গানটি ভালো লাগে । আমার কমেন্টে like দিলে আবার হয়ত গানটি শুনতে পাবো।,-1,এই সিনেমা টি 20 বছর আগে দেখেছি। খুব খুব ভালো লেগেছিল। 2025 কমেন্ট করলাম। পৃথিবীতে কত বাঁচবো জানিনা । গানটি ভালো লাগে । আমার কমেন্টে like দিলে আবার হয়ত গানটি শুনতে পাবো।,2025-08-09T15:58:50Z
Ugy2uxotWgzK2WUrIvB4AaABAg,"একসময় রেডিও ছাড়া একমুহূর্তোও চলতো না,,তার কারন হচ্ছে এইসব গান যা এখনো হৃদয়ে দাগ কাটে,,এই সব গান আর পৃথিবীতে কেউ সৃষ্টি করবে না আর যারা করতো তারা আর এই পৃথিবীতে নেই😢",-1,"একসময় রেডিও ছাড়া একমুহূর্তোও চলতো না,,তার কারন হচ্ছে এইসব গান যা এখনো হৃদয়ে দাগ কাটে,,এই সব গান আর পৃথিবীতে কেউ সৃষ্টি করবে না আর যারা করতো তারা আর এই পৃথিবীতে নেই",2023-11-13T19:19:55Z
Ugyun9chRDc8QzlCJgt4AaABAg,একজনকে ভালোবাসতাম অনন্তকালের জন্য তাকে পাইনি তবুও তার ভালোবাসা আমার মাঝে স্মৃতি হয়ে আছে,-1,একজনকে ভালোবাসতাম অনন্তকালের জন্য তাকে পাইনি তবুও তার ভালোবাসা আমার মাঝে স্মৃতি হয়ে আছে,2025-05-30T15:21:21Z
Ugx-O3Sgy1hyyIR_eFd4AaABAg,"আমি জাকে মন থেকে ভালোবাসতাম তাকে পেয়েছি তায় ত আমি সবসময় এখন আর টেনশন নেই আমার,, খুশি আমি,, ❤❤",-1,"আমি জাকে মন থেকে ভালোবাসতাম তাকে পেয়েছি তায় ত আমি সবসময় এখন আর টেনশন নেই আমার,, খুশি আমি,,",2025-01-26T16:08:00Z
Ugx6jHZyjMgERJPa3y14AaABAg,যদি তোমাকে পাওয়া হইত তবে মনে হয় এই গানটি এতো ভালো লাগতো না যত বার ততোই......,-1,যদি তোমাকে পাওয়া হইত তবে মনে হয় এই গানটি এতো ভালো লাগতো না যত বার ততোই......,2025-07-09T04:00:00Z
