id,text,label,clean_text,reference_time
UgwqsaN7tgpaf3ly4wJ4AaABAg,অতুলনীয় সুরমূর্ছনা যতবার শুনি অভিভূত হয়ে যাই,-1,অতুলনীয় সুরমূর্ছনা যতবার শুনি অভিভূত হয়ে যাই,2025-01-03T21:46:38Z
UgzOCqx5gvIbNXcK9md4AaABAg,মায়ের আদরের মত মধুমাখা কণ্ঠস্বর❤,-1,মায়ের আদরের মত মধুমাখা কণ্ঠস্বর,2025-01-08T10:41:07Z
Ugw4lVi5KV2nQ179m-d4AaABAg,গানের শুরু - মধ্য - শেষ সবেতেই যদি বিজ্ঞাপনের ঢল নামে তবে গান উপভোগ্য হবে কিভাবে?,-1,গানের শুরু - মধ্য - শেষ সবেতেই যদি বিজ্ঞাপনের ঢল নামে তবে গান উপভোগ্য হবে কিভাবে?,2025-03-19T07:01:55Z
Ugz4XkMqKpcyNQN_9dp4AaABAg,খুব ভালো লেগেছে গান সুপার,-1,খুব ভালো লেগেছে গান সুপার,2024-06-10T06:44:52Z
UgwNVcTu1T_XfUDbPsN4AaABAg,খুব সুন্দর গানগুলো ❤❤,-1,খুব সুন্দর গানগুলো,2025-01-07T04:27:46Z
Ugy4ozjXVWOLqTFnZWl4AaABAg,2025 সালেও এই গান গুলো শুনে সেই ছোট বেলার দিন গুলো মনে পরে গেলো যদিও আমরা 90স ছেলে কিন্তু ছোট্ট বেলায় যেকোনো অনুষ্টান হলেই এইগান গুলো শুনতে পেতাম দারুন লাগছে,-1,2025 সালেও এই গান গুলো শুনে সেই ছোট বেলার দিন গুলো মনে পরে গেলো যদিও আমরা 90স ছেলে কিন্তু ছোট্ট বেলায় যেকোনো অনুষ্টান হলেই এইগান গুলো শুনতে পেতাম দারুন লাগছে,2025-05-06T16:39:09Z
Ugx2mPsgMRDgv0UX_aV4AaABAg,খুব ছোট বেলায় তোমার গান শুনলে ভালো লাগতো  বরহয়ে  মানলাম আরতি মুখোপাধ্যায় এর গান।,-1,খুব ছোট বেলায় তোমার গান শুনলে ভালো লাগতো বরহয়ে মানলাম আরতি মুখোপাধ্যায় এর গান।,2024-05-27T15:25:39Z
UgzXQNejaURLu8EuLYB4AaABAg,"আহা কি সুন্দর, যেমন কথা তেমন সুর ও মিউজিক আর কন্ঠ, আমার ভাষা নেই।
দুঃখ বম্বের কিছু নামিজনেদের সহ্য হলনা।🙏🌹",-1,"আহা কি সুন্দর, যেমন কথা তেমন সুর ও মিউজিক আর কন্ঠ, আমার ভাষা নেই। দুঃখ বম্বের কিছু নামিজনেদের সহ্য হলনা।",2025-02-22T17:10:21Z
UgzVrx44SiWFKyX_ok94AaABAg,"0:00 টাপুর টুপুর সারা দুপুর
2:45 না বলে এসেছি
6:02 চিনেছি চিনেছি তোমারই মন 
9:10 ওগো মনের দুয়ারে
12:30 মাধবী মধুপে হল মিতালী
16:12 এই মোম জোছনায়",-1,0:00 টাপুর টুপুর সারা দুপুর 2:45 না বলে এসেছি 6:02 চিনেছি চিনেছি তোমারই মন 9:10 ওগো মনের দুয়ারে 12:30 মাধবী মধুপে হল মিতালী 16:12 এই মোম জোছনায়,2025-10-11T01:06:13Z
UgwMn-A-l6IvjWE8jWp4AaABAg,"আমার তখন ছয় বছর বয়স, দারুন sweet গান।",-1,"আমার তখন ছয় বছর বয়স, দারুন sweet গান।",2024-06-08T17:08:05Z
Ugx2s3ZwPw5vXhJgUcN4AaABAg,"যত শুনি তত মুগ্ধ হই / ফিরে যাই ফেলে আসা দিনে---, 
           জানি না আমার প্রিয় শিল্পী বর্তমানে কেমন আছেন??👌🌹👌🌹👌🌹",-1,"যত শুনি তত মুগ্ধ হই / ফিরে যাই ফেলে আসা দিনে---, জানি না আমার প্রিয় শিল্পী বর্তমানে কেমন আছেন??",2025-03-28T11:43:43Z
UgwfCs2jalaolrSSC8R4AaABAg,অসাধারণ এই সব গান কোনদিন পুরোনো হবেনা।,-1,অসাধারণ এই সব গান কোনদিন পুরোনো হবেনা।,2025-06-07T12:30:16Z
UgzHdq3GpCyIIVkyCYx4AaABAg,যেনো মৌচাক হতে সুন্দর মধুর সংঙ্গীত পরিবেশন করে চলেছেন।,-1,যেনো মৌচাক হতে সুন্দর মধুর সংঙ্গীত পরিবেশন করে চলেছেন।,2025-01-08T04:04:57Z
UgwHTdgNBj8FjKe91-F4AaABAg,মনটা খুশিতে ভরে উঠলো। এই মিষ্টি গলা অনেক কষ্টকে মুছে দেয়। ❤❤❤❤,-1,মনটা খুশিতে ভরে উঠলো। এই মিষ্টি গলা অনেক কষ্টকে মুছে দেয়।,2025-02-21T09:59:23Z
UgxrjOdoSabBGfyfXsF4AaABAg,"যত শুনি তত মুগ্ধ হই, পুরানো দিনের শিল্পীদের গান এখনো শুনতে ভালো লাগে। ❤❤",-1,"যত শুনি তত মুগ্ধ হই, পুরানো দিনের শিল্পীদের গান এখনো শুনতে ভালো লাগে।",2025-04-20T04:43:43Z
UgyUcrRWXRV24xxMfR94AaABAg,বরাবরের পছন্দের গান,-1,বরাবরের পছন্দের গান,2025-03-27T02:11:42Z
Ugx3frvzBTaVZNiBhpd4AaABAg,আমার প্রিয় শিল্পী বার বার শুনি দারুন লাগে,-1,আমার প্রিয় শিল্পী বার বার শুনি দারুন লাগে,2025-04-04T09:53:41Z
Ugz5xPo91EqTOM1AsSV4AaABAg,ওহ্ গান গুলোর কোনো কথা হবে না বার বার শুনলে ও আরও শুনতে ইচ্ছে করে।,-1,ওহ্ গান গুলোর কোনো কথা হবে না বার বার শুনলে ও আরও শুনতে ইচ্ছে করে।,2025-04-26T15:21:43Z
UgwRhkWT4yZeq5YNhg94AaABAg,কাছ থেকে শোনা মধুর স্মৃতি,-1,কাছ থেকে শোনা মধুর স্মৃতি,2025-02-17T14:20:32Z
UgwAKOwHhGXcEo8nvhh4AaABAg,B কী বলছ বাংলায় লেখো ।না হলে English এ।কিচ্ছু বুঝতে পারা গেলনা।,-1,B কী বলছ বাংলায় লেখো ।না হলে English এ।কিচ্ছু বুঝতে পারা গেলনা।,2025-07-01T05:36:07Z
UgxX4wCOaUBllpS9KVV4AaABAg,"আমার প্রিয় শিল্পী,এইসব গান কোন দিন পুরোন হবে না।",-1,"আমার প্রিয় শিল্পী,এইসব গান কোন দিন পুরোন হবে না।",2025-05-01T05:12:18Z
Ugw37Gf6sPGolRuoyzN4AaABAg,সত্যিই চিরদিনের গান❤❤❤,-1,সত্যিই চিরদিনের গান,2025-02-28T07:00:24Z
Ugw2VwyZsDdbtP5sYuV4AaABAg,"টাপুর টুপুর সারা দুপুর নূপুর বাজায় কে
যেন এক কাজলা মেয়ে,
কাজল কাজল মেঘের আঁচল শুধুই ওড়ায় কে
যেন এক কাজলা মেয়ে।

যেন তার বাদলা মনের শাপলা ফুলের একটি কলি
ওঠে আজ অকারণে ক্ষণে ক্ষণে চঞ্চলী,
যেন তার বাদলা মনের শাপলা ফুলের একটি কলি
ওঠে আজ অকারণে ক্ষণে ক্ষণে চঞ্চলী,
চরণে রিনিক ঝিনিক ঝর্না ঝরায় কে?
যেন এক কাজলা মেয়ে।
টাপুর টুপুর সারা দুপুর নূপুর বাজায় কে
যেন এক কাজলা মেয়ে।

কত না অভিমানে মানের পালা সাঙ্গ করে যায়
নতুন নতুন ছন্দ কোথা শুধুই ভেবে পায়,
কত না অভিমানে মানের পালা সাঙ্গ করে যায়
নতুন নতুন ছন্দ কোথা শুধুই ভেবে পায়,
যেন তার মেঘলা দিনের একলা মনের কতই খেলা
ভেবে তাই নিরিবিলি আলো ছায়ায় যায় রে বেলা,
যেন তার মেঘলা দিনের একলা মনের কতই খেলা
ভেবে তাই নিরিবিলি আলো ছায়ায় যায় রে বেলা,
মনেতে ক্ষণিক আলো আঁধার ভরায় কে?
যেন এক কাজলা মেয়ে।


টাপুর টুপুর সারা দুপুর নূপুর বাজায় কে
যেন এক কাজলা মেয়ে,
কাজল কাজল মেঘের আঁচল শুধুই ওড়ায় কে
যেন এক কাজলা মেয়ে,
টাপুর টুপুর সারা দুপুর নূপুর বাজায় কে
যেন এক কাজলা মেয়ে।

টাপুর টুপুর সারা দুপুর নূপুর বাজায় কে গানের লিরিক্স লিখেছেন সুনিল বরণ।",-1,"টাপুর টুপুর সারা দুপুর নূপুর বাজায় কে যেন এক কাজলা মেয়ে, কাজল কাজল মেঘের আঁচল শুধুই ওড়ায় কে যেন এক কাজলা মেয়ে। যেন তার বাদলা মনের শাপলা ফুলের একটি কলি ওঠে আজ অকারণে ক্ষণে ক্ষণে চঞ্চলী, যেন তার বাদলা মনের শাপলা ফুলের একটি কলি ওঠে আজ অকারণে ক্ষণে ক্ষণে চঞ্চলী, চরণে রিনিক ঝিনিক ঝর্না ঝরায় কে? যেন এক কাজলা মেয়ে। টাপুর টুপুর সারা দুপুর নূপুর বাজায় কে যেন এক কাজলা মেয়ে। কত না অভিমানে মানের পালা সাঙ্গ করে যায় নতুন নতুন ছন্দ কোথা শুধুই ভেবে পায়, কত না অভিমানে মানের পালা সাঙ্গ করে যায় নতুন নতুন ছন্দ কোথা শুধুই ভেবে পায়, যেন তার মেঘলা দিনের একলা মনের কতই খেলা ভেবে তাই নিরিবিলি আলো ছায়ায় যায় রে বেলা, যেন তার মেঘলা দিনের একলা মনের কতই খেলা ভেবে তাই নিরিবিলি আলো ছায়ায় যায় রে বেলা, মনেতে ক্ষণিক আলো আঁধার ভরায় কে? যেন এক কাজলা মেয়ে। টাপুর টুপুর সারা দুপুর নূপুর বাজায় কে যেন এক কাজলা মেয়ে, কাজল কাজল মেঘের আঁচল শুধুই ওড়ায় কে যেন এক কাজলা মেয়ে, টাপুর টুপুর সারা দুপুর নূপুর বাজায় কে যেন এক কাজলা মেয়ে। টাপুর টুপুর সারা দুপুর নূপুর বাজায় কে গানের লিরিক্স লিখেছেন সুনিল বরণ।",2024-12-21T05:39:29Z
UgwdXGJ5vCCdc3megpZ4AaABAg,"অপূর্ব কণ্ঠস্বর তুলনা হীন , ছোটবেলায় ফেরা হলো ,",-1,"অপূর্ব কণ্ঠস্বর তুলনা হীন , ছোটবেলায় ফেরা হলো ,",2024-06-21T07:52:22Z
UgyZJKNGTux9ySZosZN4AaABAg,সত্যি বলছি তোমাদের মোতো 😊 দেবি ছিলো বলে এখনো পর্যন্ত বেঁচে থাকার ইচ্ছা জন্মায়। ❤ ভালো থাকবেন,-1,সত্যি বলছি তোমাদের মোতো দেবি ছিলো বলে এখনো পর্যন্ত বেঁচে থাকার ইচ্ছা জন্মায়। ভালো থাকবেন,2025-05-06T05:51:19Z
UgxUsH1N4FWQ2t0rHOd4AaABAg,এই সব গান চিরকাল অমর ছিল আছে এবং থাকবে,-1,এই সব গান চিরকাল অমর ছিল আছে এবং থাকবে,2025-01-21T11:52:06Z
Ugyypyl-BlJ115T2fdN4AaABAg,অপুর্ব সুন্দর শুভেচ্ছা রইল মনোমুগ্ধকর সঙ্গীত। যদি নতুন কিছু গান সুনান খুব ভালো লাগে।,-1,অপুর্ব সুন্দর শুভেচ্ছা রইল মনোমুগ্ধকর সঙ্গীত। যদি নতুন কিছু গান সুনান খুব ভালো লাগে।,2025-07-15T13:21:31Z
Ugy1gGdHeK9hL3Qm6rR4AaABAg,"দুপুর বেলায় মাদুর পেতে কানের পাশে রেডিও, সেইসব ছোটবেলার দিন মনে পড়ে গেল ❤️, ২৯/৫/২৫",-1,"দুপুর বেলায় মাদুর পেতে কানের পাশে রেডিও, সেইসব ছোটবেলার দিন মনে পড়ে গেল ️, ২৯/৫/২৫",2025-05-29T11:22:56Z
UgyKLIDtlvq39psVWQ94AaABAg,হু ঠিক বলে ছেন🌹,-1,হু ঠিক বলে ছেন,2025-04-15T04:54:42Z
UgwyHjM4lOVTpYi05D14AaABAg,"স্মৃতি রেখে গেলাম, লাইক করলে গানটা আবার শুনতে আসবো ",-1,"স্মৃতি রেখে গেলাম, লাইক করলে গানটা আবার শুনতে আসবো",2025-08-21T06:39:27Z
UgygJp2dyeVHb5rkwiN4AaABAg,সারা দিন শুনলে ও বোর হবো না,-1,সারা দিন শুনলে ও বোর হবো না,2025-04-21T10:44:54Z
UgxQlIUmSe4pP4kIUBZ4AaABAg,আমার প্রিয় শিল্পী।,-1,আমার প্রিয় শিল্পী।,2025-04-05T18:12:23Z
UgyRXHHpar3gywnsSHF4AaABAg,অসাধারণ লাগছে শুনতে।এসব গান পুরনো হবে না।,-1,অসাধারণ লাগছে শুনতে।এসব গান পুরনো হবে না।,2025-07-15T00:43:09Z
UgwxifjUu1j6FIQHPlJ4AaABAg,অসাধারণ সুন্দর গান গুলো,-1,অসাধারণ সুন্দর গান গুলো,2025-05-27T17:18:30Z
Ugx2lVOWf2kzAxTK-RR4AaABAg,আমার প্রিয় শিল্পী,-1,আমার প্রিয় শিল্পী,2025-10-18T06:47:36Z
UgxS19VlTw1gNbP235l4AaABAg,বিজ্ঞাপন কমানো যায় না?,-1,বিজ্ঞাপন কমানো যায় না?,2025-04-17T04:03:16Z
UgxZ8SZfkwSQ9A8B-at4AaABAg,শুভ পি সাজ ❤🥰🥰🥰😍😍,-1,শুভ পি সাজ,2025-04-14T03:46:09Z
UgzWZopvB2at_6KK9jp4AaABAg,একটি গান ভালো করে শুনব কেমন করে? খালি একগাদা অ‍্যাড।,-1,একটি গান ভালো করে শুনব কেমন করে? খালি একগাদা অ্যাড।,2025-05-30T03:49:21Z
UgyIPhji30TsgpNSUoh4AaABAg,স্বর্ণযুগের বিখ‍্যাত শিল্পী,-1,স্বর্ণযুগের বিখ্যাত শিল্পী,2025-11-27T16:46:04Z
Ugxsnb8tcp3gmv_O_ep4AaABAg,এই গানগুলো শুনলে মন ভালো হয়ে যায় ❤,-1,এই গানগুলো শুনলে মন ভালো হয়ে যায়,2025-12-19T14:12:02Z
UgzvUxX2xsuA-wjRI9V4AaABAg,এমন মন মাতানো গান খুব কম প্রচলিত হয়,-1,এমন মন মাতানো গান খুব কম প্রচলিত হয়,2025-07-15T13:26:03Z
UgyGgb5YKiefjXoRx7x4AaABAg,খুব ভালো লাগলো আমার প্রিয় গান গুলো শুনে। ধন্যবাদ কৌশিক বাবু।,-1,খুব ভালো লাগলো আমার প্রিয় গান গুলো শুনে। ধন্যবাদ কৌশিক বাবু।,2025-06-07T16:02:50Z
UgzCAyZ1r7mXhPU4nI14AaABAg,2026 এসে কে কে শুনছো Swarna যুগের গান গুলি।,-1,2026 এসে কে কে শুনছো Swarna যুগের গান গুলি।,2025-12-17T08:27:11Z
UgxWG9ZaEPoND4ndvIB4AaABAg,এই গানগুলো কোনোদিন পুরনো হবে না। এসব গান চিরদিন স্মৃতি হয়ে থেকে যাবে ।,-1,এই গানগুলো কোনোদিন পুরনো হবে না। এসব গান চিরদিন স্মৃতি হয়ে থেকে যাবে ।,2025-06-05T03:18:59Z
Ugy3G0aqErKY-xPJd0p4AaABAg,মনের গান প্রানের গান।❤,-1,মনের গান প্রানের গান।,2025-10-18T05:54:38Z
UgzCOTu8Uwg-uptvF8R4AaABAg,এ গান আমার মনের মধ্য এদাকাটার মতো দাগ কেটে যায় কটা,-1,এ গান আমার মনের মধ্য এদাকাটার মতো দাগ কেটে যায় কটা,2025-07-09T16:59:49Z
UgwBT-Kz10ybGkH1l_94AaABAg,চলে এলাম গানের দেশে   ❤️❤️❤️❤️,-1,চলে এলাম গানের দেশে ️️️️,2025-07-15T23:53:11Z
UgyfVTRTZ3WxiDoiZWB4AaABAg,খুব ভালো লাগে তাই বারে বারে শুনি।,-1,খুব ভালো লাগে তাই বারে বারে শুনি।,2025-10-27T05:39:41Z
UgwDbY7IYzSkujROYkF4AaABAg,"এই কণ্ঠ, এই সুর, এই গায়াকি, এই মিউজিশিয়ান,আর কোথায় ? কি অসাধারণ প্রতিভা ! 🙏🙏🙏🙏🙏🙏🙏🙏",-1,"এই কণ্ঠ, এই সুর, এই গায়াকি, এই মিউজিশিয়ান,আর কোথায় ? কি অসাধারণ প্রতিভা !",2025-11-29T16:29:51Z
Ugzbx4W9YJ6EBnlcxkp4AaABAg,❤❤❤❤ সত্যিই গান শুনে মনটা ভালো হয়ে গেল ❤❤❤❤,-1,সত্যিই গান শুনে মনটা ভালো হয়ে গেল,2025-12-06T05:33:31Z
UgzPQs6k4Yu9Uib4N3h4AaABAg,মন মোর মুগ্ধ  হলো  গান শুনে   ❤️❤️❤️,-1,মন মোর মুগ্ধ হলো গান শুনে ️️️,2025-07-09T12:59:41Z
UgzCDTa-_fpj7e3NbFF4AaABAg,গান গুলো শুনে আমি নিজে কে তরুণ মনে হয়,-1,গান গুলো শুনে আমি নিজে কে তরুণ মনে হয়,2025-10-19T09:57:02Z
UgwyAIRozgrg2clUnTV4AaABAg,কথাগুলি মনে থাকলেই হবে,-1,কথাগুলি মনে থাকলেই হবে,2025-04-21T18:13:52Z
UgxnEWicVVMTS9CQsdx4AaABAg,চালাও সবাই দুর্গাপূজা স্পেশাল,-1,চালাও সবাই দুর্গাপূজা স্পেশাল,2025-09-15T04:46:58Z
UgzX1dCMqdctYcT1HCh4AaABAg,শুধু  একটাই কথা বলবো অপূর্ব,-1,শুধু একটাই কথা বলবো অপূর্ব,2025-07-29T11:45:16Z
UgwIx-SL-HGXqgkIWz94AaABAg,"এ ""সুন্দর"" কে :- সুন্দর বলার অপেক্ষা  রাখে না.....!",-1,"এ ""সুন্দর"" কে :- সুন্দর বলার অপেক্ষা রাখে না.....!",2025-07-29T04:02:21Z
UgzyT9gn8BOJRlfamb54AaABAg,সুন্দর গান গুলো ।,-1,সুন্দর গান গুলো ।,2025-06-08T16:24:32Z
UgwFCcbuCDGpbQ8eNgF4AaABAg,দারুন লাগলো মন টা জুড়িয়ে গেলো,-1,দারুন লাগলো মন টা জুড়িয়ে গেলো,2025-07-27T17:27:26Z
Ugz9N2GUjpZa5q2FpHF4AaABAg,মন ছুঁয়ে যাওয়া গান ❤❤❤,-1,মন ছুঁয়ে যাওয়া গান,2025-06-16T01:56:19Z
UgzqQ8cdLAS2-PYZWN54AaABAg,"গান  আমার  প্রিয়  প্রেম  গান  আমার  টান  

🌹🙏🌹🙏🌹🙏🌹🙏🌹🙏🌹🙏🌹",-1,গান আমার প্রিয় প্রেম গান আমার টান,2025-06-18T02:33:28Z
UgwLQLWfxXPU7UyFA9Z4AaABAg,"শ্রী হেমন্ত মুখোপাধ্যায় এর বাড়ি বহরু তে 
আমার বাড়ি ও বহরু তে",-1,শ্রী হেমন্ত মুখোপাধ্যায় এর বাড়ি বহরু তে আমার বাড়ি ও বহরু তে,2025-09-16T14:58:43Z
UgxSpH03bHVcdyLfz554AaABAg,Purano ganer tulona হয় না darun lage l,-1,Purano ganer tulona হয় না darun lage l,2025-08-31T11:34:19Z
UgzGLU8iNBMNQNMIaSZ4AaABAg,এক কথায় অসাধারণ,-1,এক কথায় অসাধারণ,2025-12-18T07:20:59Z
Ugx42r1F199iRhd2ZZl4AaABAg,"কৌশিক রায়  বাবুকে অনেক অনেক ধন্যবাদ  
হেমন্ত মুখোপাধ্যায় এর গান শোনানোর জন্য",-1,কৌশিক রায় বাবুকে অনেক অনেক ধন্যবাদ হেমন্ত মুখোপাধ্যায় এর গান শোনানোর জন্য,2025-06-16T10:41:33Z
UgwSlix742mbgAAnJNx4AaABAg,দশটি কালজয়ী গান l ধন্যবাদ কৌশিক বাবু l,-1,দশটি কালজয়ী গান l ধন্যবাদ কৌশিক বাবু l,2025-08-24T06:16:33Z
UgxzcIfdONnpePe5aOZ4AaABAg,এই অসাধারণ গান গুলির জন্য আমরা আজ বেঁচে আছি।,-1,এই অসাধারণ গান গুলির জন্য আমরা আজ বেঁচে আছি।,2025-06-08T12:40:12Z
UgwOBe3HC0tWttax2pB4AaABAg,অসাধারণ। আজকের। দিনে।কজন।বাঙালি।এই।অমর।শিল্পীর। গান।শুনে।,-1,অসাধারণ। আজকের। দিনে।কজন।বাঙালি।এই।অমর।শিল্পীর। গান।শুনে।,2025-08-18T15:34:11Z
UgwoQCbRsqak_0yFMat4AaABAg,কালজয়ী গানের সংকলন-ধন্যবাদ,-1,কালজয়ী গানের সংকলন-ধন্যবাদ,2025-07-27T06:58:12Z
UgwqtawXNuwJKVWmiZp4AaABAg,"এত মিষ্টি গলা শুনতে ২ নিজেকে হারিয়ে ফেলি।এই গলা আর শুনিনি,শুনবো না।আমার প্রণাম তোমায় শিল্পী।",-1,"এত মিষ্টি গলা শুনতে ২ নিজেকে হারিয়ে ফেলি।এই গলা আর শুনিনি,শুনবো না।আমার প্রণাম তোমায় শিল্পী।",2025-08-03T19:15:25Z
UgzOU9LTWgllIC0Ftxl4AaABAg,যুগের পর যুগ এই গানের আবেদন থেকে যাবে ❤❤❤,-1,যুগের পর যুগ এই গানের আবেদন থেকে যাবে,2025-05-02T16:38:57Z
