id,text,label,clean_text,reference_time
UgzNcksirwyzs5so-4R4AaABAg,"আমার no.-1,2এর গান দুটি প্রিয়",1,"আমার no.-1,2এর গান দুটি প্রিয়",2025-10-21T04:18:29Z
UgzxEP8ulTk5uN8BJuN4AaABAg,মন ভাঙ্গা আয়না টা কোথায় ???,1,মন ভাঙ্গা আয়না টা কোথায় ???,2025-10-11T04:40:03Z
UgyugIJQEP7L1yGlMK14AaABAg,সব গান গুলো আমার খুবই ভালো লাগে ❤❤❤❤❤😢😢😢,0,সব গান গুলো আমার খুবই ভালো লাগে,2025-11-19T14:17:29Z
UgwenIpHq_m6Of1fxzV4AaABAg,জুবিন দা ছোট বেলা থেকেই তোমার গান শুনে বড় হয়েছি জুবিন দা এখন তুমি আমাদের মাঝে নেই 😅💔😭😭😭😭,1,জুবিন দা ছোট বেলা থেকেই তোমার গান শুনে বড় হয়েছি জুবিন দা এখন তুমি আমাদের মাঝে নেই,2025-10-09T10:55:17Z
Ugzs_y0QM3CEr4xrFHN4AaABAg,খুব সুন্দর ❤️❤️🙌🏻,1,খুব সুন্দর ️️🏻,2025-12-14T03:42:45Z
UgwgOE99hEWNahVOVF54AaABAg,I. Miss you জুবিন দা 😢😢😢😢,1,I. Miss you জুবিন দা,2025-10-09T10:38:38Z
UgzgDLAuLtZ1tE8qpjJ4AaABAg,ওর গানের সাথে প্রত্যেকটা কথা যেন একদম,1,ওর গানের সাথে প্রত্যেকটা কথা যেন একদম,2025-10-11T17:31:40Z
UgzCdzHnf7Zz4YitJEF4AaABAg,দাদা আমার এগুলোপ্রয়োগানটা❤❤❤❤❤,1,দাদা আমার এগুলোপ্রয়োগানটা,2025-12-19T07:07:37Z
UgyEk6yLs0iYTmCz6wR4AaABAg,২ ও ৩ আমার খুবই প্রিয়,1,২ ও ৩ আমার খুবই প্রিয়,2025-11-02T15:48:32Z
UgyVN6fTrn86gtZ_aeB4AaABAg,মায়াবিনি তো ওয়ালাদের কথা ছিল😢😢😢😢😢😢😢❤❤❤❤❤❤,0,মায়াবিনি তো ওয়ালাদের কথা ছিল,2025-10-10T02:13:54Z
UgzB2Fph6a2NCEITYvZ4AaABAg,ও জানু আমাদের মধ্যে এখনও বেঁচে আছে,1,ও জানু আমাদের মধ্যে এখনও বেঁচে আছে,2025-10-11T17:31:54Z
Ugxb7gQd0UofjJUX63R4AaABAg,তুমি জুবিন গানের ফ্যান,1,তুমি জুবিন গানের ফ্যান,2025-10-12T07:10:21Z
UgxWNPNH5zQ2D7EgiPl4AaABAg,আমি এই গানটা শুনেছি,1,আমি এই গানটা শুনেছি,2025-10-10T17:29:42Z
UgwPeRfJBGeqUT-CPS14AaABAg,এতো তাড়াতাড়ি চলে গেলা 😢😢😢,1,এতো তাড়াতাড়ি চলে গেলা,2025-12-16T20:30:03Z
Ugzb26SZNNPm79QsbIB4AaABAg,আরে দাদা এসব স্মৃতি মনে করো না দাদা,0,আরে দাদা এসব স্মৃতি মনে করো না দাদা,2025-10-11T17:31:21Z
Ugy62K-lY-f4BxN8Inp4AaABAg,আয়না মন ভাঙা আয়না গান কোথায়,1,আয়না মন ভাঙা আয়না গান কোথায়,2025-12-01T03:09:47Z
UgxnslUiiwoK1-6jCFR4AaABAg,৫৪😂😂😂 এই গানটা জানিনা❤❤❤,0,৫৪ এই গানটা জানিনা,2025-10-12T02:49:20Z
UgxpE2pBm0mEJKhoMf14AaABAg,দেব গান করছে😂😂😂😂😂জিয়ে হালকা ঝারছে😂😂😂😂😂😂😂😂😂😂😂❤❤❤❤😂😂😂😂😂😂😂,1,দেব গান করছেজিয়ে হালকা ঝারছে,2025-10-20T14:11:43Z
Ugx3me7uibbt404gUXl4AaABAg,উদ্ধার যা হচ্ছে হচ্ছে তো ভাই তুমি টাকা কামাও,0,উদ্ধার যা হচ্ছে হচ্ছে তো ভাই তুমি টাকা কামাও,2025-10-11T04:15:12Z
UgzexPLlRBvBtkTydTV4AaABAg,ওগো আমার নিঃস্বার্থ ভালোবাসা দিবসে মুক্তি পাবে বলে 😮😮,1,ওগো আমার নিঃস্বার্থ ভালোবাসা দিবসে মুক্তি পাবে বলে,2025-11-11T13:47:21Z
UgwB0MEvD1IeIgYH5eR4AaABAg,কমেন্ট টা রেখে গেলাম কেউ জদি লাইক দেয় হয়তোবা আবার আসবো গান টা সুনার জন্য,1,কমেন্ট টা রেখে গেলাম কেউ জদি লাইক দেয় হয়তোবা আবার আসবো গান টা সুনার জন্য,2025-11-30T07:13:38Z
Ugz1sCWx1WqsKaBq8754AaABAg,❤ কর্মগুণে মানুষ নষ্ট রাইট গান,1,কর্মগুণে মানুষ নষ্ট রাইট গান,2025-10-14T14:32:27Z
UgykC9aYoUt-Ljl9KZZ4AaABAg,একদম ঠিক বলেছেন,0,একদম ঠিক বলেছেন,2025-08-18T04:16:35Z
UgxYAJLVwNYFwEgVQEF4AaABAg,এক  চলৰে মন‌,1,এক চলৰে মন,2025-08-10T17:21:41Z
UgxO2JKKzg-TQQTSTvJ4AaABAg,উকিল মুন্সির গান,1,উকিল মুন্সির গান,2025-09-06T16:11:35Z
UgxrdIZxxi2VZ0LtJQ94AaABAg,গান টি ইস্কুলে আসো সেচ,1,গান টি ইস্কুলে আসো সেচ,2025-12-03T17:55:37Z
UgwA2WiNJENGJ4iiaF54AaABAg,বাবা কথা মনে  পড়ছে,1,বাবা কথা মনে পড়ছে,2025-08-18T19:08:38Z
UgwyhIzx1tGl8pVUJzR4AaABAg,আমি 21 বছরের ছেলে ।আমি প্রতিদিন রাতে এই গান শুনে ঘুমাই,1,আমি 21 বছরের ছেলে ।আমি প্রতিদিন রাতে এই গান শুনে ঘুমাই,2025-08-05T16:17:45Z
Ugxlmdrx0KuX5vZvOX54AaABAg,জি জি। জিপি জ জ😢 😢 😢ও জ। জ্জ জ জ,1,জি জি। জিপি জ জ ও জ। জ্জ জ জ,2025-08-30T04:10:17Z
Ugwab0brRraMsKmVdPh4AaABAg,আমি অনেক সুনছি আমার অনেক কষ্ট  লাগে আমারকে কে ভালোবাসা দেউ,1,আমি অনেক সুনছি আমার অনেক কষ্ট লাগে আমারকে কে ভালোবাসা দেউ,2025-08-19T08:30:28Z
UgweEYJZGAoUXcTo6zJ4AaABAg,অসাধারণ অসাধারণ সালটা হলো ২৫ তার একটা হলো আর্ট,1,অসাধারণ অসাধারণ সালটা হলো ২৫ তার একটা হলো আর্ট,2025-08-06T22:25:27Z
Ugw6vNuRX-Q01GUEFC14AaABAg,অনেক সুন্দৰ গানটা ❤❤❤❤❤❤❤❤❤❤❤❤❤❤❤❤❤❤❤❤❤❤,1,অনেক সুন্দৰ গানটা,2025-08-27T11:29:39Z
UgxBxYLCUuXVkZowQcF4AaABAg,বাস্তব অবস্থার কথা বলছেন একদম ঠিক,0,বাস্তব অবস্থার কথা বলছেন একদম ঠিক,2025-08-17T03:19:30Z
Ugx_hv5t7yU3cv3yDR94AaABAg,গান টা কেনো যানি বাস্তব জীবনের মত মনে হয়,1,গান টা কেনো যানি বাস্তব জীবনের মত মনে হয়,2025-08-21T08:50:32Z
UgxG1TTjPVXLecAFWR94AaABAg,"আমি একজনকে ভালোবাসি,কিন্তু আমিও জানিনা তার দেখা পাবো কি পাবো না,
তার জন্য আমি কমেন্টটা রেখে গেলাম,,

খুব ভালোবাসি তাকে😢",1,"আমি একজনকে ভালোবাসি,কিন্তু আমিও জানিনা তার দেখা পাবো কি পাবো না, তার জন্য আমি কমেন্টটা রেখে গেলাম,, খুব ভালোবাসি তাকে",2025-08-11T08:57:36Z
Ugy6kXd-qdcotbnXybJ4AaABAg,মন মাতানো গান গুলো 😊,1,মন মাতানো গান গুলো,2025-08-02T22:24:37Z
Ugzdonzzu_doRRfG-pN4AaABAg,অসাধারণ সুন্দর গান গুলো ❤❤❤❤❤ শুনে আমার মনে খুব কান্না চলে এলো 😢😢,1,অসাধারণ সুন্দর গান গুলো শুনে আমার মনে খুব কান্না চলে এলো,2025-09-05T17:27:32Z
UgzIu3BlJ0GnHhVcyiB4AaABAg,ইনশাআল্লাহ দোয়া করি এগিয়ে যাও পাশে আছি পারবা দেখাও উড়তে,1,ইনশাআল্লাহ দোয়া করি এগিয়ে যাও পাশে আছি পারবা দেখাও উড়তে,2025-08-02T16:15:00Z
UgyZ-eIB1YzpU8ZMefF4AaABAg,ভালো লাগছে ভাই,0,ভালো লাগছে ভাই,2025-08-14T08:32:17Z
UgyXz39GEfDy84d3adJ4AaABAg,মন খারাপ হলে এই গান গুলো শুনিম😢,1,মন খারাপ হলে এই গান গুলো শুনিম,2025-08-05T07:53:12Z
UgxUW1PokYKqaPcsWtx4AaABAg,অসাধারণ একটা মুহূর্ত তৈরি হয় এই গানগুলি শুনলে,1,অসাধারণ একটা মুহূর্ত তৈরি হয় এই গানগুলি শুনলে,2025-08-13T19:11:40Z
Ugw54hkAPWOy0UTK07h4AaABAg,গানটি ভাল লেগেছে❤,0,গানটি ভাল লেগেছে,2025-08-04T08:26:12Z
UgwfElwoEilJ76U0pf54AaABAg,খুব সুন্দর অসাধারণ একটি গান মনের মতন গানটা পাইলাম,1,খুব সুন্দর অসাধারণ একটি গান মনের মতন গানটা পাইলাম,2025-08-12T18:19:12Z
Ugwyn03kjm9op5poWV54AaABAg,অনেক সুন্দর গান শুনে বালো লাগলো ❤❤❤❤❤,1,অনেক সুন্দর গান শুনে বালো লাগলো,2025-08-11T07:47:03Z
UgzQcV4zLxjBrWvIzjl4AaABAg,"গান গুলো পুরাই আগুন , -Mind Blowing",1,"গান গুলো পুরাই আগুন , -Mind Blowing",2025-09-18T10:35:35Z
UgyJT7XJ3vwZcBEo-rd4AaABAg,গান গুলো দেখে মনটা স্নিগ্ধ হয়ে গেছে ❤❤❤❤,1,গান গুলো দেখে মনটা স্নিগ্ধ হয়ে গেছে,2025-08-03T15:23:42Z
Ugy_XHAoksJvDbnAg6R4AaABAg,"গানগুলো অনেক ভালো ,❤❤❤❤❤",0,"গানগুলো অনেক ভালো ,",2025-08-04T10:04:02Z
UgxJAo4mvdv-voGRvm54AaABAg,ভালো একটা গান,0,ভালো একটা গান,2025-08-07T12:09:41Z
Ugz2UaM5OAjc5mKQGYZ4AaABAg,খুব ভালো লাগে আমার এ গান গুলো শুনতে,1,খুব ভালো লাগে আমার এ গান গুলো শুনতে,2025-08-20T16:29:56Z
Ugy3SW9I3MSRGyumdth4AaABAg,❤ গানগুলো অন্তরের গাতা গান,1,গানগুলো অন্তরের গাতা গান,2025-10-14T14:31:41Z
Ugyrfg-DYvMGmehs9sN4AaABAg,অনেক অনেক সুন্দর একটা গান,1,অনেক অনেক সুন্দর একটা গান,2025-08-21T08:49:01Z
UgwmvL9Qo16nomnvUSB4AaABAg,অসাধারণ একটা গান শুনে বালো লাগলো ❤❤,1,অসাধারণ একটা গান শুনে বালো লাগলো,2025-08-11T07:48:00Z
UgyMC2qI6HG83pRN8il4AaABAg,গানটা সেইরকম লাগছে ❤,1,গানটা সেইরকম লাগছে,2025-09-08T20:56:35Z
UgzuvC6IHr4oY_xxHM54AaABAg,গানটা অনেক অসাধারণ লাগছে,1,গানটা অনেক অসাধারণ লাগছে,2025-09-02T18:07:18Z
Ugz2ZW0_9RfvONGBzD54AaABAg,অসাধারণ সবগুলো গান অনেক সুন্দর ❤,0,অসাধারণ সবগুলো গান অনেক সুন্দর,2025-11-12T16:21:22Z
UgxW8uGndQpIzmvPt914AaABAg,গানটা অসাধারণ লাগছে,1,গানটা অসাধারণ লাগছে,2025-12-05T13:40:20Z
UgyH__scpnZ6dR55BKt4AaABAg,অনেক সুন্দর গান এই গানগুলো আমি শুনলাম 2025 সাল 9 মাস 29 তারিখ তবে গান শুনলে হবে না আমাদের আল্লাহর পথে আসতে হবে আমরা একে অপরের জন্য সব সময় দোয়া করব,1,অনেক সুন্দর গান এই গানগুলো আমি শুনলাম 2025 সাল 9 মাস 29 তারিখ তবে গান শুনলে হবে না আমাদের আল্লাহর পথে আসতে হবে আমরা একে অপরের জন্য সব সময় দোয়া করব,2025-09-29T18:39:54Z
UgyrAxGdXektu-SqyGt4AaABAg,❤ অসাধারণ ❤গানটি অনেক❤ ভালো লাগছে❤ আপনার এই❤ ❤গানগুলো❤,1,অসাধারণ গানটি অনেক ভালো লাগছে আপনার এই গানগুলো,2025-08-10T20:01:37Z
UgxDgzgCOFI_PiJ0biZ4AaABAg,বাস্তবের সাথে অনেক মিল গানের।,1,বাস্তবের সাথে অনেক মিল গানের।,2025-08-26T15:51:09Z
UgyMwD6m3KEJx5mj9i14AaABAg,অসাধারণ গান গুলা❤❤❤❤❤,0,অসাধারণ গান গুলা,2025-08-04T01:57:21Z
UgwGjsAuUcdth8yv13N4AaABAg,অনেক সুন্দর একটা গান শুনলাম গান শুনে মুগ্ধ হয়ে গেলাম গানটা খুব গানটা যে গেছেন তাকে ধন্যবাদ যে ইউ টিভি চ্যানেল তাকেও ধন্যবাদ,1,অনেক সুন্দর একটা গান শুনলাম গান শুনে মুগ্ধ হয়ে গেলাম গানটা খুব গানটা যে গেছেন তাকে ধন্যবাদ যে ইউ টিভি চ্যানেল তাকেও ধন্যবাদ,2025-09-02T12:13:04Z
Ugx6yqbRDqzfRh1dKKt4AaABAg,আমার আত্মার গান অসাধারণ দারুন লাগছে,1,আমার আত্মার গান অসাধারণ দারুন লাগছে,2025-08-21T18:21:22Z
UgyT5UT7_x10jMIQ9ih4AaABAg,"- জীবনে সুখ,শান্তিই সব না.
জীবনে বিয়ের ও দরকার আছে.🙃",0,"- জীবনে সুখ,শান্তিই সব না. জীবনে বিয়ের ও দরকার আছে.",2025-08-20T14:49:43Z
UgyXegCgAzz2gMwK99d4AaABAg,রাইট কলি গুলি 😢,1,রাইট কলি গুলি,2025-08-01T10:31:36Z
Ugzncg6FBuf9u69beUB4AaABAg,আমার মৃত মা-বাবার কথা বেশি বেশি মনে পরতেছে।,1,আমার মৃত মা-বাবার কথা বেশি বেশি মনে পরতেছে।,2025-08-21T04:04:56Z
UgyxJVAUDeXwWVY2lit4AaABAg,❤এটা বাস্তব সত্য ❤অসাধারণ গান বুঝলে অনেক কিছু বুঝে না বুঝলে কিছু না না ❤❤❤❤❤,1,এটা বাস্তব সত্য অসাধারণ গান বুঝলে অনেক কিছু বুঝে না বুঝলে কিছু না না,2025-08-14T16:31:19Z
Ugwt1K196aDbjFRHhbR4AaABAg,অনেক ভালো লাগতেছে ❤,0,অনেক ভালো লাগতেছে,2025-07-26T18:01:23Z
UgwdI1b7_QKY3fraBDN4AaABAg,শ্বাশত সত্য ৷ গীতিকারকে শত শত ধন্যবাদ ৷,1,শ্বাশত সত্য ৷ গীতিকারকে শত শত ধন্যবাদ ৷,2025-07-29T16:28:46Z
Ugz5_m5P9tFcQZGUv0d4AaABAg,অসাধারণ গানটি মন ছুঁয়ে দিলো😔,1,অসাধারণ গানটি মন ছুঁয়ে দিলো,2025-08-04T10:10:06Z
UgxobeUfA7kuEP0LeoR4AaABAg,তারে যদি পেয়ে যেতাম তাহলে মনে হয় এই গান গুলো শুনা হতো না,1,তারে যদি পেয়ে যেতাম তাহলে মনে হয় এই গান গুলো শুনা হতো না,2025-08-17T08:29:55Z
UgwE48QfaqS_XBGexg94AaABAg,ঐ।😊না ছবি ধৈ😅ঐঐ,0,ঐ।না ছবি ধৈঐঐ,2025-08-12T05:15:28Z
Ugz4JHnxQKZZ-5sUxC94AaABAg,চিরন্তন সত্যি কথা গুলো,1,চিরন্তন সত্যি কথা গুলো,2025-07-31T06:01:01Z
Ugy6zF7BY6LdGrozo5R4AaABAg,করে যার সাথে কথা ঠান্ডা গান অনেক ভালো লাগে সবাই,1,করে যার সাথে কথা ঠান্ডা গান অনেক ভালো লাগে সবাই,2025-08-06T03:52:14Z
UgzjBiRFNq9lchw-Aux4AaABAg,"আমার স্ত্রী আমাকে অনেক কষ্ট দিচ্ছে,  পেয়েও না পাওয়ার সমান, ইগনোর করে, আমি তার জীবনে গুরুত্বহীন 😢😢😢😢 অথচ তাকে পাওয়ার জন্য নিজের ক্যারিয়ার স্বপ্ন পরিবার নষ্ট করেছি, আমি তাকে ক্ষমা করবো না, মনে হচ্ছে সে সারাজীবন হয়ে থাকবে না আমার 😢😢",1,"আমার স্ত্রী আমাকে অনেক কষ্ট দিচ্ছে, পেয়েও না পাওয়ার সমান, ইগনোর করে, আমি তার জীবনে গুরুত্বহীন অথচ তাকে পাওয়ার জন্য নিজের ক্যারিয়ার স্বপ্ন পরিবার নষ্ট করেছি, আমি তাকে ক্ষমা করবো না, মনে হচ্ছে সে সারাজীবন হয়ে থাকবে না আমার",2025-08-20T15:47:23Z
UgwBUHqx6Crdld1m_x54AaABAg,গান গাইলেন অনেক শান্তি লাগলো মনে,1,গান গাইলেন অনেক শান্তি লাগলো মনে,2025-09-09T02:52:11Z
UgxS5_5dZwZtu-jWKwZ4AaABAg,"একটা বাংলা গানের জন্য যতোটা দরদ,আবেগ,সফটনেস থাকা দরকার সাবই আছে এই ছেলেটার গলায়। ❤❤",1,"একটা বাংলা গানের জন্য যতোটা দরদ,আবেগ,সফটনেস থাকা দরকার সাবই আছে এই ছেলেটার গলায়।",2025-01-19T12:04:18Z
UgxVwZSu5SEGMTK0GRJ4AaABAg,এই ছেলের জন্মই হয়েছে গানের জন‍্য ।সকল মিষ্টি গান গুলো পুনরায় জীবন ফিরে পাবে ।,1,এই ছেলের জন্মই হয়েছে গানের জন্য ।সকল মিষ্টি গান গুলো পুনরায় জীবন ফিরে পাবে ।,2025-04-27T13:26:37Z
UgwNrpGrwanhVBxeGhJ4AaABAg,"মনে হয় নানান রঙের নানান ফুলের গাঁথা কি অপূর্ব মালা, খুব ভালো লাগলো",1,"মনে হয় নানান রঙের নানান ফুলের গাঁথা কি অপূর্ব মালা, খুব ভালো লাগলো",2025-01-13T18:10:13Z
Ugyp0Cvte-gz43PveAB4AaABAg,বাচ্চাটার গানের প্রেমে  পরতেই হয়।শত বছর বেঁচে থাক বাপ।ভালো মানুষের  মত।,1,বাচ্চাটার গানের প্রেমে পরতেই হয়।শত বছর বেঁচে থাক বাপ।ভালো মানুষের মত।,2025-02-10T05:21:01Z
UgzOir0HPnSFc--jo_14AaABAg,"প্রিয় কন্ঠে, প্রিয় গানগুলো অসাধারণ লেগেছে। ইংরেজি নতুন বছরের অনেক অনেক শুভেচ্ছা ও ভালোবাসা রইলো তোমার জন্য। 'আমার সারাটা দিন', 'কেন দূরে থাক', যদি সময় হয় কখনো, এ গান দুটো আমাদের সবটুকু শুনিয়ো। এ বছরটা তোমার অসম্ভব ভালো হোক।👍🎉🌄💚",1,"প্রিয় কন্ঠে, প্রিয় গানগুলো অসাধারণ লেগেছে। ইংরেজি নতুন বছরের অনেক অনেক শুভেচ্ছা ও ভালোবাসা রইলো তোমার জন্য। 'আমার সারাটা দিন', 'কেন দূরে থাক', যদি সময় হয় কখনো, এ গান দুটো আমাদের সবটুকু শুনিয়ো। এ বছরটা তোমার অসম্ভব ভালো হোক।",2024-12-31T14:27:48Z
UgzYWFStE8q7YbWplfF4AaABAg,জীবনে প্রথমবার ইউটিউব রেকমেন্ডেশন একটা হীরার খোঁজ দিলো। অফুরন্ত ভালোবাসা আর শুভ কামনা রইল।,1,জীবনে প্রথমবার ইউটিউব রেকমেন্ডেশন একটা হীরার খোঁজ দিলো। অফুরন্ত ভালোবাসা আর শুভ কামনা রইল।,2025-07-15T18:48:00Z
UgyZWKnCwrP3UDEkAlJ4AaABAg,"আমি ভাবছি, কিভাবে এতো সুন্দর করে মানুষের মনে পৌছানো যায়। 🤔🤔🤔🤔",1,"আমি ভাবছি, কিভাবে এতো সুন্দর করে মানুষের মনে পৌছানো যায়।",2025-09-02T09:15:04Z
UgxfDGyabvUuekjBsgt4AaABAg,অসাধারণ ❤ আপনার গানের নির্বাচন ও গান গাওয়ার ধরন সত্যিই অনবদ্য!! অনেক ভালোবাসা ❤From কলকাতা 🇮🇳,1,অসাধারণ আপনার গানের নির্বাচন ও গান গাওয়ার ধরন সত্যিই অনবদ্য!! অনেক ভালোবাসা From কলকাতা,2025-01-04T17:23:56Z
UgzBFJ8m_wlMhVILirp4AaABAg,রুবি রায় সম্পূর্ণ গানটা আপনার গলায় শুনতে চাই,1,রুবি রায় সম্পূর্ণ গানটা আপনার গলায় শুনতে চাই,2025-01-11T16:23:06Z
UgynbUxylf974er56nZ4AaABAg,"তোমার দারুন কণ্ঠস্বর। অনেক ভালোবাসা ভাই | From Kolkata, INDIA 💌",1,"তোমার দারুন কণ্ঠস্বর। অনেক ভালোবাসা ভাই | From Kolkata, INDIA",2025-06-20T16:34:22Z
UgyeS371J7JXXLr1iTp4AaABAg,"অসাধারণ। কিছু বলার নেই, অপূর্ব গলা। I যতবার শুনি, ততবার ই মুগ্ধ হয়ে যাই।❤😘😘💕",0,"অসাধারণ। কিছু বলার নেই, অপূর্ব গলা। I যতবার শুনি, ততবার ই মুগ্ধ হয়ে যাই।",2025-01-28T11:23:01Z
UgyQjOBsFyMUjhiZIMp4AaABAg,মাহতিম সাকিব একজনই ❤এই রকম র ভোকাল একজনেরই ❤ মনে হচ্ছিল ঘন্টার নাগাদ চলতে থাকুক।,1,মাহতিম সাকিব একজনই এই রকম র ভোকাল একজনেরই মনে হচ্ছিল ঘন্টার নাগাদ চলতে থাকুক।,2024-12-31T14:03:32Z
