id,text,label,clean_text,reference_time
Ugz9hNsqHX8Ubu2XGT94AaABAg,অনেক ভালো হয়েছে ❤❤❤❤,-1,অনেক ভালো হয়েছে,2025-07-16T09:54:34Z
Ugzvr3bKAskgRXMOuK54AaABAg,গান গুলি শুনলে কেনজানি কলিজায় আগাত লাগে,-1,গান গুলি শুনলে কেনজানি কলিজায় আগাত লাগে,2025-08-01T04:03:41Z
Ugwb5f1pGnabBtBYrxl4AaABAg,❤অসাধারণ বুঝলে অনেক কিছু বুঝায় ❤না বুঝে চেষ্টা করলে কিছু না ❤❤❤❤❤❤❤❤❤,-1,অসাধারণ বুঝলে অনেক কিছু বুঝায় না বুঝে চেষ্টা করলে কিছু না,2025-08-14T06:34:34Z
UgyHe9qPQtGNcI6eS0Z4AaABAg,অসাধারন অনেক ভালো লাগলো,-1,অসাধারন অনেক ভালো লাগলো,2025-09-29T06:41:23Z
Ugxmn8ARwH1wE04nnCZ4AaABAg,আশা আছি স্বপ্ন পূরুন করা আশা আছি কবে হবে স্বপ্ন পূরুন জানি আমার আল্লাহ ভালো জানে তবে আল্লাহ যার পাশে আছেন সেই একদিন স্বপ্ন পূরুন হবে ইনশাআল্লাহ 😂😢😢😂❤,-1,আশা আছি স্বপ্ন পূরুন করা আশা আছি কবে হবে স্বপ্ন পূরুন জানি আমার আল্লাহ ভালো জানে তবে আল্লাহ যার পাশে আছেন সেই একদিন স্বপ্ন পূরুন হবে ইনশাআল্লাহ,2025-07-21T13:23:17Z
UgxC_nvnRaQZbxhPOSl4AaABAg,"আমার বয়স 18 তবু আমাকে খুব ভালো লাগে এই গান টা 
আর আমি গান টা বুঝতে পারছি ভালো করে 😢😢😢😢😢😢😢",-1,আমার বয়স 18 তবু আমাকে খুব ভালো লাগে এই গান টা আর আমি গান টা বুঝতে পারছি ভালো করে,2025-10-03T16:38:10Z
UgxOlSHLRbVQLpyyYjl4AaABAg,অসাধারণ সুন্দর গানগুলো,-1,অসাধারণ সুন্দর গানগুলো,2025-11-08T04:16:44Z
UgxE3Emt8EUVrYQBdSV4AaABAg,মাসালা খুব সুন্দর বিউটিফুল আইলাভইউ। গান ও সুন্দ বিউটিফুল গায়েকওসুনদর।ধন্যবাদ ❤❤❤❤❤❤❤❤❤❤❤❤❤❤❤❤,-1,মাসালা খুব সুন্দর বিউটিফুল আইলাভইউ। গান ও সুন্দ বিউটিফুল গায়েকওসুনদর।ধন্যবাদ,2025-10-02T10:59:51Z
UgzIQznuSLoAGgAc6l54AaABAg,এই গানটির মূল লেখকের নাম মোঃ আল শরীফ। ইনশাআল্লাহ।,-1,এই গানটির মূল লেখকের নাম মোঃ আল শরীফ। ইনশাআল্লাহ।,2025-09-17T22:17:14Z
UgyNOjDd5GozV-pofHp4AaABAg,সোনা আই লাভ ইউ সোনা আমি তোমার সাথে সাবধানে চালাবো রং গিনা নৌ,-1,সোনা আই লাভ ইউ সোনা আমি তোমার সাথে সাবধানে চালাবো রং গিনা নৌ,2025-09-15T19:04:51Z
UgzxIVqiSgMJTzlbl-h4AaABAg,❤❤❤🎉🎉🎉তোমার ভিডিওটা খুব সুন্দর হয়েছে তোমার ভিডিওটা দেখতেছি পটুয়াখালী জেলা থেকে তোমার ভিডিওতে লাইক সাপোর্ট কমেন্টস এত সুন্দর ভিডিও বানানোর জন্য ধন্যবাদ,-1,তোমার ভিডিওটা খুব সুন্দর হয়েছে তোমার ভিডিওটা দেখতেছি পটুয়াখালী জেলা থেকে তোমার ভিডিওতে লাইক সাপোর্ট কমেন্টস এত সুন্দর ভিডিও বানানোর জন্য ধন্যবাদ,2025-11-05T18:50:59Z
UgyW85DwinphN2b7Zgh4AaABAg,অনেক সুন্দর ভিডিও অনেক সুন্দর গান ভালো লাগছে ধন্যবাদ,-1,অনেক সুন্দর ভিডিও অনেক সুন্দর গান ভালো লাগছে ধন্যবাদ,2025-09-08T17:49:00Z
Ugzbe6uJ7IaEozQkgh54AaABAg,তোমারে তো আমি চিনা হালাইছি ময়না,-1,তোমারে তো আমি চিনা হালাইছি ময়না,2025-10-12T09:21:01Z
UgwTakiDmvpz6hx8bpd4AaABAg,তোমার কণ্ঠস্বর খুব সুন্দর তুমি ভালো শিল্পী হতে পারবা,-1,তোমার কণ্ঠস্বর খুব সুন্দর তুমি ভালো শিল্পী হতে পারবা,2025-10-09T19:19:49Z
Ugwyrb16J4jKNkNFC1h4AaABAg,ছোটবেলার আর্লিস এর কারণে দাঁতের অবস্থা এরকম,-1,ছোটবেলার আর্লিস এর কারণে দাঁতের অবস্থা এরকম,2025-09-08T09:50:10Z
UgzodNRn25Ov84NSLcB4AaABAg,দারুন হয়েছে বন্ধু,-1,দারুন হয়েছে বন্ধু,2025-10-24T17:46:29Z
UgzEnfOYAc9853TYCyB4AaABAg,ভালো লাগছে বজরঙ্গী গানা খুব ভালো লাগবে,-1,ভালো লাগছে বজরঙ্গী গানা খুব ভালো লাগবে,2025-09-20T09:20:34Z
UgyHbWH-15j8JbOHTxZ4AaABAg,খুব ভালো লাগছে ভাই,-1,খুব ভালো লাগছে ভাই,2025-10-02T00:16:49Z
UgykuDhEEV6oRHfu5Fh4AaABAg,"আমি কিছু গান ইউবটুবে ছেড়েছি,কেমন হয়েছে জানাবে।",-1,"আমি কিছু গান ইউবটুবে ছেড়েছি,কেমন হয়েছে জানাবে।",2025-10-19T19:05:24Z
UgzOacxwiJLBpEyRAdx4AaABAg,খুব ই ভালো লাগালো 😅,-1,খুব ই ভালো লাগালো,2025-12-22T15:35:41Z
UgzSRSdzaTijZUPmk2F4AaABAg,দাতের কি অবস্থা বাবা! দাতগুলো ঢেকে রাখা যায় না?,-1,দাতের কি অবস্থা বাবা! দাতগুলো ঢেকে রাখা যায় না?,2025-09-06T16:51:27Z
Ugw26n13NTyW_cYJ3_54AaABAg,স স হ😢😮,-1,স স হ,2025-10-08T04:33:40Z
UgwN_CSGPXZEX-GgW0h4AaABAg,খুব খুব ভালো,-1,খুব খুব ভালো,2025-09-05T09:25:11Z
UgwKWRhW9VTulxv6hUl4AaABAg,❤❤❤ খুব সুন্দর লাগে আমার ❤❤,-1,খুব সুন্দর লাগে আমার,2025-09-16T07:13:53Z
UgyaN2ZJLUQaEGWKsdl4AaABAg,গানগুলো শুনতে হেবি সুন্দর লাগছে❤❤❤❤❤❤❤❤❤❤❤❤❤❤❤❤❤❤❤❤❤❤❤❤❤❤❤❤❤❤❤❤❤❤❤❤❤❤❤❤❤❤❤❤❤❤❤❤❤❤❤❤❤❤❤❤,-1,গানগুলো শুনতে হেবি সুন্দর লাগছে,2025-09-03T12:00:37Z
UgwmkzZ7kxUA6fGBmVt4AaABAg,গানগুলো খুব ভালো লাগে❤❤❤❤❤❤❤❤❤❤,-1,গানগুলো খুব ভালো লাগে,2025-09-01T10:16:03Z
Ugxr2yfGtdp7QqjIxu54AaABAg,❤❤❤❤🎉🎉🎉🎉 অসাধারণ অনেক ধন্যবাদ,-1,অসাধারণ অনেক ধন্যবাদ,2025-08-27T10:34:19Z
UgzD6voEQe1wlQVRNBV4AaABAg,গান গুলো খুব ভালো লাগলো ❤❤❤❤❤❤❤❤❤😂,-1,গান গুলো খুব ভালো লাগলো,2025-09-26T06:33:16Z
Ugy6hgoka9JxvSfNT3J4AaABAg,এই গানগুলি আমার পছন্দের ❤❤,-1,এই গানগুলি আমার পছন্দের,2025-10-06T04:57:00Z
Ugw15acjQnT9KqkjmCJ4AaABAg,আমার গান শুনতে খুব ভালো লাগে ❤❤❤❤😊😊😊😮😮,-1,আমার গান শুনতে খুব ভালো লাগে,2025-10-03T05:09:38Z
UgxagxBm_6gx1QBme3d4AaABAg,"২:৫২ মিনিটে যে লাইনটা গাওয়া হইছে তুমি নারী নাকি পরী বিধি নিজেই করবে ভুল, এই কথাটি সম্পুর্ন শিরক, কারন আল্লাহ কখনো ভুল করতে পারেন না, আল্লাহ যেন সবাইকে বুঝার তৌফিক দান করেন আমীন..!",-1,"২:৫২ মিনিটে যে লাইনটা গাওয়া হইছে তুমি নারী নাকি পরী বিধি নিজেই করবে ভুল, এই কথাটি সম্পুর্ন শিরক, কারন আল্লাহ কখনো ভুল করতে পারেন না, আল্লাহ যেন সবাইকে বুঝার তৌফিক দান করেন আমীন..!",2021-06-09T19:41:22Z
Ugyjte6rDnVkVKccse14AaABAg,যারা গানটা সার্চ দিয়ে আমার মত মাঝে মাঝে শুনেন তারা সাড়া দেন তো...👍,-1,যারা গানটা সার্চ দিয়ে আমার মত মাঝে মাঝে শুনেন তারা সাড়া দেন তো...,2021-03-29T07:52:25Z
UgySHqo-QF36L0I8IEN4AaABAg,এই গানটা এই ভারতীয় উপমহাদেশের সব জায়গার মানুষ শুনছে,-1,এই গানটা এই ভারতীয় উপমহাদেশের সব জায়গার মানুষ শুনছে,2025-12-22T03:07:34Z
UgyUkhanX5ZOqXMV2-14AaABAg,"গানটি অনেক সুন্দর ভাল লাগে কিন্তু গানে একটি শেরেকি কথা আছে,,বিধি নিজেই করবে ভুল।আল্লাহর কোনো ভুল হয়না।আল্লাহ আমাদের ক্ষমা করুক।",-1,"গানটি অনেক সুন্দর ভাল লাগে কিন্তু গানে একটি শেরেকি কথা আছে,,বিধি নিজেই করবে ভুল।আল্লাহর কোনো ভুল হয়না।আল্লাহ আমাদের ক্ষমা করুক।",2021-07-14T20:36:19Z
Ugz-vWAVoYkp1D_nKV54AaABAg,পূর্ণিমার চাঁদের ছেয়েও সুন্দর ছিলেন দয়ার নবী হযরত মুহাম্মদ সাঃ🌹,-1,পূর্ণিমার চাঁদের ছেয়েও সুন্দর ছিলেন দয়ার নবী হযরত মুহাম্মদ সাঃ,2021-07-12T16:09:32Z
UgzIx0Qz2z0x2WWUsKV4AaABAg,আমার কাছে মনে হয় অভিয়ন জগতের শাবনূর ই সেরা আর গানের জগতের জন্য গানের রাজা এন্ড্রোকিশোর সেরা এই দুইজন আমাদের চলচিত্রকে রাঙিয়ে দিয়েছে ধন্যবাদ জানাই এই গুণী শিল্পীদের,-1,আমার কাছে মনে হয় অভিয়ন জগতের শাবনূর ই সেরা আর গানের জগতের জন্য গানের রাজা এন্ড্রোকিশোর সেরা এই দুইজন আমাদের চলচিত্রকে রাঙিয়ে দিয়েছে ধন্যবাদ জানাই এই গুণী শিল্পীদের,2020-07-17T01:55:32Z
UgyEbmj1VGgs8K0W9R54AaABAg,গানটা শুনলেই অজানা অচেনা কোন এক কল্পনার অদেখা মানুষের প্রেমে পড়তে ইচ্ছে করে।,-1,গানটা শুনলেই অজানা অচেনা কোন এক কল্পনার অদেখা মানুষের প্রেমে পড়তে ইচ্ছে করে।,2025-12-18T17:47:26Z
UgyRFX8ni_nKbCzRiht4AaABAg,আমার মতো কে কে আছে যে শাবনূরকে অনেক বেশি ভালোবাসে এবং তার সিনেমার গান শুনতে বেশি পছন্দ তারা লাইক দিন,-1,আমার মতো কে কে আছে যে শাবনূরকে অনেক বেশি ভালোবাসে এবং তার সিনেমার গান শুনতে বেশি পছন্দ তারা লাইক দিন,2020-08-23T13:52:16Z
UgzmTmqUWO14ZlJKuI14AaABAg,"আসলেই শাবনুর আপু রুপের রানী।😍
এতো মায়াবী চেহারা!😘
এতো সুন্দর মায়াবী চোখ!😍
প্রিয় নায়িকা।🥰🥰🥰🥰",-1,আসলেই শাবনুর আপু রুপের রানী। এতো মায়াবী চেহারা! এতো সুন্দর মায়াবী চোখ! প্রিয় নায়িকা।,2020-03-23T18:53:09Z
Ugxf7M4-NF_VRz8TczJ4AaABAg,আসুন সকল ব্যস্ততার মাঝে মহান আল্লাহ রাব্বুল আলামীন কে স্মরণ করি আল্লাহ আকবার আল্লাহু আকবার,-1,আসুন সকল ব্যস্ততার মাঝে মহান আল্লাহ রাব্বুল আলামীন কে স্মরণ করি আল্লাহ আকবার আল্লাহু আকবার,2022-07-02T15:21:52Z
UgzvIZoL7iwXR3b7twF4AaABAg,Covid-19 Virus এর সময় যারা গানটা শুনেন তারা লাইক দেন।হয়তো একদিন কেউ থাকবে না এই সময়কার কিন্তু মানুষগুলো এই গানকে ভালোবাসাবে।,-1,Covid-19 Virus এর সময় যারা গানটা শুনেন তারা লাইক দেন।হয়তো একদিন কেউ থাকবে না এই সময়কার কিন্তু মানুষগুলো এই গানকে ভালোবাসাবে।,2020-06-09T09:52:09Z
Ugw61fzD4F7tJBqUKTF4AaABAg,★লকডাউনে এসে গানটা কে কে শুনতেছো লাইক দিয়ে জানাও★০৩-০৫-২০২১★,-1,লকডাউনে এসে গানটা কে কে শুনতেছো লাইক দিয়ে জানাও০৩-০৫-২০২১,2021-05-03T17:51:26Z
UgxPPOZc1A35o8BJ9r54AaABAg,বাংলার ৯০ দশক থেকে শুরু করে ২০০৮ এর মধ্যে যত রোমান্টিক গান সবই তো শাবনূর আপুর,-1,বাংলার ৯০ দশক থেকে শুরু করে ২০০৮ এর মধ্যে যত রোমান্টিক গান সবই তো শাবনূর আপুর,2019-03-03T04:55:46Z
UgzysuqiULOP9k_t85V4AaABAg,২০৫০ সালের জন্য কমেন্ট রেখে গেলাম🙃,-1,২০৫০ সালের জন্য কমেন্ট রেখে গেলাম,2025-03-12T15:27:40Z
Ugx72A03WMOeV1NMgY94AaABAg,"শাবনুর ও সাকিবের সেরা রোমান্টিক গান,,,😍😍😍",-1,"শাবনুর ও সাকিবের সেরা রোমান্টিক গান,,,",2020-03-12T03:19:06Z
Ugw1-LoJZwVhdHiBNRZ4AaABAg,"এন্ড্রু কিশোরের মৃত্যুর পর শুনতে আসলাম।😓
আহারে! আমাদের শৈশব।😓",-1,এন্ড্রু কিশোরের মৃত্যুর পর শুনতে আসলাম। আহারে! আমাদের শৈশব।,2020-07-07T06:17:44Z
UgylUvHwC02AGZGUjp94AaABAg,আমার মতো নতুন বছর ২০২১ এ কে কে শুনছো?,-1,আমার মতো নতুন বছর ২০২১ এ কে কে শুনছো?,2020-12-31T19:32:15Z
UgympPJ3zIZwxJXtiW94AaABAg,"তুমি নারী নাকি পরী বিধি নিজেই করবে ভুল 😢😢😢,,,এই কথাটা শিরক আল্লাহ তায়ালা কখনো ভুল করেন না আল্লাহ তায়ালা যা করেন সব কিছু ঠিক করেন,,, আল্লাহ তায়ালা সবাইকে হেদায়েত করুক",-1,"তুমি নারী নাকি পরী বিধি নিজেই করবে ভুল ,,,এই কথাটা শিরক আল্লাহ তায়ালা কখনো ভুল করেন না আল্লাহ তায়ালা যা করেন সব কিছু ঠিক করেন,,, আল্লাহ তায়ালা সবাইকে হেদায়েত করুক",2025-08-13T18:52:47Z
UgzAUJIppj9s4Gp97yd4AaABAg,এ গানটা ২০১৯ এ কে কে দেখছেন লাইক দিয়ে জানিয়ে দিন,-1,এ গানটা ২০১৯ এ কে কে দেখছেন লাইক দিয়ে জানিয়ে দিন,2019-03-10T15:40:15Z
UgzKTgP2QshhYVFyVyx4AaABAg,"কিং অলওয়েজ কিং!
ভালোবাসি বস শাকিব খান।♥

শাবনূর তো সবসময় সেরা!✌",-1,কিং অলওয়েজ কিং! ভালোবাসি বস শাকিব খান। শাবনূর তো সবসময় সেরা!,2020-08-26T21:12:38Z
Ugz14AcTIpgApRPGxJ94AaABAg,"শাকিব সত্যি সুদশন হিরো, সত্যি অনেক মায়াবী লুক শাকিবের 😍😍😍",-1,"শাকিব সত্যি সুদশন হিরো, সত্যি অনেক মায়াবী লুক শাকিবের",2020-08-26T11:58:52Z
UgwY3zJy-7id0vsEH0Z4AaABAg,"Overview
Lyrics
দুধে আলতা বদন তোমার
চন্দনের সুবাস ভরা
দুটি দিঘল কাজল আঁখি
যেন মেঘের কাজল পরা
দুধে আলতা বদন তোমার
চন্দনের সুবাস ভরা
দুটি দিঘল কাজল আঁখি
যেন মেঘের কাজল পরা
তোমার নরম দুটি ঠোঁটে
ফোটে লাল পদ্ম ফুল
যেন রেশমি সুতোর গোছা
তোমার মাথার ওই না চুল
দুধে আলতা বদন তোমার
চন্দনের সুবাস ভরা
দুটি দিঘল কাজল আঁখি
যেন মেঘের কাজল পরা
তুমি ফেলবে যেথায় চরণ
সেই মাটি হবে ধন্য
ধুলো হয়ে আসবে উড়ে
তোমার চরণ ছোঁয়ার জন্য
তোমার হাসি দেখে ফুলের
খুব ঈর্ষা হবে মনে
লজ্জাতে পড়বে ঝরে
যেও নাকো ফুলবনে
তুমি নারী নাকি পরী
বিধি নিজেই করবে ঠিক
আমি তো হায় একটি মানুষ
খুঁজে পাই না কোনো কুল
দুধে আলতা বদন তোমার
চন্দনের সুবাস ভরা
দুটি দিঘল কাজল আঁখি
যেন মেঘের কাজল পরা
তোমার কণ্ঠ শুনে কোকিল
যেন বোবা হয়ে যাবে
এত মিষ্টি সুর-সারগাম
ও, সে কোথায় খুঁজে পাবে?
তোমার মুখটি দেখে চাঁদের
মুখ হয়ে যাবে কালি
ডুবে যাবে কালো মেঘে
বুঝি দেবে না আর আলি
তুমি নারী নাকি পরী
বিধি নিজেই করবে ঠিক
আমি তো হায় একটি মানুষ
খুঁজে পাই না কোনো কুল
দুধে আলতা বদন তোমার
চন্দনের সুবাস ভরা
দুটি দিঘল কাজল আঁখি
যেন মেঘের কাজল পরা
দুধে আলতা বদন তোমার
চন্দনের সুবাস ভরা
দুটি দিঘল কাজল আঁখি
যেন মেঘের কাজল পরা
তোমার নরম দুটি ঠোঁটে
ফোটে লাল পদ্ম ফুল
যেন রেশমি সুতোর গোছা
তোমার মাথার ওই না চুল
দুধে আলতা বদন তোমার
চন্দনের সুবাস ভরা
দুটি দিঘল কাজল আঁখি
যেন মেঘের কাজল পরা
Translate to English",-1,"Overview Lyrics দুধে আলতা বদন তোমার চন্দনের সুবাস ভরা দুটি দিঘল কাজল আঁখি যেন মেঘের কাজল পরা দুধে আলতা বদন তোমার চন্দনের সুবাস ভরা দুটি দিঘল কাজল আঁখি যেন মেঘের কাজল পরা তোমার নরম দুটি ঠোঁটে ফোটে লাল পদ্ম ফুল যেন রেশমি সুতোর গোছা তোমার মাথার ওই না চুল দুধে আলতা বদন তোমার চন্দনের সুবাস ভরা দুটি দিঘল কাজল আঁখি যেন মেঘের কাজল পরা তুমি ফেলবে যেথায় চরণ সেই মাটি হবে ধন্য ধুলো হয়ে আসবে উড়ে তোমার চরণ ছোঁয়ার জন্য তোমার হাসি দেখে ফুলের খুব ঈর্ষা হবে মনে লজ্জাতে পড়বে ঝরে যেও নাকো ফুলবনে তুমি নারী নাকি পরী বিধি নিজেই করবে ঠিক আমি তো হায় একটি মানুষ খুঁজে পাই না কোনো কুল দুধে আলতা বদন তোমার চন্দনের সুবাস ভরা দুটি দিঘল কাজল আঁখি যেন মেঘের কাজল পরা তোমার কণ্ঠ শুনে কোকিল যেন বোবা হয়ে যাবে এত মিষ্টি সুর-সারগাম ও, সে কোথায় খুঁজে পাবে? তোমার মুখটি দেখে চাঁদের মুখ হয়ে যাবে কালি ডুবে যাবে কালো মেঘে বুঝি দেবে না আর আলি তুমি নারী নাকি পরী বিধি নিজেই করবে ঠিক আমি তো হায় একটি মানুষ খুঁজে পাই না কোনো কুল দুধে আলতা বদন তোমার চন্দনের সুবাস ভরা দুটি দিঘল কাজল আঁখি যেন মেঘের কাজল পরা দুধে আলতা বদন তোমার চন্দনের সুবাস ভরা দুটি দিঘল কাজল আঁখি যেন মেঘের কাজল পরা তোমার নরম দুটি ঠোঁটে ফোটে লাল পদ্ম ফুল যেন রেশমি সুতোর গোছা তোমার মাথার ওই না চুল দুধে আলতা বদন তোমার চন্দনের সুবাস ভরা দুটি দিঘল কাজল আঁখি যেন মেঘের কাজল পরা Translate to English",2025-12-03T05:44:09Z
UgyWQpObVXiiBTzoWz94AaABAg,২০২০ সালে গানটা কে কে দেখেছেন লাইক দিয়ে যান,-1,২০২০ সালে গানটা কে কে দেখেছেন লাইক দিয়ে যান,2020-01-19T17:43:27Z
