id,text,label,clean_text,reference_time
Ugxzq30KMW_4IIkIr2R4AaABAg,"মধ্যবিত্তদের অর্থ বিত্ত, ক্ষমতা না থাকতে পারে,কিন্তু প্রত্যেকের ঘরই যেন স্বর্গ। টিকে থাকুক এ সুখ।যদি বিত্তবান ও হই কোনদিন এ সুখ এ স্বর্গ নষ্ট হতে দেবনা ইনশাআল্লাহ। এ সুখ টাকায় কিনা নয়,পারিবারিক মুল্যবোধের শক্তি এ সুখ।পারিবারিক মুল্যবোধ,শিক্ষা, অল্পতেই খুশি,এসব যেন হারিয়ে না যায় এই দোয়াই করি💓💓💓",-1,"মধ্যবিত্তদের অর্থ বিত্ত, ক্ষমতা না থাকতে পারে,কিন্তু প্রত্যেকের ঘরই যেন স্বর্গ। টিকে থাকুক এ সুখ।যদি বিত্তবান ও হই কোনদিন এ সুখ এ স্বর্গ নষ্ট হতে দেবনা ইনশাআল্লাহ। এ সুখ টাকায় কিনা নয়,পারিবারিক মুল্যবোধের শক্তি এ সুখ।পারিবারিক মুল্যবোধ,শিক্ষা, অল্পতেই খুশি,এসব যেন হারিয়ে না যায় এই দোয়াই করি",2023-10-03T21:20:49Z
Ugw-IK7wbH6oWV4lq594AaABAg,ওল্ড ইজ গোল্ড।  সেই পুরোনো দিনগুলো ফিরে পেতে খুব ইচ্ছে করে।,-1,ওল্ড ইজ গোল্ড। সেই পুরোনো দিনগুলো ফিরে পেতে খুব ইচ্ছে করে।,2024-12-24T05:52:48Z
UgxbxVPUeaug2ooHtfR4AaABAg,আমার মনের মতন গান য়া মনকে ভালো করে তোলে আমার কথা কি রাইট এখন কার সময়য়ে ডিজে গান চলে কিনতু ওসময় দিন গুলু সুদু মনের মায়া ভালো বাসা আর কখনো পাবোনা.... ইতি  একটা লাইক দিয়েন।,-1,আমার মনের মতন গান য়া মনকে ভালো করে তোলে আমার কথা কি রাইট এখন কার সময়য়ে ডিজে গান চলে কিনতু ওসময় দিন গুলু সুদু মনের মায়া ভালো বাসা আর কখনো পাবোনা.... ইতি একটা লাইক দিয়েন।,2022-01-22T19:40:06Z
Ugzvnr2nqx7Xt5SrT0x4AaABAg,সাদামাটা সেই ছোটা বেলাটা যদি আবার ফিরে পেতাম😢,-1,সাদামাটা সেই ছোটা বেলাটা যদি আবার ফিরে পেতাম,2024-12-28T17:47:38Z
UgwsJYu-8IWF2gogFLF4AaABAg,ছবিটা দেখে হলে অনেক কান্না করেছিলাম তখন সেভেনে  পড়ি ।,-1,ছবিটা দেখে হলে অনেক কান্না করেছিলাম তখন সেভেনে পড়ি ।,2025-03-24T20:39:35Z
Ugy9ACMJ4ugKVtRWY194AaABAg,আমি অলকা পোরদার বিরাটী থেকে দেখছি আমার এতো সুন্দর লাগছে গানটা শুনতে মনে হয় বার বার শূনি ❤❤❤❤❤,-1,আমি অলকা পোরদার বিরাটী থেকে দেখছি আমার এতো সুন্দর লাগছে গানটা শুনতে মনে হয় বার বার শূনি,2025-06-22T14:03:54Z
Ugzu2w2R-Pxt2ggYJ3p4AaABAg,"আমার এখনও মনে পড়ে আমার মা আমাকে এই গান শুনিয়ে পিঠে হাত দিয়ে ঘুম পাড়াতো,😢😢😢তখন আমার বয়স বড়জোর ৩থেকে ৫ বছর, আমার ভালোই মনে আছে, খুবই সুন্দর করে গাইতো আমার মা,সেই গান যেন অমৃত
😭😭😭😭😭😭😭😭😭😭😭😭",-1,"আমার এখনও মনে পড়ে আমার মা আমাকে এই গান শুনিয়ে পিঠে হাত দিয়ে ঘুম পাড়াতো,তখন আমার বয়স বড়জোর ৩থেকে ৫ বছর, আমার ভালোই মনে আছে, খুবই সুন্দর করে গাইতো আমার মা,সেই গান যেন অমৃত",2021-01-07T20:29:33Z
UgyxLRLiHfRZd6obcvd4AaABAg,ধন্যবাদ এই গানটি যিনি লিখেছেন তিনি কতটা সময় এবং ধৈর্য নিয়ে গানটি লিখেছেন গান এবং অভিনয়ের সাথে বাস্তবতার মিল আছে পরবর্তীকালে জারা গানটি শুনবে তারা শুধু এটি ভাববে এত বছর আগের অভিনয় শিল্পীরা এবং গানের লেখক ও কণ্ঠশিল্পীরা অসাধারণ গান উপহার দিয়ে গেল,-1,ধন্যবাদ এই গানটি যিনি লিখেছেন তিনি কতটা সময় এবং ধৈর্য নিয়ে গানটি লিখেছেন গান এবং অভিনয়ের সাথে বাস্তবতার মিল আছে পরবর্তীকালে জারা গানটি শুনবে তারা শুধু এটি ভাববে এত বছর আগের অভিনয় শিল্পীরা এবং গানের লেখক ও কণ্ঠশিল্পীরা অসাধারণ গান উপহার দিয়ে গেল,2024-11-21T18:04:37Z
Ugyuv6j4CJzTfZPdh6F4AaABAg,"আহ কি সুন্দর,, একেই বলে ক্লাসিক বিউটি ❤️",-1,"আহ কি সুন্দর,, একেই বলে ক্লাসিক বিউটি ️",2025-05-06T15:08:23Z
UgzMZJJGtaRP7dJGPyx4AaABAg,আমার খুবই  পচঁন্দের একটা গান,-1,আমার খুবই পচঁন্দের একটা গান,2020-10-18T06:00:24Z
Ugzyrl8YsewfmgVBYyl4AaABAg,আমি কেন জানি ইমোশনাল খুব..কান্না চলে আসে অতিতের কিছু দেখলা.. এখন কান্না করতেছি গান গুলা শুনে আমার ছোট বেলায় শক্রবার ছবি গুলা দিলে আমি মা বাবা বোন আশে পাশে অনেক আপু রা বাসায় আসত দেখার জন্য.. কিন্ত এখন কে কোথায় আর ত কেউ আসে না টিভি দেখতে খুব কান্না পায় আগের কথা গুলা মনে পরলে😭😭😭,-1,আমি কেন জানি ইমোশনাল খুব..কান্না চলে আসে অতিতের কিছু দেখলা.. এখন কান্না করতেছি গান গুলা শুনে আমার ছোট বেলায় শক্রবার ছবি গুলা দিলে আমি মা বাবা বোন আশে পাশে অনেক আপু রা বাসায় আসত দেখার জন্য.. কিন্ত এখন কে কোথায় আর ত কেউ আসে না টিভি দেখতে খুব কান্না পায় আগের কথা গুলা মনে পরলে,2020-10-04T07:41:01Z
Ugw7cO21-HZm67vcz2d4AaABAg,আহ সেই দিন গুলো যদি আবার ফিরে পেতাম 😢,-1,আহ সেই দিন গুলো যদি আবার ফিরে পেতাম,2024-12-24T05:55:02Z
Ugy3tA-_vzquUcv0i0d4AaABAg,আমার জান প্রান আমার বাবা মা।1988 টির মুভি  ছিল মনে হয়। এই মুভি দুই বাংলাকেই কাপিয়েছিল  কি অসাধারণ একটা মুভি ছিল।,-1,আমার জান প্রান আমার বাবা মা।1988 টির মুভি ছিল মনে হয়। এই মুভি দুই বাংলাকেই কাপিয়েছিল কি অসাধারণ একটা মুভি ছিল।,2020-08-30T05:32:44Z
Ugw1RIZLPYIpAybIKst4AaABAg,"আমার অনেক পছন্দমত এই গান টা,যত শুনি ততই শুনতে মন চায়,",-1,"আমার অনেক পছন্দমত এই গান টা,যত শুনি ততই শুনতে মন চায়,",2024-09-29T07:20:10Z
Ugyi6M_9nru5aYJrXa94AaABAg,🌹জীবনসংসারমূখী আদর্শিক গান🌹🌹,-1,জীবনসংসারমূখী আদর্শিক গান,2022-03-16T17:33:27Z
UgwsMozgGJxKFVEnoDB4AaABAg,"অতীতে শতোবার শুনেছি  গানটি,27.6.22 আবার শুনলাম আজ আমি দুটি ছেলের বাবা,,ঘরটি সত্যি স্বর্গ ই মনে হয়।গানটা শুনলে হৃদয় জুরিয়ে দেয়।",-1,"অতীতে শতোবার শুনেছি গানটি,27.6.22 আবার শুনলাম আজ আমি দুটি ছেলের বাবা,,ঘরটি সত্যি স্বর্গ ই মনে হয়।গানটা শুনলে হৃদয় জুরিয়ে দেয়।",2022-06-27T11:47:49Z
Ugwgy3z5eVGN0hxv3mV4AaABAg,৮০ দশকের পরের গানগুলোশুনার মত  একবেলা বাত দুই বেলা গান,-1,৮০ দশকের পরের গানগুলোশুনার মত একবেলা বাত দুই বেলা গান,2024-05-02T17:22:16Z
UgxjOi2CdsZgCVfs4w54AaABAg,এই গান গুলো কেন জানি হারিয়ে যাচ্ছে,-1,এই গান গুলো কেন জানি হারিয়ে যাচ্ছে,2021-06-26T13:37:07Z
UgxkeXHuRs1aw7-uoa54AaABAg,টাকা পয়সার চেয়ে সুখ টাই জীবনে প্রয়োজন ❤,-1,টাকা পয়সার চেয়ে সুখ টাই জীবনে প্রয়োজন,2024-04-16T03:57:09Z
Ugxd4gg4F--K-Uaopp14AaABAg,"পারফেক্ট বাঙালি নারী হলো শাবানা মেম,,, সব ধরনের অভিনয়ে পারদর্শী আর এতো মায়া লাগে",-1,"পারফেক্ট বাঙালি নারী হলো শাবানা মেম,,, সব ধরনের অভিনয়ে পারদর্শী আর এতো মায়া লাগে",2022-06-03T09:09:46Z
UgzumHSVJ5PKIXwz9eN4AaABAg,2025  সেপ্টেম্বর  এ দেখছি অনেক  ভালো লাগছে,-1,2025 সেপ্টেম্বর এ দেখছি অনেক ভালো লাগছে,2025-09-27T10:48:48Z
UgypyWgIF46LAx6tIz94AaABAg,গানগুলো শুনলে কষ্ট কেন লাগে বুঝিনা,-1,গানগুলো শুনলে কষ্ট কেন লাগে বুঝিনা,2021-11-11T06:56:33Z
UgzVINDGq2yzeSYsmPF4AaABAg,এই গান গুলো শুনলে মনে হয় আমার জীবনের সবচেয়ে স্মরনীয় ঘটনা কিন্তু এখন মনে হচ্ছে সবচেয়ে বেশি কষ্টের কারণ বরগুনা জেলা থেকে বলছি নাম জান্নাতুল নেছা মিষ্টি,-1,এই গান গুলো শুনলে মনে হয় আমার জীবনের সবচেয়ে স্মরনীয় ঘটনা কিন্তু এখন মনে হচ্ছে সবচেয়ে বেশি কষ্টের কারণ বরগুনা জেলা থেকে বলছি নাম জান্নাতুল নেছা মিষ্টি,2024-05-19T08:07:48Z
UgzppAHRFgNkGSgqtJt4AaABAg,"অনেক সুন্দর গান ,
আসলেই আগের গান গুলো অনেক সুন্দর ছিল,,💟💟👌👌",-1,"অনেক সুন্দর গান , আসলেই আগের গান গুলো অনেক সুন্দর ছিল,,",2021-04-28T14:44:49Z
Ugxg7bzYoRJgEBihmkF4AaABAg,"তুমার যা আছে ওদের তাও নেইত
এইত সুখ বাবা এইত♥️",-1,তুমার যা আছে ওদের তাও নেইত এইত সুখ বাবা এইত️,2024-05-26T11:35:49Z
UgyFbNPgbHfv9asrz0x4AaABAg,"৯০ বিদায় নিয়ে চলে গেছে কিন্তু ৯০ এর এই গানগুলো নিজেকে সেই কৈশোরকে মনে করিয়ে দেয়,,",-1,"৯০ বিদায় নিয়ে চলে গেছে কিন্তু ৯০ এর এই গানগুলো নিজেকে সেই কৈশোরকে মনে করিয়ে দেয়,,",2023-07-18T17:12:14Z
UgwjrdMR-38rAsNJ5qF4AaABAg,এই গানটা ছোটো বেলায় শুনতাম আর এখন ও শুনি,-1,এই গানটা ছোটো বেলায় শুনতাম আর এখন ও শুনি,2024-10-15T15:30:31Z
UgwpMpfPcr5IAzU_Cch4AaABAg,অনেক সুন্দর অসাধারণ অপূর্ব একটা গান ছবি টা সেই সময় দুইবার দেখেছি তখন 7/8 এ পড়ি এখন সেই রকম নায়ক  নায়িকা নেই কতো রেকর্ড করেছিল ছবিটি ।💕💕,-1,অনেক সুন্দর অসাধারণ অপূর্ব একটা গান ছবি টা সেই সময় দুইবার দেখেছি তখন 7/8 এ পড়ি এখন সেই রকম নায়ক নায়িকা নেই কতো রেকর্ড করেছিল ছবিটি ।,2020-08-31T20:53:23Z
UgzJ-xecRl8Kor9Y1JN4AaABAg,"অসাধারন অসাধারন , অনেক অনেক ভালো লাগলো ধন্যবাদ সবাইকে ।",-1,"অসাধারন অসাধারন , অনেক অনেক ভালো লাগলো ধন্যবাদ সবাইকে ।",2025-04-03T13:04:34Z
UgzEuJoJ_A8b3YBbI-54AaABAg,কত সুন্দর আর সাবলীল ভাষা লাইন গুলো 🥰🥰,-1,কত সুন্দর আর সাবলীল ভাষা লাইন গুলো,2022-10-04T16:03:10Z
UgyZA91868ZHxEj-lTJ4AaABAg,"তখনকার ছবি ছিল বাস্তব জীবনের সাথে মিশ্রণ,",-1,"তখনকার ছবি ছিল বাস্তব জীবনের সাথে মিশ্রণ,",2021-01-11T12:46:41Z
UgxkFwL0Xc0PN5r1A814AaABAg,দুনিয়ায় আমরা থাকবো না গান গুলো চিরকাল থাকবে।,-1,দুনিয়ায় আমরা থাকবো না গান গুলো চিরকাল থাকবে।,2024-10-13T09:15:29Z
UgyOc_n48LR_CSIQHTR4AaABAg,আগে একটা সুতি কমদামি জামা পেলেও যে আনন্দ হতো এখন কত দামি জামা পড়ি কিন্তু সেই আনন্দটা আর হয় না।,-1,আগে একটা সুতি কমদামি জামা পেলেও যে আনন্দ হতো এখন কত দামি জামা পড়ি কিন্তু সেই আনন্দটা আর হয় না।,2020-03-12T04:08:47Z
UgzjLSjE4sfHSGALJM14AaABAg,"কোন একদিনের জন্য বৌকে dedicate করে কমেন্ট করে গেলাম। বেঁচে থাকলে হয়তো দেখাবো কোন একদিন যে, বহু আগে থেকেই অদেখা আপনাকে ফীল করতাম!",-1,"কোন একদিনের জন্য বৌকে dedicate করে কমেন্ট করে গেলাম। বেঁচে থাকলে হয়তো দেখাবো কোন একদিন যে, বহু আগে থেকেই অদেখা আপনাকে ফীল করতাম!",2022-09-21T18:16:02Z
UgwAaVCFCTfvG_a31_V4AaABAg,খুব ভালো মানের একটা ছবি সত্য মিথ্যা ।এ ছবিটা কযেকবার দেখেছি ।,-1,খুব ভালো মানের একটা ছবি সত্য মিথ্যা ।এ ছবিটা কযেকবার দেখেছি ।,2020-09-11T16:42:50Z
UgytwWYHIl6tpr-8u7t4AaABAg,কেন যেন বারে বারে এই গানটা শুনি মনে হয় কি মায়ার বাদন এই গানে মনের সূর বাজে,-1,কেন যেন বারে বারে এই গানটা শুনি মনে হয় কি মায়ার বাদন এই গানে মনের সূর বাজে,2022-10-03T00:38:17Z
UgzT0sCLkOZqj0fOae54AaABAg,"আগে মনে করতাম শুধু আমি আগের দিন গুলি মনে রাখি, এখন দেখি সবাই আমার মত আগের দিনগুলি কথা করে। আগে কি সুন্দর দিন কাটাইতাম আমরা। তোমরা কি একমত?????",-1,"আগে মনে করতাম শুধু আমি আগের দিন গুলি মনে রাখি, এখন দেখি সবাই আমার মত আগের দিনগুলি কথা করে। আগে কি সুন্দর দিন কাটাইতাম আমরা। তোমরা কি একমত?????",2020-07-01T08:43:56Z
UgwSY0AbeyE7wH4-C-h4AaABAg,আমার মৃত্যু যেন এই গানতা শুনতে শুনতে হয় এত প্রিয় আমার এ গানটি,-1,আমার মৃত্যু যেন এই গানতা শুনতে শুনতে হয় এত প্রিয় আমার এ গানটি,2023-11-28T18:17:17Z
UgzBiG8rbC3_4_F-GQV4AaABAg,"ভাই আমিও দেখেছি নয় বার ।আর শাবানা সব ছবি সামাজিক দেখার মত ।আরেক টি কথা আমি যখন শাবানার ছবি দেখতাম ।তখন মনে হচ্ছিলো আমি যেন আমার নিজের আপন যনের অভিনয় দেখছি ।এক কথায় শাবানাকে মা,খালার মত লাগতো ।তাকে নিয়ে কোনো খারাপ মনত্ব আসতোনা",-1,"ভাই আমিও দেখেছি নয় বার ।আর শাবানা সব ছবি সামাজিক দেখার মত ।আরেক টি কথা আমি যখন শাবানার ছবি দেখতাম ।তখন মনে হচ্ছিলো আমি যেন আমার নিজের আপন যনের অভিনয় দেখছি ।এক কথায় শাবানাকে মা,খালার মত লাগতো ।তাকে নিয়ে কোনো খারাপ মনত্ব আসতোনা",2021-04-08T20:33:23Z
UgwrE-EfGMR2GukCDxJ4AaABAg,আমার হাজারো গানের মধ‍্যে এই একটা গান আমার ভীষণ ভীষণ পৃও❤❤❤❤,-1,আমার হাজারো গানের মধ্যে এই একটা গান আমার ভীষণ ভীষণ পৃও,2023-07-15T12:48:22Z
Ugzxt8N315K2xZkiO7p4AaABAg,আমি মিস্টার আবারো ফিরে এলাম এ সিনেমা দেখে বাংলাদেশের মহিলা পুরুষ সবাই দেখবেন 80 বছরের জন্য কম কমেন্ট করবেন দিয়া গেলাম আর ছবিটা দেখে ভালো মানুষ হন ভালোবাসা দেন ছেলেমেয়েরে থ্যাঙ্ক ইউ,-1,আমি মিস্টার আবারো ফিরে এলাম এ সিনেমা দেখে বাংলাদেশের মহিলা পুরুষ সবাই দেখবেন 80 বছরের জন্য কম কমেন্ট করবেন দিয়া গেলাম আর ছবিটা দেখে ভালো মানুষ হন ভালোবাসা দেন ছেলেমেয়েরে থ্যাঙ্ক ইউ,2024-05-16T19:31:56Z
UgxESKDAXqWN4k6e-qB4AaABAg,অসাধারণ গান ছোটকালের সিনেমা,-1,অসাধারণ গান ছোটকালের সিনেমা,2025-11-06T20:12:09Z
UgwuMKH4bSEeVdBYsJx4AaABAg,"সাবিনা ইয়াসমিন, এন্ড্রু কিশোর এরা যেন শিল্পি শুধু নয়, সাক্ষাত সুর স্রষ্টা। এদের মতো শিল্পি আর আসবে কিনা তা সন্দেহ আছে।",-1,"সাবিনা ইয়াসমিন, এন্ড্রু কিশোর এরা যেন শিল্পি শুধু নয়, সাক্ষাত সুর স্রষ্টা। এদের মতো শিল্পি আর আসবে কিনা তা সন্দেহ আছে।",2022-11-08T14:37:50Z
UgxSd1q6anovoYgcP7F4AaABAg,সবাই নামাজ পড়ছে ঘরে ঘরের ছাদের উপরে আমিতো মসজিদে পড়াইছি,-1,সবাই নামাজ পড়ছে ঘরে ঘরের ছাদের উপরে আমিতো মসজিদে পড়াইছি,2025-10-24T00:56:00Z
Ugypg_kXHfOhrU0rM7l4AaABAg,"দশবার দেখা আমার জীবনের প্রথম ছবি সত্য মিথ্যা, এখনো হ্রদয়ে নাড়া দেয়! আহ, কি সুন্দর সময় ছিল?",-1,"দশবার দেখা আমার জীবনের প্রথম ছবি সত্য মিথ্যা, এখনো হ্রদয়ে নাড়া দেয়! আহ, কি সুন্দর সময় ছিল?",2020-02-29T03:58:44Z
Ugx-9lO_O6AzMBF2ugB4AaABAg,অসাধারণ দারুন অসাধারণ চমৎকার  সৃষ্টি  বাংলার সোনালী  যুগের,-1,অসাধারণ দারুন অসাধারণ চমৎকার সৃষ্টি বাংলার সোনালী যুগের,2022-02-08T13:03:53Z
UgzsaV5T1SEODa4CxO54AaABAg,সংসারে অভাব না থাকলেই ঘব স্বগ হয়,-1,সংসারে অভাব না থাকলেই ঘব স্বগ হয়,2020-10-24T22:11:14Z
Ugzvc_lgIXuoWhSWJSB4AaABAg,অসাধারণ কথা অসাধারণ সুর। এ গান অমর হয়ে রবে। আমি পশ্চিমবঙ্গের মুর্শিদাবাদ জেলার বহরমপুর থানার অন্তর্গত  বাণী নাগপুর গ্রাম থেকে শুনছি। আজ 12/11 /2024 খ্রিস্টাব্দে 26 শে কার্তিক 1431 বঙ্গাব্দ। নয় জমাদিউল আউয়াল 1446 হিজরী সন.। আজ মঙ্গলবার।,-1,অসাধারণ কথা অসাধারণ সুর। এ গান অমর হয়ে রবে। আমি পশ্চিমবঙ্গের মুর্শিদাবাদ জেলার বহরমপুর থানার অন্তর্গত বাণী নাগপুর গ্রাম থেকে শুনছি। আজ 12/11 /2024 খ্রিস্টাব্দে 26 শে কার্তিক 1431 বঙ্গাব্দ। নয় জমাদিউল আউয়াল 1446 হিজরী সন.। আজ মঙ্গলবার।,2024-11-12T14:57:05Z
