id,text,label,clean_text,reference_time
UgwSJJ1k1jeycLolXN94AaABAg,মানুষের সুখের চেয়ে দুঃখ অনেক গুন বেশি।,-1,মানুষের সুখের চেয়ে দুঃখ অনেক গুন বেশি।,2024-06-17T06:24:43Z
UgwGo9Itu1BMKWzorbp4AaABAg,এসব গান অমর হয়ে থাকবে আজীবন ধন্যবাদ সুবীর নন্দী এত সুন্দর গান উপহার দেওয়ার জন্য আমাদের,-1,এসব গান অমর হয়ে থাকবে আজীবন ধন্যবাদ সুবীর নন্দী এত সুন্দর গান উপহার দেওয়ার জন্য আমাদের,2025-06-02T06:30:45Z
UgyY5CDKL747sr31YVx4AaABAg,কত যে তোমায় বেসেছি ভালো সে কথা তুমি যদি জানতে😢😢,-1,কত যে তোমায় বেসেছি ভালো সে কথা তুমি যদি জানতে,2025-08-29T15:25:17Z
UgwBAXMScnQ6yrZGMSp4AaABAg,হৃদয় ছুঁয়ে যাওয়ার গান।100বছর এ গান মানুষ হূদয় থাকবে।,-1,হৃদয় ছুঁয়ে যাওয়ার গান।100বছর এ গান মানুষ হূদয় থাকবে।,2024-02-12T14:57:05Z
UgyNbos4Pr2De7EPQih4AaABAg,মানুষের মনের ঘরে কি গান গান না থাক অনেক আল্লাহ সব কিছু সৃষ্টি করে পাঠান 🎉🎉🎉🎉,-1,মানুষের মনের ঘরে কি গান গান না থাক অনেক আল্লাহ সব কিছু সৃষ্টি করে পাঠান,2025-01-17T16:58:18Z
UgwAN1453fGIu_A2y1l4AaABAg,তুমি থেকে গেলে হয়তো আশি বছর বয়সে ও আগলে রাখতাম তোমায়। কিন্তু আমাদের আর কোন দিন কখনো ও কথা হবে না। গোটা একটা জীবন চলে যাবে তবু ও আমাদের আর কোন দিন কখনো ও দেখা হবে না। ভালোবাসা সুন্দর যদি মানুষটি সঠিক এবং পারফেক্ট হয় 💘💘💔💔,-1,তুমি থেকে গেলে হয়তো আশি বছর বয়সে ও আগলে রাখতাম তোমায়। কিন্তু আমাদের আর কোন দিন কখনো ও কথা হবে না। গোটা একটা জীবন চলে যাবে তবু ও আমাদের আর কোন দিন কখনো ও দেখা হবে না। ভালোবাসা সুন্দর যদি মানুষটি সঠিক এবং পারফেক্ট হয়,2024-10-04T16:57:31Z
UgxXf3SsP32vbl3q4Ox4AaABAg,শতকোটি গান শুনার পড়েও আবারও তার গান শুনতে এলাম❤ সত্যি তার গানে জাদু আছে🎉,-1,শতকোটি গান শুনার পড়েও আবারও তার গান শুনতে এলাম সত্যি তার গানে জাদু আছে,2025-12-01T21:39:59Z
UgzRlUScq7r-2Pphx2R4AaABAg,গানের লাইন গুলো জীবনের  সাথে হুবহু  মিলে গিয়েছে।  কমেন্ট  রেখে গেলাম।  কেউ যদি রিপ্লাই  দেয় তাহলে আবার শুনতে আসবো।,-1,গানের লাইন গুলো জীবনের সাথে হুবহু মিলে গিয়েছে। কমেন্ট রেখে গেলাম। কেউ যদি রিপ্লাই দেয় তাহলে আবার শুনতে আসবো।,2025-09-19T16:48:22Z
UgyxCjLxQfd_f3pGIl94AaABAg,"এই গানটা আমার হৃদয়ের খুব কাছের। যতবারই শুনি, মনে হয় প্রথমবার শুনছি। এর প্রতিটি কথা, সুর আর অনুভূতি আমার মনে গভীর ছাপ ফেলে। সত্যিই, এটাই আমার প্রিয় গান, কারণ এটা শুধু গান নয় — এটা আমার অনুভব, আমার স্মৃতি, আমার ভালোবাসা।",-1,"এই গানটা আমার হৃদয়ের খুব কাছের। যতবারই শুনি, মনে হয় প্রথমবার শুনছি। এর প্রতিটি কথা, সুর আর অনুভূতি আমার মনে গভীর ছাপ ফেলে। সত্যিই, এটাই আমার প্রিয় গান, কারণ এটা শুধু গান নয় — এটা আমার অনুভব, আমার স্মৃতি, আমার ভালোবাসা।",2025-07-12T12:26:31Z
UgwEa3K0Zk4JO0u8tJt4AaABAg,প্রিয় কয়েকটি গানের একটি ❤❤❤❤❤,-1,প্রিয় কয়েকটি গানের একটি,2025-08-30T14:02:12Z
UgzZ0VxI89QlokekxUV4AaABAg,😢খুব ভালো লাগে তাইতো সুনি,-1,খুব ভালো লাগে তাইতো সুনি,2025-01-29T11:00:27Z
UgzgN1K22_F4nP-ajC94AaABAg,যে গান শুনে সারাদিনের ক্লান্তি দূর হয়ে যায় সেই শিল্পীর নাম সুবীর নন্দী শিল্পী,-1,যে গান শুনে সারাদিনের ক্লান্তি দূর হয়ে যায় সেই শিল্পীর নাম সুবীর নন্দী শিল্পী,2025-08-04T03:47:38Z
Ugy9C1PrVAV0Cx0Bk514AaABAg,আমাদের ছোট্ট বেলা জড়িয়ে আছে এই গান গুলোতে,-1,আমাদের ছোট্ট বেলা জড়িয়ে আছে এই গান গুলোতে,2025-05-05T03:54:43Z
UgwlDubfHQd6pnjj7fF4AaABAg,এই গানের অ্যালবাম টা আমাকে একজন উপহার দিয়েছিল গানটা শুনলে খুব মিস করি তাকে,-1,এই গানের অ্যালবাম টা আমাকে একজন উপহার দিয়েছিল গানটা শুনলে খুব মিস করি তাকে,2025-08-24T01:22:04Z
UgwhpPRuCOkow729XsZ4AaABAg,এই গানগুলো যতই শুনি ততোই নতুন মনে হয়,-1,এই গানগুলো যতই শুনি ততোই নতুন মনে হয়,2024-12-01T15:24:20Z
Ugw9jZyrSvoEh8F3AQd4AaABAg,এই গান গুলো কখনো শেষ হবার নয়,-1,এই গান গুলো কখনো শেষ হবার নয়,2025-05-09T09:14:01Z
UgwPVOjtkBbttCxkAld4AaABAg,ছোটবেলার কথা সেই মনে পড়ে,-1,ছোটবেলার কথা সেই মনে পড়ে,2025-06-27T09:40:42Z
UgyTgxVA7h0BVZMSZFd4AaABAg,ভালোবাসার আর এক নাম প্রিয়া,-1,ভালোবাসার আর এক নাম প্রিয়া,2025-08-05T07:10:56Z
UgwGAMutpiDK97835YR4AaABAg,আমার মন খারাপ থাকলে আমি গান গুলো শুনি আমার কাছে খুব ভালো লাগে,-1,আমার মন খারাপ থাকলে আমি গান গুলো শুনি আমার কাছে খুব ভালো লাগে,2025-06-30T15:03:43Z
UgxWRovZe4gpL7NQONd4AaABAg,চিরকাল এই গান অবিস্মরণীয় হয়ে থাকবে।,-1,চিরকাল এই গান অবিস্মরণীয় হয়ে থাকবে।,2024-12-29T14:59:27Z
UgyR4MhgA2ivmCF8WGl4AaABAg,আমার এ দুটি চোখ পাথর তো নয় তবু   কেন ক্ষয় ক্ষয়ে যায় 💚,-1,আমার এ দুটি চোখ পাথর তো নয় তবু কেন ক্ষয় ক্ষয়ে যায়,2025-08-15T07:17:55Z
UgxrfIMGe4IpgsVtBnB4AaABAg,এই গান গুলো  পুরান  হবার নয়।,-1,এই গান গুলো পুরান হবার নয়।,2025-08-17T10:37:15Z
Ugwzxl2lfyNydRUVQoB4AaABAg,❤এই সব গান মানুষের মনে সব সময় থেকে যাবে😢❤,-1,এই সব গান মানুষের মনে সব সময় থেকে যাবে,2025-05-11T19:52:04Z
UgxYqZOVUXWqGRcdiVd4AaABAg,গানগুলো শুনে হৃদয়টা কেমন জানি কেঁপে  উঠলো। ১৩/০৫/২০২৫/ রংপুর পাগলাপীর।,-1,গানগুলো শুনে হৃদয়টা কেমন জানি কেঁপে উঠলো। ১৩/০৫/২০২৫/ রংপুর পাগলাপীর।,2025-05-13T13:58:11Z
UgxVy9Pbn31yR7WRvuR4AaABAg,সেই ছোট কালে বাটন ফোনে এই গান শুনতাম অনেক ভালো লাগতো।আর ২০২৪ এসেও এই গান শুনলাম,-1,সেই ছোট কালে বাটন ফোনে এই গান শুনতাম অনেক ভালো লাগতো।আর ২০২৪ এসেও এই গান শুনলাম,2024-12-10T06:09:17Z
Ugx_ZLZGzHrMV3K0FaR4AaABAg,২০ বছর পড় দেখমু,-1,২০ বছর পড় দেখমু,2025-08-12T04:44:43Z
UgxCPVdVqdZhR86amgl4AaABAg,আমার জিবনে শোনা সেরা গান।।২৪এর শেষে আবার শুনলাম,-1,আমার জিবনে শোনা সেরা গান।।২৪এর শেষে আবার শুনলাম,2024-12-30T06:22:38Z
UgxtMf5DGqUkRrZ-8cJ4AaABAg,আমার সাথে মিলেগেছে,-1,আমার সাথে মিলেগেছে,2025-10-06T16:09:53Z
UgwdVm5GvTJTJJeVJhJ4AaABAg,অসাধারণ গান শুনতে খুবই ভালো লাগে,-1,অসাধারণ গান শুনতে খুবই ভালো লাগে,2025-06-16T10:20:11Z
UgwDVAPH1_J3buqYQfd4AaABAg,আমার সবচেয়ে প্রিয় গানগুলোর মধ্যে এগুলো,-1,আমার সবচেয়ে প্রিয় গানগুলোর মধ্যে এগুলো,2025-05-06T04:59:31Z
Ugz7_o7-lXjYddQrN014AaABAg,❤ এই গান সব সময় শুনতে ইচ্ছে হয় ❤ দারুণ গান ❤,-1,এই গান সব সময় শুনতে ইচ্ছে হয় দারুণ গান,2025-07-16T08:26:16Z
UgzBs-CcXfk1oNeIfZB4AaABAg,আমি অনেক অনেক অনেক  পছন্দের গান❤️❤️,-1,আমি অনেক অনেক অনেক পছন্দের গান️️,2025-05-27T19:08:39Z
UgxdkEJB-KBwPM5Voih4AaABAg,সুন্দর গান আমার প্রিয়,-1,সুন্দর গান আমার প্রিয়,2025-09-30T04:25:16Z
UgyGiPz3sN7YVjkLe9Z4AaABAg,যতো শুনি তত ই ভালো লাগে,-1,যতো শুনি তত ই ভালো লাগে,2025-06-20T10:38:49Z
UgxTZhdL4VjVIybYbZB4AaABAg,"গানটা ১০ বছর পর শুনলাম,,  প্রথম গানটা,,❤❤❤",-1,"গানটা ১০ বছর পর শুনলাম,, প্রথম গানটা,,",2025-09-05T04:15:47Z
UgxNeJe1Qd-YzGtfvv94AaABAg,অনেক পছন্দ করি গান গুলো❤❤😂,-1,অনেক পছন্দ করি গান গুলো,2025-08-23T05:22:35Z
Ugx7IIm5NTUBhA1YV314AaABAg,সব গুলো গানেই আমার খুব পছন্দের ❤❤,-1,সব গুলো গানেই আমার খুব পছন্দের,2025-06-08T04:38:00Z
Ugz7LntGaNIv1Gcw3ud4AaABAg,খুব ভাল লাগে গান গুলো,-1,খুব ভাল লাগে গান গুলো,2025-06-12T13:25:17Z
Ugz2uTMNUthJZi59X6J4AaABAg,"সুবীর নন্দীর গানগুলো বেঁচে থাকবে যুগ যুগ ধরে,,,",-1,"সুবীর নন্দীর গানগুলো বেঁচে থাকবে যুগ যুগ ধরে,,,",2025-06-04T00:04:34Z
UgyLFHlF0TWDpsKrIR14AaABAg,সে ছোট্ট বেলার গান আজও আগের মতোই ভালো লাগে❤️❤️,-1,সে ছোট্ট বেলার গান আজও আগের মতোই ভালো লাগে️️,2025-05-05T17:31:01Z
UgyZ38VjQ9PZTFT-JRF4AaABAg,সেরা সুরে সুরকার হিসেবে অমরণীয় হয়ে থাকবে।,-1,সেরা সুরে সুরকার হিসেবে অমরণীয় হয়ে থাকবে।,2025-01-03T09:23:11Z
UgyEyJL2gShZN-rXgfJ4AaABAg,পছন্দের এই পুরনো গান গুলো চির অমর হয়ে থাকবে মানুষের হৃদয়ে।,-1,পছন্দের এই পুরনো গান গুলো চির অমর হয়ে থাকবে মানুষের হৃদয়ে।,2025-07-05T05:25:15Z
UgzO295L4C2GLX_nJKR4AaABAg,আমার খুব মজা লাগে এই গান গুলো ভাই ও আপুরা,-1,আমার খুব মজা লাগে এই গান গুলো ভাই ও আপুরা,2025-07-01T15:33:48Z
UgxXA-NS17A60HxkUnR4AaABAg,পুরনো দিনের গানগুলা শুনলে মনে হয় আমি আবার চলে যায় সেই,-1,পুরনো দিনের গানগুলা শুনলে মনে হয় আমি আবার চলে যায় সেই,2025-01-06T15:48:39Z
UgxmYaE5PKP2NAuBVmJ4AaABAg,"গানগুলো যত শুনি, ততই ভালো লাগে",-1,"গানগুলো যত শুনি, ততই ভালো লাগে",2025-08-01T18:42:33Z
Ugy9D2rEJKLZyS2cIBV4AaABAg,এই গান গুলোর সাথে জরিয়ে আছে অনেক মনের ভেতর জমে থাকা অনেক কস্ট,-1,এই গান গুলোর সাথে জরিয়ে আছে অনেক মনের ভেতর জমে থাকা অনেক কস্ট,2025-09-09T15:28:02Z
UgwOvRAozAkFtrWxs194AaABAg,হারিয়ে যাওয়া দিনের কথা গুলো মনে পড়ে গেল 😢😢😢,-1,হারিয়ে যাওয়া দিনের কথা গুলো মনে পড়ে গেল,2025-06-15T05:56:07Z
Ugz-GfxQQ8HleTARGGx4AaABAg,অসাধারণ গান মনের মধ্যে গেঁথে আছে,-1,অসাধারণ গান মনের মধ্যে গেঁথে আছে,2025-06-14T15:27:03Z
UgwA0kqqvUAAkmZywqZ4AaABAg,গান গুলো অসাধারন শুনতেই মন চায়,-1,গান গুলো অসাধারন শুনতেই মন চায়,2025-08-30T04:23:14Z
Ugz76PZzigAB46QTued4AaABAg,"আগের গান গুলো অনেক সুন্দর,,",-1,"আগের গান গুলো অনেক সুন্দর,,",2025-07-23T16:27:41Z
Ugyi7zpgNc5i-H0zeO94AaABAg,গানগুলো শুনলে মনটা যেন অন্য রকম হয়ে যায় আমার অনেক পছন্দের গান,-1,গানগুলো শুনলে মনটা যেন অন্য রকম হয়ে যায় আমার অনেক পছন্দের গান,2025-08-04T03:49:32Z
UgxPoSr71tZVUN4xpIx4AaABAg,"এ গান গুলো ভালো লাগে আমার,,, 🎉",-1,"এ গান গুলো ভালো লাগে আমার,,,",2025-07-03T10:17:17Z
UgxzLFqmmbARxHbXp0Z4AaABAg,এটা আমার অনেক প্রিয় একটা গান,-1,এটা আমার অনেক প্রিয় একটা গান,2025-07-06T19:03:24Z
Ugwq3n3_elquG_zJBa54AaABAg,আমার অনেক প্রিয় গান গুলো,-1,আমার অনেক প্রিয় গান গুলো,2025-09-25T04:05:42Z
Ugzt_YuVj_hV0UMsBKd4AaABAg,সেই ছোটো বেলা থেকে এই গানগুলো শুনি আমার খুব পছন্দের গান,-1,সেই ছোটো বেলা থেকে এই গানগুলো শুনি আমার খুব পছন্দের গান,2025-10-25T05:57:49Z
UgxODVDAcn29aY5HKIp4AaABAg,আমার অনেক ভালোবাসার গান ছিল এগুলি,-1,আমার অনেক ভালোবাসার গান ছিল এগুলি,2025-09-24T15:40:26Z
Ugyys5avgwN-b-l1ciR4AaABAg,০৬/০৭ ২০২৫ সালে গানটি শুনে ভালো লাগলো,-1,০৬/০৭ ২০২৫ সালে গানটি শুনে ভালো লাগলো,2025-07-06T09:16:24Z
Ugz2YeKBLLDERM1BsEl4AaABAg,একদিন আমি বলতাম কেমন একটা গান শুনতে খুব বাজে আজকে বুঝতে পারছি গানটা আমার রিদয়ের প্রতিটি না বলা কথা,-1,একদিন আমি বলতাম কেমন একটা গান শুনতে খুব বাজে আজকে বুঝতে পারছি গানটা আমার রিদয়ের প্রতিটি না বলা কথা,2025-10-18T08:52:45Z
UgzbXEWlbGqH7mbzURl4AaABAg,আমি যে তোমার তুমি মানতে 💔🥀২০২৫,-1,আমি যে তোমার তুমি মানতে ২০২৫,2025-06-14T07:29:17Z
UgyvNuzU19UGJ4QvcZF4AaABAg,"সে কথা তুমি যদি জানতে,,,❤",-1,"সে কথা তুমি যদি জানতে,,,",2023-10-31T18:29:56Z
UgxItoyifKAHfgVs1dV4AaABAg,আমার আম্মু খুব সুন্দর করে এই গান বলতে পারে আমার বনের ছেলে কে মাঝে মাঝে শুনাতো 😊,-1,আমার আম্মু খুব সুন্দর করে এই গান বলতে পারে আমার বনের ছেলে কে মাঝে মাঝে শুনাতো,2025-12-01T08:49:21Z
Ugw-pmhbi2T3LVPyp_t4AaABAg,এগাণ টা আমার প্রিও,-1,এগাণ টা আমার প্রিও,2025-06-16T23:51:47Z
UgwuPPXkzFe3mVy43iR4AaABAg,আপনার গান শুনতে ভালবাসি,-1,আপনার গান শুনতে ভালবাসি,2025-11-25T11:07:36Z
Ugz8HA5hNiZiVnbJ3md4AaABAg,গান গুলা অনেক ভালো লাগে মাঝে মধ্যে সুনি,-1,গান গুলা অনেক ভালো লাগে মাঝে মধ্যে সুনি,2025-07-28T17:46:35Z
Ugxgbc6UWOAgbJwJyhR4AaABAg,সেদিনের গান গুলো খুব মিস করি,-1,সেদিনের গান গুলো খুব মিস করি,2025-09-26T03:39:05Z
UgyBFtLp5iD8868sQZR4AaABAg,"এই গানগুলো শুনলে মনের ভিতর অনেক ভালো লাগে,",-1,"এই গানগুলো শুনলে মনের ভিতর অনেক ভালো লাগে,",2025-10-07T18:41:51Z
UgzrFpMxguR3WB3-f3l4AaABAg,সব সময় ভাল লাগার মত গান।,-1,সব সময় ভাল লাগার মত গান।,2025-12-11T06:57:04Z
Ugy50gdF12-5Td-hh394AaABAg,কখনো কেউ মন থেকে ভালো বাসলে সেটা পায় না আমি বুজে গেছি  ভালো বাসা মিথ্যা ভালো বাসা বলতে কিছু নাই শুধু আবেগ যা মানুষ কে শুধু দুংখ দেয়,-1,কখনো কেউ মন থেকে ভালো বাসলে সেটা পায় না আমি বুজে গেছি ভালো বাসা মিথ্যা ভালো বাসা বলতে কিছু নাই শুধু আবেগ যা মানুষ কে শুধু দুংখ দেয়,2023-11-22T17:39:03Z
UgyVJyYM-o6DsqmKT2F4AaABAg,২০২৪ সালে এসে কে কে শুনতে আসছেন?,-1,২০২৪ সালে এসে কে কে শুনতে আসছেন?,2024-02-04T09:54:22Z
Ugz2A-X5S6SpMXBX-a94AaABAg,এই সব গান কখন ও পূরণ হবে না ।,-1,এই সব গান কখন ও পূরণ হবে না ।,2024-06-22T06:35:14Z
UgwsI2gHBMCyY_6htzd4AaABAg,"2024 এ এসে আবারো প্রেমে পড়ে গেলাম এই গানগুলির।
অমরণ হয়ে রইবে এই গানগুলি সারা জীবন❤❤❤❤",-1,2024 এ এসে আবারো প্রেমে পড়ে গেলাম এই গানগুলির। অমরণ হয়ে রইবে এই গানগুলি সারা জীবন,2024-12-21T10:52:23Z
UgxJD5F9EhadBJ8QPVZ4AaABAg,তোমাকে অনেক অনেক দোয়া করি,-1,তোমাকে অনেক অনেক দোয়া করি,2025-01-13T14:07:38Z
UgyrrTzT7_3SdUSl3Z94AaABAg,২০২৪ সালে  কে কে গান শুনেছ,-1,২০২৪ সালে কে কে গান শুনেছ,2024-10-01T12:40:53Z
Ugy81QKrWAFzLGAEHXJ4AaABAg,"\\ প্রিয় সেলিনা,  (আমলাপাড়া)  কালের স্রোতে তুমি আমার থেকে ভেসে গেছো অনেক দূর। আর সেই কালের স্রোতেই আমি এক টুকরো কাষ্ঠখন্ডের মত ভেসে ভেসে খুঁজে বেড়াই একুল থেকে অন্য এক কুল। সুদীর্ঘ ৩৪ বছর হয়ে গেলো আমাদের আর কোন যোগাযোগ হয়নি। খুব মিস করি তোমাকে //",-1,"\\ প্রিয় সেলিনা, (আমলাপাড়া) কালের স্রোতে তুমি আমার থেকে ভেসে গেছো অনেক দূর। আর সেই কালের স্রোতেই আমি এক টুকরো কাষ্ঠখন্ডের মত ভেসে ভেসে খুঁজে বেড়াই একুল থেকে অন্য এক কুল। সুদীর্ঘ ৩৪ বছর হয়ে গেলো আমাদের আর কোন যোগাযোগ হয়নি। খুব মিস করি তোমাকে //",2025-11-13T12:46:06Z
Ugy1mAbVFzv7iL0quU54AaABAg,"28 03 2024 সালে গান টি শুনলাম 
রেখে দিলাম সৃতি",-1,28 03 2024 সালে গান টি শুনলাম রেখে দিলাম সৃতি,2024-03-28T09:10:15Z
Ugw_NgvBVLHNNJgtA5V4AaABAg,আমিও আছি ছোট থেকে শুনি যতোদিন মারা যাবনা শুনব,-1,আমিও আছি ছোট থেকে শুনি যতোদিন মারা যাবনা শুনব,2025-04-09T06:13:53Z
Ugz9F41JYbSIDSqfERl4AaABAg,আরো 20 বছর পর এই কমেট দেখব আমি,-1,আরো 20 বছর পর এই কমেট দেখব আমি,2023-10-20T11:13:34Z
Ugw174880qziYd1zSZh4AaABAg,শিল্পী সুবীর নন্দীর এইসব গান শুনে শৈশবের মধ্যে নিজেকে যেন নতুন করে ফিরে পেলাম মনপ্রাণ ভরে গেল। সম্মোহন দাস রতনপুর সাগরদীঘি মুর্শিদাবাদ।,-1,শিল্পী সুবীর নন্দীর এইসব গান শুনে শৈশবের মধ্যে নিজেকে যেন নতুন করে ফিরে পেলাম মনপ্রাণ ভরে গেল। সম্মোহন দাস রতনপুর সাগরদীঘি মুর্শিদাবাদ।,2024-06-05T12:40:49Z
UgwQ1TP4hU2bpc-fi0N4AaABAg,ভালোবেসে কি পেলাম কি হারালাম। এই অ্যালবাম চাই,-1,ভালোবেসে কি পেলাম কি হারালাম। এই অ্যালবাম চাই,2025-07-30T17:30:33Z
